companyid,headline,mostimportantdateutc,keydeveventtypeid,keydeveventtypename,companyname,audiolengthsec,transcriptid,transcriptcomponentid,transcriptcomponenttypename,transcriptpersonname,companyofperson,speakertypename,componentorder,componenttext,word_count
29096.0,"Google Inc., Q2 2011 Earnings Call, Jul 14, 2011",2011-07-14,48.0,Earnings Calls,Alphabet Inc.,3757.0,141363.0,9130701.0,Question,Anthony DiClemente,,Analysts,51,"I have one for Patrick and one for Larry. Patrick if you just isolate the 6% sequential growth in cost-per-click versus last quarter, wondering if you could help us understand the driver of that acceleration, and moving forward, should we expect that to continue or moderate, given that as Mobile queries start to take up more of the query mix? And then question for Larry, it would appear that in social media that switching costs for users are high perhaps years of photos on a social network platform. And as you look at Google+ and the growth there, what are the most compelling offsets to those switching costs you think or do you perhaps see a future where folks can simultaneously be a part of multiple social networking platforms?",129
29096.0,"Google Inc., Q2 2011 Earnings Call, Jul 14, 2011",2011-07-14,48.0,Earnings Calls,Alphabet Inc.,3757.0,141363.0,9130702.0,Answer,Patrick Pichette,,Executives,52,"So why don't I let Susan actually give you a bit of color on our CPC and evolution, and then Larry will take on the latter, the social one.",30
29096.0,"Google Inc., Q2 2011 Earnings Call, Jul 14, 2011",2011-07-14,48.0,Earnings Calls,Alphabet Inc.,3757.0,141363.0,9130703.0,Answer,Susan Wojcicki,,Executives,53,"The drivers of CPC, there are few of them. One of them in this quarter was FX, certainly. But we've been really focused on our ads quality improvements, and how do we continue to obviously make our ads better for our users and for our advertisers. And in doing so, we've actually -- we done a lot of optimization of our ads that appear above the search results like site links, some of the ad changes in the formats that we made this quarter, and a lot of the ads that appear above the top search results tend to be higher CPC because they're the first 3 ads. So as we continue to optimize and really drive a lot of the increased click-through and visibility for the ads that appear above the search results, you will see -- since those tend to be higher CPC because they're at the top of the results, you will see some of that increasing.",160
29096.0,"Google Inc., Q2 2011 Earnings Call, Jul 14, 2011",2011-07-14,48.0,Earnings Calls,Alphabet Inc.,3757.0,141363.0,9130704.0,Answer,Patrick Pichette,,Executives,54,Larry on sell-through and switching costs?,7
29096.0,"Google Inc., Q2 2011 Earnings Call, Jul 14, 2011",2011-07-14,48.0,Earnings Calls,Alphabet Inc.,3757.0,141363.0,9130705.0,Answer,Larry Page,,Executives,55,"I think we've been really excited about Google+ really improving the overall social experience and making it more like how you would share in real-life. And that's really a different product than is out there now. And we're getting just rave reviews for that. People really like being able to share with more discrete groups in an easy way, intuitive way, and there's a lot of magic built into the product that causes that. And as you say, you asked about the photos, we actually have a really great photo experience on the Android. Like if you take a picture on Android and you have Google+ client, which you would have, if you're using it. It uploads your photos automatically, and it's super easy to share them and post-them to your friends, or your family or whatever. It's a really, really great experience. So there is legacy in Google, as a company, believes in users owning their own data and being able to easily move it out of Google. As some of our competitors don't believe in that. We think the users will eventually move to services that are in their best interest and that work really well for them.",201
29096.0,"Google Inc., Q2 2011 Earnings Call, Jul 14, 2011",2011-07-14,48.0,Earnings Calls,Alphabet Inc.,3757.0,141363.0,9130706.0,Question and Answer Operator Message,Operator,,Operator,56,We'll take our final question from Jim Friedland with Cowen and Company.,13
29096.0,"Google Inc., Q2 2011 Earnings Call, Jul 14, 2011",2011-07-14,48.0,Earnings Calls,Alphabet Inc.,3757.0,141363.0,9130707.0,Question,James Friedland,,Analysts,57,"I wanted to ask a question on -- or follow-up on where you guys said that you're a little ahead of where you expected to be on hiring. Should we think about the hiring and particularly in R&D sort of coming in waves where you hire a bunch of people, get them integrated, it sort of slows down and picks up again? And then the second question and just on the P&L, other cost surviving users of percentage of  [indiscernible] TAC seems to be a little high. Is that coming from increased Data Center depreciation or is it may be coming from YouTube and content related costs?",107
29096.0,"Google Inc., Q2 2011 Earnings Call, Jul 14, 2011",2011-07-14,48.0,Earnings Calls,Alphabet Inc.,3757.0,141363.0,9130708.0,Answer,Patrick Pichette,,Executives,58,"I'll answer the first one, the latter one, and then I'll let Larry talk about hiring in general. The P&L, yes, it is a combination of factors this quarter. So in that cost is also included headcount. And so headcount is actually increased. Power is increased because of seasonality. It's summer now, so our power is a little higher. And we've also had kind of catch up on expenses on some of the equipment. So there's been a bit of a between Q1 and Q2, there's been a bit of a cleanup in some of the areas of equipment that have actually slightly deflated Q1 and inflated Q2 as we finish the clean up, so that was a bit of a catch up there. So I wouldn't read the data point between Q1 and Q2. Don't create a graph with that, with that line. But it's a bit of everything, including a bit of cleanup and some of the equipment accounts. For the issue of hiring, I'll let Larry actually talk about general where we stand right now.",179
29096.0,"Google Inc., Q2 2011 Earnings Call, Jul 14, 2011",2011-07-14,48.0,Earnings Calls,Alphabet Inc.,3757.0,141363.0,9130709.0,Answer,Larry Page,,Executives,59,"That's a great question. I think just a couple of factors that affected that and I think you know we implemented compensation changes in Q1. We increased our employee compensation. And they've had even more positive effect on hiring and retention than when we expected. It's been a super successful change. And I think in general this has more excited people who want to work at Google and who want to stay working at Google than we expected. And so that's had some impact on those numbers. Of course there's a limit on how many we can -- and how fast we can productively hire, and I said this in my remark, I think kind of my judgments where at the edge of that piece being reasonable. We're just adding a lot of people. And I'd say that we're always looking for good people, and we're always -- the exact rate is going to depend on success and where we really want to invest in the company. We have a really strong management team. I said that's working together fabulously, and we can absorb those hires and put them to use well. But like I said, we're definitely -- we're surprised that the success of our previous changes around compensation as well.",213
29096.0,"Google Inc., Q2 2011 Earnings Call, Jul 14, 2011",2011-07-14,48.0,Earnings Calls,Alphabet Inc.,3757.0,141363.0,9130710.0,Answer,Patrick Pichette,,Executives,60,"With that, I just want to thank Larry for joining us today, and Nikesh, and Susan for the comments as well as the Q&A. I want to thank, once again as I always do, all the Googlers out there. Our fantastic Googlers that have made this quarter possible. And all of the innovation, especially I think it's worth mentioning, our Google+ team that has done a phenomenal job in this launch. So 2 thumbs up. 
So on behalf of all of us here, congratulations and many thanks to all of our gang at Google. With that, I'll let you, Jamie, close the call. And thank you, everybody, for participating today.",110
29096.0,"Google Inc., Q2 2011 Earnings Call, Jul 14, 2011",2011-07-14,48.0,Earnings Calls,Alphabet Inc.,3757.0,141363.0,9130711.0,Question and Answer Operator Message,Operator,,Operator,61,"Thank you, sir. That does conclude today's conference. We do appreciate everyone's participation.",13
29096.0,"Google Inc., Q3 2011 Earnings Call, Oct 13, 2011",2011-10-13,48.0,Earnings Calls,Alphabet Inc.,3366.0,172719.0,10690881.0,Presentation Operator Message,Operator,,Operator,0,"Good day, everyone, and welcome to the Google Inc. Third Quarter 2011 Earnings Conference Call. This call is being recorded. At this time, I'd like to turn the conference over to Ms. Jane Penner, Head of Investor Relations. Please go ahead, ma'am.",42
29096.0,"Google Inc., Q3 2011 Earnings Call, Oct 13, 2011",2011-10-13,48.0,Earnings Calls,Alphabet Inc.,3366.0,172719.0,10690882.0,Presenter Speech,Jane Penner,,Executives,1,"Good afternoon, everyone, and welcome to today's third quarter 2011 earnings conference call. With us are Larry Page, Chief Executive Officer; Patrick Pichette, Senior Vice President and Chief Financial Officer; Susan Wojcicki, Senior Vice President, Advertising; Nikesh Arora, Senior Vice President and Chief Business Officer. 
First, Larry, Patrick, Nikesh, and Susan, will provide us with their thoughts on the quarter. Also, as you know, we now distribute our earnings release through our Investor Relations website located at investor.google.com. So please refer to our IR website for our earnings release, as well as supplementary slides that accompany the call. This call is also being webcast from investor.google.com. A replay of the call will be available on our website in a few hours. 
Now let me quickly cover the safe harbor. Some of the statements that we make today may be considered forward-looking, including statements regarding Google's future investments and our long-term growth and innovation, the expected performance of our business and our expected level of capital expenditures. These statements involve a number of risks and uncertainties that could cause actual results to differ materially.
Please note that these forward-looking statements reflect our opinions only as of the date of this presentation, and we undertake no obligation to revise or publicly release the results of any revisions to these forward-looking statements in light of new information or future events. Please refer to our SEC filings for a more detailed description of the risk factors that may affect our results. 
Please note that certain financial measures that we use on this call, such as operating income and operating margin, are also expressed on a non-GAAP basis and have been adjusted to exclude charges related to stock-based compensation. We've also adjusted our net cash provided by operating activities to remove capital expenditures, which we refer to as free cash flow. Our GAAP results and reconciliations of non-GAAP to GAAP measures can be found in our earnings press release. 
With that, I will now turn the call over to Larry.",335
29096.0,"Google Inc., Q3 2011 Earnings Call, Oct 13, 2011",2011-10-13,48.0,Earnings Calls,Alphabet Inc.,3366.0,172719.0,10690883.0,Presenter Speech,Larry Page,,Executives,2,"Well, thank you, and it's great to be here, and thanks for taking the time to be with us today. When I look back over the last quarter, the word that springs to mind is gangbusters. Revenue was up 33% year-on-year, and our quarterly revenue was just short of $10 billion, not bad for a 13-year-old. 
I'm also incredibly excited about the progress we've made on the product side. Ever since taking over as CEO, I had to focus much of my energy on increasing Google's velocity and execution, and we're beginning to see results. 
Look at Google+, we had 100 features launched in 90 days, the team is really cranking. We had Hangouts on the phone, Hangouts on air, Will.i.am did a Hangout from his concert in Central Park. You can now share Circles. You can search Google+ and you can play games in Google+. And far and most exciting of all, open sign-ups, Google+ for everyone. 
Looking at the numbers for Google+, I was taken aback. I now want to announce that we passed the 40 million user mark on Google+. People are flocking into Google+ at an incredible rate and we're just getting started. 
The engagement we're seeing is phenomenal too. Over 3.4 billion photos have already been uploaded in Google+. But it's still incredibly early days for Google+ because our goal is actually far bigger than the individual feature launches themselves. Our ultimate ambition is to transform the overall Google experience, making it beautifully simple, almost automagical because we understand what you want and can deliver it instantly. 
This means baking identity and sharing into all of our products so that we build a real relationship with our users. Sharing on the web will be like sharing in real-life across all your stuff. You'll have better, more relevant search results and ads. Think about it this way. Last quarter, we shipped the Plus, and now we're going to ship the Google part. The new visual design, beautiful, consistent UIs for Search, News, Maps, Translate, and lots of other features, is only the beginning of that process. 
Last quarter, I talked about focus, and we've made great progress here too. To create products that really change people's lives, that they use every day, 2x or 3x a day, is really hard. So we have to make tough decisions about what to focus on or we end up doing things that don't have the impact that we strive for. 
Since we last spoke, we've begun the process of shutting over 20 different products including Sidewiki, Google Pack, Google Notebook, and Fast Flip, and we'll continue to simplify and streamline our products going forward. This prioritization is crucial if we are to really invest in the extraordinary opportunities in front of Google today. 
Let me give you a few examples. Chrome, usage is going through the roof. We have now hit over 200 million users and still growing fast. Turns out that people really care about getting to the web quickly and securely and having a whole ecosystem of apps at their fingertips. 
I'm super pleased with Google Maps, it's a favorite with our users, especially on mobile devices. In August, we launched in 40 new countries, taking our total to 130 countries. The growth of Android is mind-boggling too. Over 190 million devices have now been activated globally. I'm super excited about the soon-to-be released new version of Android called Ice Cream Sandwich, that's right, Ice Cream Sandwich. You won't believe what we managed to get done in this release. 
We're also seeing a huge positive revenue impact from Mobile, which has grown 2.5x in the last 12 months to a run rate of over $2.5 billion. Generally, I found that high usage products will make a lot of money over time for well-managed technology companies, and that's why it's so important to run these businesses for the long term. 
That said, we must never lose sight of the fact that today's revenues and growth serve as the engine that funds all of our future innovation. People are a crucial part of Google's long-term success, because great companies are no greater than the efforts and ingenuity of their employees. So our goal is to hire the best people at every level and keep them at Google. Our hiring has to be manageable, if we are to balance our short and long-term needs. 
You may have noticed quite substantial hiring this quarter, driven in part by a lot of university graduates. Despite the seasonal effect, the total number of people we hired was about the same as last quarter. Our attrition remains low, which is great, though obviously it contributes to our overall current headcount. As I said previously, I continue to believe that our headcount growth is the edge of what's manageable. 
Let me finish by saying that we are still at the very early stages of what technology can deliver. These tools we use online will look very different in 5 years time. We're building those tools now as Google+, which is why I'm so excited to be here. 
So thank you. And again, we had a great quarter. And now I'll turn it over to Patrick.",870
29096.0,"Google Inc., Q3 2011 Earnings Call, Oct 13, 2011",2011-10-13,48.0,Earnings Calls,Alphabet Inc.,3366.0,172719.0,10690884.0,Presenter Speech,Patrick Pichette,,Executives,3,"Thank you, Larry. Good afternoon, everyone, and thanks for joining us. Let me first turn to the specifics of our performance in the quarter from a financial perspective. Our gross revenue grew 33% year-over-year to $9.7 billion and 8% quarter-over-quarter. Note that while some currency fluctuation boosted our revenue again this quarter a little bit, even in constant FX terms, our growth rates remain very strong. 
Our Google website revenue was up 39% year-over-year to $6.7 billion and 8% quarter-over-quarter, which trends across most major geographies and verticals in fact. Our Google Network revenue was up 18% year-over-year to $2.6 billion and 4% quarter-over-quarter. 
On the one hand, year-over-year network revenue growth slowed slightly due to a few factors, including the Search quality changes that we made earlier this year that we already commented on. On the other hand, the momentum of our Display business, which comprises only part of the network line, continues. And Nikesh will have more to say on this in a few minutes. 
Our other revenue was up also 52% year-over-year to $385 million, and that was up 24% quarter-over-quarter. Our global aggregate Paid Click growth was very strong, up 28% year-over-year, and up 13% quarter-over-quarter. The corollary, the aggregate cost-per-click growth was up 5% year-over-year and down 5% quarter-over-quarter. Remember too that, that's an aggregate number, which includes both Google.com and our AdSense properties. As usual, there's some variability quarter-over-quarter in these metrics but, overall, we continue to be very pleased with our revenue and the performance of our ad system. Again, Susan will give you a few more comments in a few minutes. 
So turning to our geographic performance, the U.S. and rest of worlds are growing at a very healthy pace, and our results clearly reflect that. Even the U.K. continues to show some positive momentum. In our earnings slides, which you'll find on our Investor Relations website, you'll see that we've broken down our revenue by U.S., U.K. and rest of world to show the impact of FX and the benefits from our hedging program. So please refer to those slides for the exact calculations. 
Our revenue from the U.S. was up 26% year-over-year to $4.4 billion. Our non-U.S. revenue accounted for 55% of our total revenue or $5.3 billion, up 41% year-over-year, which includes a modest $1 million of benefits from our hedging program, and this is compared to $89 million benefit in Q3 of last year. The U.K. was up 25% to $1 billion and year-over-year growth and fixed FX still is pretty healthy and would have been 20% -- or is 20%.
Let me now turn to expenses. Our traffic acquisition growth and costs were $2.2 billion or 23.7% of total advertising revenue. And our other cost of revenue was $1.1 billion, which exclude stock-based compensation of $72 million. 
Finally, operating expenses, also excluding SBC, totaled $2.8 billion. And SBC, itself, totaled $499 million in Q3. So our increase year-over-year in SBC is primarily due to the annual equity refresh, which we do at this time of year. And the increase in year-over-year for our OpEx was primarily due, as usual, in payroll, increased professional services and advertising and promotion spend. So as a result of all this, our non-GAAP operating profit was $3.6 billion in Q3, which exclude SBC, and are resulting in non-GAAP operating margin of 37.3%. 
Headcount was approximately up by 2,585 versus Q2, ending the quarter with 31,353 full-time employees. And as Larry already noted, there are 2 factors at work here. Q3 usually has significant headcount additions and this quarter is no exception due to a bumper crop of university hires. In fact, we had the second-highest number of university hires in Google's history this quarter. Additionally, acquisitions this quarter added a large number of people as well. Our effective tax rate was 19% in Q3, flat with Q2, and the lower tax rate is driven by a mix of earnings between domestic and international subsidiaries. 
Now let me turn to cash management. Other income and expense was $302 million for Q3. OI&E was driven by a strong portfolio management performance and, additionally, we saw lower-than-expected FX cash flow hedging expenses due to the strengthening of the U.S. dollar in September. For more details on OI&E, again, please refer to the slide that accompanies this call on our IR website. 
Operating cash flow was very strong at $4 billion. Our CapEx for the quarter, down from last quarter, to $680 million, and the majority of the CapEx once again in Q3 was related to facilities and production equipment. And as a reminder, we continue to make these significant investments in CapEx, and these have shown to be lumpy from quarter-to-quarter depending on where we're able to make these investments. We're very pleased with our free cash flow and consequence of all this, which was $3.3 billion. 
So before handing it over to Nikesh, I know that many of you have had questions about general economic outlook and have been kind of asking us those questions. Look, what we're seeing is not terribly surprising or different from what you're all seeing, watching on TV, reading in the press. And while, obviously, we don't control the economy or the exchange rates that fluctuate so much, we do very much control our own operating agenda. And that's why we will, as always, stay focused on what we control, our agenda for the long term, with the strategy and investments that are not calibrated for quarter-to-quarter views but really designed to create, as Larry said, fantastic products that transform our users lives and create significant value for our shareholders. 
With that, let me now hand it off to Nikesh, who will cover more details on our sales performance in this quarter. Nikesh?",964
