companyid,headline,mostimportantdateutc,keydeveventtypeid,keydeveventtypename,companyname,audiolengthsec,transcriptid,transcriptcomponentid,transcriptcomponenttypename,transcriptpersonname,companyofperson,speakertypename,componentorder,componenttext,word_count
29096.0,"Google Inc., Q4 2010 Earnings Call, Jan 20, 2011",2011-01-20,48.0,Earnings Calls,Alphabet Inc.,3687.0,94066.0,6557871.0,Answer,Patrick Pichette,,Executives,67,"On compensation first, as I said, we raised all salaries. So if you think of kind of financial modeling for a second, all salaries had been raised 10% across-the-board, January 1. And that has a ripple effect on -- the kind of ripple effect of the employee taxes, 401(k)s and all the rest of the benefits. It will also impact, obviously, everybody that we bring on this year as well. So as we bring in new people, they are costing us now slightly more. In addition to that, what we've done is part of the bonus is kind of calculated without giving you the exact number. We had two components to our annual bonus. One, which is a company multiplier, and one which is an individual multiplier. And what we've done for the non-execs, because we want execs to actually continue to be treated differently, the non-execs are treated in that what used to be a company multiplier, which didn't really have a lot of influence on, we shifted over to base pay. And their individual multiplier component of the bonus continues to be a very kind of directly involved into their calculation of their personal bonus. So by shifting that company multiplier we didn't have a lot of influence on, right, it just moves into more predictable cash flows for them all through the year rather than waiting for the end of the year, and that was the rationale for doing it. In terms of revenue growth, I mean, last quarter, we gave kind of two syndication points on Display, on Mobile, right? We've talked about the fact that our core -- if you look at our Enterprise Business, 30 million users, 3 million businesses on apps, the kind of magnitude of numbers we're talking about in each of our growth areas, whether it be Mobile, whether it be Android, whether it be YouTube, where we continue to have YouTube, right. I mean to give you a snippet, YouTube's revenue more than doubled in 2010, right? So that's why we're optimistic across-the-board, and that's why we're very kind of open about the fact that when you have such a digital economy running in high gear, why don't you take the opportunity to invest at the time where it is actually transforming itself. And that's what we're doing, and we're delighted in fact to continue to push hard on that. And that's what you see also in sales and marketing.
With that -- let me reiterate, so I probably hope I got your attention back because the front end of this conversation got totally sideswiped by the big three, you guys showing up and taking over our seats and phones, but phenomenal year end to what has been a terrific year. I have to thank all of our Googlers. They do an amazing job every day. It looks easy when I show up with Jonathan and Nikesh and talking about these fantastic results, but our Googlers do an amazing job all around the world, and so does our partners. And so to them, thank you so much for your fantastic efforts in 2010, and we'll just set up for a fantastic 2011 again. With that, I'll let Jay close the call.",541
29096.0,"Google Inc., Q4 2010 Earnings Call, Jan 20, 2011",2011-01-20,48.0,Earnings Calls,Alphabet Inc.,3687.0,94066.0,6557872.0,Answer,Jonathan Rosenberg,,Executives,68,That does conclude today's conference. We thank you for your participation.,12
29096.0,"Google Inc., Q1 2011 Earnings Call, Apr 14, 2011",2011-04-14,48.0,Earnings Calls,Alphabet Inc.,4187.0,115251.0,7682709.0,Presentation Operator Message,Operator,,Operator,0,"Good day, and welcome, everyone, to the Google Inc. First Quarter 2011 Earnings Conference Call. [Operator Instructions] At this time, I would like to turn the call over to Jane Penner, Head of Investor Relations. Please go ahead, ma'am.",39
29096.0,"Google Inc., Q1 2011 Earnings Call, Apr 14, 2011",2011-04-14,48.0,Earnings Calls,Alphabet Inc.,4187.0,115251.0,7682710.0,Presenter Speech,Jane Penner,,Executives,1,"Good afternoon, everyone, and welcome to today's First Quarter 2011 Earnings Conference Call. With us are Patrick Pichette, Senior Vice President and Chief Financial Officer; Susan Wojcicki, Senior Vice President, Advertising; Jeff Huber, Senior Vice President, Commerce and Local; Nikesh Arora, Senior Vice President and Chief Business Officer.
First, Patrick, Susan and Jeff will provide us with their thoughts on the quarter, after which Nikesh will join the group to answer your questions. Also, as you know, we now distribute our earnings release through our Investor Relations website located at investor.google.com. So please refer to our IR website for our earnings release, as well as supplementary slides that accompany the call. This call is also being webcast from investor.google.com. A replay of the call will be available on our website in a few hours.
Now let me quickly cover the Safe Harbor. Some of the statements we make today may be considered forward looking, including statements regarding Google's future and investments in our long-term growth and innovation, the expected performance of our business and our expected level of capital expenditures. These statements involve a number of risks and uncertainties that could cause actual results to differ materially. Please note that these forward-looking statements reflect our opinions only as of the date of this presentation, and we undertake no obligation to revise or publicly release results of any revisions to these forward-looking statements in light of new information or future events.  Please refer to our SEC filings for a more detailed description of the risk factors that may affect our results. 
Please note that certain financial measures which we use on this call, such as operating income and operating margin, are all also expressed on a non-GAAP basis and have been adjusted to exclude charges relating to stock-based compensation. We have also adjusted our net cash provided by operating activities to remove capital expenditures, which we refer to as free cash flow. Our GAAP results and reconciliations of non-GAAP to GAAP measures can be found in our earnings press release.
With that, I will now turn the call over to Patrick.",350
29096.0,"Google Inc., Q1 2011 Earnings Call, Apr 14, 2011",2011-04-14,48.0,Earnings Calls,Alphabet Inc.,4187.0,115251.0,7682711.0,Presenter Speech,Patrick Pichette,,Executives,2,"Thank you, Jane. Good afternoon, everybody. We just happen to have a surprise visit. Larry is joining us for a few minutes at the beginning of the call and wanted to make a few comments. So before we start officially our call, I just want to welcome Larry. Welcome, Larry.",50
29096.0,"Google Inc., Q1 2011 Earnings Call, Apr 14, 2011",2011-04-14,48.0,Earnings Calls,Alphabet Inc.,4187.0,115251.0,7682712.0,Presenter Speech,Larry Page,,Executives,3,"Thank you, Patrick. It's great to take just a few minutes with all of you. We've had a tremendous quarter, 27% year-over-year revenue growth in Q1. And we're really excited about that, and I think it shows the strength of our business and our continuing -- and the continuing growth really in the tech industry. And it's really still at the beginning from a user perspective. There's tremendous improvements to be had in our core products and our core business, and we're really excited about that.
I also wanted to mention a little bit about the management changes. Everything we told you last quarter has happened as we expected. It's all working very well, exactly as we planned. I'll just reiterate that quickly. I'm managing the day-to-day operations of Google as the CEO, working very closely with my team, and I'm really excited about the progress we've had there. I think we really hit the ground running. And Eric, of course, is focused externally, on the government partnerships, government relations and partnership outreaches. And last quarter alone, he was in Germany and Brazil, Argentina and Spain and has been just doing tremendous things for the company.  Sergey, as we mentioned, is working very intensively on a few emerging projects for us. As I said, this was all exactly as we planned, and I'm very, very excited about those changes. I'd also mention we've made a number of changes to just simplify our organ, improve our velocity and execution and basically, simplify our reporting structures and such. 
Now I'm very excited about Google and our momentum and very, very optimistic about our future. I also just wanted to mention we have Jonathan Rosenberg, who's usually done this call, is transitioning out of the company as was announced a while ago. And I really wanted to thank him for all of his insights and hard work and fine communication with all of you. And so we'll clearly miss him, and we really wanted to thank him from the bottom of our hearts. 
So those are the main things I wanted to say. I'm tremendously excited about all of the things that lay before us as a company. And I also want to say you're in very good hands with the team here, and Patrick who now should take the call away.",389
29096.0,"Google Inc., Q1 2011 Earnings Call, Apr 14, 2011",2011-04-14,48.0,Earnings Calls,Alphabet Inc.,4187.0,115251.0,7682713.0,Presenter Speech,Patrick Pichette,,Executives,4,"Great. Thank you, Larry. Thank you for taking a few minutes in the schedule to just drop in. So what we'll do now is we are back. So we found a phone for the last 30 seconds, and we're going to be back now with the rest of the team to go back to our regular call.
So as an overview, I'll be giving you the regular speech. Susan and Jeff will give you color comments as well in the product area, as well as the monetization side. And Nikesh is with us so that when we go through Q&A, he'll be answer to give you a lot more color commentary in some areas. 
Look, we're nothing but very, very excited about our reporting 27% year-over-year revenue growth in Q1. This 27% proves really the logic behind our strategy, not only to invest heavily in our core Search business and Ads but also in our new emerging businesses like Display, like Mobile, like Enterprise. From an investment perspective, our Q1 results don't only show our continued commitment to invest in hiring, in marketing and in the other areas, but they also -- as you can see through our expenses, they reflect, for the first time, the full impact of the compensation changes we announced in Q4, the 10% salary increase. Google is clearly benefiting from and is also fueling the unrelenting pace of the digital economy that's around us. And it's growth that we believe will benefit both Google but in fact, the entire ecosystem for a long time to come.
So let's turn to the specifics of our performance for the quarter. Gross revenue, as we mentioned already, 27% to $8.6 billion and interestingly, 2% quarter-over-quarter. To put this in context, this is quite remarkable if you think that Q4 was an amazingly strong quarter. And in fact, it adds also the impact of the Nexus One from Q1 of last year and to a lesser extent, the events that have occurred in Japan. 
So Google website's revenue was up 32% year-over-year, $5.9 billion, with strength across all major geographies and verticals. The Google Network revenue was up 19% year-over-year to $2.4 billion. That Network revenue was negatively impacted by two things, the loss of a Search distribution partnership deal and also, what has been broadly communicated, by Search quality improvement made during the quarter. Regarding the Search quality improvement, remember that we regularly make such trade-offs. We really believe that the quality improvements that benefit the user always serves us well both in the short term and in the mid term in terms of revenue. So Jeff will cover that in more detail in the coming minutes. Other revenue was down 10% year-over-year to $269 million. And note that in Q1 of 2010 was the first quarter that we'd booked Nexus One revenues, and this is what drives the year-over-year decline.
Global aggregate paid click gross -- that's my tongue twister for every quarter. It was very strong again, up 18% year-over-year, interestingly, 4% up also quarter-over-quarter and again, reflecting the accelerated shift of off-line to online. Aggregate cost-per-click growth was also quite healthy, up 8% and only 1% down quarter-over-quarter. And you should all know that the FX had a pretty neutral effect on CPC growth year-over-year and quarter-over-quarter. Remember too that that's an aggregate number and includes both google.com and our AdSense properties. 
So now turning to our geographic performance, the U.S. and the rest of world are both growing at a very healthy pace, and our results reflect that. The U.K. continues to lag a bit because of its global economic recovery, the pace of its -- the recovery.  Revenue from the U.S. was up 25% year-over-year to $4 billion. In our earnings slides you can find on our Investor Relations website, you will see that we have broken down our revenue by U.S., U.K. and rest of world to show the impact of FX and the benefit of our hedging program. So please refer to those slides for the exact calculations.
International revenue accounted for 53% of our total revenue or $4.6 billion, and it was up 28% year-over-year. It includes a $14 million benefit from our hedging program, and that compares to a $10 million benefit of Q1 of last year. If we use a fixed exchange rate, our international revenue would have been roughly $23 million lower year-over-year. Also, it's worth noting that the tragedy in Japan somewhat negatively impacted our international revenue in Q1. And as I mentioned earlier, the U.K. was up 15% year-over-year to $969 million as the country continues to experience struggling economy. But even that 15% is really 17% in FX adjusted basis.
Let me turn to expenses. Traffic acquisition costs were $2.0 billion or 25% of total advertising revenue. Our other cost of revenue, $897 million, including stock-based compensation of $49 million. And finally, all operating expenses totaled $2.8 billion, including approximately $383 million in stock-based compensation. The increase year-over-year in OpEx, primarily due to payroll, increased advertising and promotional spend and some other professional services. So a result of all these expenses, our non-GAAP operating profit, which excludes the stock-based compensation, was $3.2 billion in Q1 of this year, resulting in a non-GAAP operating margin of 37.6%. Headcount was up approximately 1,900 people from Q4, ending the quarter with 26,316 full-time employees. Our effective tax rate was 21% roughly. The exact number is 20.5%. 
Let we now turn to cash management. Our other income and expenses was $96 million for Q1, in fact, a very solid performance from our portfolio management. And unfortunately, just masked by the impact of our higher hedging expenses associated with our SFAS 133, the accounting of which we know is quite volatile from quarter to quarter. So for more details on OI&E, please again refer to the slides that accompany our call on our IR site. 
Operating cash flow, very strong, $3.2 billion. CapEx for the quarter, $890 million, significantly below last quarter of $2.5 billion. And remember that last quarter, that increase was largely due to our purchase of the New York City office. Majority of CapEx spend in Q1 was related to facilities, expenses and data center operations. In the facility space, we spent -- was really driven by the purchase of two buildings, one in Dublin and one in Paris. Just as a reminder, we continue to make significant CapEx investments, and we've shown those to be lumpy from quarter to quarter depending on when we're able to make such investments. Obviously, we're pleased with our free cash flow, which was $2.3 billion for the quarter.
As I said earlier, our accelerating growth trajectory, it really shows our confidence to expand across products and geographies. Roughly 18 months ago, we began communicating how we were really optimistic about our opportunities, and we had the business confidence to invest heavily in the next phase of innovation and revenue generation. Well, our product innovation over the last 18 months has been nothing short but extraordinary. Let's take a look at this. 
We have built from scratch the world's most popular smartphone operating system. We've built also from scratch the world's fastest growing browser. And in some countries like India, one in four people are now accessing the web via Chrome. We've reinvented display advertising, creating not only a business but an entire ecosystem with a $2.5 billion annual run rate as of Q3 of last year. We've pushed the frontier of mobile search, creating a whole new search segment that is adding to our overall search volume and brand new monetization opportunities. We've seen YouTube develop into a platform, a win-win platform in fact, where partners can generate significant revenue from their content and users watch 2 billion views a day.
And our revenue growth clearly shows the wisdom of those decisions to fuel our growth ahead of the curve. So the facts speak [ph] from the sales really. The second half of 2010, we grew roughly 25% year-over-year. But even more telling, this quarter, growth rate of 27% compared to a comp of 23% just a year ago. We are building multibillion dollar businesses, and we're confident that now is the time to invest. It's with this optimism that we'll continue to do so aggressively but with discipline, with strong focus on fueling the winning products. From an expense point of view, we're taking some bold steps but always with good strategic rationale in mind and discipline in mind. 
So as our Q1 results continue to reflect some marketing -- you've heard of our marketing going up. It's a very deliberate choice as an example. We have laid, made very specific focus on Chrome, customer and advertiser acquisition in the U.S. and international markets. And in both cases, we're seeing the fruits of these investments. The same is true for our labor strategy. And finally, we continue to invest in our long-term infrastructure. 
So now let me turn it over to Jeff and Susan to provide you more details on the products that are the engine of both our growth and our optimism. They'll also provide you more details on where we're deploying some of these additional resources as they're coming on board. So with that, I'll turn it over to Jeff.",1554
29096.0,"Google Inc., Q1 2011 Earnings Call, Apr 14, 2011",2011-04-14,48.0,Earnings Calls,Alphabet Inc.,4187.0,115251.0,7682714.0,Presenter Speech,Jeffrey Huber,,Executives,5,"Thanks, Patrick, and hi, everyone. In his comments, Patrick mentioned our ambitious hiring this quarter, which was by design. We announced in January, with a blog post to help energize recruiting, that 2011 will be the biggest hiring year in our history, topping the 6,000 people we hired in 2007. And we ended up hiring 1,900 people this quarter. We're very happy about this, because we feel this is a very good time to invest. We look at the factors like our revenue growth and how well our core and growing businesses are doing and say to ourselves, ""Who wouldn't want to invest in this business?"" So that's what we're doing, hiring great people to invest in the future. In fact, over half the Newglers who joined this quarter are going to be working in high potential and revenue growth areas like YouTube, Mobile, Chrome, commerce and local and Enterprise. 
So that's what Susan and I are going to talk about today. We'll give you an update on our core business of Search and Ads, as well as these businesses where we're investing. Susan will cover our Ads products, Search Ads, Mobile Ads, local Ads, Display Ads and YouTube, and I'll talk about Search, Android, Chrome and Enterprise. 
So let's jump in with Search. Search is the most important thing people do online, and there's loads of opportunities to make Search more intelligent and more personal. Intelligent, as in better quality. Our primary focus is to always create the best user experience. So this quarter, we launched over 90 different quality improvements. Most notably, we made an important change to our ranking algorithms to promote higher-quality sites. This noticeably impacted about 12% of our -- of all queries, and it's done a good job. We found it addressed over 80% of the sites that users reported as a poor experience via a Chrome feature we introduced a while ago. This change did have an adverse impact on revenues for some sites in our Display Network, but we've continually found improving Search results and our users' experience is always the best thing to do in the long run and for long-term value.
Personal, as in building around people. We improved social search this quarter, making it easier to find information and recommendations from the people that matter to you, whether they're publishing on YouTube or Flickr or their own blog or website. We also launched the +1 button, which makes it easy to share recommendations with the world via Google Search results. And this is just the beginning. We've got lots more useful and relevant social search features coming soon.
A lot more of our searches are coming from mobile devices. This traffic has gone up more than 500% in the last two years. Android is obviously a big driver of this. We're activating over 350,000 Android devices every day. Android market is taking off too, over 3 billion apps have been installed, up 50% in just the last quarter. You can now access the market online. Try it at market.android.com so you can shop and browse for apps from your computer, click the purchase, and they just magically show up in your device. We also recently launched In-app Billing, which has been very enthusiastically received and which gives developers more ways to make money from their hard work.
Another product and it's doing very well is Chrome. Chrome users are very valuable to Google. And as we've said in past quarters, we're investing in Chrome marketing. The payoff is worth it. We have over 120 million daily users, over 40% of whom we added in the past year as a result of our marketing efforts. The Chrome OS program is also going well, and we look forward to launching devices with our partners later this year. 
Our Enterprise business is growing across both businesses and schools. As example, this quarter, we deployed Google Apps at InterContinental Hotel Groups and RR Donnelley; signed a reseller agreement with Optus, which is the largest -- second largest telco in Australia; and signed up the University of Texas and Boston University. We were pleased that our deal with ITA Software was approved by the DOJ last week and closed this week. Travel searches in the area with lots of potential for innovation, both for end users and as a platform for the industry. We're looking forward to bringing the ITA team on board and doing great things together.
That wraps up my remarks. But before I turn it over to Susan, I just want to take a moment to thank Jonathan Rosenberg, who has been a regular on these calls, for all he's done for Google. Jonathan and I have been friends and colleagues for over 15 years. And on behalf of myself and Susan, who also worked closely with Jonathan for the last nine years, I can assure all of you that he will be missed. Over to you, Susan.",827
