companyid,headline,mostimportantdateutc,keydeveventtypeid,keydeveventtypename,companyname,audiolengthsec,transcriptid,transcriptcomponentid,transcriptcomponenttypename,transcriptpersonname,companyofperson,speakertypename,componentorder,componenttext,word_count
29096.0,"Google Inc., Q1 2011 Earnings Call, Apr 14, 2011",2011-04-14,48.0,Earnings Calls,Alphabet Inc.,4187.0,115251.0,7682780.0,Question,Youssef Squali,,Analysts,71,"Two quick questions, please. First, starting with Susan. I know you guys won't break out absolute dollar numbers, but if we just look at the non-search, non-CPC business, I mean with CPM and CPA, can you just help us understand or kind of quantify what kind of revenue growth did you see either on a year-on-year basis or on a sequential basis, just to kind of see the magnitude of your success there? And then I guess maybe for Jeff, Google has been pretty quiet about its video strategy out of YouTube's -- outside of YouTube's user-generated content. Does Google have a video strategy for non-UGC that you can speak to us about?",113
29096.0,"Google Inc., Q1 2011 Earnings Call, Apr 14, 2011",2011-04-14,48.0,Earnings Calls,Alphabet Inc.,4187.0,115251.0,7682781.0,Answer,Patrick Pichette,,Executives,72,"On the first -- let me talk about the latter one first and then let Susan talk about the first one. On the non-UGC content, we have made a number of addition to the YouTube team that have very specific expertise in that area. So you should kind of consider that we have a focus on it, but we have nothing specific to announce. Jeff may have additional comments on that.",71
29096.0,"Google Inc., Q1 2011 Earnings Call, Apr 14, 2011",2011-04-14,48.0,Earnings Calls,Alphabet Inc.,4187.0,115251.0,7682782.0,Answer,Jeffrey Huber,,Executives,73,"Yes, the -- with YouTube, YouTube's roots obviously start with user-generated content. There's a tremendous both size and activity in the user base there. So there's a great asset that we begin with. We are interested in long-form premium content in the longer-term role of YouTube. Another area that we're very excited about and we announced an acquisition this quarter, a company called Next New Networks, which is signaling intent for developing content that is kind of up volume for this new medium that's being created. So I think you'll see a lot more of that as well.",98
29096.0,"Google Inc., Q1 2011 Earnings Call, Apr 14, 2011",2011-04-14,48.0,Earnings Calls,Alphabet Inc.,4187.0,115251.0,7682783.0,Answer,Patrick Pichette,,Executives,74,"Susan, on the first question of non-CPC revenues and models?",10
29096.0,"Google Inc., Q1 2011 Earnings Call, Apr 14, 2011",2011-04-14,48.0,Earnings Calls,Alphabet Inc.,4187.0,115251.0,7682784.0,Answer,Susan Wojcicki,,Executives,75,"Sure. Actually, one thing I do want to kind of step back for is that we are thinking about the best way for our advertisers to be bidding and to be paying for ads across Search and Display. And so we -- with Search, for example, we are enabling our advertisers to bid, for example, with a CPA target. Then Google will figure out the CPCs and the backgrounds. So that's one way that was found, for example, has really grown advertisers' spend on Search. The Product Listing Ads that I talked about in the script actually works with the CPA model. So in Display, we have advertisers who bid on a CPC basis, and when they bought they also bid on a CPM basis. Right now -- and we see advertisers participating in both. A lot of times it has to do with the objective of the advertiser in terms of whether they're more performance driven or more brand driven. As we release more brand features, like I mentioned, like the reserve, that will be a CPM feature. And so really, what we see is that the bidding is very important, that we want to give advertisers a lot of flexibility and how they actually buy it and how they're able to optimize depending upon their objective. And there's no one right way. There's just -- there's a series of things that we will offer to make sure that we have the right product for the advertiser.",248
29096.0,"Google Inc., Q1 2011 Earnings Call, Apr 14, 2011",2011-04-14,48.0,Earnings Calls,Alphabet Inc.,4187.0,115251.0,7682785.0,Question and Answer Operator Message,Operator,,Operator,76,"Our next question comes from Jordan Rohan with Stifel, Nicolaus.",10
29096.0,"Google Inc., Q1 2011 Earnings Call, Apr 14, 2011",2011-04-14,48.0,Earnings Calls,Alphabet Inc.,4187.0,115251.0,7682786.0,Question,Jordan Rohan,,Analysts,77,"Sure. A couple of smaller questions. Can you be a bit more specific about the magnitude of the disruption in the Japanese search market that you saw in the quarter? And second, Android, you mentioned 350,000 devices activated per day. Can you give us some understanding of how that breaks down by smartphone versus tablet and U.S. versus international?",59
29096.0,"Google Inc., Q1 2011 Earnings Call, Apr 14, 2011",2011-04-14,48.0,Earnings Calls,Alphabet Inc.,4187.0,115251.0,7682787.0,Answer,Patrick Pichette,,Executives,78,"So on Japan, let me make two comments. One is the events really shocked us as well at Google. And I just want to kind of let the investors know that our first and first response to all the events were really to actually help the Japanese community. So it was about people finding people and all the tools that we have for disaster recovery. We spent a lot of time at Google to actually focus on the community rather than trying to optimize anything that had to do with revenue. Clearly, the month of March has seen some impact from revenue, because all of the community in Japan was focused on the events themselves. Tons of searches, by the way, but not monetizable sort of searches. Japan is a great market for us, and it was and continues to be a very good performing market. So from that perspective when we look ahead into Q2 and Q3, the one thing we do know is we've actually asked -- we made a quick search. We asked Hal Varian, our Chief Economist, to look at other events that would have occurred in Japan of say kind of that type of magnitude to see the resiliency of Japan. And he looked, for example, at the economic recovery after the Kobe disaster of '95. And Japan is actually a first-world country with a very good infrastructure. So they bounce back fast. So although we don't -- we can't predict how the Japanese economy is going to rebound on advertising and -- what is very clear is they are a first-world economy that will recover. So from right now, all we can do is say it's already a strong economy for us and a strong market, right? It has had an impact in Q1. We expect some impact in Q2 as they try to recover, but it will continue to be a strong market for us. So that's on the first -- on the second question. On the first question, why don't I turn it over to Jeff?",344
29096.0,"Google Inc., Q1 2011 Earnings Call, Apr 14, 2011",2011-04-14,48.0,Earnings Calls,Alphabet Inc.,4187.0,115251.0,7682788.0,Answer,Jeffrey Huber,,Executives,79,"Yes. So on Android, as mentioned, over 350,000 devices a day are being activated, which is just tremendous growth. In terms of breaking out share by device or by market, we don't break out share by device. If you just look though at where the distribution relationships and partnerships are, obviously, we've got a great presence in the U.S., strong partners in Europe, Japan, Korea. So international is really growing as a component of the overall pie. In terms of phones versus tablets, Android is relatively early on with tablets. So we have the Honeycomb operating system now, which is developed specifically for the devices. We've got some great initial devices like the Motorola XOOM. But as I mentioned earlier in one of the questions, we're seeing just a tremendous amount of innovation in the markets, but I think you're going to see a lot more great Android tablet devices soon.",151
29096.0,"Google Inc., Q1 2011 Earnings Call, Apr 14, 2011",2011-04-14,48.0,Earnings Calls,Alphabet Inc.,4187.0,115251.0,7682789.0,Answer,Patrick Pichette,,Executives,80,"Okay, we have time -- we're over time already, so we'll take one last question. I just -- before we take the last question, can I just say that for those on the call that may be having trouble accessing our financial slides, we're working on this issue right now. And it should have been fixed for most of the users and will be done very, very shortly. So just to let you know. So Jay, let's take our last question, please.",82
29096.0,"Google Inc., Q1 2011 Earnings Call, Apr 14, 2011",2011-04-14,48.0,Earnings Calls,Alphabet Inc.,4187.0,115251.0,7682790.0,Question and Answer Operator Message,Operator,,Operator,81,Our final question comes from Heath Terry with Canaccord.,9
29096.0,"Google Inc., Q1 2011 Earnings Call, Apr 14, 2011",2011-04-14,48.0,Earnings Calls,Alphabet Inc.,4187.0,115251.0,7682791.0,Question,Heath Terry,,Analysts,82,"Nikesh, you mentioned that video is changing everything in Display. Much of the video inventory at YouTube is still going unmonetized. What's limiting that, since clearly, the demand from advertisers is there? And is there a roadmap you can talk about or a level that you're thinking of in terms of getting YouTube to what you would consider full monetization?",60
29096.0,"Google Inc., Q1 2011 Earnings Call, Apr 14, 2011",2011-04-14,48.0,Earnings Calls,Alphabet Inc.,4187.0,115251.0,7682792.0,Answer,Nikesh Arora,,Executives,83,"I think it's important to understand we monetize video not just on YouTube but also rich media across the Google Display Network. So our intent and our hope is to try and monetize video as a format across the various publisher partners that we have. So that's our point number one. In terms of being able to monetize and continue to grow that, you have to understand there is a value chain that goes through this. We have to make sure that we have the right advertisers, who are excited about this as a medium. I have to make sure that the creative agencies adapt their creatives to work with sort of multiple users. They don't -- you can't just create one ad, which is going to be used on YouTube with 10 million views. You actually have the ability to personalize and target them a bit more. So the creative industry needs to get involved a little bit more in trying to find creative ways, no pun intended, to be able to target all the users that the advertisers would like to target. But having said that, it is a process of selling. We have the sales teams in force. We have the technology in place. We have it integrated across the technology chain in terms of through our exchanges, through our ad serving platforms, et cetera. So we are going down the path [ph] now. We're working with the creative agencies and the most important, the analysis agencies, who actually can prove that there is value in shifting some of the dollars in television towards mediums like YouTube and other video sites around the world. So we're very happy with the progress we're making. We think also that the ducks are in a row. And we hope as we continue to see this trend, this trend is going to shift lots and lots more dollars away from what is now traditionally television towards what I call IP-based video delivery.",332
29096.0,"Google Inc., Q1 2011 Earnings Call, Apr 14, 2011",2011-04-14,48.0,Earnings Calls,Alphabet Inc.,4187.0,115251.0,7682793.0,Answer,Patrick Pichette,,Executives,84,"Thank you, Nikesh. So with that, let me just take two last comments. The first one is, as usual, thank our Googlers. I mean, Jeff and Susan and Nikesh and I kind of look good here giving you these great results with 27% year-over-year growth and so many innovations in so many areas of the company. It is really the result of our fantastic Googlers working all the time on all of these areas. So I would just want to thank them. 
And also, my last closing notes on Jonathan. Everybody commented on Jonathan. He couldn't be here today, because it was already planned that he had a vacation with his family. So we're glad to have Susan and Jeff with us. Clearly, Jonathan's passion for our product is legendary at Google. I don't think that the word is too strongly stated. He loved the tension between the combination of Search and Search monetization. And just to quote him, from one of his last times, he said as Search gets better, it actually creates another huge challenge for us, which is the ads need to keep pace to get better too. Otherwise, what would happen is people will click on fewer ads and well that -- to quote him, well, that would be bad. So as a Jonathan-ism to close the call, it's very obvious that we keep -- we just are immensely thankful for Jonathan's contribution and leadership, and we'll keep focused. I know that he's going to be overlooking on us to make sure that we keep that balance between Search and Ads and all the other innovations. 
With that, Jay, I will let you close the call. And thank you, everybody, for taking the time this afternoon to listen to the story of Q1. We'll talk to you in Q2.",303
29096.0,"Google Inc., Q1 2011 Earnings Call, Apr 14, 2011",2011-04-14,48.0,Earnings Calls,Alphabet Inc.,4187.0,115251.0,7682794.0,Question and Answer Operator Message,Operator,,Operator,85,That does conclude today's conference. We thank you for your participation.,12
29096.0,"Google Inc., Q2 2011 Earnings Call, Jul 14, 2011",2011-07-14,48.0,Earnings Calls,Alphabet Inc.,3757.0,141363.0,9130650.0,Presentation Operator Message,Operator,,Operator,0,"Good day, and welcome, everyone to the Google Inc. Second Quarter 2011 Earnings Conference Call. This call is being recorded. At this time, I'd like to turn the call over to Jane Penner, Senior Manager, Investor Relations. Please go ahead, ma'am.",41
29096.0,"Google Inc., Q2 2011 Earnings Call, Jul 14, 2011",2011-07-14,48.0,Earnings Calls,Alphabet Inc.,3757.0,141363.0,9130651.0,Presenter Speech,Jane Penner,,Executives,1,"Good afternoon, everyone and welcome to today's Second Quarter 2011 Earnings Conference Call. With us are Larry Page, Chief Executive Officer; Patrick Pichette, Senior Vice President and Chief Financial Officer; Susan Wojcicki, Senior Vice President, Advertising; Nikesh Arora, Senior Vice President and Chief Business Officer. 
First, Larry, Patrick, Nikesh and Susan will provide us with results on the quarter. Also, as you know, we now distribute our earnings release through our Investor Relations website located at investor.google.com. So please refer to our IR website for our earnings releases, as well as supplementary slides that accompany the call. This call is also being webcast from investor.google.com. A replay of the call will be available on our website in a few hours.
So let me quickly cover the Safe Harbor. Some of the statements that we make today may be considered forward-looking, including statements regarding Google's future investments in our long-term growth and innovation, the expected performance of our business and our expected level of capital expenditures. These statements involve a number of risks and uncertainties that could cause actual results to differ materially. Please note that these forward-looking statements reflect our opinions only as of the date of this presentation, and we undertake no obligation to revise or publicly release the results of any revisions to these forward-looking statements in light of new information or future events. Please refer to our SEC filings for a more detailed description of the risk factors that may affect our results. 
Please note that certain financial measures that we use on this call such as operating income and operating margin, are also expressed on a non-GAAP basis, and have been adjusted to exclude charges related to stock-based compensation. We have also adjusted our net cash provided by operating activities to remove capital expenditures, which we refer to as free cash flow. Our GAAP results and reconciliations of non-GAAP to GAAP measures can be found in our earnings press release. 
With that, I will now turn the call over to the Larry.",336
29096.0,"Google Inc., Q2 2011 Earnings Call, Jul 14, 2011",2011-07-14,48.0,Earnings Calls,Alphabet Inc.,3757.0,141363.0,9130652.0,Presenter Speech,Larry Page,,Executives,2,"Well, thank you, and good afternoon, everyone. Thanks for joining us today. It's really exciting to be with you today and share directly with you the progress we have made in my first quarter as CEO. 
As you will see from our press release, we had a great quarter, with revenue up by 32% year-on-year and a new record for quarterly revenue at over $9 billion. We've substantially increased our velocity and execution this quarter, which is a key goal of mine since taking over as CEO. So I created a new product focus management structure, with clear leaders responsible for each area. 
The new management team is working together fabulously and has already achieved a lot in just these 3 months. First of all, I want to talk about Google+, which we launched a field trial invitation only. Our goal at Google+ is to make sharing on the web like sharing in real-life, as well as improve the overall Google experience. 
Circles lets you choose with precision who you're sharing with, not surprisingly this has been very well received, because in real life, we share different things with different people. Hangouts allows for serendipitous interactions. Like in real life, when you run into a few friends, gives you seamless and fun multiuser video, and it's really amazing. 
Last quarter, we launched the +1 button in search results and ads, enabling users to recommend stuff they like and to have those recommendations show up in the search results of people they know. This quarter, we released the +1 buttons to the entire web and many sites like Huffington Post, The Washington Post, and Best Buy has added +1 buttons. Google+ is still in field trial with limited access as we scale the system. Users have to be invited and sign up with a profile in order to use it. However, the growth on Google+ has been great, and I'm excited to release some new metrics for you today.
Over 10 million people have joined Google+. That's a great achievement for the team. There's also a ton of activity, and we are seeing over 1 billion items shared and received in a single day. Our +1 button is already all over the web, and it's being served 2.3 billion times a day. So while we still have a lot of work still to do, we are really excited about our progress with Google+. 
Google+ is also a great example of another focus of mine, beautiful products that are simple and intuitive to use, and actually was one of the first products to contain our new visual redesign. We also launched that beautiful, consistent and simpler design on our homepage, Gmail and calendar, with many more products soon to come. Reader focus has also been another big feature for me this quarter. More wood behind fewer arrows and last month, we announced that we'll be closing Google Health and Google PowerMeter. We've also done substantial internal work, simplifying and streamlining our product line. 
While much of that work has not yet become visible externally, I'm very happy with our progress here. Focus and prioritization are crucial given our amazing opportunities. Indeed, I see more opportunities for Google today than ever before, because believe it or not, we are still in the very early stages of what we want to do. Even in Search, which we've been working on for 12 years, there's never been more important changes to make. 
For example, this quarter, we launched a pilot that shows an author's name and picture in search results, making it easier for users to find things from authors they trust. Of course, when we started doing Search, people thought we were crazy. They said there was no money to be made in search over and above a bit of banner advertising. Most new Internet businesses have had that same criticism. Fast-forward to today, it feels like we're watching the same movie again in slow motion. We have tremendous new businesses being viewed as crazy. Android, I actually have a new metric to report in Android of 550,000 phones activated a day. And that's a huge number, even by Google standards. 
Chrome is the fastest-growing browser. We have over 160 million users. Now people rightly ask, ""How will we monetize these businesses?"" Of course, I understand the need to balance the short-term with the longer-term needs because our revenues in growth serve as the engine that funds our innovation. But our emerging high usage products can generate huge new businesses for Google in the long run, just like Search. And we have tons of experience monetizing successful products over time. Well run technology businesses with tremendous consumer usage make a lot of money over the long term. 
And I think about our products in 3 separate categories. First, there is Search in our Ads products, the core driver of revenue for the company. And Nikesh and Susan are going to talk more about Ads later in the call. Next, we have products that are employing high consumer success: YouTube, Android and Chrome. We are investing in these in order to optimize their long-term success. Then we have our new products, Google+ in commerce and local. We are investing in them to drive innovation and adoption. Overall, we are focused on long-term, absolute profit and growth, as we have always been, and I will continue to have tight financial management we have had in the last two years, even as we were making significant investments in our future. 
I'd like to finish on our people. Great companies are no greater than the efforts and ingenuity of their people. We're continuing to hire the best. Keeping them happy and well-rewarded is crucial to our future. Many of you will be interested in hiring whether we hired a few hundred more or less than you expected this quarter. But we will optimize headcount for the long-term in the opportunities we see.  
I'm happy with the investments we've made in people, but we're probably even a little ahead of where we need to be with headcount growth at the edge of what's manageable now. Easy to focus on things we do that are speculative, e.g. driverless cars. But we spend the vast majority of our resources on the core products. We may have a few small speculative projects happening at any given time but we're very careful stewards of shareholder money. We're not betting the farm on this stuff. 
All of us at Google will want to create services that people in the world use twice a day just like toothbrush. And we strive to make those services beautiful, simple and easy to use. That way we can provide huge benefit to the world. We've made a good start, but we're only at 1% of what's possible. Google is just getting started, and that's why I'm here, working hard to lead the company in the next level. 
Thank you. And again, we had a great quarter. Now over to Patrick for the financial results.",1176
