companyid,headline,mostimportantdateutc,keydeveventtypeid,keydeveventtypename,companyname,audiolengthsec,transcriptid,transcriptcomponentid,transcriptcomponenttypename,transcriptpersonname,companyofperson,speakertypename,componentorder,componenttext,word_count
140283.0,"Texas Instruments Incorporated, Q4 2018 Earnings Call, Jan 23, 2019",2019-01-23,48.0,Earnings Calls,Texas Instruments Incorporated,2598.0,1640797.0,64624537.0,Presentation Operator Message,Operator,,Operator,0,"Good day, everyone, and welcome to the Texas Instruments 4Q '18 and 2018 Year-End Earnings Release Conference. Today's call is being recorded. At this time, I'd like to turn the conference over to Dave Pahl. Please go ahead, sir.",39
140283.0,"Texas Instruments Incorporated, Q4 2018 Earnings Call, Jan 23, 2019",2019-01-23,48.0,Earnings Calls,Texas Instruments Incorporated,2598.0,1640797.0,64624538.0,Presenter Speech,Dave Pahl,,Executives,1,"Thank you. Good afternoon, and thank you for joining our fourth quarter and 2018 earnings conference call. Rafael Lizardi, TI's Chief Financial Officer, is with me today. For any of you who missed the release, you can find it on our website at ti.com/ir. This call is being broadcast live over the web and can be accessed through our website. A replay will be available through the web.
This call will include forward-looking statements that involve risks and uncertainties that could cause TI's results to differ materially from management's current expectations. We encourage you to review the notice regarding forward-looking statements contained in the earnings release published today as well as TI's most recent SEC filings for a more complete description.
First, let me provide some information that's important for your calendars. We plan to hold a call to review our capital management strategy on February 5 at 10 a.m. Central time. Similar to what we've done in the past, Rafael and I will provide insight into our strategy.
For today's call, let me start by summarizing what Rafael and I will be reviewing. I'll cover 3 topics: first, a high-level summary of the financial results for the fourth quarter; second, I'll provide some details of the fourth quarter by segment and end market, and I'll include some additional color in light of the market weakness we're currently experiencing; and finally, since this is the end of the calendar year, I'll provide a summary of our performance by end market for 2018. Rafael will then review profitability, capital management results and the outlook. We'll then open the call for Q&A.
Starting with a high-level summary for the fourth quarter results. The weakness in demand for our products that began in the third quarter continued into the fourth quarter. The weakness was across most markets and came in about as we expected. There were a few exceptions that I'll cover in more detail when I discuss our fourth quarter segment and end market performance. 
In our core businesses, Analog revenue grew 4%, and Analog Processing (sic) [ Embedded Processing ] declined 12% compared with the same quarter a year ago. Both businesses' growth decelerated. Operating margins decreased in both businesses. And similar to the third quarter, Embedded remained weaker than Analog, primarily because Analog benefited from increasing content in 5G, while the weakness in other markets became more pronounced in Embedded. It is not unusual for Analog and Embedded to perform differently in the short term, but they are more consistent in the long term. Earnings per share were $1.27, including $0.01 discrete tax benefit not in our original guidance. 
In the fourth quarter, our cash flow from operations was $2.1 billion. As we note each quarter, we believe that free cash flow growth, especially on a per-share basis, is most important to maximizing shareholder value in the long term. Free cash flow for the trailing 12-month period was $6.1 billion, up 30% from a year ago. Free cash flow margin for the same period was 38.4% of revenue, up from 31.2% a year ago. We continue to benefit from an improved product portfolio that's long-lived and diverse and the efficiency of our manufacturing strategy, the latter of which includes our growing 300-millimeter Analog output. We believe that free cash flow will only be valued if it's productively invested in the business or if it's returned to owners. In 2018, we returned $7.7 billion in cash to owners through a combination of dividends and stock repurchases.
Moving on, I'll now provide some details on the fourth quarter by segment and end market and offer some additional color on the market. From a year-ago quarter, Analog revenue grew 4% due to Signal Chain and Power, partially offset by declines in High Volume. Embedded Processing revenue declined 12% from the year-ago quarter due to declines from both product lines, Processors and Connected Microcontrollers. In our Other segment, revenue declined $31 million from the year-ago quarter. For the year in total, Analog and Embedded grew 9% and 2%, respectively, and combined were 91% of TI's revenue.
Now given the current market environment, I want to provide some additional color on the quarter. As I mentioned earlier, the weakness in demand in our products that began in the third quarter continued into the fourth quarter. Demand came in mostly as expected, although personal electronics and specifically smartphones, was weaker, including Chinese smartphone manufacturers. Automotive and industrial both declined sequentially but still grew single digits from the year-ago quarter. In contrast, Communications Equipment grew about 20% year-on-year, benefiting from 5G deployment. 
On a regional basis, demand in China was weaker than the other regions. End markets within China, though, behaved directionally consistent with the rest of the world. We are seeing signs from our customers and the channel that this weakness is primarily from increased caution due to trade tensions. We assume that this weakness is a combination of lower local end demand as well as reduced exports, but we do not have the visibility to distinguish between the 2. In addition, I would note that distributors, particularly in Asia, did get more conservative on their inventory positions late in the quarter. 
Finally, as we do at the end and close of each calendar year, I'll now describe our revenue by end market for 2018, which is a good indicator of our strategic progress. We break this into 6 categories: industrial; automotive; personal electronics, which includes products such as mobile phones, PCs, tablets and TVs; communications equipment; enterprise systems; and other, which is primarily calculators. In summary, industrial, automotive and enterprise systems each grew double digits, while communications equipment was about even, and personal electronics declined low-single digits in 2018. Specifically, as a percentage of revenue, industrial was 36% and automotive was 20%. Personal electronics was 23%, comms equipment and enterprise systems were 11% and 7%, respectively. Other was 3% of revenue, down low single digits.
One of our competitive advantages is diversity and longevity. For 2018, we did not have a customer who was more than 10% of our revenue. We continue our efforts to diversify our growth across products, markets and customers, strengthening this competitive advantage. We continue to focus our strategy on industrial and automotive markets, where we've been allocating our capital and driving initiatives to strengthen our position. This is based on our belief that industrial and automotive will be the fastest-growing semiconductor markets. They have increasing semiconductor content and also provide diversity and longevity. All of this translates to high terminal value of our portfolio. In 2018, industrial and automotive combined made up 56% of TI's revenue, up from 54% in 2017 and up from 42% just 5 years ago. We have established momentum in these markets, and we see great opportunity ahead. 
Rafael will now review profitability, capital management and our outlook.",1142
140283.0,"Texas Instruments Incorporated, Q4 2018 Earnings Call, Jan 23, 2019",2019-01-23,48.0,Earnings Calls,Texas Instruments Incorporated,2598.0,1640797.0,64624539.0,Presenter Speech,Rafael Lizardi,,Executives,2,"Thanks, Dave, and good afternoon, everyone. Gross profit in the quarter was $2.41 billion or 64.8% of revenue. From a year ago, gross profit decreased primarily due to lower revenue and reduced factory loadings. Gross profit margin decreased 30 basis points.
Operating expenses in the quarter were [ $814 ] million. Operating expenses for the year were up 1% and were 20.5% of revenue, within our range of expectations. For the year, we have invested $1.56 billion in R&D, an important element of our capital allocation. Acquisition charges and noncash expense was $79 million. Acquisition charges will be about $80 million per quarter through the third quarter and then decline to about $50 million per quarter for 2 remaining years. 
Operating profit was $1.52 billion or 40.8% of revenue. Operating profit was down 3% from the year-ago quarter. Operating margin for Analog was 46.7%, and for Embedded Processing was 29.6%. Our focused investments on the best sustainable growth opportunities with differentiated positions enabled both businesses to continue to contribute nicely to free cash flow growth over time. 
Net income in the fourth quarter was $1.24 billion or $1.27 per share, which included a $0.01 discrete tax benefit not in our prior outlook as we have discussed. As a reminder, the year-ago quarter included noncash charges associated with the tax law changes. 
Let me now comment on our capital management results, starting with our cash generation. Cash flow from operations was $2.15 billion in the quarter, up 11% from a year ago. Capital expenditures were $323 million in the quarter. 
In the fourth quarter, we paid $736 million in dividends and repurchased $2.01 billion of our own stock for a total return to owners of $2.75 billion in the fourth quarter.
Our balance sheet remains strong, with $4.23 billion of cash and short-term investments at the end of the fourth quarter. Total debt was $5.1 billion, with a weighted average coupon rate of 2.77%.
Inventory days were 152, up 18 days from a year ago and above our targeted range, as mentioned on our last call. We continue to believe there is strategic value in owning and controlling our inventory. We have reduced our operating plans starting in the fourth quarter, so we are also working to replenish inventory of low-volume devices. These actions have served us well in the past. In addition, we have made progress on our next phase of our consignment programs with our distributors. We expect inventory will continue to run above our targeted range for several more quarters. 
Now let's look at some of these results for the year. In 2018, cash flow from operations was $7.19 billion. Capital expenditures were $1.13 billion or 7.2% of revenue. Free cash flow for 2018 was $6.06 billion or 38.4% of revenue. Our cash flow reflects the strength of our business model. 
As we have said, we believe free cash flow growth, especially on a per share basis, is most important to maximizing shareholder value in the long term and will be valued only if it is productively invested in the business or returned to shareholders. We remain committed to return all our free cash flow to owners. Total cash returned to owners in 2018 was $7.66 billion. This combined returns of dividends and share repurchases demonstrate our confidence in our business model and our commitment to return all free cash flow to our owners. In 2018, we paid $2.56 billion in dividends or about 42% of free cash flow, evidence of their sustainability. Outstanding share count was reduced by 3.9% in 2018 and has been reduced by 45% since the end of 2004, when we initiated our program designed to reduce our share count.
Turning to our outlook for the first quarter, we expect TI revenue in the range of $3.34 billion to $3.62 billion and earnings per share to be in the range of $1.03 to $1.21, which includes an estimated $20 million discrete tax benefit. For 2019, our operating -- our annual operating tax rate remains unchanged from our prior expectation of 16%. As usual, details of our expectations for taxes can be found on our IR website under Financial Summary Data.
In closing, we believe that after 10 quarters of year-on-year growth, the weakness we are seeing is primarily due to the semiconductor cycle. In addition, the macro environment, including uncertainty caused by trade tensions, could impact the depth and duration of this cycle. Given our experience, we will stay focused on making TI stronger for the long term while remaining diligent in the short term. We continue to invest in our competitive advantages, which are technology and manufacturing, portfolio breadth, market reach and diverse and long-lived positions. We will continue to strengthen these advantages through disciplined capital allocation and by focusing on the best products, Analog and Embedded Processing, and the best markets, industrial and automotive, which I believe will enable us to continue to improve and deliver free cash flow per share growth for a long time to come. 
With that, let me turn it back to Dave.",845
140283.0,"Texas Instruments Incorporated, Q4 2018 Earnings Call, Jan 23, 2019",2019-01-23,48.0,Earnings Calls,Texas Instruments Incorporated,2598.0,1640797.0,64624540.0,Presenter Speech,Dave Pahl,,Executives,3,"Thanks, Rafael. 
Operator, you can now open the lines for questions. [Operator Instructions] Operator?",14
140283.0,"Texas Instruments Incorporated, Q4 2018 Earnings Call, Jan 23, 2019",2019-01-23,48.0,Earnings Calls,Texas Instruments Incorporated,2598.0,1640797.0,64624541.0,Question and Answer Operator Message,Operator,,Operator,4,[Operator Instructions] We will take our first question from Vivek Arya with Bank of America.,15
140283.0,"Texas Instruments Incorporated, Q4 2018 Earnings Call, Jan 23, 2019",2019-01-23,48.0,Earnings Calls,Texas Instruments Incorporated,2598.0,1640797.0,64624542.0,Question,Vivek Arya,,Analysts,5,"I'm curious, how are you managing your utilization in this downturn that we are seeing? I know, Rafael, you mentioned that you have long-lived parts. But how are you managing utilization? And how are you making any distinction by the end market that the specific part is going into? And as part of that, should we continue to assume the same 75% or so incremental gross margin fall-through?",69
140283.0,"Texas Instruments Incorporated, Q4 2018 Earnings Call, Jan 23, 2019",2019-01-23,48.0,Earnings Calls,Texas Instruments Incorporated,2598.0,1640797.0,64624543.0,Answer,Rafael Lizardi,,Executives,6,"Yes. So let me answer the last one first, yes, and now let me go back to your question. So as I -- there's a bit of an echo on the call, but as I -- as we talked a lot on the call 90 days ago, we have reduced our wafer starts to align our operating plan better with our revenue expectations. We did that in fourth quarter, and we're doing that again in first quarter. That does drive lower factory loadings, and that does have a P&L effect. But the way we're thinking about it is as owner, is from a cash standpoint. So inventory is a use of cash. As we drive down inventory, that actually helps cash. And most -- more importantly, it sets us up to support our revenue expectations for the coming year. As revenue expectations -- those certain expectations change over time, then we'll adjust the factory loadings and utilization in order to manage that appropriately.",163
140283.0,"Texas Instruments Incorporated, Q4 2018 Earnings Call, Jan 23, 2019",2019-01-23,48.0,Earnings Calls,Texas Instruments Incorporated,2598.0,1640797.0,64624544.0,Answer,Dave Pahl,,Executives,7,"Yes, and I'll just add to the second part of your question. We've got tens of thousands of products across 100,000 customers, so you can imagine the complexity of that planning. The strongest signal that we get is the orders from customers as well as the demand signals that we get through our consignment programs. So as we go through with planned wafer starts, that's what we pay close attention to. And obviously in a time like this, we'll be very diligent in watching that and then proactively moving when we need to. So with that, do you have a follow-up, Vivek?",102
140283.0,"Texas Instruments Incorporated, Q4 2018 Earnings Call, Jan 23, 2019",2019-01-23,48.0,Earnings Calls,Texas Instruments Incorporated,2598.0,1640797.0,64624545.0,Question,Vivek Arya,,Analysts,8,"Dave, so the second part is I know you mentioned that it's hard to predict when we come out of this downturn. But are there any other signs that you look at, even if they're qualitative, that can give us some indication when whether this is a 1 or 2 or 3-quarter issue? I understand it's very trade-dependent. But have you seen cancellations that are any different or similar to prior downturns? Any other color that you could help -- that you could give us to help us try and at least predict somewhat when we come out of this will be very useful.",104
140283.0,"Texas Instruments Incorporated, Q4 2018 Earnings Call, Jan 23, 2019",2019-01-23,48.0,Earnings Calls,Texas Instruments Incorporated,2598.0,1640797.0,64624546.0,Answer,Dave Pahl,,Executives,9,"Yes, Vivek, so maybe just a couple of things. I think when we look at different things that we can look at like cancellations, they were up in the quarter but just up a little. Lead times overall, they continue to be stable. We can always find pockets where we're working aggressively with customers to close. But by and far, they tend to be very stable. So we'll look at all of those signals. I think on a broader view, and I've been in the industry for over 30 years now, we looked at data over that period of time. And I've been through 9 up cycles, and obviously, we're entering into the ninth down cycle. And if you stared at the data, and I've seen in your reports, Vivek, that you've done some analysis on that too, there is no typical or average to those numbers. But if you had to pick a number, it's probably around 12 months that a cycle could last. And things like the trade tensions could lengthen that, but it doesn't mean it has to be that long. As you know, it could be longer or shorter than that. So again, the best signal that we get is those orders from customers. Rafael, you want to add to that?",215
140283.0,"Texas Instruments Incorporated, Q4 2018 Earnings Call, Jan 23, 2019",2019-01-23,48.0,Earnings Calls,Texas Instruments Incorporated,2598.0,1640797.0,64624547.0,Answer,Rafael Lizardi,,Executives,10,"Yes, just to add to that, we are proactively setting the operating plan so that we can manage whatever comes at us. So it's at a level that if we can run sideways for a while, we are prepared to support a potential snapback. Or if it's deeper and longer, then we have to make further adjustments. But we're in a good position to make those adjustments and protect the cash flow and have the company in a good position going forward.",82
140283.0,"Texas Instruments Incorporated, Q4 2018 Earnings Call, Jan 23, 2019",2019-01-23,48.0,Earnings Calls,Texas Instruments Incorporated,2598.0,1640797.0,64624548.0,Question and Answer Operator Message,Operator,,Operator,11,We'll move to John Pitzer with Crédit Suisse.,9
140283.0,"Texas Instruments Incorporated, Q4 2018 Earnings Call, Jan 23, 2019",2019-01-23,48.0,Earnings Calls,Texas Instruments Incorporated,2598.0,1640797.0,64624549.0,Question,John Pitzer,,Analysts,12,"Just, Rafael, going back to kind of utilization and inventory, I know you said in your prepared comments, you'll be above sort of your inventory targets for next several quarters. I'm just kind of curious, relative to how you see the world today and what action you've already taken on utilization, do you think 152 days will represent kind of the peak in inventory days? Or would you expect it to migrate higher before migrating lower? And I guess as you answer the question, if you could just remind us with the consignment plan, kind of how -- what are the new targets for inventory longer term?",107
140283.0,"Texas Instruments Incorporated, Q4 2018 Earnings Call, Jan 23, 2019",2019-01-23,48.0,Earnings Calls,Texas Instruments Incorporated,2598.0,1640797.0,64624550.0,Answer,Rafael Lizardi,,Executives,13,"Yes, so that's a good question. Let me just give you a few things to think about on that. First, as I said before, at the end of the day, our objective here is to maximize long-term growth of free cash flow. So that's how we think about all these knobs. Loadings and inventory is one of them. CapEx is another one, and then all we're doing is trying to maximize the long-term growth. With inventory, as we say, we see value in owning that inventory. That's part of the reason why we are building that low volume -- those low-volume buffers that we talked about. It's also the reason why we're increasing the consignment inventory. And that does push -- put upward pressure on inventory. At the same time, we -- overall, we have lowered the operating plan. So that is to control the cash that's used for inventory more so than any particular inventory days target. Now to get to the heart of your specific question, it depends, right? So if this thing gets weaker, then inventory days could theoretically go up higher than 152. If it stays above stable, then over 1, 2 or 3 quarters, we'll get back to the -- inside the range.",208
140283.0,"Texas Instruments Incorporated, Q4 2018 Earnings Call, Jan 23, 2019",2019-01-23,48.0,Earnings Calls,Texas Instruments Incorporated,2598.0,1640797.0,64624551.0,Answer,Dave Pahl,,Executives,14,"You have a follow-up, John?",6
140283.0,"Texas Instruments Incorporated, Q4 2018 Earnings Call, Jan 23, 2019",2019-01-23,48.0,Earnings Calls,Texas Instruments Incorporated,2598.0,1640797.0,64624552.0,Question,John Pitzer,,Analysts,15,"Dave, as a follow-up, you talked about sort of the -- there has been times where discrepancy in growth between Analog and Embedded. I'm wondering if you could just help us understand kind of from an end market perspective where the discrepancy is sort of the largest. So for example, I know in comms space, there's a really good content story on the Analog side that might not be there on the Embedded side. So when you look at the difference of growth rates, is there any sort of end market color you can give us?",96
140283.0,"Texas Instruments Incorporated, Q4 2018 Earnings Call, Jan 23, 2019",2019-01-23,48.0,Earnings Calls,Texas Instruments Incorporated,2598.0,1640797.0,64624553.0,Answer,Dave Pahl,,Executives,16,"Yes. And certainly, both of those segments do have different end market exposure. We talked about the benefit that Analog is seen in comms equipment. Most of our PE revenue is in Analog as well, so that's the difference. We do have some inside of Embedded. But -- and John, if you look at year-over-year growth rates for as long as we've had these segments out there, you'll notice in times that they actually move in opposite directions. And -- but over time, if you look at those numbers, they really do perform more similar. And then also if you look at just industry data for the Analog market and compare that to the Embedded market, those behave differently. So I think that that's just kind of the facts of how those 2 businesses behave.",135
140283.0,"Texas Instruments Incorporated, Q4 2018 Earnings Call, Jan 23, 2019",2019-01-23,48.0,Earnings Calls,Texas Instruments Incorporated,2598.0,1640797.0,64624554.0,Question and Answer Operator Message,Operator,,Operator,17,We'll move next to Harlan Sur with JPMorgan.,9
140283.0,"Texas Instruments Incorporated, Q4 2018 Earnings Call, Jan 23, 2019",2019-01-23,48.0,Earnings Calls,Texas Instruments Incorporated,2598.0,1640797.0,64624555.0,Question,Harlan Sur,,Analysts,18,"What was the book to bill in the December quarter? And near term, kind of looking at bookings and the rolling forecast on your direct and consignment base customers, have you guys seen any signs of stabilization? Or do the near-term trends still suggest kind of continued weakness along the same sort of slope?",54
140283.0,"Texas Instruments Incorporated, Q4 2018 Earnings Call, Jan 23, 2019",2019-01-23,48.0,Earnings Calls,Texas Instruments Incorporated,2598.0,1640797.0,64624556.0,Answer,Dave Pahl,,Executives,19,"Yes. So our book to bill, and I always make this comment whenever it's asked, we've got now 65% of our revenues on some type of a consignment program. So you're seeing that number begin to move up as we implement further stages of our consignment programs with distributors. So book to bill is -- somewhat, you just have to be cautious with the number. But this past quarter it was 0.98. It was 0.98 a year ago and 0.96 in the last quarter. So that's just what the facts are. I think if you look at things like order linearity, orders decreased each month of the quarter. To some degree, that's not completely unusual that in the fourth quarter that you'd see weakness as you got into the third month. But I'd just say that those orders and the demand feeds that we get from our customers has really driven us to give you the guidance that we have. So that's really where we are, Harlan. You have a follow-on?",171
