companyid,headline,mostimportantdateutc,keydeveventtypeid,keydeveventtypename,companyname,audiolengthsec,transcriptid,transcriptcomponentid,transcriptcomponenttypename,transcriptpersonname,companyofperson,speakertypename,componentorder,componenttext,word_count
140283.0,"Texas Instruments Incorporated, Q1 2020 Earnings Call, Apr 21, 2020",2020-04-21,48.0,Earnings Calls,Texas Instruments Incorporated,3666.0,2015182.0,78838814.0,Answer,Rafael Lizardi,,Executives,74,"Yes. No, good question. First, let me step back and remind you that for us, the objective of inventory is to maintain high levels of customer service, minimize obsolescence while we improve our manufacturing asset utilization. The target of $115 million to $145 million, frankly, is kind of incidental, right? It's just a calculation. 
At the end of the day, this is a capital allocation decision. We're going to -- we have 2 -- 2-point some billion dollars of inventory. That's real money. That's on the balance sheet that if it wasn't there, it'd be back in the owner's bucket. So we're very thoughtful in how we're going to -- how we make those decisions to put potentially more inventory on that balance sheet, right? 
That's less cash than we have. But we just think it's going to give us great optionality throughout this thing, right? 
And like any decision when it comes to capital management, it's going to depend, right? So that's the decision we're making now. We have to see how things develop in the coming months. And based on that, we'll adjust. The important thing, the inventory lasts a long time. This is inventory that the scrap levels on this inventory is very, very low. So the others that -- well, there's working capital and an opportunity cost to it. But it's very low given that it's highly unlikely that it's going to be scrapped, and it gives us just tremendous optionality on the other side.",249
140283.0,"Texas Instruments Incorporated, Q1 2020 Earnings Call, Apr 21, 2020",2020-04-21,48.0,Earnings Calls,Texas Instruments Incorporated,3666.0,2015182.0,78838815.0,Answer,Richard Templeton,,Executives,75,"Okay. Just to follow-up, Rafael, and Tim, Rafael said this before, so it's just me repeating his comment. The other thing to keep in mind and he spelled this out is, while our inventory would be growing in the second quarter, we will drain yet again distribution inventory. So we just got to keep these multiple variables in mind, and it just keeps putting us in a better and better position when we're doing that. So if our balance sheet may show higher inventory, but we love the fact that that channel inventory will be getting leaner and leaner, and the inventory will be in one place where we can get the most effective use out of it.",118
140283.0,"Texas Instruments Incorporated, Q1 2020 Earnings Call, Apr 21, 2020",2020-04-21,48.0,Earnings Calls,Texas Instruments Incorporated,3666.0,2015182.0,78838816.0,Answer,Rafael Lizardi,,Executives,76,"And I'll go ahead and add, when you and all the investors listening on the call, when you compare us to most or maybe all of our competitors, our balance sheet is very different in that regard, because we have many consignment arrangements. Well, 6 days at 5%, 2/3 of our revenue goes to consignment, whether it's through distribution or directly with the end customer. 
So that puts upwards pressure on that inventory level that we have. We also have our own manufacturing too including assembly test operation, whereas to a very high degree, about 80% of our output goes through our fabs and maybe 60% or 70% through our assembly test operations. So that's also very different than our competitors. So that's why it's not apples-to-apples when you compare our inventory levels to those of our competitors. 
But let me make the point, though, that we think owning and controlling that inventory is a strategic asset. So we're very pleased we've -- we having those consignment arrangement. Clearly, very pleased with owning our own manufacturing and what that has enabled us to do any time, but particularly in times of disruption, like what we just experienced and continue to experience, where it just really puts us in a much better position to support our customers.",217
140283.0,"Texas Instruments Incorporated, Q1 2020 Earnings Call, Apr 21, 2020",2020-04-21,48.0,Earnings Calls,Texas Instruments Incorporated,3666.0,2015182.0,78838817.0,Answer,Dave Pahl,,Executives,77,Right. Okay. I think we have time for one last caller.,11
140283.0,"Texas Instruments Incorporated, Q1 2020 Earnings Call, Apr 21, 2020",2020-04-21,48.0,Earnings Calls,Texas Instruments Incorporated,3666.0,2015182.0,78838818.0,Question and Answer Operator Message,Operator,,Operator,78,"And we will go to Mark Lipacis, Jefferies.",8
140283.0,"Texas Instruments Incorporated, Q1 2020 Earnings Call, Apr 21, 2020",2020-04-21,48.0,Earnings Calls,Texas Instruments Incorporated,3666.0,2015182.0,78838819.0,Question,Mark Lipacis,,Analysts,79,"So I had one. Our own field work in the supply chain downstream from you guys indicate that inventories are indeed like normal, if not lean levels. And as the virus spreads around the world to places like Malaysia and Philippines that there's shortages of components, understanding that your inventories are higher than -- at the high end of the range and not hearing anything about TI shortages. But basically, supply is being disrupted, and there's a reticence to give up any excess inventories downstream for you. I'm wondering if you could describe what you're seeing on your own supplier base that you want to run your factories at consistent levels here. Are you seeing any of these supply chain disruptions that your customers are seeing at other components. Are you seeing that? And how are you managing that? And there's a risk that you're not going to be able to run your capacities consistently because of your own supply disruptions? That's all I had.",165
140283.0,"Texas Instruments Incorporated, Q1 2020 Earnings Call, Apr 21, 2020",2020-04-21,48.0,Earnings Calls,Texas Instruments Incorporated,3666.0,2015182.0,78838820.0,Answer,Rafael Lizardi,,Executives,80,"Yes. Sure. Yes. No, no problem. The short answer to that is we're not seeing anything worth mentioning on this call, little things here and there, but nothing that we cannot manage. 
Remember, I referred to our business continuity program. And we've been -- in this call, we've been talking mainly about inventory, finished goods inventory that we carry, but that also applies on multiple other angles. So for example, we also carry raw material inventory buffer. We have many dual and triple and quadruple sourcing of key raw materials. And we also have, as I talked about earlier geographically, the diverse manufacturing footprint in Malaysia, in the Philippines, in Taiwan, in Mexico, in China. So that just really puts us in a very good position. Also gives us leverage to work with those suppliers, which, by the way, we pay them in 30 days. 
We make -- that's part of our thinking, to be fair to those suppliers, and we don't play games on that. So that -- that's also from a long-term relationship standpoint, I think we are in very good shape with all of those suppliers.",189
140283.0,"Texas Instruments Incorporated, Q1 2020 Earnings Call, Apr 21, 2020",2020-04-21,48.0,Earnings Calls,Texas Instruments Incorporated,3666.0,2015182.0,78838821.0,Answer,Dave Pahl,,Executives,81,Would you like to wrap this up?,7
140283.0,"Texas Instruments Incorporated, Q1 2020 Earnings Call, Apr 21, 2020",2020-04-21,48.0,Earnings Calls,Texas Instruments Incorporated,3666.0,2015182.0,78838822.0,Answer,Rafael Lizardi,,Executives,82,"Yes. So let me just wrap up by reiterating what we have said previously. History has shown us that it is times like this when we can make the most strategic progress. We will continue to invest in and strengthen our 4 competitive advantages, which are manufacturing technology, portfolio breadth, market reach and diverse and long-lived products. We will also continue to pursue the 3 ambitions Rich mentioned: We will act like owners who will own the company for decades; we will adapt in a world that's ever changing; and we will be a company that we're personally proud to be a part of and would be proud to have as a neighbor. 
When we are successful, our employees, customers, communities and owners will all benefit. It is these ambitions that will guide our decisions in weeks and months ahead as we navigate in these uncertain times. Our best to you and your families.",154
140283.0,"Texas Instruments Incorporated, Q1 2020 Earnings Call, Apr 21, 2020",2020-04-21,48.0,Earnings Calls,Texas Instruments Incorporated,3666.0,2015182.0,78838823.0,Question and Answer Operator Message,Operator,,Operator,83,"And ladies and gentlemen, that does conclude today's conference. Thank you all for your participation.",15
140283.0,"Texas Instruments Incorporated, Q2 2020 Earnings Call, Jul 21, 2020",2020-07-21,48.0,Earnings Calls,Texas Instruments Incorporated,2667.0,2077091.0,81507765.0,Presentation Operator Message,Operator,,Operator,0,"Good day and welcome to the Texas Instruments 2Q '20 Earnings Release Conference Call. Today's conference is being recorded. At this time, I would like to turn the conference over to Mr. Dave Pahl. Please go ahead, sir.",38
140283.0,"Texas Instruments Incorporated, Q2 2020 Earnings Call, Jul 21, 2020",2020-07-21,48.0,Earnings Calls,Texas Instruments Incorporated,2667.0,2077091.0,81507766.0,Presenter Speech,Dave Pahl,,Executives,1,"Thank you. And good afternoon, and thank you for joining our second quarter 2020 earnings conference call. For any of you who missed the release, you can find it on our website at ti.com/ir. This call is being broadcast live over the web and can be accessed through our website. A replay will be available through the web.
This call will include forward-looking statements that involve risks and uncertainties that could cause TI's results to differ materially from management's current expectations. We encourage you to review the notice regarding forward-looking statements contained in the earnings release published today as well as TI's most recent SEC filings for a more complete description.
Our Chief Financial Officer, Rafael Lizardi, is with me today, and we'll provide the following updates. First, I'll start with a reminder of the framework we described during the April earnings call for how we'll navigate the COVID-19 economy. Next, I'll provide insight into the second quarter revenue results with more details than usual by end market, including sequential performance since it's more informative at this time. And lastly, Rafael will cover financial results, some insight into onetime items and our guidance for the third quarter.
During the April call, we explained that we will use our 3 ambitions to drive our decisions as they are particularly helpful in uncertain times like we faced with COVID-19. For decades, these ambitions have driven all decisions inside TI. They are: to act like owners who own the company for decades; secondly, to adapt and succeed in a world that's ever changing; and third, to be a company that you're proud to be a part of and will be proud to have as a neighbor. When we pursue these ambitions, our employees, customers, communities and owners will all benefit.
While second quarter did not experience the depth of the decline we saw in the 2008 financial crisis, nonetheless, we remain cautious on how the economy might behave over the next few years. As a reminder, in April, we provided a broader framework to help you understand how we'll operate through this environment. First, we will maintain high optionality with our operating plan so we can support customers, particularly during a time when their ability to forecast will be limited. Next, we'll maintain investments in R&D and in new capabilities like those for ti.com since they're 5- to 10-year time horizon decisions and critical to building TI stronger. And finally, we will invest to ensure long-term manufacturing capacity, particularly for the 2022 to '25 time frame. Making decisions with our ambitions in mind will continue to serve us well. And that, coupled with the framework I just mentioned, should help you understand our actions.
We are particularly pleased with our decision to maintain an operating plan that allowed us to maximize our optionality. During the second quarter, we were able to respond to unforecasted demand. We will continue to maintain this posture in the third quarter.
Moving on, I will now provide some insight into our second quarter revenue. There are several key points to summarize what we're seeing in the market. First, overall, the weakness was primarily from the automotive market. Automotive was down about 40% sequentially and down over 40% compared to a year ago. To help appreciate this impact, excluding automotive, TI was up 8% sequentially and down 3% versus a year ago. The automotive market appears to have bottomed in May as North American and European assembly plants resumed operations.
Next, the industrial market was up about 2% sequentially and also up 2% from a year ago. There are end markets that are weak and others that are understandably strong, like medical. We do believe that some customers are trying to maintain strong inventory positions to limit exposure to any supply chain disruptions. Personal Electronics was up over 20% sequentially and up about 10% compared to a year ago. This can best be explained by work-from-home trends and TI being in a position to support unforecasted demand in the second quarter.
Next, communications equipment was up 20% sequentially, but down 15% compared to a year ago. Within this market, it's important to note that Analog achieved sequential and year-over-year growth, while Embedded was down in both comparisons, following our planned decline in this portion of the business.
Enterprise systems was up sequentially and year-over-year. This strength, similar to Personal Electronics, is best explained by work-from-home trends and TI being positioned to support unforecasted demand.
Rafael will now review profitability, capital management and our outlook.",755
140283.0,"Texas Instruments Incorporated, Q2 2020 Earnings Call, Jul 21, 2020",2020-07-21,48.0,Earnings Calls,Texas Instruments Incorporated,2667.0,2077091.0,81507767.0,Presenter Speech,Rafael Lizardi,,Executives,2,"Thanks, Dave, and good afternoon, everyone. Second quarter revenue was $3.2 billion, down 12% from a year ago. Gross profit in the quarter was $2.1 billion or 64% of revenue. From a year ago, gross profit decreased due to lower revenue, and gross profit margin was even.
Operating expenses in the quarter were $780 million, down 4% from a year ago and about as expected. On a trailing 12-month basis, operating expenses were 23% of revenue.
Over the last 12 months, we have invested $1.5 billion in R&D.
Operating profit was $1.2 billion in the quarter or 38% of revenue. Operating profit was down 18% from the year-ago quarter.
Net income in the second quarter was $1.4 billion or $1.48 per share, which included a $0.33 benefit primarily for tax-related items that were not in our prior outlook. The benefit included $0.02 of restructuring charges to strengthen our Embedded business by focusing investments on the best opportunities for long-term growth.
Let me now comment on our capital management results, starting with our cash generation. Cash flow from operations was $1.7 billion in the quarter. Capital expenditures were $130 million in the quarter. Free cash flow on a trailing 12-month basis was $5.7 billion.
In the quarter, we paid $823 million in dividends and repurchased $882 million of our stock for a total return to owners of $1.7 billion. In total, we have returned $6.7 billion in the past 12 months, consistent with our strategy to return all free cash flow. Over the same period, our dividends represented 56% of free cash flow, underscoring their sustainability.
Our balance sheet remains strong with $5 billion of cash and short-term investments at the end of the second quarter. In the quarter, we issued $750 million of debt with a coupon of 1.75% due in 10 years. This resulted in total debt of $6.8 billion, with a weighted average coupon of 2.77%. We have repaid $500 million of debt due in the second quarter, and we have no further debt due this year. We have $550 million of debt due in 2021.
Regarding inventory, TI inventory dollars were up $133 million from first quarter, and days were 166, about as expected. Distribution-owned inventory declined again in second quarter by about $150 million, the seventh consecutive quarter of planned reductions as we continue the transition to have fewer distributors and bring more customers direct. Tactically and strategically, we are pleased. We have held total inventory dollars steady while increasing the percent of inventory held inside TI and therefore in fewer places. This enables us to continue to maintain short lead times and high availability to meet unforecasted customer demand.
For the third quarter, we expect TI revenue in the range of $3.26 billion to $3.54 billion and earnings per share to be in the range of $1.14 to $1.34.
Regarding our factory operating plan, as we have stated, we will maintain high optionality so we can continue to support customers' demand, particularly during a time when their ability to forecast may continue to be limited. We have informed our customers that lead times on our products remain short, and more than 40,000 products are available for immediate shipment on ti.com. Short lead times and high availability are important capabilities that allow us to continue to support our customers' near-term and unforecasted demand. Our product portfolio of mostly long-lived parts afford us to have a steady hand, and therefore, we will take a similar approach to our factory operating plan again in third quarter.
In closing, we continue to invest to strengthen our competitive advantages and in making our business stronger. History has shown us that it is in times like these when we can make the most strategic progress.
With that, let me turn it back to Dave.",633
140283.0,"Texas Instruments Incorporated, Q2 2020 Earnings Call, Jul 21, 2020",2020-07-21,48.0,Earnings Calls,Texas Instruments Incorporated,2667.0,2077091.0,81507768.0,Presenter Speech,Dave Pahl,,Executives,3,"Thanks, Rafael. Operator, you can now open the lines for questions. [Operator Instructions] Operator?",14
140283.0,"Texas Instruments Incorporated, Q2 2020 Earnings Call, Jul 21, 2020",2020-07-21,48.0,Earnings Calls,Texas Instruments Incorporated,2667.0,2077091.0,81507769.0,Question and Answer Operator Message,Operator,,Operator,4,[Operator Instructions] We'll take our first question from Stacy Rasgon with Bernstein Research.,13
140283.0,"Texas Instruments Incorporated, Q2 2020 Earnings Call, Jul 21, 2020",2020-07-21,48.0,Earnings Calls,Texas Instruments Incorporated,2667.0,2077091.0,81507770.0,Question,Stacy Rasgon,,Analysts,5,"First question I have, you still mentioned that you think some of your industrial customers are trying to build, I guess, inventories and making sure that their own position is still strong. But if your lead times are short and you're building -- you have 40,000 products that are ready to ship, why would any of your customers actually have any need to prebuy anything? And if so, do you think what you're seeing right now is maybe just more indicative of what the actual end demand state might look like? Like how do we square that circle?",98
140283.0,"Texas Instruments Incorporated, Q2 2020 Earnings Call, Jul 21, 2020",2020-07-21,48.0,Earnings Calls,Texas Instruments Incorporated,2667.0,2077091.0,81507771.0,Answer,Dave Pahl,,Executives,6,"Yes, Stacy, it's a good question. I think as we've talked about last quarter, we saw some unusual order patterns as we talked about revenue running up really strong into March and things abating. They certainly didn't abate as we thought that they would. We saw supply constraints across the industry. And sometimes, as customers' orders -- as they look at building inventory, our visibility ends at their dock when we ship them products. So they may decide to build some finished good inventory, so we don't have visibility into that. So that's really not a number that we can look into a system to provide us that. It's really just more instinct and experience and also just talking to our field teams and getting input from that standpoint. So that's -- when we look at the numbers, that's what it's telling us.",143
140283.0,"Texas Instruments Incorporated, Q2 2020 Earnings Call, Jul 21, 2020",2020-07-21,48.0,Earnings Calls,Texas Instruments Incorporated,2667.0,2077091.0,81507772.0,Answer,Rafael Lizardi,,Executives,7,"Yes, Stacy, just to add to that, a few comments. One, out of our 100,000 or so customers, I would guess 70,000 to 80,000 of those are in industrial, right? So it's frankly just difficult to draw conclusions with such a huge number of customers that have different idiosyncrasies in the way they behave. The other thing I would tell you is that if I'm a purchasing manager of one of these customers and I'm ordering 200 different parts for our board, are they really going to treat certain suppliers a little differently than others if they decided to build inventory to stock up and feel safer? Probably not, right? So that's another dynamic that maybe you should take into account.",121
140283.0,"Texas Instruments Incorporated, Q2 2020 Earnings Call, Jul 21, 2020",2020-07-21,48.0,Earnings Calls,Texas Instruments Incorporated,2667.0,2077091.0,81507773.0,Answer,Dave Pahl,,Executives,8,"And not in all cases, right?",6
140283.0,"Texas Instruments Incorporated, Q2 2020 Earnings Call, Jul 21, 2020",2020-07-21,48.0,Earnings Calls,Texas Instruments Incorporated,2667.0,2077091.0,81507774.0,Answer,Rafael Lizardi,,Executives,9,Right.,1
140283.0,"Texas Instruments Incorporated, Q2 2020 Earnings Call, Jul 21, 2020",2020-07-21,48.0,Earnings Calls,Texas Instruments Incorporated,2667.0,2077091.0,81507775.0,Answer,Dave Pahl,,Executives,10,"Not in all cases. So there's probably some of that, and that's just the caution that we provide. You have a follow-up, Stacy?",23
140283.0,"Texas Instruments Incorporated, Q2 2020 Earnings Call, Jul 21, 2020",2020-07-21,48.0,Earnings Calls,Texas Instruments Incorporated,2667.0,2077091.0,81507776.0,Question,Stacy Rasgon,,Analysts,11,"Yes. I guess just to follow up on that a little bit, so if I look at kind of the trajectory you've had over the last few quarters, Q1, you were above seasonal; Q2 ex auto, you were above seasonal; your Q3 guide is kind of at the low end of the seasonal but kind of roughly. I mean so far, like at least outside of auto, it doesn't seem like the pandemic is having any real impact on you at all. I just find it a little surprising. I mean what are you hearing from your customers, if anything, as to that effect in terms of what they're seeing and the impact that the pandemic is having on the supply chain because as far as I can tell, it's not having much impact on you at all? I guess it's good.",142
140283.0,"Texas Instruments Incorporated, Q2 2020 Earnings Call, Jul 21, 2020",2020-07-21,48.0,Earnings Calls,Texas Instruments Incorporated,2667.0,2077091.0,81507777.0,Answer,Dave Pahl,,Executives,12,"Well, I'll remind you that the number we've turned in was down 12%, right? So...",15
140283.0,"Texas Instruments Incorporated, Q2 2020 Earnings Call, Jul 21, 2020",2020-07-21,48.0,Earnings Calls,Texas Instruments Incorporated,2667.0,2077091.0,81507778.0,Question,Stacy Rasgon,,Analysts,13,"Yes. But it was up 8% ex auto, right?",9
140283.0,"Texas Instruments Incorporated, Q2 2020 Earnings Call, Jul 21, 2020",2020-07-21,48.0,Earnings Calls,Texas Instruments Incorporated,2667.0,2077091.0,81507779.0,Answer,Dave Pahl,,Executives,14,"Correct. Yes. And unfortunately, we have to report the numbers with auto in, so that is the reality. Auto was down 40%, so that is real. And the auto manufacturers closed down because of COVID, so I wouldn't quite go so far to say that it didn't have an impact.
And if you look inside of that, you saw strength in some areas like the work-from-home trends, like PCs and tablets and servers from the inside of enterprise, right? So we're seeing some strength that's due to that, which is also driving that. So there's some things that are moving around that we saw. And the other thing that I'd -- if you look longer term, when we -- as we entered the year, as you know, I think we described back in January that we were seeing signs of stabilization with the fourth quarter results. As we had worked our way through the bottom of the cycle, we're starting to see those signs of stabilization. Now with those signs of stabilization, again, we just turned in a down 12% overall.
So those are the results, and we do have to report the numbers all in. But I think it is important we wanted to give the color of auto because that was the driver of the weakness from a year ago. So thanks, Stacy.",225
140283.0,"Texas Instruments Incorporated, Q2 2020 Earnings Call, Jul 21, 2020",2020-07-21,48.0,Earnings Calls,Texas Instruments Incorporated,2667.0,2077091.0,81507780.0,Question and Answer Operator Message,Operator,,Operator,15,We'll hear now from Vivek Arya with Bank of America.,11
