companyid,headline,mostimportantdateutc,keydeveventtypeid,keydeveventtypename,companyname,audiolengthsec,transcriptid,transcriptcomponentid,transcriptcomponenttypename,transcriptpersonname,companyofperson,speakertypename,componentorder,componenttext,word_count
18749.0,"Amazon.com Inc., Q2 2013 Earnings Call, Jul 25, 2013",2013-07-25,48.0,Earnings Calls,"Amazon.com, Inc.",2533.0,490099.0,22647634.0,Question,Benjamin Schachter,,Analysts,29,"Two quick questions on revenue recognition. Over the past few [ph]  quarters, I believe that the surge [ph] in digital media, at least, has moved around between the agency and wholesale model. Can you help us quantify how this has actually impacted the reported media revenue rates? In other words, would 2Q revenue rates have been meaningfully different if the model had been the same? And the second question, just quickly on Prime. Can you remind us how you recognize revenue from the Prime membership fee over the course of the year?",92
18749.0,"Amazon.com Inc., Q2 2013 Earnings Call, Jul 25, 2013",2013-07-25,48.0,Earnings Calls,"Amazon.com, Inc.",2533.0,490099.0,22647635.0,Answer,Thomas Szkutak,,Executives,30,"Sure. In terms of the Prime, we recognize it over the life of the subscription. And then in terms of third party versus first party, certainly, we have had some shift within digital media. But again, digital media is primarily a first-party business and happens to be one portion of our business. But you're absolutely right. And in terms of our third-party business, which from a unit perspective is 40% of our total units this quarter, we recognize the share of that revenue, the rev share, if you will, as revenue. Whereas the other parts of our business, largely, we're recognizing that as first-party revenue. And so we're recognizing the full amount of the revenue in the current period.",119
18749.0,"Amazon.com Inc., Q2 2013 Earnings Call, Jul 25, 2013",2013-07-25,48.0,Earnings Calls,"Amazon.com, Inc.",2533.0,490099.0,22647636.0,Question and Answer Operator Message,Operator,,Operator,31,"Our next question comes from Jordan Rohan from Stifel, Nicolaus.",10
18749.0,"Amazon.com Inc., Q2 2013 Earnings Call, Jul 25, 2013",2013-07-25,48.0,Earnings Calls,"Amazon.com, Inc.",2533.0,490099.0,22647637.0,Question,Jordan Rohan,,Analysts,32,"I'm curious about your expansion efforts in Spain, since it's a relatively new territory for you, how well situated you are and how ready you are for the fourth quarter there. And also, there've been a lot of stories about Amazon heading into Brazil, but I don't believe we've identified any fulfillment centers and things like that. Can you discuss the extent and breadth of your offering in Brazil, whether it's Kindle devices, digital media or something beyond that?",80
18749.0,"Amazon.com Inc., Q2 2013 Earnings Call, Jul 25, 2013",2013-07-25,48.0,Earnings Calls,"Amazon.com, Inc.",2533.0,490099.0,22647638.0,Answer,Thomas Szkutak,,Executives,33,"In terms of Spain, we're very excited about what we see. It's growing very fast. We're in investment mode, and it's an exciting geography for us and we're very optimistic, over time, that will be a great geography for us. So we're very happy to serve customers in Spain, and we'll continue to -- as we've done in other geographies, that we'll continue to serve customers and continue to expand selection and get service levels even better over time, and so very excited about that. In terms of Brazil, we do have a Kindle store, and we have devices at physical retailers. So from a Kindle perspective, that's what we're doing in Brazil.",113
18749.0,"Amazon.com Inc., Q2 2013 Earnings Call, Jul 25, 2013",2013-07-25,48.0,Earnings Calls,"Amazon.com, Inc.",2533.0,490099.0,22647639.0,Question and Answer Operator Message,Operator,,Operator,34,Our next question comes from Ron Josey from JMP Securities.,10
18749.0,"Amazon.com Inc., Q2 2013 Earnings Call, Jul 25, 2013",2013-07-25,48.0,Earnings Calls,"Amazon.com, Inc.",2533.0,490099.0,22647640.0,Question,Ronald Josey,,Analysts,35,"I'm wondering if you can talk a little bit about North America EGM. Just given the strength you saw in the business and the continued reacceleration, have you seen any sort of impact, and assuming no, but from price-matching programs from offline retailers, and we'll talk -- and also on sales tax?",53
18749.0,"Amazon.com Inc., Q2 2013 Earnings Call, Jul 25, 2013",2013-07-25,48.0,Earnings Calls,"Amazon.com, Inc.",2533.0,490099.0,22647641.0,Answer,Thomas Szkutak,,Executives,36,"In terms of North America total growth, we saw an acceleration from last quarter from 26% to 30%. We saw an acceleration in both North America media as well as North America EGM. Within EGM, it was very broad in terms of growth. We saw very strong growth across many different categories, and so very pleased with that. I called out a couple that were notable in terms of apparel, as well as in consumables. Certainly, those are getting larger and still growing very fast, which is why I've called those out. In terms of competitiveness, it's been -- it's very competitive. It is today, it has been since our inception. We have many different competitors online. We have many competitors offline. As you go to your home or office, you pass our competitors every day. That's an environment we're used to dealing in. It's something that's not new. It's something that we see in all of our geographies across many different categories.",163
18749.0,"Amazon.com Inc., Q2 2013 Earnings Call, Jul 25, 2013",2013-07-25,48.0,Earnings Calls,"Amazon.com, Inc.",2533.0,490099.0,22647642.0,Question and Answer Operator Message,Operator,,Operator,37,Our next question comes from Heath Terry from Goldman Sachs.,10
18749.0,"Amazon.com Inc., Q2 2013 Earnings Call, Jul 25, 2013",2013-07-25,48.0,Earnings Calls,"Amazon.com, Inc.",2533.0,490099.0,22647643.0,Question,Heath Terry,,Analysts,38,"As you get closer to customers with more FCs and more efficient shipping, what kind of impact is that having on conversion rates on -- within customers in those areas? Is shipping time shortened, or delivery time shortened? And then as you look at the early adopters for Fresh in L.A., any sense that you can share with us of what kind of cross-shopping you're seeing among new Fresh customers? Are they bundling media and EGM in those other orders? Or to any degree, are these new Amazon -- new-to-Amazon customers that have been brought in purely because of Fresh?",100
18749.0,"Amazon.com Inc., Q2 2013 Earnings Call, Jul 25, 2013",2013-07-25,48.0,Earnings Calls,"Amazon.com, Inc.",2533.0,490099.0,22647644.0,Answer,Thomas Szkutak,,Executives,39,"If you take a look at L.A., it's just, again, very excited and it's very early. So I think on that one, you'll just have to stay tuned. But in terms of as we get closer and closer to customers with fulfillment, we have seen growth due to that, and it's manifested its way -- in a few different ways. But most notably, you see it in Prime. We've -- because of our fulfillment logistics capability, we've been able to offer Prime broadly. And we just have selection that's just closer and closer to customers. And if you look back over the last several years, there's been different reasons why we've grown the way we've grown, in terms of adding new selection and making sure that we have really sharp pricing. But certainly, Prime, which includes speed of delivery, has certainly been a notable -- has had a notable impact. And we're very pleased with the Prime program. Customers like it. We're adding -- we see very strong growth in Prime subscribers. We see very good retention of Prime members. So it's a great program for us and certainly, again, delivery speed is certainly impacting that program and our overall growth.",202
18749.0,"Amazon.com Inc., Q2 2013 Earnings Call, Jul 25, 2013",2013-07-25,48.0,Earnings Calls,"Amazon.com, Inc.",2533.0,490099.0,22647645.0,Question and Answer Operator Message,Operator,,Operator,40,Our next question comes from Anthony DiClemente from Barclays.,9
18749.0,"Amazon.com Inc., Q2 2013 Earnings Call, Jul 25, 2013",2013-07-25,48.0,Earnings Calls,"Amazon.com, Inc.",2533.0,490099.0,22647646.0,Question,Anthony DiClemente,,Analysts,41,"Topic of media. Just wondering, Tom, if there are any callouts in terms of categories of strength or weakness within physical or digital media that you could call out? And along those lines, just wondering if you could comment on your media device rollout strategy from here, if there's anything you could tell us. And then quickly, is there any reason Prime Instant Video isn't available for Android devices?",69
18749.0,"Amazon.com Inc., Q2 2013 Earnings Call, Jul 25, 2013",2013-07-25,48.0,Earnings Calls,"Amazon.com, Inc.",2533.0,490099.0,22647647.0,Answer,Thomas Szkutak,,Executives,42,"In terms of media growth, not a lot of callouts, except probably the obvious is digital units growing very fast relative to physical units, and we're excited to see that. And because of where we are, we're further penetrated in North America, you're seeing a bigger impact on our growth rate than you are in International, and we certainly see that, but not a lot of other callouts there. But again, we're very pleased and certainly, customers are responding to many things, including selection and great prices and everything else within those digital offerings. But also, they're responding to unique selection that we have. And we -- if you take a look at our release, you'll see the specific numbers related to some of the exclusives we have and certainly, that's having an impact. So there's many, many different things that are working for us in that space as part of our overall ecosystem for digital that we're pleased with. In terms of our device plan, we're very pleased with the devices we have and to offer customers. We think we have a great offering, both in terms of Kindle and Kindle Fire. And in terms of our future road map, we have a long-standing practice of not talking about what they'll -- what that will be prior to announcement.",220
18749.0,"Amazon.com Inc., Q2 2013 Earnings Call, Jul 25, 2013",2013-07-25,48.0,Earnings Calls,"Amazon.com, Inc.",2533.0,490099.0,22647648.0,Question and Answer Operator Message,Operator,,Operator,43,Our next question comes from Youssef Squali from Cantor Fitzgerald.,10
18749.0,"Amazon.com Inc., Q2 2013 Earnings Call, Jul 25, 2013",2013-07-25,48.0,Earnings Calls,"Amazon.com, Inc.",2533.0,490099.0,22647649.0,Question,Youssef Squali,,Analysts,44,"2 quick questions please. Tech and content was up to 9% of revenues. I think that's the highest it's ever been. How much of that is actually streaming-content related, and how do we look at it going forward? Does it stay at that elevated level? And then on Fresh, is that business profitable for you in the Seattle area?",59
18749.0,"Amazon.com Inc., Q2 2013 Earnings Call, Jul 25, 2013",2013-07-25,48.0,Earnings Calls,"Amazon.com, Inc.",2533.0,490099.0,22647650.0,Answer,Thomas Szkutak,,Executives,45,"In terms of tech and content, we're spending in a number of different areas, but there's a few that I'd like to highlight. One is, certainly, keep in mind that the infrastructure related to our very fast-growing web services business is included in tech and content. So certainly, as we ramp up that business and it's becoming more sizable and growing very fast, you're seeing that impacting that line item. We're also investing very heavily in digital, and that's across many different parts of our digital offerings there. That's also included any of the tech teams that are working on customer experience across Amazon as we grow. So as we support both our seller businesses and our retail businesses, they're included in that line item. So certainly, that's what you're seeing there. In terms of Fresh, we're not breaking out the financials, and -- but keep in mind that Fresh was designed as a pilot. And certainly, the economics have improved over time through invention on behalf of the team there, as well as operating efficiencies. So again, that was set up as a test and which has enabled us to launch L.A.",193
18749.0,"Amazon.com Inc., Q2 2013 Earnings Call, Jul 25, 2013",2013-07-25,48.0,Earnings Calls,"Amazon.com, Inc.",2533.0,490099.0,22647651.0,Question and Answer Operator Message,Operator,,Operator,46,And we'll now go to Colin Sebastian from Robert Baird.,11
18749.0,"Amazon.com Inc., Q2 2013 Earnings Call, Jul 25, 2013",2013-07-25,48.0,Earnings Calls,"Amazon.com, Inc.",2533.0,490099.0,22647652.0,Question,Colin Sebastian,,Analysts,47,"I guess a quick follow-up on the device strategy, and given the fairly quick pace of innovation in the tablet market overall, I wonder if you can contrast the benefits of that for Amazon, given the popularity of shopping and media apps, with the costs and complexity of maintaining your own line of hardware. And related to this, it seems as if the pace of new content acquisition and licensing has picked up a bit. And so I wonder if that reflects any changes in either the competitive dynamics or pricing, or is some sort of other strategy shift on your part?",103
18749.0,"Amazon.com Inc., Q2 2013 Earnings Call, Jul 25, 2013",2013-07-25,48.0,Earnings Calls,"Amazon.com, Inc.",2533.0,490099.0,22647653.0,Answer,Thomas Szkutak,,Executives,48,"In terms of some of the dynamics, we're very excited about our digital business. We're inventing. You see a lot of different inventions, both on the hardware side as well as on the software side from a device standpoint. You also see a lot of invention around the content side. And we think, for example, in our Prime Instant Video, which combines video and our Prime membership, is very compelling and we're investing heavily in content. It's still very early there, but we're finding that customers, certainly existing Prime members, are more and more streaming content. We're having new Prime members come to Amazon largely because of video in terms of one segment of that population that's coming -- for new Prime members is because of Prime Instant Video, and we can see that based on the free trials and the conversion of those free trials from -- related to Prime Instant Video. And so that's certainly one portion of our growth in Prime memberships which we find exciting. For us to be able to offer exclusive content on the book side is very interesting. So again, we're inventing a lot of different -- across a lot of different areas, and yes, there are a lot of different dynamics, but we think we're well suited for both device, software and content side of those businesses.",225
18749.0,"Amazon.com Inc., Q2 2013 Earnings Call, Jul 25, 2013",2013-07-25,48.0,Earnings Calls,"Amazon.com, Inc.",2533.0,490099.0,22647654.0,Question and Answer Operator Message,Operator,,Operator,49,Our next question comes from Matt Nemer from Wells Fargo Securities.,11
18749.0,"Amazon.com Inc., Q2 2013 Earnings Call, Jul 25, 2013",2013-07-25,48.0,Earnings Calls,"Amazon.com, Inc.",2533.0,490099.0,22647655.0,Question,Matt Nemer,,Analysts,50,"Just 2 questions. One, given your comments that International will be in investment mode for some time, can you just remind us what the priorities are there from either a geography or a product standpoint? And then secondly, following the management changes at Quidsi, would love an update on the plans for that business and maybe just a sense for how integrated it is to Amazon Retail?",67
18749.0,"Amazon.com Inc., Q2 2013 Earnings Call, Jul 25, 2013",2013-07-25,48.0,Earnings Calls,"Amazon.com, Inc.",2533.0,490099.0,22647656.0,Answer,Thomas Szkutak,,Executives,51,"Yes. In terms of the International piece, what I was referring to was -- why it's in investment mode for sometime, I was referring to China specifically. And we have a lot of opportunity to grow. We'll still continue to invest in International, but my comment was specifically around China. And then your question around Quidsi? I missed it, the last part.",62
18749.0,"Amazon.com Inc., Q2 2013 Earnings Call, Jul 25, 2013",2013-07-25,48.0,Earnings Calls,"Amazon.com, Inc.",2533.0,490099.0,22647657.0,Question and Answer Operator Message,Operator,,Operator,52,And we'll go to Stephen Ju from Crdit Suisse.,10
18749.0,"Amazon.com Inc., Q2 2013 Earnings Call, Jul 25, 2013",2013-07-25,48.0,Earnings Calls,"Amazon.com, Inc.",2533.0,490099.0,22647658.0,Question,Stephen Ju,,Analysts,53,"Tom, is there...",3
18749.0,"Amazon.com Inc., Q2 2013 Earnings Call, Jul 25, 2013",2013-07-25,48.0,Earnings Calls,"Amazon.com, Inc.",2533.0,490099.0,22647659.0,Answer,Thomas Szkutak,,Executives,54,"Just to follow up, I think on the -- the Quidsi question, I think, was around the founders leaving, and were you well positioned with them leaving. I missed the last part of that. But no, we did -- we were fortunate to have the founders with us for a number of years. They did a great job while they were here, and we have a great team at Quidsi and we're pleased with that business. And the team -- retail team works very closely with the Quidsi business and excited to have that as part of the Amazon team.",100
18749.0,"Amazon.com Inc., Q2 2013 Earnings Call, Jul 25, 2013",2013-07-25,48.0,Earnings Calls,"Amazon.com, Inc.",2533.0,490099.0,22647660.0,Question,Stephen Ju,,Analysts,55,"Tom, is there anything you can share in terms of the situation in Germany with the worker strikes? Are you able to fulfill from unaffected fulfillment centers, or is it causing some hindrance to your operations there? And also, if you can update us on what you've been doing with Kiva since you've acquired it. Are you focusing more on internal integration, or are you selling more aggressively to external clients?",71
18749.0,"Amazon.com Inc., Q2 2013 Earnings Call, Jul 25, 2013",2013-07-25,48.0,Earnings Calls,"Amazon.com, Inc.",2533.0,490099.0,22647661.0,Answer,Thomas Szkutak,,Executives,56,"In terms of Germany, there's not a lot I can add to there. We're certainly serving customers. Those results are reflected in our overall total results that you see today for Q2, as well as our International results. In terms of Kiva, we certainly -- we have a great team there. We love the technology. We don't have any announcements in terms of rollouts. But we're ahead of schedule from what we had set out at the time of purchase, which we're happy about. So you'll have to stay tuned on the actual rollout, but we're very encouraged by what we see there.",103
18749.0,"Amazon.com Inc., Q2 2013 Earnings Call, Jul 25, 2013",2013-07-25,48.0,Earnings Calls,"Amazon.com, Inc.",2533.0,490099.0,22647662.0,Question and Answer Operator Message,Operator,,Operator,57,And our final question comes from Ken Sena from Evercore Partners.,11
18749.0,"Amazon.com Inc., Q2 2013 Earnings Call, Jul 25, 2013",2013-07-25,48.0,Earnings Calls,"Amazon.com, Inc.",2533.0,490099.0,22647663.0,Question,Kenneth Sena,,Analysts,58,"Just going back to your comments on unit acceleration. Has the shift from agency to wholesale in terms of the DOJ e-book settlement, has that completed or are you still working your way through many of the U.S. publishers?",39
18749.0,"Amazon.com Inc., Q2 2013 Earnings Call, Jul 25, 2013",2013-07-25,48.0,Earnings Calls,"Amazon.com, Inc.",2533.0,490099.0,22647664.0,Answer,Thomas Szkutak,,Executives,59,"We're working through it. I wouldn't say that that's complete, but we're working through it.",16
18749.0,"Amazon.com Inc., Q2 2013 Earnings Call, Jul 25, 2013",2013-07-25,48.0,Earnings Calls,"Amazon.com, Inc.",2533.0,490099.0,22647665.0,Answer,Sean Boyle,,Executives,60,"Okay. Thank you for joining us on the call today and for your questions. A replay will be available on our Investor Relations website, at least through the end of the quarter. We appreciate your interest in Amazon.com and look forward to talking with you again next quarter.",48
18749.0,"Amazon.com Inc., Q3 2013 Earnings Call, Oct 24, 2013",2013-10-24,48.0,Earnings Calls,"Amazon.com, Inc.",2694.0,533471.0,24431618.0,Presentation Operator Message,Operator,,Operator,0,"Thank you for standing by. Good day, everyone, and welcome to the Amazon.com Third Quarter 2013 Financial Results Teleconference. [Operator Instructions] Today's call is being recorded. For opening remarks, I will be turning the call over to the Vice President of Investor Relations, Mr. Sean Boyle. Please go ahead, sir.",50
18749.0,"Amazon.com Inc., Q3 2013 Earnings Call, Oct 24, 2013",2013-10-24,48.0,Earnings Calls,"Amazon.com, Inc.",2694.0,533471.0,24431619.0,Presenter Speech,Sean Boyle,,Executives,1,"Hello, and welcome to our Q3 2013 financial results conference call. Joining us today is Tom Szkutak, our CFO. We will be available for questions after our prepared remarks.
The following discussion and responses to your questions reflect management's views as of today, October 24, 2013, only, and will include forward-looking statements. Actual results may differ materially. Additional information about factors that could potentially impact our financial results is included in today's press release and our filings with the SEC, including our most recent annual report on Form 10-K. As you listen to today's conference call, we encourage you to have our press release in front of you, which includes our financial results, as well as our metrics and commentary on the quarter.
During this call, we will discuss certain non-GAAP financial measures. In our press release, slides accompanying this webcast and our filings with the SEC, each of which is posted on our IR website, you will find additional disclosures regarding these non-GAAP measures, including reconciliations of these measures with comparable GAAP measures. Finally, unless otherwise stated, all comparisons in this call will be against our results for the comparable period of 2012.
Now I will turn the call over to Tom.",203
