companyid,headline,mostimportantdateutc,keydeveventtypeid,keydeveventtypename,companyname,audiolengthsec,transcriptid,transcriptcomponentid,transcriptcomponenttypename,transcriptpersonname,companyofperson,speakertypename,componentorder,componenttext,word_count
18749.0,"Amazon.com Inc., Q1 2013 Earnings Call, Apr 25, 2013",2013-04-25,48.0,Earnings Calls,"Amazon.com, Inc.",2156.0,448260.0,20979476.0,Question and Answer Operator Message,Operator,,Operator,10,"Moving on, we'll take a question from Mark Mahaney of RBC Capital Markets.",13
18749.0,"Amazon.com Inc., Q1 2013 Earnings Call, Apr 25, 2013",2013-04-25,48.0,Earnings Calls,"Amazon.com, Inc.",2156.0,448260.0,20979477.0,Question,Mark Mahaney,,Analysts,11,"Just a broad question on demand. That's kind of mid-teens at the low end revenue growth that you've been kind of guiding to for a quarter or 2 now. That would seem well below the kind of the average that you've seen in the past. Are there any other factors you would want to call out or specifically not call out? Do you think that things like the imposition of state sales taxes are having a near-term drag on growth rates? Last quarter, I think you talked about consumer electronics at the high end, are there any particular categories there you would want to call out as maybe driving that low -- that could produce the low end of the range outside of negative FX?",125
18749.0,"Amazon.com Inc., Q1 2013 Earnings Call, Apr 25, 2013",2013-04-25,48.0,Earnings Calls,"Amazon.com, Inc.",2156.0,448260.0,20979478.0,Answer,Thomas Szkutak,,Executives,12,"Sure. We give -- as we've been consistently doing, we're giving a wide range. We think that's appropriate given all the factors, that's not something new that we're doing. That's something that we have been doing for some time. And you're right, the growth rate guidance for Q2 is 13% to 26%. Certainly, foreign exchange having an impact, that includes approximately 275 basis points of foreign exchange, so it's approximately 16% to 29% on a local currency basis. So again, it's a wide range, and there's probably not a lot to add there but it takes into account all the things that we think we need to take into account as we give guidance. And in terms of the absolute dollar range, it's very similar to what we would have in terms of the dollar range we would have given for Q1. I think it's maybe a $100 million difference in terms of the absolute value of that range that we gave. So again, a wide range, we think that, that's appropriate.",172
18749.0,"Amazon.com Inc., Q1 2013 Earnings Call, Apr 25, 2013",2013-04-25,48.0,Earnings Calls,"Amazon.com, Inc.",2156.0,448260.0,20979479.0,Question and Answer Operator Message,Operator,,Operator,13,Our next question today will come from Ben Schachter of Macquarie.,11
18749.0,"Amazon.com Inc., Q1 2013 Earnings Call, Apr 25, 2013",2013-04-25,48.0,Earnings Calls,"Amazon.com, Inc.",2156.0,448260.0,20979480.0,Question,Benjamin Schachter,,Analysts,14,"Are there any factors that are impacting the unit growth, particularly that the shift from physical to digital, for instance, a rented video versus purchasing a video? Or are there any other factors that you'd highlight that are impacting the unit growth?",42
18749.0,"Amazon.com Inc., Q1 2013 Earnings Call, Apr 25, 2013",2013-04-25,48.0,Earnings Calls,"Amazon.com, Inc.",2156.0,448260.0,20979481.0,Answer,Thomas Szkutak,,Executives,15,"The one factor I would call out, first of all, in terms of overall unit growth, our overall unit growth is 30% year-over-year, again, very solid growth. It compares to approximately 49% of -- in Q1 of last year, so it's certainly -- we're certainly overlapping a pretty strong growth last Q1. In terms of the physical and digital, certainly, one thing that we're seeing is certainly digital is growing at a much faster rate. And where you do see that a little bit is in our third-party units as a percentage of total units. You'll see that, that's approximately 40% this quarter. That compares to last year, up about approximately 100 basis points. But what we are seeing is because the digital units are growing at a faster rate and they're mostly first-party, you're seeing that number impacted our -- that percentage, as a percentage of our total, is not growing as fast as it has the last few quarters. And again, that's largely driven by the digital units growth that you're seeing. So again, that's -- if you were to back out, for example, and just look at our physical units, our physical units as a percentage of total units this year versus last year is up over 300 basis points. Yes, again, that's 3P growth as a percentage of total units.",224
18749.0,"Amazon.com Inc., Q1 2013 Earnings Call, Apr 25, 2013",2013-04-25,48.0,Earnings Calls,"Amazon.com, Inc.",2156.0,448260.0,20979482.0,Question and Answer Operator Message,Operator,,Operator,16,Our next question today comes from Ross Sandler of Deutsche Bank.,11
18749.0,"Amazon.com Inc., Q1 2013 Earnings Call, Apr 25, 2013",2013-04-25,48.0,Earnings Calls,"Amazon.com, Inc.",2156.0,448260.0,20979483.0,Question,Ross Sandler,,Analysts,17,"Question on the -- follow-up question on the shipping. So just your shipping costs, not your net shipping margin, but your shipping costs relative to gross profit declined about 300 basis points, similar to what you've seen over the past 4 quarters. So as you start to comp some of these efficiency gains that you're seeing in shipping, do you think that line will continue to show leverage or is it going to start to level out from here?",79
18749.0,"Amazon.com Inc., Q1 2013 Earnings Call, Apr 25, 2013",2013-04-25,48.0,Earnings Calls,"Amazon.com, Inc.",2156.0,448260.0,20979484.0,Answer,Thomas Szkutak,,Executives,18,"Yes, we're not giving -- certainly not giving guidance on any specific line item, but certainly over a long period of time, we think there's opportunity to be more productive there. And there's certainly efficiency gains to be had there. And that's something that certainly the team will continuously work on.",51
18749.0,"Amazon.com Inc., Q1 2013 Earnings Call, Apr 25, 2013",2013-04-25,48.0,Earnings Calls,"Amazon.com, Inc.",2156.0,448260.0,20979485.0,Question and Answer Operator Message,Operator,,Operator,19,Next we'll hear from Colin Sebastian of Robert W. Baird & Company.,13
18749.0,"Amazon.com Inc., Q1 2013 Earnings Call, Apr 25, 2013",2013-04-25,48.0,Earnings Calls,"Amazon.com, Inc.",2156.0,448260.0,20979486.0,Question,Colin Sebastian,,Analysts,20,A question on web services. I wonder if you can comment on enterprise-level adoption and whether there are any meaningful barriers to that happening over time? We noticed you've been pretty aggressive in hiring enterprise-level sales people.,37
18749.0,"Amazon.com Inc., Q1 2013 Earnings Call, Apr 25, 2013",2013-04-25,48.0,Earnings Calls,"Amazon.com, Inc.",2156.0,448260.0,20979487.0,Answer,Thomas Szkutak,,Executives,21,"No, I don't think that there is. I think the team is doing a fantastic job in terms of developing services that are great for many different customer types, including enterprises. And the team is heads-down-focused on making sure we have a great operational -- these services are great from an operational standpoint and a security standpoint and they're doing a terrific job. And so it's a very great opportunity for enterprises to adopt our web services, and the team is certainly focused on that along with other customers. And so -- other customers -- so again it's a great opportunity for those customers and for us.",107
18749.0,"Amazon.com Inc., Q1 2013 Earnings Call, Apr 25, 2013",2013-04-25,48.0,Earnings Calls,"Amazon.com, Inc.",2156.0,448260.0,20979488.0,Question and Answer Operator Message,Operator,,Operator,22,Our next question comes from Douglas Anmuth of JPMorgan.,9
18749.0,"Amazon.com Inc., Q1 2013 Earnings Call, Apr 25, 2013",2013-04-25,48.0,Earnings Calls,"Amazon.com, Inc.",2156.0,448260.0,20979489.0,Question,Douglas Anmuth,,Analysts,23,"You've clearly been more aggressive in terms of video content recently, and you're sort of leading with it more in the release tonight in terms of the business content. I was hoping if you could just add some more color here on the value that you think that TV and movie content adds to consumers' overall purchase patterns?",59
18749.0,"Amazon.com Inc., Q1 2013 Earnings Call, Apr 25, 2013",2013-04-25,48.0,Earnings Calls,"Amazon.com, Inc.",2156.0,448260.0,20979490.0,Answer,Thomas Szkutak,,Executives,24,"Sure. It's certainly one of our digital offerings, and we have a number of different -- a few different services. We have certainly content that we're using as part of our Prime offer, that we have a lot of free content for customers. We think that's a great service for customers, along with our express shipping offers, as well as other content that we have free. For example, our Kindle owners Lending Library for books. So again, we think it's a great -- Prime's a great value for customers and it's part of that value proposition. We also have a very good transaction business for video as well, that's growing very, very fast. And certainly, customers like it and we're seeing that reflected in the results that you see today.",130
18749.0,"Amazon.com Inc., Q1 2013 Earnings Call, Apr 25, 2013",2013-04-25,48.0,Earnings Calls,"Amazon.com, Inc.",2156.0,448260.0,20979491.0,Question and Answer Operator Message,Operator,,Operator,25,"Moving on, we'll hear next from Justin Post with Merrill Lynch.",11
18749.0,"Amazon.com Inc., Q1 2013 Earnings Call, Apr 25, 2013",2013-04-25,48.0,Earnings Calls,"Amazon.com, Inc.",2156.0,448260.0,20979492.0,Question,Justin Post,,Analysts,26,"I was wondering if you could help us a little bit about the Kindle ecosystem. On prior calls a few years ago, you singled it out as a fast-growth area, and you're very happy with the performance. We haven't heard as much about it lately. Kind of the impact of sort of how units are doing against your expectations, and then the impact it's having on Prime subs and also your gross and operating margins?",75
18749.0,"Amazon.com Inc., Q1 2013 Earnings Call, Apr 25, 2013",2013-04-25,48.0,Earnings Calls,"Amazon.com, Inc.",2156.0,448260.0,20979493.0,Answer,Thomas Szkutak,,Executives,27,"We're very pleased with our Kindle and digital business, and we're super excited. In terms of the ecosystem, you're certainly seeing that in our results that you see today. For example, if you look at our Media growth, we're certainly -- that ecosystem is more penetrated there than it is in international, and you see that reflected in those associated growth rates. Another way you see it is if you take a look at our top 10 best-selling items worldwide in Q1, the top 10 are all either digital or Kindle-related. Paperwhite is our best-selling product worldwide. But again, all 10 spots in the Q1 were either Kindle or digital items. And I believe that, that's the first time that we've seen that. We've been looking at that from a quarter results standpoint for some period of time, and we've had various levels of the top 10, but I think this may be the first quarter we've had all top 10 being either Kindle-related or digital-related. So again, we're very pleased with what we're doing there, and we're going to continue to innovate on behalf of customers.",188
18749.0,"Amazon.com Inc., Q1 2013 Earnings Call, Apr 25, 2013",2013-04-25,48.0,Earnings Calls,"Amazon.com, Inc.",2156.0,448260.0,20979494.0,Question,Justin Post,,Analysts,28,Any impact on your gross or operating margins you want to call out?,13
18749.0,"Amazon.com Inc., Q1 2013 Earnings Call, Apr 25, 2013",2013-04-25,48.0,Earnings Calls,"Amazon.com, Inc.",2156.0,448260.0,20979495.0,Answer,Thomas Szkutak,,Executives,29,"The one thing I would say is we certainly are investing. It's certainly an area of investment, and you're seeing that reflected. We're making a number of investments across the business, and certainly we're investing in Kindle and our digital offerings. We're investing in some of the other things I mentioned earlier like China, some of the emerging geographies. So those are certainly some of the larger key investments we're making.",71
18749.0,"Amazon.com Inc., Q1 2013 Earnings Call, Apr 25, 2013",2013-04-25,48.0,Earnings Calls,"Amazon.com, Inc.",2156.0,448260.0,20979496.0,Question and Answer Operator Message,Operator,,Operator,30,"Moving on, we'll hear from Matt Nemer of Wells Fargo Securities.",11
18749.0,"Amazon.com Inc., Q1 2013 Earnings Call, Apr 25, 2013",2013-04-25,48.0,Earnings Calls,"Amazon.com, Inc.",2156.0,448260.0,20979497.0,Question,Matt Nemer,,Analysts,31,We're hearing reports that there is refrigeration equipment going into some of your fulfillment centers outside of Seattle area. Just wondering if you can update us on plans to expand Amazon Fresh?,33
18749.0,"Amazon.com Inc., Q1 2013 Earnings Call, Apr 25, 2013",2013-04-25,48.0,Earnings Calls,"Amazon.com, Inc.",2156.0,448260.0,20979498.0,Answer,Thomas Szkutak,,Executives,32,"No, I have nothing to announce. We're very pleased with what we've seen in the Seattle area. But again, it's been a test, and we continue to monitor that test carefully. It's certainly something that we see that customers love the experience. The challenge has always been making sure we can get the economics right, and that's something we'll continue to focus on.",63
18749.0,"Amazon.com Inc., Q1 2013 Earnings Call, Apr 25, 2013",2013-04-25,48.0,Earnings Calls,"Amazon.com, Inc.",2156.0,448260.0,20979499.0,Question and Answer Operator Message,Operator,,Operator,33,"And up next, we'll take a question from Stephen Ju of Credit Suisse.",13
18749.0,"Amazon.com Inc., Q1 2013 Earnings Call, Apr 25, 2013",2013-04-25,48.0,Earnings Calls,"Amazon.com, Inc.",2156.0,448260.0,20979500.0,Question,Stephen Ju,,Analysts,34,"Tom, anything you can say in terms of how much Amazon has done in video as well as potentially your own in-house-produced content currently helps and will -- should in the future help reduce churn in Amazon Prime?",38
18749.0,"Amazon.com Inc., Q1 2013 Earnings Call, Apr 25, 2013",2013-04-25,48.0,Earnings Calls,"Amazon.com, Inc.",2156.0,448260.0,20979501.0,Answer,Thomas Szkutak,,Executives,35,"Yes, it's something -- we haven't released any of the numbers. It's something that we're tracking very closely. It is something that we believe over time will reduce churn, and that's certainly helping today. What we are seeing is great traction. We see a lot of usage of the service. Customers love it, and we think it's a very interesting part of Prime offering, and that's why we have been expanding in why you see some of the more recent announcement, including some of the stuff included in the earnings release today around original content. So again, it's something that we find very interesting, and we're excited about it.",109
18749.0,"Amazon.com Inc., Q1 2013 Earnings Call, Apr 25, 2013",2013-04-25,48.0,Earnings Calls,"Amazon.com, Inc.",2156.0,448260.0,20979502.0,Question and Answer Operator Message,Operator,,Operator,36,And we'll go next to Ken Sena of Evercore Partners with our next question.,15
18749.0,"Amazon.com Inc., Q1 2013 Earnings Call, Apr 25, 2013",2013-04-25,48.0,Earnings Calls,"Amazon.com, Inc.",2156.0,448260.0,20979503.0,Question,Kenneth Sena,,Analysts,37,"I was just hoping you can maybe provide a little more color on the unit growth deceleration. And looking back over the last 4 quarters, it seems like about 500 basis points or so each quarter of deceleration, you had about 200 basis points here, which is an improvement. But anything you could say just to any signs of maturity in some of the businesses in maybe where that deceleration is specifically coming from?",74
18749.0,"Amazon.com Inc., Q1 2013 Earnings Call, Apr 25, 2013",2013-04-25,48.0,Earnings Calls,"Amazon.com, Inc.",2156.0,448260.0,20979504.0,Answer,Thomas Szkutak,,Executives,38,"No, there's not a lot I can add. I mean, I think the -- 30% is still a very strong growth rate. Again, that's growing at a faster rate than revenue, revenue at 22%, revenue local currency growth of 24%, very strong third-party growth continues to be very strong, retail growth is strong. So again, there's not a lot I can provide you there. But again, keep in mind that we are overlapping 49% growth last year Q1, which is certainly a little bit of a difficult compare. But again, pleased with the 30% growth rate.",96
18749.0,"Amazon.com Inc., Q1 2013 Earnings Call, Apr 25, 2013",2013-04-25,48.0,Earnings Calls,"Amazon.com, Inc.",2156.0,448260.0,20979505.0,Question and Answer Operator Message,Operator,,Operator,39,And our next question today comes from John Blackledge of Cowen and Company.,13
18749.0,"Amazon.com Inc., Q1 2013 Earnings Call, Apr 25, 2013",2013-04-25,48.0,Earnings Calls,"Amazon.com, Inc.",2156.0,448260.0,20979506.0,Question,John Blackledge,,Analysts,40,"Just a question on the Amazon advertising platform. Given the immense amount of purchase data you have on Amazon customers, how is that being used as a competitive advantage? And maybe you just provide an overall view on the direction of the Amazon ad platform over time?",47
18749.0,"Amazon.com Inc., Q1 2013 Earnings Call, Apr 25, 2013",2013-04-25,48.0,Earnings Calls,"Amazon.com, Inc.",2156.0,448260.0,20979507.0,Answer,Thomas Szkutak,,Executives,41,"Yes. In terms of the platform itself, we think it's a very sizable, very good long-term opportunity for us. And it's something that we've been working on for some time, and we just think it's very interesting. One thing you'll notice, on our site, we're being obviously very -- making sure the customer experience is great. What we're really trying to do is we're trying to help customers find and discover what they want to buy online. So we're very -- again, it's very customer-centric. But it's also, from a business standpoint, a very good long-term opportunity. We have a great team that's working on the opportunity, and we're excited about the long-term potential of it.",116
18749.0,"Amazon.com Inc., Q1 2013 Earnings Call, Apr 25, 2013",2013-04-25,48.0,Earnings Calls,"Amazon.com, Inc.",2156.0,448260.0,20979508.0,Question and Answer Operator Message,Operator,,Operator,42,Moving on to Anthony DiClemente of Barclays.,7
18749.0,"Amazon.com Inc., Q1 2013 Earnings Call, Apr 25, 2013",2013-04-25,48.0,Earnings Calls,"Amazon.com, Inc.",2156.0,448260.0,20979509.0,Question,Anthony DiClemente,,Analysts,43,"I'm just wondering what you're seeing in terms of the attach rate of your transactional video-on-demand business versus usage of Prime Instant Video. I'm wondering just if your consumers tend to choose between the 2 when they're making a selection, or does one sort of drive the other? Does a Prime subscriber have a higher transactional VOD attach rate than a non-Prime? So it would be helpful to see what you're -- to hear what you're seeing there in terms of usage.",83
18749.0,"Amazon.com Inc., Q1 2013 Earnings Call, Apr 25, 2013",2013-04-25,48.0,Earnings Calls,"Amazon.com, Inc.",2156.0,448260.0,20979510.0,Answer,Thomas Szkutak,,Executives,44,"Yes, I think the only thing to help you with this, we see -- I'll take Prime customers for example. We certainly see adoption of the service in terms of free content, but those same customers are purchasing content as well. And so there is a good attachment to it, which we like. And what we see Prime members doing not just within video content but we see them doing a lot of cross shopping, so it's not surprising. We see them do -- maybe a customer comes and has been traditionally purchasing the pre-Prime in a few categories. We find that they do a lot more cross shopping. Same thing with digital content. As they use the service, they might start with free content and then they will also continue to view and stream free content but also purchase paid content. So it's a nice effect that we're seeing, which is why we like Prime so much.",158
18749.0,"Amazon.com Inc., Q1 2013 Earnings Call, Apr 25, 2013",2013-04-25,48.0,Earnings Calls,"Amazon.com, Inc.",2156.0,448260.0,20979511.0,Question and Answer Operator Message,Operator,,Operator,45,"Up next, we'll hear from Youssef Squali of Cantor Fitzgerald.",10
18749.0,"Amazon.com Inc., Q1 2013 Earnings Call, Apr 25, 2013",2013-04-25,48.0,Earnings Calls,"Amazon.com, Inc.",2156.0,448260.0,20979512.0,Question,Youssef Squali,,Analysts,46,"Two quick questions, please. Going back to the international question, what's going on in international media to decelerate? I think last year, Q1, I think it was up 22%, FX-adjusted this quarter, it was up 7%. Is it all macro or are there any maybe other factors that you can talk about, maybe specific to SKUs or something? And the other is more of a clarification. I know last quarter, you gave the unit growth in aggregate versus the unit growth of 3P. I was wondering if you could give that to us as well?",95
18749.0,"Amazon.com Inc., Q1 2013 Earnings Call, Apr 25, 2013",2013-04-25,48.0,Earnings Calls,"Amazon.com, Inc.",2156.0,448260.0,20979513.0,Answer,Thomas Szkutak,,Executives,47,"In terms of the international media growth, this quarter, it was 1% on a dollar basis, 7% on a local currency basis, which are -- in terms of the overall growth rate, certainly what you're seeing is digital content as part of that is growing very fast, but it's not as large or as penetrated. Our ecosystem isn't as developed, I would say, as it is in the U.S. And so when you compare the 2 geographies for a second, that's one of the more meaningful differences that you see between the 2. As you see that both are growing digital content very fast, it's just the ecosystem is more built out in North America. But again, certainly, we see very positive signs, but given the growth that we're experiencing in international, it's just on a lower base, so that's again to be helpful there. In terms of the unit growth, we said that our overall unit growth was 30% for the quarter. Our 3P unit growth, I don't have the overall growth rate, but it's growing at a faster rate than the total.",184
18749.0,"Amazon.com Inc., Q1 2013 Earnings Call, Apr 25, 2013",2013-04-25,48.0,Earnings Calls,"Amazon.com, Inc.",2156.0,448260.0,20979514.0,Question and Answer Operator Message,Operator,,Operator,48,And our next question today will come from Jordan Rohan of Stifel.,12
18749.0,"Amazon.com Inc., Q1 2013 Earnings Call, Apr 25, 2013",2013-04-25,48.0,Earnings Calls,"Amazon.com, Inc.",2156.0,448260.0,20979515.0,Question,Jordan Rohan,,Analysts,49,"I was hoping if you could comment on the market entry and expansion strategy for Amazon in Brazil. There seems to be a tremendous amount of press last year about it, and it seems to have died down to some degree. I know the company may already be there with Amazon Web Services and some Kindle offerings, but when do you think that might get a little bit broader? And secondly, there's been some stories recently about an Internet streaming device box, a set-top box, something of that sort. Can you comment on any new hardware form factors, including that plus some sort of a cellphone or handset that might be coming down the pike? Anything to look forward to in the Kindle family or related?",126
18749.0,"Amazon.com Inc., Q1 2013 Earnings Call, Apr 25, 2013",2013-04-25,48.0,Earnings Calls,"Amazon.com, Inc.",2156.0,448260.0,20979516.0,Answer,Thomas Szkutak,,Executives,50,"In terms of geographic expansion, there's not a lot I can say specifically about Brazil. We think we're in the right geographies right now. We've expanded into a number of geographies over the past few years. That's certainly something we obviously look at, and you should expect us to expand into additional geographies over time. In terms of any questions related to our product roadmap, we don't -- we have a long-standing practice of not talking about what we might or might not do there, but we're certainly excited about the product roadmap that we have for the future. And again, we have a long-standing practice of not giving details until closer at launch.",114
18749.0,"Amazon.com Inc., Q1 2013 Earnings Call, Apr 25, 2013",2013-04-25,48.0,Earnings Calls,"Amazon.com, Inc.",2156.0,448260.0,20979517.0,Question and Answer Operator Message,Operator,,Operator,51,"And ladies and gentlemen, we do we have time for one final question today. That question will come from Jason Helfstein of Oppenheimer & Co.",25
18749.0,"Amazon.com Inc., Q1 2013 Earnings Call, Apr 25, 2013",2013-04-25,48.0,Earnings Calls,"Amazon.com, Inc.",2156.0,448260.0,20979518.0,Question,Jason Helfstein,,Analysts,52,"Can you give us a little more color around customer growth? I mean, it kind of -- that number has been slowing not dramatically, but that is a slowing trend. Are you focused more on higher-value customers to drive the business and any color around the quarter would be helpful.",50
18749.0,"Amazon.com Inc., Q1 2013 Earnings Call, Apr 25, 2013",2013-04-25,48.0,Earnings Calls,"Amazon.com, Inc.",2156.0,448260.0,20979519.0,Answer,Thomas Szkutak,,Executives,53,"We're actually pleased with the growth from a customer standpoint. We've seen very good growth, and we continue to -- we have many, many teams across Amazon that are just heads-down focused on trying to improve the customer experience and inventing on behalf of customers, so we couldn't be more pleased with what they're doing. And you see that reflected in our overall growth rate this quarter, with revenue up 24% on a local currency basis and units growing at 30% on top of a strong growth quarter last year Q1.",92
