companyid,headline,mostimportantdateutc,keydeveventtypeid,keydeveventtypename,companyname,audiolengthsec,transcriptid,transcriptcomponentid,transcriptcomponenttypename,transcriptpersonname,companyofperson,speakertypename,componentorder,componenttext,word_count
18749.0,"Amazon.com Inc., Q4 2012 Earnings Call, Jan 29, 2013",2013-01-29,48.0,Earnings Calls,"Amazon.com, Inc.",2214.0,406567.0,19192452.0,Presentation Operator Message,Operator,,Operator,0,"Good day, everyone, and welcome to the Amazon.com Fourth Quarter 2012 Financial Results Teleconference. [Operator Instructions] Today's call is being recorded. For opening remarks, I will be turning the call over to the Vice President of Investor Relations, Mr. Sean Boyle. Please go ahead.",44
18749.0,"Amazon.com Inc., Q4 2012 Earnings Call, Jan 29, 2013",2013-01-29,48.0,Earnings Calls,"Amazon.com, Inc.",2214.0,406567.0,19192453.0,Presenter Speech,Sean Boyle,,Executives,1,"Hello, and welcome to our Q4 2012 Financial Results Conference Call. Joining us today is Tom Szkutak, our CFO. We will be available for questions after our prepared remarks.
The following discussion and responses to your questions reflect management's views as of today, January 29, 2013 only, and will include forward-looking statements. Actual results may differ materially.
Additional information about factors that could potentially impact our financial results is included in today's press release and our filings with the SEC, including our most recent annual report on Form 10-K.
As you listen to today's conference call, we encourage you to have our press release in front of you, which includes our financial results, as well as metrics and commentary on the quarter.
During this call, we will discuss certain non-GAAP financial measures. In our press release, slides accompanying this webcast and our filings with the SEC, each of which is posted on our IR website, you will find additional disclosures regarding these non-GAAP measures, including reconciliations of these measures with comparable GAAP measures. 
Finally, unless otherwise stated, all comparisons in this call will be against our results for the comparable period of 2011.
Now I'll turn the call over to Tom.",201
18749.0,"Amazon.com Inc., Q4 2012 Earnings Call, Jan 29, 2013",2013-01-29,48.0,Earnings Calls,"Amazon.com, Inc.",2214.0,406567.0,19192454.0,Presenter Speech,Thomas Szkutak,,Executives,2,"Thanks, Sean. I'll begin with comments on our fourth quarter financial results. Trailing 12-month operating cash flow increased 7% to $4.18 billion. Trailing 12-month free cash flow decreased 81% to $395 million. Trailing 12-month capital expenditures were $3.79 billion. This amount includes $1.4 billion in purchases of our previously leased corporate office space, as well as property for development of additional corporate office space located in Seattle, Washington, which we purchased in the fourth quarter. 
The increase in capital expenditures reflects additional investments in support of continued business growth, consisting of investing in technology infrastructure, including Amazon Web Services, and additional capacity to support our fulfillment operations. 
Return on invested capital was 4%, down from 22%. ROIC is TTM free cash flow divided by average total assets minus current liabilities, excluding the current portion of long-term debt over 5 quarter ends. The combination of common stock and stock-based awards outstanding was 470 million shares compared with 468 million shares 1 year ago. 
Worldwide revenue grew 22% to $21.27 billion or 23%, excluding the $178 million unfavorable impact from year-over-year changes in foreign exchange. We're grateful to our customers who continue to take advantage of our low prices, vast selection and shipping offers. 
Media revenue increased to $6.51 billion, up 8% or 10%, excluding foreign exchange. EGM revenue increased to $13.93 billion, up 28% or 29% excluding foreign exchange. Worldwide EGM increased to 65% of worldwide sales, up from 63%. Worldwide paid unit growth was 32%. Active customer accounts exceeded 200 million. Worldwide active seller accounts were more than 2 million. Seller units represented 39% of paid units. 
Now I'll discuss operating expenses, excluding stock-based compensation. Cost of sales was $16.14 billion or 75.9% of revenue compared with 79.3%. Fulfillment, marketing, technology and content and G&A combined was $4.45 billion or 20.9% of sales, up approximately 293 basis points year-over-year. Fulfillment was $2.2 billion or 10.3% of revenue compared with 9.3%. Tech and content was $1.22 billion or 5.7% of revenue compared with 4.5%. Marketing was $833 million or 3.9% of revenue compared with 3.3%. 
Now I'll talk about our segment results, and consistent with prior periods, we do not allocate the segments our stock-based compensation or other operating expense line item. In the North America segment, revenue grew 23% to $12.17 billion. Media revenue grew 13% to $2.9 billion. EGM revenue grew 24% to $8.5 billion, representing 70% of North America revenues, up from 69%. North America segment operating income increased 114% to $608 million, a 5% operating margin. 
In the International segment, revenue grew 21% to $9.09 billion. Adjusting for the $183 million year-over-year unfavorable impact from foreign exchange, revenue growth was 23%. Media revenue grew 5% to $3.61 billion or 7%, excluding foreign exchange. And EGM revenue grew 35% to $5.43 billion or 37%, excluding foreign exchange. EGM now represents 60% of international revenues, up from 54%. 
International segment operating income decreased 61% to $70 million, a 0.8% operating margin. Excluding the unfavorable impact from foreign exchange, International segment operating income decreased 56%. CSOI increased 47% to $678 million or 3.2% of revenue, up approximately 54 basis points year-over-year. 
Unlike CSOI, our GAAP operating income includes stock-based compensation expense and other operating expense. GAAP operating income increased 56% to $405 million or 1.9% of net sales. 
Our income tax expense was $194 million in Q4, resulting in a 58% rate for the quarter and a 79% rate for the full year 2012. GAAP net income was $97 million or $0.21 per diluted share compared with $177 million and $0.38 per diluted share. 
Now I'll discuss the full year results. Revenue grew 27% to $61.09 billion. North America revenue grew 30% to $34.81 billion, and International revenue grew 23% to $26.28 billion or a 27% growth, excluding year-over-year changes in foreign exchange. Consolidated segment operating income or CSOI increased 6% to $1.67 billion or 7%, excluding the unfavorable year-over-year impact from foreign exchange. And operating margin decreased 54 basis points to 0.7%. GAAP operating income decreased 22% to $676 million or 1.1% of net sales. 
Turning to the balance sheet. Cash from marketable securities increased $1.87 billion year-over-year to $11.45 billion. Inventory increased 21% to $6.03 billion and inventory turns were 9.3, down from 10.3 turns a year ago as we expanded selection, improved in-stock levels and introduced new product categories. Accounts payable increased 20% to $13.32 billion, and accounts payable days increased to 76 from 74 in the prior year. 
In Q4 2012, we issued $3 billion of senior nonconvertible unsecured debt in 3-, 5- and 7-year tranches, with proceeds to be used for general corporate purposes. 
I'll conclude my portion of today's call with guidance. Incorporated into the guidance are the order trends that we've seen to date and what we believe today to be appropriately conservative assumptions. Our results are inherently unpredictable and may be materially affected by many factors, including a high level of uncertainty surrounding exchange rate fluctuations, as well as the global economy and consumer spending. It's not possible to accurately predict demand and, therefore, our actual results could differ materially from our guidance. 
As we describe in more detail in our public filings, issues such as settling intercompany balances and foreign currencies amongst our subsidiaries, unfavorable resolution of legal matters and changes to our effective tax rates can all have a material impact on guidance. 
Our guidance further assumes that we don't conclude any additional business acquisitions, investments or settlements, record any further revisions to stock-based compensation estimates, and that foreign exchange rates remain approximately where they've been recently. 
For Q1 2013, we expect net sales of between $15.0 billion and $16.6 billion or growth between 14% and 26%. This guidance anticipates approximately 122 basis points of unfavorable impact from foreign exchange rates, GAAP operating income or loss to be between a $285 million loss and $65 million positive income compared to $192 million of income in the prior period year. This includes approximately $285 million for stock-based compensation and amortization of intangible assets. 
We anticipate consolidated segment operating income, which excludes stock-based compensation and other expense, to be between $0 and $350 million compared to $398 million income in the prior period. 
We remain head-sound focused on driving a better customer experience through price, selection and convenience. We believe putting customers first is the only reliable way to create lasting value for shareholders. 
Thanks. With that, Sean, let's move to questions.",1070
18749.0,"Amazon.com Inc., Q4 2012 Earnings Call, Jan 29, 2013",2013-01-29,48.0,Earnings Calls,"Amazon.com, Inc.",2214.0,406567.0,19192455.0,Presenter Speech,Sean Boyle,,Executives,3,"Great. Thanks, Tom. Let's move on to the Q&A portion of the call. Operator, will you please remind our listeners how to initiate a question?",25
18749.0,"Amazon.com Inc., Q4 2012 Earnings Call, Jan 29, 2013",2013-01-29,48.0,Earnings Calls,"Amazon.com, Inc.",2214.0,406567.0,19192456.0,Question and Answer Operator Message,Operator,,Operator,4,[Operator Instructions] We'll take our first question from Scott Devitt with Morgan Stanley.,13
18749.0,"Amazon.com Inc., Q4 2012 Earnings Call, Jan 29, 2013",2013-01-29,48.0,Earnings Calls,"Amazon.com, Inc.",2214.0,406567.0,19192457.0,Question,Scott Devitt,,Analysts,5,"Tom, it looks that you've successfully begun a transition of your logistics cost in the direction of being more of a fixed fulfillment cost, with lower unit base shipping costs, given that the growth rate of shipping is now meaningfully below the fulfillment growth rate. And so the question is, is this something that we should expect to continue now on the back of this meaningful fulfillment center expansion ramp? And then separately but on the same topic, we're also wondering, are there other parts of the business in which you can make this transition to more of a fixed cost in the future?",104
18749.0,"Amazon.com Inc., Q4 2012 Earnings Call, Jan 29, 2013",2013-01-29,48.0,Earnings Calls,"Amazon.com, Inc.",2214.0,406567.0,19192458.0,Answer,Thomas Szkutak,,Executives,6,"In terms of the fulfillment question, you're right in terms of over the past few years, we have expanded our fulfillment network pretty extensively to the point where we are closer to customers. And you're seeing that reflected in our transportation costs. You can obviously see the fulfillment expense is certainly not fixed in terms of -- in absolute terms. But you can see that we had the 20 fulfillment centers last year, and that's reflected in the operating expense that you're seeing. But that is a benefit of adding to our fulfillment center network. We move closer and closer to our customers with a lot of great selection. And so you're seeing that reflected in the individual business gross margins, which shows up as benefits of transportation cost. In terms of other opportunities, certainly, there are a number of opportunities as we invest in individual customer experience areas across the business, many of those would be on our website. We have a relatively fixed expense as we've launched those, and we're able to amortize those costs over our full customer base. So as they grow and become more effective on a per unit or per customer base. So there is a number of opportunities that we have had and will have going forward to do that.",217
18749.0,"Amazon.com Inc., Q4 2012 Earnings Call, Jan 29, 2013",2013-01-29,48.0,Earnings Calls,"Amazon.com, Inc.",2214.0,406567.0,19192459.0,Question and Answer Operator Message,Operator,,Operator,7,We'll take our next question from Douglas Anmuth with JPMorgan.,11
18749.0,"Amazon.com Inc., Q4 2012 Earnings Call, Jan 29, 2013",2013-01-29,48.0,Earnings Calls,"Amazon.com, Inc.",2214.0,406567.0,19192460.0,Question,Douglas Anmuth,,Analysts,8,"Just wanted to ask about the shift to third party and, I guess, in particular, I think last 4Q, you talked about shifting more of the business in the video game space, in particular, to third party. Are there certain categories that you would specifically point to in this last 4Q, where you made sort of a similar shift?",59
18749.0,"Amazon.com Inc., Q4 2012 Earnings Call, Jan 29, 2013",2013-01-29,48.0,Earnings Calls,"Amazon.com, Inc.",2214.0,406567.0,19192461.0,Answer,Thomas Szkutak,,Executives,9,"We did see a good expansion, as you mentioned in 3P, third-party units of the percentage of total units increased from 36% last year Q4 to 39%, so an expansion of approximately 300 basis points. Our overall unit growth rate for the quarter in total was 32%, and our third-party growth rate was in excess of 40%. So again, nice growth. It is -- you're certainly seeing it in a number of areas. You see it certainly in our EGM business. If you look at our North America growth rates, you can see that our revenue was up 23%, but our third-party -- our total unit growth rate was substantially faster than that. And our third-party units were growing very fast there as well. So there's a number of different areas that you're seeing that, but certainly you're seeing it there.",141
18749.0,"Amazon.com Inc., Q4 2012 Earnings Call, Jan 29, 2013",2013-01-29,48.0,Earnings Calls,"Amazon.com, Inc.",2214.0,406567.0,19192462.0,Question and Answer Operator Message,Operator,,Operator,10,We'll take our next question from Brian Pitz with Jefferies.,11
18749.0,"Amazon.com Inc., Q4 2012 Earnings Call, Jan 29, 2013",2013-01-29,48.0,Earnings Calls,"Amazon.com, Inc.",2214.0,406567.0,19192463.0,Question,Brian Pitz,,Analysts,11,"It looks like you're moving more in the direction of same-day shipping. Would you provide any thoughts or insights here? Should we anticipate a significant ramp-up of fulfillment center build-outs, particularly in Q2, Q3? And maybe you could just comment more generally on your FC build-out plans, U.S. versus international?",51
18749.0,"Amazon.com Inc., Q4 2012 Earnings Call, Jan 29, 2013",2013-01-29,48.0,Earnings Calls,"Amazon.com, Inc.",2214.0,406567.0,19192464.0,Answer,Thomas Szkutak,,Executives,12,"There's not a lot I can comment on in terms of our plans. Similar to last year, as we progress through the year, we can give you further updates on what we plan to do there. Last year, we opened up 20 new fulfillment centers, and so we saw very rapid growth in fulfillment capacity last year. And well, stay tuned and we'll let you know more as the year progresses there.",73
18749.0,"Amazon.com Inc., Q4 2012 Earnings Call, Jan 29, 2013",2013-01-29,48.0,Earnings Calls,"Amazon.com, Inc.",2214.0,406567.0,19192465.0,Question and Answer Operator Message,Operator,,Operator,13,We'll go next to Mark Mahaney with RBC Capital Markets.,11
18749.0,"Amazon.com Inc., Q4 2012 Earnings Call, Jan 29, 2013",2013-01-29,48.0,Earnings Calls,"Amazon.com, Inc.",2214.0,406567.0,19192466.0,Question,Mark Mahaney,,Analysts,14,"Two questions please. That paid unit growth deceleration to 32%, it seems a bit of a disconnect versus an active customer growth that didn't decelerate as much on a per customer basis. Are you seeing some sort of change in overall activity? Is that the impact of newer international markets? And then just on the investment cycle, the last couple of calls, you've consistently called out future investments, whether the $1.4 billion for Seattle or distribution center expansion. You didn't do it this quarter. I don't want to overread into it, but does that mean that we're at the end of a major investment cycle?",105
18749.0,"Amazon.com Inc., Q4 2012 Earnings Call, Jan 29, 2013",2013-01-29,48.0,Earnings Calls,"Amazon.com, Inc.",2214.0,406567.0,19192467.0,Answer,Thomas Szkutak,,Executives,15,"In terms of unit growth, there's not a lot more I can add to it. We did see very strong -- we saw substantially high unit growth and revenue growth in terms of paid unit growth in Q4, which we're seeing very strong third-party growth as well, was up over 40%. In terms of investment cycle, yes, I wouldn't read into anything related to that. We will still be adding capacity during 2013 in terms of the levels of how much we'll add. As I mentioned earlier in the call, just stay tuned and we'll let you know as the year progresses.",102
18749.0,"Amazon.com Inc., Q4 2012 Earnings Call, Jan 29, 2013",2013-01-29,48.0,Earnings Calls,"Amazon.com, Inc.",2214.0,406567.0,19192468.0,Question and Answer Operator Message,Operator,,Operator,16,We'll go next to Heath Terry with Goldman Sachs.,10
18749.0,"Amazon.com Inc., Q4 2012 Earnings Call, Jan 29, 2013",2013-01-29,48.0,Earnings Calls,"Amazon.com, Inc.",2214.0,406567.0,19192469.0,Question,Heath Terry,,Analysts,17,"I was wondering if you can give us just a bit of a sense of what you're seeing as you roll out fulfillment centers into new states. Obviously, the sales tax issue has been one that's come up a good bit. But here, you've touched on the impact of being closer with faster delivery in those same states. Net-net, what do you see as being the impact on -- I'm not asking you to give us a kind of state-by-state breakdown, but the impact of rolling out the fulfillment center footprint, taking both of those things into account?",99
18749.0,"Amazon.com Inc., Q4 2012 Earnings Call, Jan 29, 2013",2013-01-29,48.0,Earnings Calls,"Amazon.com, Inc.",2214.0,406567.0,19192470.0,Answer,Thomas Szkutak,,Executives,18,"I'm not really sure how best to answer your question. I mean, we certainly have expanded pretty dramatically over the past, really coming out of 2009. So between, 2010, '11 and '12, we've rapidly increased our footprint globally. Your comment was more directed towards the U.S., but we've also rapidly increased our footprint in the U.S. As a result of that, we're able to carry selection, a much broader selection, closer to customers just with the -- as you would expect with this rapid increase. We've also expanded selection during that time period. So we continue to be in the locations we'd like to be in, and we'll continue to expand our footprint over time and become even closer and closer to customers. Beyond that, there's not a lot I can add.",133
18749.0,"Amazon.com Inc., Q4 2012 Earnings Call, Jan 29, 2013",2013-01-29,48.0,Earnings Calls,"Amazon.com, Inc.",2214.0,406567.0,19192471.0,Question and Answer Operator Message,Operator,,Operator,19,We'll go next to Gene Munster with Piper Jaffray.,10
18749.0,"Amazon.com Inc., Q4 2012 Earnings Call, Jan 29, 2013",2013-01-29,48.0,Earnings Calls,"Amazon.com, Inc.",2214.0,406567.0,19192472.0,Question,C. Eugene Munster,,Analysts,20,"From a high level, can you remind us the margin difference between 1P and 3P? I know in the past, you've talked about you being agnostic between the 2, but the growth in 3P and what your CSOI margins would imply that 3P adds a little bit higher margin. Is that the correct read-through?",54
18749.0,"Amazon.com Inc., Q4 2012 Earnings Call, Jan 29, 2013",2013-01-29,48.0,Earnings Calls,"Amazon.com, Inc.",2214.0,406567.0,19192473.0,Answer,Thomas Szkutak,,Executives,21,"There is some variation by business but certainly, that's -- we attempt to do is from a pricing standpoint is to try to be agnostic. That's certainly how we run the business. Again, this is on a third-party versus a retail. And then we've always also added certainly a lot of other services over the past year in terms of fulfillment. So it really depends upon where we are in the investment cycle, what our utilization is. As you know, certainly as you look at the last few years, we've been very heavily expanding in terms of fulfillment capacity because of the growth that we've been experiencing. That certainly would put pressure on our overall cost structure certainly as -- on a per unit basis because we're not getting the productivity. We don't get the full productivity for a number of years after expanding. So depending on what type of customer is, whether it's a retail unit, a straight third-party unit or an FPA unit. But again, we're certainly attempting at least on a product basis to be roughly agnostic.",180
18749.0,"Amazon.com Inc., Q4 2012 Earnings Call, Jan 29, 2013",2013-01-29,48.0,Earnings Calls,"Amazon.com, Inc.",2214.0,406567.0,19192474.0,Question and Answer Operator Message,Operator,,Operator,22,We'll go next to Brian Nowak with Nomura.,9
18749.0,"Amazon.com Inc., Q4 2012 Earnings Call, Jan 29, 2013",2013-01-29,48.0,Earnings Calls,"Amazon.com, Inc.",2214.0,406567.0,19192475.0,Question,Brian Nowak,,Analysts,23,"I have 2. First is about the device strategy with Kindles and Kindle HDs. Can you help us at all with what you're seeing with attach rate trends on digital goods after people buy the Kindles? And then generally, do you see a higher overall GMV per customer on Kindle devices than users on Amazon Apps through other devices?",59
18749.0,"Amazon.com Inc., Q4 2012 Earnings Call, Jan 29, 2013",2013-01-29,48.0,Earnings Calls,"Amazon.com, Inc.",2214.0,406567.0,19192476.0,Answer,Thomas Szkutak,,Executives,24,"In terms of attach rates, there's not -- we haven't given a lot of detail. But I think one thing certainly to look at that doesn't give you an attach rate but it gives you at least a sense of the health of the business is the number that was in the release today. We show we have a multibillion dollar e-book business growing, approximately 70% year-over-year. That's the total year last year, and that's growing at that rate after a -- it's really just launching the business approximately 5 years ago. So it's a pretty good, healthy growth rate 5 years in. And we're seeing good, I can't give you specific numbers, but we've seen very good progress on a number of our other digital media categories. Video, I talked about a little bit earlier. We're seeing Prime customers. Certainly, the percentage of Prime customers who were watching free content through Prime Instant Video has gone up dramatically year-over-year. We've also increased Prime membership dramatically year-over-year. They were also purchasing paid content. Those customers that are using the service, they watch free but they're also paying for new content which is great. We've launched a number of new services on the music side, most recently, certainly, our CD with free MP3, which we have on many titles. It's still very early, but we certainly like that service and pleased to offer it to customers. So I can't give you specific for attach rates but the business is making good progress on the video content side. And again, it's still very early.",262
18749.0,"Amazon.com Inc., Q4 2012 Earnings Call, Jan 29, 2013",2013-01-29,48.0,Earnings Calls,"Amazon.com, Inc.",2214.0,406567.0,19192477.0,Question and Answer Operator Message,Operator,,Operator,25,We'll go next to Ross Sandler with Deutsche Bank.,10
18749.0,"Amazon.com Inc., Q4 2012 Earnings Call, Jan 29, 2013",2013-01-29,48.0,Earnings Calls,"Amazon.com, Inc.",2214.0,406567.0,19192478.0,Question,Ross Sandler,,Analysts,26,"Just 2 quick questions. As you guys build out the Prime membership and the SKUs available through FBA, you run into the challenge of increasing your unit volume of tail items. And at the same time, you need to get products to customers in much shorter shipping cycles. So can you talk about how the new fulfillment footprint helps on that front? Is your reliance on air going down as a percent of total items shipped? And then if I remember correctly, you guys reclassified some FBA revenue in early 2012. Can you just remind us how that flows through the shipping revenue line and what could happen as you comp that in the beginning of '13?",117
18749.0,"Amazon.com Inc., Q4 2012 Earnings Call, Jan 29, 2013",2013-01-29,48.0,Earnings Calls,"Amazon.com, Inc.",2214.0,406567.0,19192479.0,Answer,Thomas Szkutak,,Executives,27,"Sure. Just in terms of overall selection, as we added to Prime, what I was talking about earlier in terms of having a -- just a more expanded footprint is there's no question that's helping us add additional selection more economically to Prime. And so that's both in terms of third-party selection as well as retail selection. And so that's something that we continue to have the benefit of as we get more and more members of Prime and have a bigger and bigger concentration of 2-day shipping in the U.S. for that. So we did add the shipping portion of FBA fees in Q1 of 2012, and we see some benefit year-over-year. But we're still seeing leverage in terms of our x the FBA fees, quite a bit of leverage there. So we don't have the specific number for you there, but we're still seeing quite a bit of leverage there x that re-class that you're referring to.",159
18749.0,"Amazon.com Inc., Q4 2012 Earnings Call, Jan 29, 2013",2013-01-29,48.0,Earnings Calls,"Amazon.com, Inc.",2214.0,406567.0,19192480.0,Question and Answer Operator Message,Operator,,Operator,28,We'll go next to Justin Post with Merrill Lynch.,10
