companyid,headline,mostimportantdateutc,keydeveventtypeid,keydeveventtypename,companyname,audiolengthsec,transcriptid,transcriptcomponentid,transcriptcomponenttypename,transcriptpersonname,companyofperson,speakertypename,componentorder,componenttext,word_count
24937.0,"Apple Inc., Q3 2010 Earnings Call, Jul-20-2010",2010-07-20,48.0,Earnings Calls,Apple Inc.,120.0,68102.0,5016219.0,Answer,Timothy Cook,,Executives,85,"I don't think we're hitting law of large numbers. I think that the phone market will increasingly become a smartphone market. And Steve said that long ago, and we've seen that, that forecast has come true as the smartphone market continues to grow at multiples of the basic handset market that is shrinking. I think we have a lot of opportunity domestically and in the other parts of the Americas. And I think Peter's comment was more that our growth as a company, whether you look at Mac, iPhone or iPod, is we're growing faster internationally than we are domestically. And you can see that in the revenues as well. However, i think you have to put that in perspective. The company's revenues in Americas are growing over 40%. And so this is a huge number. We're not talking about a low number. It's just that the international numbers are absolutely killer.",153
24937.0,"Apple Inc., Q3 2010 Earnings Call, Jul-20-2010",2010-07-20,48.0,Earnings Calls,Apple Inc.,120.0,68102.0,5016220.0,Question,Kathryn Huberty,,Analysts,86,"And then just on a more global basis, a lot of the iPhone growth has come from broadening distribution among carriers and in new countries. Can you just cover the opportunity that you see or don't see to broaden within countries you're already in to go after emerging markets like China and India? And then, just quickly, thoughts on prepaid markets and whether that's an opportunity for you.",68
24937.0,"Apple Inc., Q3 2010 Earnings Call, Jul-20-2010",2010-07-20,48.0,Earnings Calls,Apple Inc.,120.0,68102.0,5016221.0,Answer,Timothy Cook,,Executives,87,"Yes, and I think, both on the Mac and the iPhone, and later, the iPad, as we roll it out to more places, I think there's still extraordinary opportunity left. I mean, if you look at the Mac as an example, in Asia-Pacific, the Macs grew 73% year-over-year. This is phenomenal that we could grow by this much. And in China, we grew 144%. In Korea, we grew 184%. In Hong Kong, we almost doubled. And even in a country like Spain where the economy has clearly been very difficult, the Mac grew 59%. And so there's some very, very extraordinary numbers in that. In the iPhone space, we are doing well in basically all of the key markets. And so in terms of expanding that, learning what we've learned with the exclusive deals and continuing to look market by market, as I've indicated in the past, we've elected to open Spain up. And at the end of this month, we will go from an exclusive carrier market to having three carriers. And so that's one example. There are also more countries remaining. And frankly, there's still increased distribution and increased market penetration like enterprise and consumer, and a general move in the marketplace from the basic voice and text phone to the smartphone, all of which are in the iPhone saver. And so, honestly, I just see an enormous amount of opportunity out there. And our biggest challenge is to decide which of these to deploy resources against, not to have good ideas about which ones are about making the list of ideas.",264
24937.0,"Apple Inc., Q3 2010 Earnings Call, Jul-20-2010",2010-07-20,48.0,Earnings Calls,Apple Inc.,120.0,68102.0,5016222.0,Question and Answer Operator Message,Operator,,Operator,88,"From JPMorgan, we'll go to Mark Moskowitz.",7
24937.0,"Apple Inc., Q3 2010 Earnings Call, Jul-20-2010",2010-07-20,48.0,Earnings Calls,Apple Inc.,120.0,68102.0,5016223.0,Question,Mark Moskowitz,,Analysts,89,"Tim, just coming back to the iPad for a second, I know there's a lot of speculation about potential cannibalization down the road while it's still premature to speculate. I'm just trying to get a sense, could there actually be a reverse effect where Apple maybe benefits from a halo effect, where folks buy the iPad but then they also decide to maybe buy some other Apple devices to keep at home when they're using the iPad on the road? In the early stages, has your data shown that where you're seeing someone buy an iPad and then there's a subsequent purchase of a MacBook, or iMac or an iPhone?",110
24937.0,"Apple Inc., Q3 2010 Earnings Call, Jul-20-2010",2010-07-20,48.0,Earnings Calls,Apple Inc.,120.0,68102.0,5016224.0,Answer,Timothy Cook,,Executives,90,"I do agree that I think most people external to Apple focused on cannibalization has been negative, and internally, we focused on exactly the opposite. It's the synergy between, both technically and from a demand point of view. If you look at the iPod historically, all of the people here felt that the iPod created a halo for the Mac. And in fact, as the iPod volumes took off, you will see a dramatic change in the Mac sales back in time that we experienced. And so could that happen on iPhone and iPad? We'll see. I don't want to predict it. But I do think that with our Mac share -- the Mac has outgrown the market 17 straight quarters. However, the Mac share is still low. And so there's still an enormous opportunity for the Mac to grow. And certainly, the more customers we can introduce to Apple through iPad, and through iPhones and through iPods, you would think that there might be some synergy with the Mac there, and there may be synergy between the iPad and the iPhone as well, and so on and so forth. And so that's the way that we look at it internally, instead of the negative. Although I know everybody is more focused on the negative piece of it. This is where it's great to have a lower share, because if it turns out that the iPad cannibalizes PCs, then I think it's fantastic for us, because there's a lot of PCs to cannibalize. It's still a big market.",258
24937.0,"Apple Inc., Q3 2010 Earnings Call, Jul-20-2010",2010-07-20,48.0,Earnings Calls,Apple Inc.,120.0,68102.0,5016225.0,Question,Mark Moskowitz,,Analysts,91,"Peter, have you had a chance to kind of formulate what could be the scenario, whereby some of the subcontractors that you work with, that they do have to put through significant wage hikes over the next course of contract renewals over the next year or so? How would that impact Apple? Do you have to absorb any of those kind of pass-through on the wage hikes or were those subcontractors have to absorb 100% of the wage hikes?",79
24937.0,"Apple Inc., Q3 2010 Earnings Call, Jul-20-2010",2010-07-20,48.0,Earnings Calls,Apple Inc.,120.0,68102.0,5016226.0,Answer,Timothy Cook,,Executives,92,"Yes, this is Tim again. We don't want to get into the terms of our commercial agreements. We hold these to be competitive advantages and do not want to release those.",31
24937.0,"Apple Inc., Q3 2010 Earnings Call, Jul-20-2010",2010-07-20,48.0,Earnings Calls,Apple Inc.,120.0,68102.0,5016227.0,Question and Answer Operator Message,Operator,,Operator,93,And that'll come from Chris Whitmore with Deutsche Bank.,10
24937.0,"Apple Inc., Q3 2010 Earnings Call, Jul-20-2010",2010-07-20,48.0,Earnings Calls,Apple Inc.,120.0,68102.0,5016228.0,Question,Chris Whitmore,,Analysts,94,"Tim, earlier you mentioned there's a lot of opportunity domestically for the iPhone. Do you need to expand your carrier relationships to tap that? Or do you think there's plenty of headroom with AT&T?",34
24937.0,"Apple Inc., Q3 2010 Earnings Call, Jul-20-2010",2010-07-20,48.0,Earnings Calls,Apple Inc.,120.0,68102.0,5016229.0,Answer,Timothy Cook,,Executives,95,I don't want to get into what we will or will not do. I would say that we are very happy to be a partner with AT&T. And they've been a first-class partner and have really pioneered the smartphone growth from a network point of view in the U.S. and that's all I have to say about that.,59
24937.0,"Apple Inc., Q3 2010 Earnings Call, Jul-20-2010",2010-07-20,48.0,Earnings Calls,Apple Inc.,120.0,68102.0,5016230.0,Question,Chris Whitmore,,Analysts,96,"Secondly, on the gross margin guidance, just back of the envelope, it seems to suggest iPhone margins will be down maybe 10 or 15 points quarter-on-quarter. Is that in the right neighborhood? And if so, can you provide a little more color on which components are driving that? It seems they contradict third-party data around the bill and material costs for that product.",63
24937.0,"Apple Inc., Q3 2010 Earnings Call, Jul-20-2010",2010-07-20,48.0,Earnings Calls,Apple Inc.,120.0,68102.0,5016231.0,Answer,Peter Oppenheimer,,Executives,97,"Sure, Chris, it's Peter. Let me begin by suggesting that you don't put a lot of credence in these third-party reports that you see. It's always amazing to me the cost categories and the components that never seem to make it into the reports. And as, I think, answered in Toni's questions, look, with the iPhone 4, we have been very aggressive here. This is the best iPhone that we have ever shipped. We're delivering great value to customers. And it has a higher cost structure than its predecessor product. And I don't want to comment on its specific gross margin.",101
24937.0,"Apple Inc., Q3 2010 Earnings Call, Jul-20-2010",2010-07-20,48.0,Earnings Calls,Apple Inc.,120.0,68102.0,5016232.0,Question,Chris Whitmore,,Analysts,98,"Back to you, Tim. Just trying to ballpark the size of the supply-demand gap for the iPhone and the iPad. Again, back of the envelope, are we talking about a couple million iPhone units short of demand, and maybe 500,000 iPads short of demand? Is that the kind of gap we're talking about?",53
24937.0,"Apple Inc., Q3 2010 Earnings Call, Jul-20-2010",2010-07-20,48.0,Earnings Calls,Apple Inc.,120.0,68102.0,5016233.0,Answer,Timothy Cook,,Executives,99,"I don't know. That question is very difficult to answer, because the way that you will truly find out what it is, at least from my own experience and perspective is you have enough supply to serve the demand and then you know what the demand is. And today, we don't have enough on either iPhone 4 or iPad. And so I truly don't know. Obviously, we have taken bets internally, in terms of the capacities that we're going for, and we've rolled those into the guidance. And I think you can get from the guidance but I think is extremely strong, that we're pretty confident with being able to pick up the supply.",115
24937.0,"Apple Inc., Q3 2010 Earnings Call, Jul-20-2010",2010-07-20,48.0,Earnings Calls,Apple Inc.,120.0,68102.0,5016234.0,Answer,Nancy Paxton,,Executives,100,"A replay of today's call will be available for two weeks as a podcast on the iTunes Store, as a webcast on apple.com/investor and via telephone. And the numbers for the telephone replay are (888) 203-1112 or (719) 457-0820, and the confirmation code is 4748846. And these replays will be available beginning at approximately 5 p.m. Pacific Time today. 
Members of the press with additional questions can contact Steve Dowling at (408) 974-1896, and financial analysts can contact Joan Hoover or me with additional questions. Joan's at (408) 974-4570 and I'm at (408) 974-5420. And thanks again for joining us.",101
24937.0,"Apple Inc., Q3 2010 Earnings Call, Jul-20-2010",2010-07-20,48.0,Earnings Calls,Apple Inc.,120.0,68102.0,5016235.0,Question and Answer Operator Message,Operator,,Operator,101,"Ladies and gentlemen, that does conclude today's presentation. We do thank everyone for your participation.",15
24937.0,"Apple Inc., Q4 2010 Earnings Call, Oct 18, 2010",2010-10-18,48.0,Earnings Calls,Apple Inc.,7260.0,80046.0,5746383.0,Presentation Operator Message,Operator,,Operator,0,"Good day, everyone. Welcome to this Apple Inc. Fourth Quarter Fiscal Year 2010 Earnings Release. [Operator Instructions] At this time for opening remarks and introductions, I would like to turn the call over to Nancy Paxton, Senior Director of Investor Relations. Please go ahead, ma'am.",45
24937.0,"Apple Inc., Q4 2010 Earnings Call, Oct 18, 2010",2010-10-18,48.0,Earnings Calls,Apple Inc.,7260.0,80046.0,5746384.0,Presenter Speech,Nancy Paxton,,Executives,1,"Thank you. Good afternoon, and thanks to everyone for joining us. Please note that some of the information you'll hear during our discussion today will consist of forward-looking statements, including without limitation, those regarding revenue, gross margins, operating expenses, other income and expense, stock-based compensation expense, taxes, earnings per share and future products. Actual results or trends can differ materially from our forecast. 
For more information, please refer to the risk factors discussed in Apple's Form 10-K for 2009 as amended, the Forms 10-Q for the first three quarters of fiscal 2010 and the Form 8-K filed with the SEC today, along with the attached press release. Apple assumes no obligation to update any forward-looking statements or information, which speak as of their respective date.
And with that, I'd like to turn the call over to Apple's CFO, Peter Oppenheimer for introductory remarks.",143
24937.0,"Apple Inc., Q4 2010 Earnings Call, Oct 18, 2010",2010-10-18,48.0,Earnings Calls,Apple Inc.,7260.0,80046.0,5746385.0,Presenter Speech,Peter Oppenheimer,,Executives,2,"Thank you, Nancy. Thank you for joining us. We're extremely pleased to report the conclusion of a great fiscal year for Apple with outstanding results for the September quarter. Our innovative product lineup is the best ever and customer response have been tremendous. As a result, we set new all-time records for Mac, iPhone and iPad sales in the September quarter, and we are thrilled to report the highest quarterly revenue and earnings in Apple's history.
Revenue for the quarter was $20.34 billion, an increase of more than $8.1 billion over the prior September quarter's result, representing growth of 67%. The very strong growth was fueled primarily by record iPhone sales, the tremendous popularity of iPad and our best Mac quarter ever. Operating margin was $5.45 billion, representing 26.8% of revenue. Net income was $4.31 billion, which exceeded our previous quarterly earnings record by $930 million and represented 70% growth over the year ago quarter's earnings. These results translated to earnings per share of $4.64.
Turning to the details of the quarter. I'd like to begin with our Mac products and services. We set a new quarterly record with sales of almost 3.9 million Macs, exceeding the previous record established in the June quarter by over 400,000. This represents 27% year-over-year growth, more than double IDC's latest published estimate of 11% growth for the market overall in the September quarter. We experienced strong double-digit growth in both Mac desktop and portable categories, led by very strong sales of iMac, which was updated in July, and the continued popularity of the MacBook Pro and MacBook. Mac growth was strong in each of our geographic segments, led by Asia Pacific at 56% year-over-year and Japan at 49%. We began and ended the quarter with between three and four weeks of Mac channel inventory.
Moving to our music products. We sold nearly 9.1 million iPods compared to 10.2 million in the year ago quarter. In September, we announced a great new lineup of iPods for the holiday season, including our redesigned iPod shuffle featuring clickable buttons, the reinvented iPod nano with Multi-Touch and the new iPod touch with Retina display and FaceTime video calling. iPod's share of the U.S. market for MP3 players remains at over 70%, based on the latest monthly data published by NPD. iPod also continues to be the top-selling MP3 player and to gain share internationally year-over-year in most of the countries we track, based on the latest data published by GfK. We remain within our target range of four to six weeks of iPod channel inventory on a look-back basis.
The iTunes Store also had another strong quarter with revenue over $1 billion. In September, we launched iTunes 10, including a number of new features, such as $0.99 TV rentals, AirPlay wireless music playback and Ping, which offers social music discovery to millions of iTunes users in 23 countries. We also introduced the new Apple TV, which provides a simple way to watch movies and TV shows on your HDTV for the breakthrough price of just $99.
I'd now like to turn to iPhone. We were extremely pleased to have sold 14.1 million iPhones compared to just under 7.4 million in the previous September quarter. This represents 91% year-over-year growth and is well ahead of IDC's latest published estimate of 64% growth for the global smartphone market overall in the September quarter. Recognized revenue from iPhone handset and accessories sales was $8.82 billion during the quarter compared with $4.61 billion in the year ago quarter, an increase of 92%. The sales value of iPhones alone was about $8.6 billion, which yields an ASP [average selling price] of about $610.
At the end of the September quarter, we had iPhone distributions through 166 carriers in 89 countries. We continue to experience very strong year-over-year growth, particularly in Asia, Europe and Japan where iPhone sales more than doubled year-over-year. We were very happy to be shipping iPhone 4 in China as of the last day of the September quarter, and we've been very pleased with customer response to date. Last month, J.D. Power and Associates announced that for a fourth consecutive time, Apple ranked highest in its survey of customer satisfaction among manufacturers of smartphone, citing particularly strong performance in ease of operation, operating system, features and physical design.
Adoption of iPhone within the enterprise continues to accelerate. In fact, since we've shipped iPhone 4, we've seen extraordinary growth from 60% to more than 80% of Fortune 500 companies deploying or piloting iPhone. Enterprise CIOs continue to add iPhone to their approved device list worldwide. Most recently, Fortune 500 companies like Procter & Gamble, General Electric, Pfizer, Allstate and Cardinal Health, and Global 500 accounts such as Aviva Group, Total, Novartis, Roche and sanofi-aventis, have made iPhone available to their employees. We ended the quarter with about 3.3 million iPhones in channel inventory, a sequential increase of about 825,000, to support the launch of iPhone 4. We continue to have a sizable backlog and believe we could have sold even more iPhones if we had been able to supply them.
Turning to iPad. We're thrilled with this momentum. In just the second quarter of availability, we sold almost 4.2 million iPads with distribution in 26 countries by the end of the September quarter. We're seeing great enthusiasm for iPad from consumers, educators and businesses. Enterprise CIOs are adding iPad to their approved device list at an impressive rate. Since the launch of iPad, over 65% of the Fortune 100 are already deploying or piloting iPad. Some recent examples of companies approving iPad include Procter & Gamble, Lowe's, Hyatt, NBC Universal and Novartis. Recognized revenue from sales of iPad and iPad accessories during the quarter was $2.8 billion. The sales value of iPads alone was about $2.7 billion, which yields an ASP of about $645.
We were able to increase the supply of iPads over the course of the quarter, building channel inventory by about 500,000 units to end the quarter with between three and four weeks of channel inventory, below our target range of four to six weeks. We're expanding U.S. iPad distribution to include Walmart, Target, Verizon and AT&T stores. We are also expanding distribution internationally. 
Combining iPhone, iPad and iPod touch, we surpassed cumulative iOS device sales of 125 million last month. During the September quarter, we released iOS 4.1, which builds on the innovations of iOS 4, bringing FaceTime video calling, multitasking, folders and Game Center to iPod touch in addition to iPhone customers. And in November, we plan to release iOS 4.2, which will bring many of the great new features of iOS 4 to iPad. iOS 4.2 will also include AirPrint, Apple's new printing architecture, that automatically finds printers on local networks and enables printing from iOS devices over Wi-Fi without the need to install drivers or download software. 
The App Store continues to be an unparalleled success. There are now over 200,000 registered iOS developers that continue to bring outstanding and creative new apps [applications] to the iOS platform, including over 65,000 game and entertainment titles and over 30,000 apps designed specifically for iPad. And we launched iAd in July, which provides marketers with the ability to place interactive ads in popular apps for iPhone, iPod touch and iPad. We were very happy with the results so far. Customers are loving the media rich ad and marketers are very pleased with viewer engagement. 
I'd now like to turn to the Apple Retail Stores, which had a record-breaking quarter. Retail revenue was $3.57 billion compared to $2.04 billion in the year ago quarter, an increase of 75%. Our stores sold a record 874,000 Macs compared to 670,000 Macs in the year ago quarter, an increase of 30%. About half the Macs sold in our stores during the September quarter were to customers who had never owned a Mac before. 
We opened 24 stores during the September quarter, 16 of which were outside the United States, including spectacular stores in Beijing, Shanghai, London and Paris. Our new Beijing and Shanghai stores opened on the last day of the quarter, and first day sales from both stores exceeded all previous store openings. Our four China stores are our highest traffic stores in the world and are among our highest performing. We also entered our 11th country, with the opening of stores in Barcelona and Madrid. That brings us to a total of 317 stores worldwide as of the end of the quarter, with 84 of them outside the United States. With an average of 301 stores open during the September quarter, average revenue per store was $11.8 million compared to $7.8 million in the year ago quarter, an increase of 52%. 
Retail segment margin was $917 million compared to $564 million in the year ago quarter. We hosted a record 74.5 million visitors in our stores during the quarter compared to 45.9 million visitors in the year ago quarter, an increase of 62%. As we look ahead to fiscal 2011, we see great opportunity to continue our retail growth with our focus on international expansion. In total, we expect to open 40 to 50 stores in our fiscal 2011, with over 50% of them outside the United States. We will also begin replacing several stores in the United States to get them rightsize for Apple's current product line and to meet our service goals.
Total company gross margin was 36.9%, which was 190 basis points above our guidance. About 2/3 of this favorability was driven by lower commodity and other costs and the remainder was mostly attributable to a better-than-planned mix of iPhone sales. Operating expenses were $2.07 billion and included $185 million of stock-based compensation expense. OI&E [other income & expenses] was $14 million, and the tax rate for the quarter was 21%, about five points below our guidance, largely a result of two factors. First, we had a higher mix of foreign earnings than we planned. Second, we had some discrete onetime tax benefits in the quarter as well. Our tax rate for fiscal 2010 was about 24.5%.
Turning to cash. Our cash plus short-term and long-term marketable securities totaled $51 billion at the end of the September quarter compared to $45.8 billion at the end of the June quarter, an increase of $5.2 billion. Cash flow from operations was $5.7 billion. 
The September quarter was the culmination of a monumental year for Apple. In fiscal 2010, we launched several new Macs, establishing record sales of over 13.6 million and achieving 31% year-over-year sales growth, significantly outpacing the growth of the overall PC market. We introduced the tremendously popular iPhone 4 with breakthrough features, including FaceTime and Retina display, fueling full year sales of 40 million iPhones, an increase of 93% over fiscal 2009. We launched the groundbreaking iPad, selling nearly 7.5 million to delighted customers in two quarters alone. We also brought great new features to iOS and iTunes and continue to innovate with completely new designs for iPod. And as a result, we generated record revenue of over $65 billion, an increase of over $22 billion year-over-year or 52%. Earnings of $14 billion grew even faster at 70% year-over-year. To put this growth into perspective, in fiscal 2010, Apple generated almost 5x the revenue and more than 10x the earnings it did just five years earlier in fiscal 2005.
As we move ahead into the December quarter, I'd like to review our outlook, which includes the types of forward-looking information that Nancy referred to at the beginning of the call. We expect revenue to be about $23 billion compared to $15.7 billion in the December quarter last year. We expect gross margins to be about 36%, reflecting approximately $52 million related to stock-based compensation expense. We expect OpEx to be about $2.325 billion, including about $250 million related to stock-based compensation. We expect OI&E to be about $65 million, and we expect the tax rate to be about 25.5%. We are targeting EPS of about $4.80.
In closing, we're thrilled with our record September quarter and fiscal year 2010 results. We're very enthusiastic about our innovative product lineup and our significant opportunities for growth as we head into fiscal 2011, and we are extremely confident in our new product pipeline. 
Before taking your questions, I would like to turn the call over to our CEO, Steve Jobs.",2064
