companyid,headline,mostimportantdateutc,keydeveventtypeid,keydeveventtypename,companyname,audiolengthsec,transcriptid,transcriptcomponentid,transcriptcomponenttypename,transcriptpersonname,companyofperson,speakertypename,componentorder,componenttext,word_count
24937.0,"Apple Inc., Q1 2010 Earnings Call, Jan-25-2010",2010-01-25,48.0,Earnings Calls,Apple Inc.,3660.0,46831.0,3573219.0,Answer,Peter Oppenheimer,,Executives,67,"Yes, Keith, let me clarify this for you. I talked about how we're accounting for an iPhone sale in really two elements. The first being the initial hardware and the software that somebody would buy and walk out of the store with. And the second element being the right to receive future upgrades when and if they become available and we have estimated the selling price of that upgrade for iPhone to be about $25. So in terms of what we've done here in the revision of our financial statements, we went back and applied a $25 deferral to all iPhones that we have sold in the past and a $10 deferral to Apple TV. And when you look at the -- all the things that we put out today in terms of income statements and balance sheets and cash flow, you'll see that there is substantially less deferred revenue on those balance sheets and no deferred costs. We are recognizing the deferred revenue from the $25 deferral each quarter in our balance sheet. And so to help you be sure that you have your models correct on a go-forward basis, we essentially recognized about $110 million in the December quarter for the $25 that we deferred for all the iPhones that we sold over the past two years. So Keith, we deferred $25 on the 8.7 million iPhones that we sold in the quarter. So that came out as revenue. But then we put in about 110 million from the amortization that occurred from the past two years sale. Does that make sense?",264
24937.0,"Apple Inc., Q1 2010 Earnings Call, Jan-25-2010",2010-01-25,48.0,Earnings Calls,Apple Inc.,3660.0,46831.0,3573220.0,Question,Keith Bachman,,Analysts,68,"Yes, that's fine. Tim, for you, I wanted -- on Asia Pac and Japan, CPU sales were particularly strong. And moreover, if you look at Asia Pac, the revenues were about -- the year-over-year growth rate was about three times higher than the CPU units. So I just want to try to understand in Japan and Asia Pac, that looks like a pretty strong mix up in terms of computers but also just underlying strength. I'm wondering here if you could offer some more color about that please?",88
24937.0,"Apple Inc., Q1 2010 Earnings Call, Jan-25-2010",2010-01-25,48.0,Earnings Calls,Apple Inc.,3660.0,46831.0,3573221.0,Answer,Timothy Cook,,Executives,69,"Sure, in Japan, what's going on there is that the iPhone has been a runaway hit. The iPhone was up over 400% year-on-year during the quarter. And so that's what's driving that huge revenue growth that you see in Japan. The Mac growth is above market, but we believe we can do better in the Mac area in Japan. In Asia Pacific, Asia Pacific is doing an incredible job with the Mac, growing 54%. It's our highest performing region in terms of growth. And in the iPhone, the iPhone was up over 500% in Asia Pacific and as you probably remembered, we talked about China on this call, but we also added Korea during the quarter and we added several other countries throughout the year after Q1 of last year. And so iPhone really drove an incredible amount of the total revenue growth that you see on revenue of 140%.",150
24937.0,"Apple Inc., Q1 2010 Earnings Call, Jan-25-2010",2010-01-25,48.0,Earnings Calls,Apple Inc.,3660.0,46831.0,3573222.0,Question,Keith Bachman,,Analysts,70,"Peter, what revenue in EPS would have been under the previous accounting policy for the December quarter?",17
24937.0,"Apple Inc., Q1 2010 Earnings Call, Jan-25-2010",2010-01-25,48.0,Earnings Calls,Apple Inc.,3660.0,46831.0,3573223.0,Answer,Peter Oppenheimer,,Executives,71,"Keith, actually I did not say that and that's actually not something that we have the time to try and figure out. As I've said before, the team did just an amazing job to implement this new accounting within four months of the FASB ratifying it. The comments that I made were that our revenue were $15.68 billion under the new accounting, exceeded the guidance we gave under the old accounting by over 4 billion. About half of that was driven by the amazing performance of the business, and the other half was driven by the accounting change.",98
24937.0,"Apple Inc., Q1 2010 Earnings Call, Jan-25-2010",2010-01-25,48.0,Earnings Calls,Apple Inc.,3660.0,46831.0,3573224.0,Question and Answer Operator Message,Operator,,Operator,72,We'll hear from Chris Whitmore with Deutsche Bank.,9
24937.0,"Apple Inc., Q1 2010 Earnings Call, Jan-25-2010",2010-01-25,48.0,Earnings Calls,Apple Inc.,3660.0,46831.0,3573225.0,Question,Chris Whitmore,,Analysts,73,"I wanted to follow up on earlier questions around that mobile advertising in the application stores. Specifically, I'm interested to understand what role if any, you expect mobile advertising to have on your business model going forward? Can you characterize the changing relationship you have with Google as they've entered the smartphone space?",53
24937.0,"Apple Inc., Q1 2010 Earnings Call, Jan-25-2010",2010-01-25,48.0,Earnings Calls,Apple Inc.,3660.0,46831.0,3573226.0,Answer,Timothy Cook,,Executives,74,"Sure, well we work with Google in some areas and we compete with them in others. I think mobile advertising is just in it's infancy. And with the great folks that we've acquired and are going to be working with at Quattro, we look forward to providing our developers with a great opportunity from mobile advertising. And that's what we know at this point.",64
24937.0,"Apple Inc., Q1 2010 Earnings Call, Jan-25-2010",2010-01-25,48.0,Earnings Calls,Apple Inc.,3660.0,46831.0,3573227.0,Question,Chris Whitmore,,Analysts,75,Do you anticipate mobile advertising as being a significant revenue earnings contributor going forward? Or is this primarily some of those strategies we've seen in iTunes and the App Store to drive demand for your devices?,36
24937.0,"Apple Inc., Q1 2010 Earnings Call, Jan-25-2010",2010-01-25,48.0,Earnings Calls,Apple Inc.,3660.0,46831.0,3573228.0,Answer,Timothy Cook,,Executives,76,"No, we are in infancy and I honestly don't know. We'll have to see. We'll then do -- work hard to provide, as I said, the developers, a great opportunity. We'll see where that takes us.",36
24937.0,"Apple Inc., Q1 2010 Earnings Call, Jan-25-2010",2010-01-25,48.0,Earnings Calls,Apple Inc.,3660.0,46831.0,3573229.0,Question and Answer Operator Message,Operator,,Operator,77,Bill Fearnley with FTN Equity Capital.,6
24937.0,"Apple Inc., Q1 2010 Earnings Call, Jan-25-2010",2010-01-25,48.0,Earnings Calls,Apple Inc.,3660.0,46831.0,3573230.0,Question,Bill Fearnley,,Analysts,78,"In the Pro segment, Tim, could you update us on what you're seeing in the Pro segment since the last call, and as you look at the upcoming year, are you seeing improvement there? And if you do, is it helping the Mac Pro product line or is it helping sales of higher end MacBook Pros and the iMacs? What did you see after the quarter and what do you expect? And I have a quick follow up?",78
24937.0,"Apple Inc., Q1 2010 Earnings Call, Jan-25-2010",2010-01-25,48.0,Earnings Calls,Apple Inc.,3660.0,46831.0,3573231.0,Answer,Timothy Cook,,Executives,79,"Bill, we saw a small year-over-year increase in Pro software sales, Final Cut, Aperture and Pro audio space. And we used that as a proxy for how many of our Pro machines are being sold in that space. And so I would still describe that as an economically challenged area currently. And I hope that we see improvement as we move forward, but I'm not projecting it.",67
24937.0,"Apple Inc., Q1 2010 Earnings Call, Jan-25-2010",2010-01-25,48.0,Earnings Calls,Apple Inc.,3660.0,46831.0,3573232.0,Question,Bill Fearnley,,Analysts,80,"And if I could switch gears to education. What are your latest thoughts there? Because you've in the past, made comments about state tax revenue and budgets have gotten worse, and certainly, the headlines have become even worse since the last time we talked to you guys? So what's going on with K-12 that helps you above the problems that are there? And in higher ed, with declining endowments is the per student purchase segment you're focused on higher ed, if you could give us some more color on K-12 and higher Ed and what's happening right for you and why? It would be helpful please?",106
24937.0,"Apple Inc., Q1 2010 Earnings Call, Jan-25-2010",2010-01-25,48.0,Earnings Calls,Apple Inc.,3660.0,46831.0,3573233.0,Answer,Timothy Cook,,Executives,81,"Well the great thing is, and I'm talking about the Mac here specifically, was that the combination of K-12 and higher ed in the U.S. was up 16% year-over-year and that's the best growth rate we've seen since the, before the recession began. And so we feel great about how we came out of the quarter. That we had very few orders that were supported with stimulus funds. And I would hope that, that would change in the future, although I don't know if that will happen or not. Our whole Ed business is based on that, we really understand teaching and learning and student achievement at a very deep level. And we think we're the only technology company that really gets it. And so we sell a lot more than just sell boxes as many other people do. And so I think with staying very focused in that market, I think we can continue to do well. And I was thrilled to see the results that we get last quarter.",171
24937.0,"Apple Inc., Q1 2010 Earnings Call, Jan-25-2010",2010-01-25,48.0,Earnings Calls,Apple Inc.,3660.0,46831.0,3573234.0,Answer,Nancy Paxton,,Executives,82,"Thank you, Bill, and thanks to everyone, for your participation. A replay of today's call will be available for two weeks, as the podcast on the iTunes store and the webcast on apple.com/investor and via telephone. The numbers for the telephone replay are 888-203-1112 or 719-457-0820. And please enter confirmation code 403-5751. These replays can be available beginning at approximately 5:00 p.m. Pacific Time today. Members of the press with additional questions can contact Steve Dowling at 408-974-1896 and financial analysts can contact John Hoover or me with additional questions, John's at 408-974-4570 and I'm at 408-974-5420. Thanks again for joining us.",102
24937.0,"Apple Inc., Q1 2010 Earnings Call, Jan-25-2010",2010-01-25,48.0,Earnings Calls,Apple Inc.,3660.0,46831.0,3573235.0,Question and Answer Operator Message,Operator,,Operator,83,"Ladies and gentlemen, that does conclude today's presentation. We do thank everyone for your participation.",15
24937.0,"Apple Inc., Q2 2010 Earnings Call, Apr-20-2010",2010-04-20,48.0,Earnings Calls,Apple Inc.,21156096.0,57323.0,4321256.0,Presentation Operator Message,Operator,,Operator,0,"Good day, ladies and gentlemen, and welcome to this Apple Inc. Second Quarter Fiscal Year 2010 Earnings Release Conference Call. Today’s call is being recorded. At this time, for opening remarks and introductions, I would like to turn the conference over to Nancy Paxton, Senior Director of Investor Relations. Please go ahead, ma'am.",53
24937.0,"Apple Inc., Q2 2010 Earnings Call, Apr-20-2010",2010-04-20,48.0,Earnings Calls,Apple Inc.,21156096.0,57323.0,4321257.0,Presenter Speech,Nancy Paxton,,Executives,1,"Thank you, good afternoon and thanks to everyone for joining us. Speaking today is Apple's CFO, Peter Oppenheimer; and he'll be joined by Apple's COO, Tim Cook; and Treasurer, Gary Wipfler for the Q&A session with analysts. 
Please note that some of the information you'll hear during our discussion today will consist of forward-looking statements, including, without limitation, those regarding revenue, gross margin, operating expenses, other income and expense, stock-based compensation expense, taxes, earnings per share and future products. Actual results or trends could differ materially from our forecast. For more information, please refer to the risk factors discussed in Apple's Form 10-K for 2009 as amended, the Form 10-Q for the first quarter of fiscal 2010 and the Form 8-K filed with the SEC today, along with the attached press release.
Apple assumes no obligation to update any forward-looking statements or information which speak as of their respective date. And with that, I'd like to turn the call over to Peter Oppenheimer for introductory remarks.",166
24937.0,"Apple Inc., Q2 2010 Earnings Call, Apr-20-2010",2010-04-20,48.0,Earnings Calls,Apple Inc.,21156096.0,57323.0,4321258.0,Presenter Speech,Peter Oppenheimer,,Executives,2,"Thank you, Nancy. Thank you for joining us. We're thrilled to report outstanding March quarter results that exceeded our expectations. The strong momentum we experienced in the holiday quarter continued in the March quarter. As a result, we are reporting our best non-holiday quarter revenue and earnings ever, the highest quarterly iPhone sales ever and a new record for Mac sales in the March quarter. We're delivering the best products in Apple's history and our customers are responding enthusiastically. 
Revenue was $13.5 billion, a 49% increase over the prior March quarter's results. This very strong performance was due primarily to the more than doubling in iPhone sales and the strong momentum of our Mac products. This resulted in a much smaller sequential revenue decline from the December to March quarters than we normally experience.  Operating margin was $4 billion, representing 29.5% of revenue. Net income was $3.1 billion, up 90% over the year-ago quarter. And earnings per share were $3.33.
Turning to the details of our results, I'd like to begin with our Mac products and services. We generated record March quarter sales of 2.94 million Macs. This represents 33% year-over-year growth compared to IDC's latest published estimate of 24% growth for the market overall in the March quarter.
We were very pleased with Mac sales growth in each of our geographic segments, and we experienced strong double-digit growth for both desktop and portable categories. We made our portable lineup even stronger last week by introducing an updated MacBook Pro line with faster processors, more powerful next-generation NVIDIA graphics and even longer battery life. We began and ended the quarter with between three and four weeks of Mac channel inventory.
Moving on to our music products. We sold 10.9 million iPods, about equal to the 11 million we sold in the year-ago quarter. Sales of iPod touch continued to be very strong, with units growing 63% year-over-year. The strong mix of iPod touch resulted in overall iPod revenue growth of 12%, the strongest iPod revenue growth rate in the last two years. Our share of the U.S. market for MP3 players remains at over 70% based on the latest monthly data published by NPD. iPod was also the top-selling MP3 player and continued to gain share internationally year-over-year in nearly every country we track, including high market share countries, such as Australia, the U.K., Canada and Japan, based on the latest data published by GfK.
The iTunes Store delivered its best quarter ever with sales of $1.1 billion due to the continued strong demand for music, video and apps. iTunes has the world's largest online music catalog with a selection of over 12 million songs, and in February, we crossed the 10 billion mark for songs purchased and downloaded. The App Store continues to be a phenomenal success with more than 185,000 apps and well over 4 billion downloads to date by iPhone and iPod touch users in 90 countries.
We're very excited to have launched the iBook Store, as well as over 3,500 new apps designed for iPad. We ended the quarter within our target range of four to six weeks of iPod channel inventory. 
I'd now like to turn to the iPhone. We are thrilled to have sold 8.75 million iPhones during the quarter, an all-time high, exceeding the previous record set in the most recent holiday quarter. This represents 131% year-over-year growth over the previous March quarter's result and is more than 3x IDC's published estimate of 41% growth for the Smartphone market overall in the March quarter. Recognized revenue from iPhone handset sales, accessory sales and carrier payments was $5.45 billion during the quarter compared to $2.43 billion in the year-ago quarter. The sales value of iPhones alone was about $5.3 billion and dividing this by the 8.75 million units, yields in ASP of about $600.
We've continued to expand iPhone's reach by adding both carriers and countries, and we now have iPhone distribution with 151 carriers in 88 countries. We experienced very strong year-over-year growth in each of our geographic segments and particularly in Asia, Australia, Japan and Europe. We were very pleased with the significant sales growth from both existing and new carrier partners. We were also very pleased that customers, once again, ranked iPhone first in J.D. Power and Associates' 2010 U.S. Wireless Smartphone Customer Satisfaction Study.
We are also very excited about the release of the iPhone OS 4 this summer. Developer response to the beta release and new SDK has been very positive, and we believe customers and developers will really enjoy the over 100 new features, including multitasking for third-party apps, folders, enhanced enterprise support, the iAd mobile advertising program and much more.
Turning to the iPad. We're extremely pleased with sales results during the past couple of weeks and the critical reviews and customer feedback have been outstanding. Customers are loving the iPad and its revolutionary Multi-Touch user interface that lets them browse the Web, read and send e-mail, enjoy and share photos, watch HD videos, listen to music, play games, read eBooks and much more. We're on track to begin shipping the 3G version of the iPad in the U.S. on April 30 and to begin shipping both versions of the iPad in nine additional countries at the end of May. 
I'd now like to turn to the Apple Retail Stores. Revenue in the quarter was $1.68 billion compared to $1.38 billion in the year-ago quarter, an increase of 22%. Our stores sold 606,000 Macs compared to 438,000 Macs in the year-ago quarter, an increase of 38%. About half the Macs sold in our stores during the March quarter were to customers who’ve never owned a Mac before.
We opened two new stores in the U.K. during the quarter, as well as a new store in Germany to end with 286 stores. With an average of 284 stores opened during the March quarter, average revenue per store was $5.9 million compared to $5.5 million in the year-ago quarter. Retail segment margin was $373 million or 22.2% compared to $317 million or 23% in the year-ago quarter. We hosted 47 million visitors in our stores during the quarter compared to 39.1 million visitors in the year-ago quarter, an increase of 20%.
We also conducted over 700,000 Personal Training Sessions, and we ended the quarter with 607,000 members in our One to One program. We remain on track to open 40 to 50 new stores in total during fiscal 2010 with over half being in international locations including London, Paris and Shanghai.
Total company gross margin was 41.7%, which was 270 basis points above our guidance. This difference was primarily driven by several categories of positive factors compared to our forecast. In order of relative impact, these were: First, a stronger product mix including more iPhones and accessories; second, lower costs; and third, fixed cost leverage from the higher-than-expected revenue in the March quarter, as well as a few other small items.
Operating expenses were $1.65 billion and included $194 million in stock-based compensation expense. OI&E was $50 million and the tax rate for the quarter was 24%. We had previously forecasted a 29% tax rate for the full year but have revised our forecast to about 27% based on a higher mix of foreign earnings. The 24% tax rate for the March quarter was required to true up the year-to-date provision to 27%.
Turning to cash. Our cash plus short-term and long-term marketable securities totaled $41.7 billion at the end of the March quarter compared to $39.8 billion at the end of the December quarter, an increase of $1.9 billion. Cash flow from operations was over $2.3 billion. Our investment priority for the cash continues to be preservation of capital, which has served us well in the current environment. We are continuing to focus on short-dated, high-quality investments and remain comfortable with our investment portfolio.
Looking ahead to the June quarter, I'd like to review our outlook, which includes the types of forward-looking information that Nancy referred to at the beginning of the call. We expect revenue to be between about $13 billion and $13.4 billion compared to $9.7 billion in the June quarter last year. We expect gross margin to be about 36%, down from 41.7% in the March quarter and reflecting approximately $36 million related to stock-based compensation expense. We expect about 25% of the sequential gross margin decline to be driven by the first quarter of iPad sales. As we said in January when we announced the iPad, we have been very aggressive with pricing and are delivering tremendous value to customers. We think the market for the iPad will be large, and we want to capitalize on our first mover advantage.
We expect the remaining three quarters of the margin decline to be due to four factors of roughly equal impact including a stronger U.S. dollar, our Mac portable transition, the beginning of the education buying season and a future product transition.
We expect OpEx to be about $1.83 billion, including $185 million related to stock-based compensation. We expect OI&E to be about $45 million, reflective of the short-term interest rate environment, and we expect the tax rate to be about 27%. We are targeting EPS in the range of $2.28 to $2.39 compared to $2.01 in the year-ago quarter. 
In closing, we are thrilled with our record March quarter results and the momentum of our business. We're very pleased with the market share gains for our iPhone, Mac and iPod products and with the tremendous customer response to iPad. We're looking forward to the release of both iPad versions in nine international countries at the end of May, and we're very enthusiastic about iPhone OS 4 arriving this summer. We are very confident in our new product pipeline and are excited about the months ahead. With that, I'd like to open the call to questions.",1651
24937.0,"Apple Inc., Q2 2010 Earnings Call, Apr-20-2010",2010-04-20,48.0,Earnings Calls,Apple Inc.,21156096.0,57323.0,4321259.0,Question and Answer Operator Message,Operator,,Operator,3,Your first question will come from Gene [Charles] Munster.,9
24937.0,"Apple Inc., Q2 2010 Earnings Call, Apr-20-2010",2010-04-20,48.0,Earnings Calls,Apple Inc.,21156096.0,57323.0,4321260.0,Question,C. Eugene Munster,,Analysts,4,"It's clear that the iPad is off to a fast start, and based on our work, it looks like this has a potential to become the Mac of the masses, if you will. My question is what insights have you gained in the last three weeks in the U.S. market in terms of gauging what the impact to the iPad has been on the demand for the overall Mac? Has, basically, there been any cannibalization? And I would guess there's some data somewhere that would give us some insight into answering that question.",94
24937.0,"Apple Inc., Q2 2010 Earnings Call, Apr-20-2010",2010-04-20,48.0,Earnings Calls,Apple Inc.,21156096.0,57323.0,4321261.0,Answer,Timothy Cook,,Executives,5,"Hi Gene, it's Tim. If you look at last quarter, we made the announcement, as you know, of the iPad in January. And in our view, for the last quarter, there was no obvious impact on either the Mac or the iPod. But you can look at the numbers that we're reporting and judge that for yourself. Going forward, now that we're selling into April, we really don't have enough experience to come to a judgment yet, so we'll see how it goes. We're obviously thrilled with the sales of the iPad. They have far exceeded our expectations, and we feel we're off to a great start.",107
24937.0,"Apple Inc., Q2 2010 Earnings Call, Apr-20-2010",2010-04-20,48.0,Earnings Calls,Apple Inc.,21156096.0,57323.0,4321262.0,Question,C. Eugene Munster,,Analysts,6,"Just a follow-up question, Tim, is throughout the March quarter, so if you're going to look on a month-to-month basis, based on some of the third-party data, we saw a deceleration of the growth rate in Mac in the month of March. Do you think any of that could have been attributed to potential people holding off on buying a Mac for an iPad? And what would you attribute maybe that step down in the month of March to?",80
24937.0,"Apple Inc., Q2 2010 Earnings Call, Apr-20-2010",2010-04-20,48.0,Earnings Calls,Apple Inc.,21156096.0,57323.0,4321263.0,Answer,Timothy Cook,,Executives,7,"If you look at the previous March, Gene, the base quarter that you're comparing to, we announced a new iMac and a new Mac mini. And so our compare point was to a month that we announced two new products versus a month that we didn't announce any new Macs. And so I wouldn't look at -- I don't think you can really judge the Mac business on a month-by-month basis. I think looking at a longer period of time is correct. And certainly, our internal expectation was that the comparable would come down through the quarter at it began to comp against those products.",105
24937.0,"Apple Inc., Q2 2010 Earnings Call, Apr-20-2010",2010-04-20,48.0,Earnings Calls,Apple Inc.,21156096.0,57323.0,4321264.0,Question,C. Eugene Munster,,Analysts,8,Final question is just on the mix between 3G versus Wi-Fi. Any sort of flavor you can give us on how to model that out?,26
