companyid,headline,mostimportantdateutc,keydeveventtypeid,keydeveventtypename,companyname,audiolengthsec,transcriptid,transcriptcomponentid,transcriptcomponenttypename,transcriptpersonname,companyofperson,speakertypename,componentorder,componenttext,word_count
24937.0,"Apple Inc., Q2 2010 Earnings Call, Apr-20-2010",2010-04-20,48.0,Earnings Calls,Apple Inc.,21156096.0,57323.0,4321311.0,Answer,Timothy Cook,,Executives,55,"The units were up for the quarter, 34% year-over-year. But the absolute number of units are still small and we still classify the product as the hobby for the company. And I would just repeat what I probably have said before is that if you look at the other markets that Apple is in, the Macintosh competes in a market of 300 million or so units a year. The iPhone competes in a market, if you look at all phones, of maybe 1.2 billion a year. The iPod competes in a market that has 100 million plus or minus units in it per year. And so these are enormous-sized markets. And clearly, the market that Apple TV is in is not, in our view, nearly that large as yet. And so that's the reason we classify it as a hobby so that no one gets the wrong impression that we have a vision that it's anywhere close to the size of the other businesses. However, a number of us love the product, use the product. And we continue to think there's something interesting there and continue to invest in it.",190
24937.0,"Apple Inc., Q2 2010 Earnings Call, Apr-20-2010",2010-04-20,48.0,Earnings Calls,Apple Inc.,21156096.0,57323.0,4321312.0,Question,Brian Marshall,,Analysts,56,"Final question with regards to the iAds. I guess, do you think this could be a significant source of potential incremental earnings down the road? I think what you offer advertisers is a pretty compelling demographic and user base with the information and the emotion that you're able to convey.",50
24937.0,"Apple Inc., Q2 2010 Earnings Call, Apr-20-2010",2010-04-20,48.0,Earnings Calls,Apple Inc.,21156096.0,57323.0,4321313.0,Answer,Peter Oppenheimer,,Executives,57,"It's Peter. As I think I've commented on a prior question, at this point, we're putting our toes in the water. So we don't expect much this calendar year. We think we're going to learn a lot, and we’ll look to build a foundation for the future.",48
24937.0,"Apple Inc., Q2 2010 Earnings Call, Apr-20-2010",2010-04-20,48.0,Earnings Calls,Apple Inc.,21156096.0,57323.0,4321314.0,Question and Answer Operator Message,Operator,,Operator,58,"From RBC Capital Markets, we'll hear from Mike Abramsky.",9
24937.0,"Apple Inc., Q2 2010 Earnings Call, Apr-20-2010",2010-04-20,48.0,Earnings Calls,Apple Inc.,21156096.0,57323.0,4321315.0,Question,Mike Abramsky,,Analysts,59,Just wondering why you didn't see or whether you expect any touch cannibalization from the iPad? And what's your sense? Or do think iPad is cannibalizing maybe competitive netbooks?,30
24937.0,"Apple Inc., Q2 2010 Earnings Call, Apr-20-2010",2010-04-20,48.0,Earnings Calls,Apple Inc.,21156096.0,57323.0,4321316.0,Answer,Timothy Cook,,Executives,60,"Mike, it's Tim. I can only tell you that in the quarter that we finished, the Q2 that we finished in March, that although we announced the iPad in January, there was nothing obvious in the iPod numbers or the Mac numbers to suggest cannibalization. Now there's an obvious difference between announcing, and people know it's coming and it's starting to sell. And so that part of the equation, we don't know yet. We will find out. We are thrilled with how the iPad is selling and the enormous response that we've received. We also announced new MacBook Pros that you probably saw last week and the whole line changed. And so we're also happy about how the Mac business is positioned and the level of product innovation in those notebooks is enormous. We’ve taken battery life up to 10 hours; it's absolutely amazing. In terms of the iPad competing for customers who were considering a netbook, I'm the wrong person to ask that because to me it's a no-brainer. iPad, netbook, it's sort of 100 to zero. I can't think of a single thing the netbook does well. And iPad does so many things very, very well that I'm already personally addicted to mine and couldn’t live without it. So I'm probably not the right person to ask that just yet.",222
24937.0,"Apple Inc., Q2 2010 Earnings Call, Apr-20-2010",2010-04-20,48.0,Earnings Calls,Apple Inc.,21156096.0,57323.0,4321317.0,Question,Mike Abramsky,,Analysts,61,"Well, Tim, you just talked about -- you see it as a huge independent category. And given all the public debate over its positioning, which you obviously have some strong views on, can you elaborate on why you see it as a huge independent category given it's a new market? You just sort of listed off a bunch of markets that are pre-existing. But you've stated in this case, you also feel without that pre-existing market, it is big. And why do you think Apple's approach will outpace that of, say, competitor tablets or vertical devices like e-books?",98
24937.0,"Apple Inc., Q2 2010 Earnings Call, Apr-20-2010",2010-04-20,48.0,Earnings Calls,Apple Inc.,21156096.0,57323.0,4321318.0,Answer,Timothy Cook,,Executives,62,"Well, I think Steve did this extremely well as usual in positioning the product in the January announcement when he talked about that if a product category were to exist between the notebook and the Smartphone, that it would need to do some things better than either of those. And I'm just saying from my personal use, there's a variety of things that I would put on that list. And I love notebooks personally, but I would put e-mail on it, I would put browsing on it, listening to music, watching videos, watching TV shows of any type, reading books. And the list goes on. Of course, you have the entire App Store in the ecosystem built around that. And so people that like to play games as well, they now have that large canvas to play games on. And other Apps, from serious Apps to less serious Apps, the larger canvas provides a artist a lot more room to do things that are very cool. And so I think that it is a new category. And that certainly the -- it's early, but we really, really like what we see right now. We had what we thought were high hopes. And it has exceeded those. And so I mean that's all I can offer for now, but I'd love to talk again in July and tell you how the quarter went in –- for the June quarter.",238
24937.0,"Apple Inc., Q2 2010 Earnings Call, Apr-20-2010",2010-04-20,48.0,Earnings Calls,Apple Inc.,21156096.0,57323.0,4321319.0,Question and Answer Operator Message,Operator,,Operator,63,Katy Huberty with Morgan Stanley.,5
24937.0,"Apple Inc., Q2 2010 Earnings Call, Apr-20-2010",2010-04-20,48.0,Earnings Calls,Apple Inc.,21156096.0,57323.0,4321320.0,Question,Kathryn Huberty,,Analysts,64,"Tim, in a previous question, you walked through some of the incremental demand drivers for the iPhone. The one you left out was price because Apple, along with the carriers, has done a good job lowering the price of the hardware over the last couple of years. But with the low end at $99, it seems that the incremental demand from here would come from more affordable monthly service plans? And so I guess my question is whether Apple has any influence via the carriers to get more aggressive on the total cost of ownership for the iPhone? And then just have a quick follow-up on the iPad.",108
24937.0,"Apple Inc., Q2 2010 Earnings Call, Apr-20-2010",2010-04-20,48.0,Earnings Calls,Apple Inc.,21156096.0,57323.0,4321321.0,Answer,Timothy Cook,,Executives,65,"We do everything that we can, Katy, to try to get the best deal possible for the consumer. And by the way, I feel like each of the carrier partners we work with want to do the same. And so I think everybody is focused on that. When we dropped the subsidized price of the Phone to $99 last year, we were actually surprised that the mix to the 3GS was very, very high. And as you know, that one starts at $199. And so I think it's important. I think that the price is important of the device. But I think there are other things that people really want, like an extremely innovative product, and all the Apps, and the ecosystem, and the great OS and the incredible hardware that we've got. And so I just think it's one of the factors.",143
24937.0,"Apple Inc., Q2 2010 Earnings Call, Apr-20-2010",2010-04-20,48.0,Earnings Calls,Apple Inc.,21156096.0,57323.0,4321322.0,Question,Kathryn Huberty,,Analysts,66,"And then just as a follow-up on the discussion around margins for iPad, Peter. One of the upside drivers of revenue and margins for the iPhone has been the aftermarket sale of things like accessories. What have you considered about attach rates to the iPad relative to what you've seen on iPod and iPhone? And could that maybe be an upside driver to gross margins for that portfolio over time?",71
24937.0,"Apple Inc., Q2 2010 Earnings Call, Apr-20-2010",2010-04-20,48.0,Earnings Calls,Apple Inc.,21156096.0,57323.0,4321323.0,Answer,Peter Oppenheimer,,Executives,67,"Katy, the accessory portfolio is good for us. And the over 5,000 accessories that work for the iPhone and the iPod, largely work for the iPad. And we've come out with some great accessories for the iPad in the first weeks and the developer community is rallying around it as well. So let's give it a little time, and presumably, some great things will happen there just like it has for iPhone and iPod.",74
24937.0,"Apple Inc., Q2 2010 Earnings Call, Apr-20-2010",2010-04-20,48.0,Earnings Calls,Apple Inc.,21156096.0,57323.0,4321324.0,Question and Answer Operator Message,Operator,,Operator,68,It’ll come From Keith Bachman with Bank of Montréal.,10
24937.0,"Apple Inc., Q2 2010 Earnings Call, Apr-20-2010",2010-04-20,48.0,Earnings Calls,Apple Inc.,21156096.0,57323.0,4321325.0,Question,Keith Bachman,,Analysts,69,"I wanted to ask about Retail. Peter, in your same-store sales comment, I think that the Retail same-store sales were up about 7% and total retail was up about 22% in terms of revenues. And therefore, as investors look out, is the Retail number really driven by new store openings? Or is there something unusual that was going on? But if you could just give a little bit of color on the drivers of the Retail business, that would be great.",81
24937.0,"Apple Inc., Q2 2010 Earnings Call, Apr-20-2010",2010-04-20,48.0,Earnings Calls,Apple Inc.,21156096.0,57323.0,4321326.0,Answer,Peter Oppenheimer,,Executives,70,"Sure. Our retail stores had a great March quarter. The average increase of revenue per store was actually up 8%. And this was the best that we had seen in six quarters. The Mac did incredibly well in the stores, up 38% overall, same-store Mac sales were up over 20%. The Phone did well. And I think the stores are going to really be a great place for customers to come and look at and buy iPads. So we're very confident in our retail stores, the experience that it's giving customers. And finally, just after 10 years of retailing, we are just ecstatic about the fact that roughly half of the Mac sales that occur each quarter are to people that have never owned a Mac before.",127
24937.0,"Apple Inc., Q2 2010 Earnings Call, Apr-20-2010",2010-04-20,48.0,Earnings Calls,Apple Inc.,21156096.0,57323.0,4321327.0,Question,Keith Bachman,,Analysts,71,"Right, but Peter, it would seem that the data’s been fairly consistent that the revenue growth in Retail, at least that category, is dependent upon new store openings.",28
24937.0,"Apple Inc., Q2 2010 Earnings Call, Apr-20-2010",2010-04-20,48.0,Earnings Calls,Apple Inc.,21156096.0,57323.0,4321328.0,Answer,Peter Oppenheimer,,Executives,72,"Again, the average store was up 8%, and in the quarter our average revenue was $5.9 million. So if you annualize it, that's incredibly high by retail standards, particularly for the size of store that we have. So, Keith, I would see good growth coming not only from new stores that we open, but the stores that we've had opened for a number of years are performing very, very well for us and cash flow from those stores is quite strong.",81
24937.0,"Apple Inc., Q2 2010 Earnings Call, Apr-20-2010",2010-04-20,48.0,Earnings Calls,Apple Inc.,21156096.0,57323.0,4321329.0,Question,Keith Bachman,,Analysts,73,"I wanted to ask one follow-up, if I could. I know Rich had asked about the iPad, but could you at least let us know where that would be categorized as a line item? Will it be independent or included in something else?",44
24937.0,"Apple Inc., Q2 2010 Earnings Call, Apr-20-2010",2010-04-20,48.0,Earnings Calls,Apple Inc.,21156096.0,57323.0,4321330.0,Answer,Peter Oppenheimer,,Executives,74,"Sure. We're going to report the iPad very similar as we do iPhone. It will be a line item on our data summary. And the revenue that we report will be for the iPad units and the iPad-specific accessories. Again, similar to what we do for iPhone.",47
24937.0,"Apple Inc., Q2 2010 Earnings Call, Apr-20-2010",2010-04-20,48.0,Earnings Calls,Apple Inc.,21156096.0,57323.0,4321331.0,Question and Answer Operator Message,Operator,,Operator,75,That’ll come from Yair Reiner with Oppenheimer & Co.,10
24937.0,"Apple Inc., Q2 2010 Earnings Call, Apr-20-2010",2010-04-20,48.0,Earnings Calls,Apple Inc.,21156096.0,57323.0,4321332.0,Question,Yair Reiner,,Analysts,76,"I recognize that the iPad is still very much in early days, but have you been able to pick out anything about the App performance? Are consumers buying different kinds of Apps than they typically have for the iPhone? And is the ASP panning out to be different than the type of Apps people have bought for the Phone to this point?",62
24937.0,"Apple Inc., Q2 2010 Earnings Call, Apr-20-2010",2010-04-20,48.0,Earnings Calls,Apple Inc.,21156096.0,57323.0,4321333.0,Answer,Peter Oppenheimer,,Executives,77,"Again, it's very early days. We put out some information after the first couple of days. Customers are loving the iPad. They are going to the App Store and getting Apps, getting books. So it's been really just a great thing for customers. But we'll talk more in the future about how that goes. I would say that we are not focused on trying to make a lot of money on the Apps Store just as we haven’t on the iTunes store. We run the store a bit over break even and we just want to offer tremendous value to customers.",101
24937.0,"Apple Inc., Q2 2010 Earnings Call, Apr-20-2010",2010-04-20,48.0,Earnings Calls,Apple Inc.,21156096.0,57323.0,4321334.0,Question,Yair Reiner,,Analysts,78,Europe appears to be performing exceptionally well. Can we finally say that you're seeing a halo effect from the iPhone there? And to what extent has that been playing out at the stores? Are more than 50% of Mac buyers in European stores new to Mac?,46
24937.0,"Apple Inc., Q2 2010 Earnings Call, Apr-20-2010",2010-04-20,48.0,Earnings Calls,Apple Inc.,21156096.0,57323.0,4321335.0,Answer,Peter Oppenheimer,,Executives,79,"We tend to not break it down by country, but I can tell you that we are thrilled with our new-to-Mac all over the world.",25
24937.0,"Apple Inc., Q2 2010 Earnings Call, Apr-20-2010",2010-04-20,48.0,Earnings Calls,Apple Inc.,21156096.0,57323.0,4321336.0,Question,Yair Reiner,,Analysts,80,"Peter, you mentioned a $600 ASP for the iPhone. Does that include the ratable revenue from software, or is that purely for the hardware?",24
24937.0,"Apple Inc., Q2 2010 Earnings Call, Apr-20-2010",2010-04-20,48.0,Earnings Calls,Apple Inc.,21156096.0,57323.0,4321337.0,Answer,Peter Oppenheimer,,Executives,81,"It's based on the sales value of the iPhone. So it doesn't include anything from carrier payments, any of the deferral or accessories. So it's the sales value in the quarter of the handset sales.",36
24937.0,"Apple Inc., Q2 2010 Earnings Call, Apr-20-2010",2010-04-20,48.0,Earnings Calls,Apple Inc.,21156096.0,57323.0,4321338.0,Question and Answer Operator Message,Operator,,Operator,82,That'll come from Mark Moskowitz with JPMorgan.,8
24937.0,"Apple Inc., Q2 2010 Earnings Call, Apr-20-2010",2010-04-20,48.0,Earnings Calls,Apple Inc.,21156096.0,57323.0,4321339.0,Question,Mark Moskowitz,,Analysts,83,"Tim, earlier you mentioned that Apple is shocked about the reception in the U.S. for the iPad. Can you talk about how you’re shocked in terms of customer penetration? Are there any customers in the early days that are taking the iPad that are completely new to Apple?",48
24937.0,"Apple Inc., Q2 2010 Earnings Call, Apr-20-2010",2010-04-20,48.0,Earnings Calls,Apple Inc.,21156096.0,57323.0,4321340.0,Answer,Timothy Cook,,Executives,84,"Of course. The numbers right now are so preliminary, and based on such a small amount of time we don't read a lot into those. And so they're not something we would disclose at this point.",36
24937.0,"Apple Inc., Q2 2010 Earnings Call, Apr-20-2010",2010-04-20,48.0,Earnings Calls,Apple Inc.,21156096.0,57323.0,4321341.0,Question,Mark Moskowitz,,Analysts,85,"And then not to look too far beyond the iPad, but in the prepared release you guys do say that there are other extraordinary products in the pipeline for this year. Are those incremental categories similar to the iPad? Or are they just enhancements of existing products?",47
24937.0,"Apple Inc., Q2 2010 Earnings Call, Apr-20-2010",2010-04-20,48.0,Earnings Calls,Apple Inc.,21156096.0,57323.0,4321342.0,Answer,Peter Oppenheimer,,Executives,86,"We're just not going to help our competitors. So that's not a question I can specifically answer for you. But let me reiterate, we are very confident in our new product pipeline and are very excited about the coming months.",41
24937.0,"Apple Inc., Q2 2010 Earnings Call, Apr-20-2010",2010-04-20,48.0,Earnings Calls,Apple Inc.,21156096.0,57323.0,4321343.0,Question,Mark Moskowitz,,Analysts,87,"Peter, in terms of the Education vertical. As far as the commentary around the margin hit for June, how much of that is driven by competitive dynamics versus maybe just your own ability here to try to prop up demand because of the troubles still facing some of the school districts out there?",53
24937.0,"Apple Inc., Q2 2010 Earnings Call, Apr-20-2010",2010-04-20,48.0,Earnings Calls,Apple Inc.,21156096.0,57323.0,4321344.0,Answer,Peter Oppenheimer,,Executives,88,"Well, you read the same things we do about the state budget situations. And the school districts are under a lot of pressure in pretty much every state across the country. I've seen no evidence that we are losing market share in education. And so I think it's really just a budget issue. And we've now entered in the June quarter the education buying season. June tends to be more dominated by K-12. And then September will be more dominated typically by higher-ed. And this year, we expect it to be competitive, but we're going to put on our uniform, suit up, and we look forward to competing.",108
24937.0,"Apple Inc., Q2 2010 Earnings Call, Apr-20-2010",2010-04-20,48.0,Earnings Calls,Apple Inc.,21156096.0,57323.0,4321345.0,Answer,Nancy Paxton,,Executives,89,"Thank you, Mark. And thanks to everyone for joining us. A replay of today's call will be available for two weeks as a podcast on the iTunes store, as a webcast on apple.com/investor and via telephone. And the numbers for the telephone replay are  888-203-1112  888-203-1112  or  719-457-0820  719-457-0820  and please enter confirmation code 5473920. These replays will be available beginning at approximately 5:00 p.m. Pacific Time today. Members of the press with additional questions can contact Steve Dowling at  408-974-1896  408-974-1896  and financial analysts can contact Joan Hoover or me with additional questions. Joan is at  408-974-4570  408-974-4570  and I'm at  408-974-5420  408-974-5420 . Thanks again for joining us.",110
24937.0,"Apple Inc., Q2 2010 Earnings Call, Apr-20-2010",2010-04-20,48.0,Earnings Calls,Apple Inc.,21156096.0,57323.0,4321346.0,Question and Answer Operator Message,Operator,,Operator,90,"Ladies and gentlemen, that does conclude today's presentation. We do thank everyone for your participation.",15
24937.0,"Apple Inc., Q3 2010 Earnings Call, Jul-20-2010",2010-07-20,48.0,Earnings Calls,Apple Inc.,120.0,68102.0,5016134.0,Presentation Operator Message,Operator,,Operator,0,"Good day, ladies and gentlemen, and welcome to this Apple Inc. Third Quarter Fiscal Year 2010 Earnings Release Conference Call. [Operator Instructions] At this time, for opening remarks and introductions, I would like to turn the conference over to Ms. Nancy Paxton, Senior Director of Investor Relations. Please go ahead, ma'am.",51
24937.0,"Apple Inc., Q3 2010 Earnings Call, Jul-20-2010",2010-07-20,48.0,Earnings Calls,Apple Inc.,120.0,68102.0,5016135.0,Presenter Speech,Nancy Paxton,,Executives,1,"Thank you. Good afternoon, and thanks to everyone for joining us. Speaking today is Apple's CFO, Peter Oppenheimer; he'll be joined by Apple's COO, Tim Cook; and Treasurer, Gary Wipfler for the Q&A session with the analysts.
Please note that some of the information you'll hear during our discussion today will consist of forward-looking statements, including without limitation, those regarding revenues, gross margins, operating expenses, other income and expense, stock-based compensation expense, taxes, earnings per share and future products.
Actual results or trends could differ materially from our forecast. For more information, please refer to the risk factors discussed in Apple's Form 10-K for 2009 as amended, the Form 10-Q for the first two quarters of fiscal 2010 and the Form 8-K filed with the SEC today, along with the attached press release. Apple assumes no obligation to update any forward-looking statements or information which speak as of their respective date. 
With that, I'd like to turn the call over to Peter Oppenheimer for introductory remarks.",166
