companyid,headline,mostimportantdateutc,keydeveventtypeid,keydeveventtypename,companyname,audiolengthsec,transcriptid,transcriptcomponentid,transcriptcomponenttypename,transcriptpersonname,companyofperson,speakertypename,componentorder,componenttext,word_count
29096.0,"Google Inc., Q1 2014 Earnings Call, Apr 16, 2014",2014-04-16,48.0,Earnings Calls,Alphabet Inc.,3250.0,612164.0,27608697.0,Answer,Patrick Pichette,,Executives,54,"Okay. Well, Robert, let's start with the last one first, and then we'll go back to revenue. ROI, clearly, we have -- we always look at capital intensity. The fact that we're investing quite a bit in CapEx right now, right, is a real tribute to kind of the potential and the optimism we have about our business going forward. Most of our core businesses, if you think of YouTube or advertising or Search, right, are not that capital-intensive relative to other areas that we have, such as, for example, Google Fiber, if you think of the access portion, right, which is much more traditional CapEx. For each of these areas, we actually track and make sure that we have good returns and we have a capital efficient. So even though, an area that, take the advertising business that we run, even though you could argue that it's phenomenally good on the return on capital, the question that we will ask internally is, ""Okay, so if the utilization rate is x on our machines on this business, right, why can't it be x-plus something?"" So even though we have already good return on capital on these areas, we continue to always push the envelope to make sure that our capital efficiency continues to be better and better on a year-to-year basis. And then across the portfolio, every area has some capital kind of targets to make sure that we're driving for value. Finally, there's a number of areas if you think of -- take the most -- the newer stuff like Loon, for example. In those cases, you test through the hurdles that we kind of we seed capital to the Loon team as they hit their hurdles and they kind of earn their right to the next toss of funding. And in doing so, right, we continue to always have the business case in mind that says, ""Hey, here's why this continues to make sense to fund and invest and with ROIC or value in mind for the long term."" But in the short term, it's really kind of delivery of milestones on very specific engineering objectives that actually gives them the next round of funding. So, Robert, as you can see, given the portfolio of mature stuff we have and growing areas, as well as kind of much more R&D and innovation at the early stages, right, we just need to have a basket of tools to actually manage the concept of ROIC or ROI on each of them. And that's what we do, I mean, it's not rocket science, it just requires a lot of discipline on our part. On the revenue side, look, we don't break out DoubleClick or YouTube. I can just tell you, as I mentioned a bit earlier, we're really pleased with our network revenue in the kind of AdMob, Ad Exchange. Many of our areas, right, continue to grow very well and we're very, very pleased by these investments. And clearly, continue to be very pleased with YouTube, as mentioned -- Nikesh mentioned a bit earlier. And that's the story there.",519
29096.0,"Google Inc., Q1 2014 Earnings Call, Apr 16, 2014",2014-04-16,48.0,Earnings Calls,Alphabet Inc.,3250.0,612164.0,27608698.0,Question and Answer Operator Message,Operator,,Operator,55,And our final question comes from Gene Munster with Piper Jaffray.,11
29096.0,"Google Inc., Q1 2014 Earnings Call, Apr 16, 2014",2014-04-16,48.0,Earnings Calls,Alphabet Inc.,3250.0,612164.0,27608699.0,Question,C. Eugene Munster,,Analysts,56,"Another question regarding trends in mobile CPCs. I know yesterday you announced an offline conversion tracking -- plan and program with Datalogic. Is that something, potentially, the whole online/offline tracking that could have a positive impact on CPCs? And separately, any updates on how you think about Fiber longer term?",50
29096.0,"Google Inc., Q1 2014 Earnings Call, Apr 16, 2014",2014-04-16,48.0,Earnings Calls,Alphabet Inc.,3250.0,612164.0,27608700.0,Answer,Patrick Pichette,,Executives,57,"Okay. So why don't I take the last portion and then Nikesh may have views on this data conversion plan. On Fiber, look, you've heard our announcement earlier this quarter where we're working with 34 cities and looking for working with these municipalities where -- I mean, they've indicated to us they're really excited about -- they kind of self-selected to be really excited about getting Fiber and the next generation of access. So right now, we're basically working directly with them to look if we have the right conditions to actually go to the next stage, which would be the build. So very excited about it. I think that it's a really good sign of things to come in access, in general. I think that everybody now in the industry is talking about the gig. It's becoming the standard. And we're absolutely thrilled for all of the users out there that can think that they'll one day get a gigabit of symmetrical Internet at a reasonable price. So stay tuned on the next part of the chapter, but really excited to work with these communities. And, Nikesh, maybe you want to talk about...",194
29096.0,"Google Inc., Q1 2014 Earnings Call, Apr 16, 2014",2014-04-16,48.0,Earnings Calls,Alphabet Inc.,3250.0,612164.0,27608701.0,Answer,Nikesh Arora,,Executives,58,"Yes, thank you, Gene. I mean, as I mentioned earlier, and the question earlier from, I think it was Heather, that the online to offline conversions are really important opportunity, where it's important for offline merchants be able to understand what result they get from their online activity. And some of the experiments that we talked about required partnerships with third-party data providers to understand how that happens. I think Datalogic is one of those things, which we are looking at to see how we can help quantify the opportunity and quantify the answer for our offline partners. So it's just one of those things that we're doing.",108
29096.0,"Google Inc., Q1 2014 Earnings Call, Apr 16, 2014",2014-04-16,48.0,Earnings Calls,Alphabet Inc.,3250.0,612164.0,27608702.0,Answer,Patrick Pichette,,Executives,59,"Thank you, Gene. Just in closing before I hand it over to Jamie. Just to reiterate the point that Nikesh made a bit earlier. To all of our Googlers out there and all of our partners out there, right, thank you so much for the great work in Q1. What a great start to the year, and then we'll see you in Q2. So thanks a million. 
Jamie, I'll leave it with you to close the call, please.",78
29096.0,"Google Inc., Q1 2014 Earnings Call, Apr 16, 2014",2014-04-16,48.0,Earnings Calls,Alphabet Inc.,3250.0,612164.0,27608703.0,Question and Answer Operator Message,Operator,,Operator,60,"Thank you. Again, that does conclude today's conference. We do thank everyone for your participation. Please have a great day.",20
29096.0,"Google Inc., Q2 2014 Earnings Call, Jul 17, 2014",2014-07-17,48.0,Earnings Calls,Alphabet Inc.,3490.0,659331.0,29339042.0,Presentation Operator Message,Operator,,Operator,0,"Good day, everyone, and welcome to the Google Inc. Second Quarter 2014 Earnings Conference Call. This call is being recorded. At this time, I'd like to turn the call over to Jane Penner, Director of Investor Relations. Please go ahead, ma'am.",41
29096.0,"Google Inc., Q2 2014 Earnings Call, Jul 17, 2014",2014-07-17,48.0,Earnings Calls,Alphabet Inc.,3490.0,659331.0,29339043.0,Presenter Speech,Jane Penner,,Executives,1,"Good afternoon, everyone, and welcome to Google's  Second Quarter 2014 Earnings Conference Call. With us are Patrick Pichette, Senior Vice President and Chief Financial Officer; and Nikesh Arora, Senior Vice President and Chief Business Officer.
Also, as you know, we distribute our earnings release through our Investor Relations website located at investor.google.com. So please refer to our IR website for our earnings releases, as well as the supplementary slides that accompany the call. You can also visit our Google+ Investor Relations page for the latest company news and updates. Please check it out. This call is also being webcast from investor.google.com. A replay of the call will be available on our website later today.
Now let me quickly cover the Safe Harbor. Some of the statements that we make today may be considered forward-looking, including statements regarding Google's future investments, our long-term growth and innovation, the expected performance of our businesses and our expected level of capital expenditures. These statements involve a number of risks and uncertainties that could cause actual results to differ materially. Please note that these forward-looking statements reflect our opinions only as of the date of this presentation, and we undertake no obligation to revise or publicly release the results of any revisions to these forward-looking statements in light of new information or future events. Please refer to our SEC filings for a more detailed description of the risk factors that may affect our results.
Please note that certain financial measures that we use on this call, such as operating income and operating margin, are expressed on a non-GAAP basis and have been adjusted to exclude charges related to stock-based compensation and restructuring. We have also adjusted our net cash provided by operating activities to remove capital expenditures, which we refer to as free cash flow. Our GAAP results and reconciliations of non-GAAP to GAAP measures can be found in our earnings press release.
With that, I'll now turn the call over to Patrick.",328
29096.0,"Google Inc., Q2 2014 Earnings Call, Jul 17, 2014",2014-07-17,48.0,Earnings Calls,Alphabet Inc.,3490.0,659331.0,29339044.0,Presenter Speech,Patrick Pichette,,Executives,2,"Thank you, Jane. Good afternoon, and thank you for joining us for our second quarter 2014 earnings call. So I'll dive right into the numbers. Nikesh is going to give you a business update, and then we'll open up for Q&A. So let's dive into the details of our financial performance for Q2. Our gross total consolidated revenue grew a healthy 22% year-over-year to $16 billion and was up 3% quarter-over-quarter.
Without currency fluctuations, our gross total consolidated revenue growth would have in fact been 21% year-over-year, still very healthy. Our Google site revenue was up 23% year-over-year to $10.9  billion and was up 4% quarter-over-quarter, driven by strength in our core search advertising business.
Our network revenue was up 7% year-over-year at $3.4 billion and was up 1% quarter-over-quarter, driven by year-over-year growth in our AdMob and Ad Exchange businesses.
Finally, Google other revenue grew 53% year-over-year to $1.6 billion and was up 3% quarter-over-quarter. Digital sales of apps and content in our Play Store drove the year-over-year growth.
Our global aggregate paid-click was strong this quarter, up 25% year-over-year and 2% quarter-over-quarter. Aggregate CPC were down 6% year-over-year, but flat quarter-over-quarter. And without currency fluctuation, aggregate cost per click would have been down 7% year-over-year. So currency had a very minimal -- and currency had no impact on quarter-over-quarter CPC growth.
As we indicated on our last earnings call, we're now disclosing paid clicks and cost-per-click changes by property type in addition to aggregate numbers. So to that end, Google site's paid clicks were up 33% year-over-year and up 6% quarter-over-quarter. Our Google site CPC were down 7% year-over-year and down 2% quarter-over-quarter.
On the network side, network paid clicks were up 9% year-over-year and down 5% quarter-over-quarter. And our network CPCs were down 13% year-over-year and up 3% quarter-over-quarter.
Our monetization metrics continue to be impacted by a number of factors at an aggregate level, including geographic mix, device mix, property mix, as well as our ongoing product and policy changes. And since we're now disclosing additional property metrics related to our monetization, it may be helpful to remind you all of what we include in each property.
So let's start with sites. Sites monetization metrics include ads that were served on Google owned and operated properties across different geographies and form factors. So these properties include: YouTube search, obviously; YouTube engagement ads, like TrueView; and then other owned operated properties, such as like Maps or Finance and otherwise. Our network monetization metrics include ads serves on non-Google properties participating in our AdSense for Search, AdSense for Content and AdMob businesses.
We also provide corresponding historical data since Q1 of 2013 for reference, which can be found on -- in our earnings slides. Nikesh and I will obviously be happy to respond, as usual, to your question about our Q2 monetization in the Q&A today, but I'm sure that some of you may have detailed questions about monetization trends from prior quarters. And help you with that, the IR team will be ready to answer your questions after the call.
Turning to geographic performance. We saw solid performance in the U.S. and the U.K. and continued strong performance in Rest of World. In our earnings slides, which you can find on our Investor Relations website, you'll see that we've broken down our revenue by U.S., U.K. and Rest of the World to show the impact of FX and the benefits of our hedging programs. So please do refer to these slides for the exact calculations.
The U.S. revenue was up 12% year-over-year to $6.6 billion. The U.K. was up 22% to $1.6 billion. And in fixed FX terms, the U.K. grew 15% year-over-year, a clear improvement from last quarter's performance.
As we've mentioned in previous quarters, our AdSense for Search business skews toward the U.S. and the U.K. And our ongoing user-focused product and policy changes have continued to have a clear impact on our revenue growth in these 2 geographies.
Our non-U.S. revenue, excluding the U.K., was up 31% year-over-year to $7.7 billion. And this accounted for 48% of our total revenue, which includes a $6 million benefit from our hedging program. So in FX term, the Rest of World grew also 31% year-over-year.
Let me now turn to expenses. Traffic acquisition costs were $3.3 billion or 23% of total advertising revenue this quarter. Our non-GAAP other cost of revenue was $2.7 billion in Q2, and this is excluding stock-based compensation. Our non-GAAP operating expenses totaled $4.8 billion, again, excluding SBC. And as a result, our non-GAAP operating profit was $5.1 billion and our non-GAAP operating margin stood at 32% in Q2.
Headcount was up roughly 2,200 people in Q2 in the last 90 days. And in total, we ended the quarter with approximately 52,000 full-time employees. But please note that the headcount does include approximately 3,500 full-time employees from the Motorola business.
Our effective tax rate was 21% in Q2. Our tax rate this quarter was impacted by the continued mix shift of earnings between our domestic and international subsidiaries. Let me now turn to cash management. Our OI&E, or other income and expense, was $145 million for the quarter. Interest income and realized gains on investments offset the continued impact of expenses from our FX hedging program. And for more detail on OI&E, please refer to the slides that accompany this call on our IR website.
We continue to be happy with our strong operating cash flow at $5.6 billion. And CapEx for the quarter was $2.6 billion. This quarter, the majority of the CapEx spend was related to data center construction, real estate purchases and finally, production equipment, in that order. Investors should see our investment in CapEx as a positive signal since it reflects our sustained optimism about Google's business.
As I've mentioned before, we will continue to invest for the long term, and our infrastructure and real estate assets remain a key strategic area of investment for us.
Our free cash flow for the quarter was $3 billion. And before I close, I want to give a brief update on Motorola. The team continues to be hard at work, and we look forward to seeing them join with the Lenovo team soon. Motorola had a great Q2, with the Moto E and Moto G both showing strong sales momentum, especially in emerging markets.
So there you have it. Strong results and an optimism that provides us the confidence to continue to fund strategic growth opportunities in many areas, including our CapEx area that we talked about earlier. And now I'll let Nikesh cover some more details on our business performance in the quarter. And after his remarks, I'll take it back to open up the phone lines for questions. Here you go, Nikesh.",1132
29096.0,"Google Inc., Q2 2014 Earnings Call, Jul 17, 2014",2014-07-17,48.0,Earnings Calls,Alphabet Inc.,3490.0,659331.0,29339045.0,Presenter Speech,Nikesh Arora,,Executives,3,"Thank you, Patrick. We've had an amazing last few months at Google. And our focus on creating great, multi-skin experiences is paying off. I hope you saw our annual I/O developer conference a few weeks ago. We were joined by over 6,000 developers in San Francisco, along with approximately 1.9 million people globally tuning in online.
We unveiled the upcoming Android L release. We also showed how we're expanding the Android platform to cars, watches, TVs, as well as making it easy to search Google from anywhere by simply saying, okay, Google. Making magical products that people love using every day is what drives our ambition, fuels our business. Last quarter, we saw strong growth with $16 billion in gross revenue. We saw particular strength in the travel and retail verticals, as well as in several countries like Japan and India. By now, you know the 4 areas driving our business. One, performance or direct response marketing. Two, helping clients build their brands. Three, our ad tech platforms for agencies and publishers. And four, our emerging businesses like digital content, enterprise and hardware.
I'll quickly go through each of them. And this quarter, I want to highlight the investments we're making to serve small businesses. Firstly, in performance advertising. In the long term, we're battling towards a world where people jump seamlessly across screens of all sizes on all types of surfaces.
In today's world, unlocking the mobile phone opportunity is absolutely key for every marketeer, and we're seeing tremendous amounts of momentum here. We've been building popular mobile app formats for years, like showcasing a business' location or Click-to-Call, et cetera. The teams are laser-focused in making ad campaigns easier across screens and helping businesses measure their effectiveness across devices, as well as offline.
We already offer great solutions for marketeers wanting to promote app installs. In April at our AdWords Performance Forum, we supercharged our offerings for app developers across search, display and as well as YouTube.
We launched improvements like app deep linking and search to help developers reengage users who have already downloaded their app, better targeting options in AdMob to help them reach the most likely customers, even a new app install format on YouTube and more powerful measurement tools so they know exactly how their app is performing at every stage. Mobile hotel booking app, Hotel Tonight, uses mobile search ad as a key part of their global marketing efforts because it drives consistently high value users who are more likely to purchase quickly in the apps.
In fact, international mobile search campaigns drive 3x times higher conversion rates compared to other direct response channels. We're also seeing tremendous amounts of momentum in the Retailer segment, as product listing ads across screen. In fact, this past quarter, we sent over 3x as much traffic to merchants on smartphones and tablet devices compared to Q2 of last year.
Moving on to the second area, brand-building. I recently spent some time at the Con Line Festival [ph]. I know it was work in con [ph], where Google had a big presence, hosting over 300 meetings with creative agencies and brands.
What was actually interesting this year was how much the conversation with brands has changed from years' past. Whereas digital used to be just one channel, today's brand are putting digital at the center of their brand-building campaigns.
We see this from our clients as well, and video seems to be linchpin of the strategy. YouTube continues to be driven by the insanely popular channels from some of our top content creators, like breakout hit Epic Rap Battles of History and new sensation VICE News. We launched our Google Preferred video offering at Brandcast in April, giving marketeers access to top content on YouTube. And we've gotten phenomenal amount of support from agencies and brands so far.
Digitas was our first agency to sign-on. And since then, Omnicom Media Group has also pledged their support. Brands including General Motors, Coca-Cola, and Universal Pictures are also having tremendous amounts of success with Google Preferred. Adidas was one of the major brands to leverage our Google platform to reach fans during the World Cup. They engaged soccer fans by live streaming events with athletes, promote them on YouTube, through TrueView ads, as well as using beautiful Lightbox Ads across our Display Network.
Now a few words about our ad technologies for agencies and publishers. Again, video is at the forefront of our efforts here. Last month, we introduced a premium programmatic video marketplace called Google Partner Select to help publishers monetize their video content and to help agencies reach top-quality video content across the web. The feedback that we've gotten from agencies and publishers has been great. We continue to see strong growth across premium inventory, particularly with the growth of private exchanges, across AdMob and AdSense, publishers are increasing their investments in mobile sites and apps and growing their businesses using our platforms.
Before I move on to our emerging businesses, I want to talk about an area we continue to invest in: online tools for small businesses. Small businesses are the cornerstone of the world's economy and a major priority for us at Google. But there's still a huge opportunity, as over 50% of SMB still don't have a website.
To help set them up for online success, last month, we introduced Google My Business, which helps small businesses manage their online presence across Search, Maps and Google+. We also have a vibrant ecosystem of partners who help local businesses optimize their AdWords campaigns and even improving our customers' support for small businesses. In fact, over the last 3 years, we've doubled our advertiser customer satisfaction scores, which bodes really well. Now let me talk about emerging new businesses, digital content, enterprise and hardware. Google Play continues to grow at breakneck speed across all types of digital content, helping developers and content partners reach users around the world. For instance, clear movies is now available in over 90 countries, with the recent additions in Argentina, Poland and the Czech Republic. We also recently signed deals with CBS-TV and Viacom to bring their TV content to Google Play.
With over 1 billion active Android users, the growing success of Google Play means that more developers are building successful global businesses in our platform. As we mentioned at I/O, since last June, we paid out more than $5 billion to developers through Play, which clearly means it's a growing business for us as well.
Shifting gears to our enterprise business. I can report that over 60% of the Fortune 500 use our paid products. This quarter, we added even more, like Rockwell Collins, that signed up 20,000 employees to use Google Apps. We also launched Google Drive for Work, a premium service for businesses that includes unlimited storage. The reception so far has been great, and we even closed our first sale within minutes of the announcement. Our cloud platform business also has momentum with new features announced at I/O.
On the hardware side, over 1 million Chrome books were sold into schools, clearly a record quarter. And the popularity of Chromecast continues to grow, now available in Australia, Korea, Portugal and many more. I got to watch some World Cup games from the ESPN app using my Chromecast. Before I close, I want to mention our marketing team. In addition to a great I/O this year, we also launched the Made With Code initiative with partners like Girl Scouts of the USA and Girls Who Code to inspire the next generation of women coders. We are really excited about the enthusiasm around this initiative. And who knows, hopefully, some of these coders will join us at Google. With that, I'd like to thank today all the Googlers around the world who helped make this a fantastic quarter. On a personal note, as you might have seen, I'm moving on to a new adventure. I'd like to thank Larry and Sergey and the founders of Google, my colleagues in Larry's staff, as well as everyone at Google for the amazing experiences and the phenomenal 10 years I've had. I look forward to working with them in the future and cheering them from the sidelines. I'll hand back to Patrick.",1381
