companyid,headline,mostimportantdateutc,keydeveventtypeid,keydeveventtypename,companyname,audiolengthsec,transcriptid,transcriptcomponentid,transcriptcomponenttypename,transcriptpersonname,companyofperson,speakertypename,componentorder,componenttext,word_count
29096.0,"Google Inc., Q4 2013 Earnings Call, Jan 30, 2014",2014-01-30,48.0,Earnings Calls,Alphabet Inc.,3231.0,574794.0,26144342.0,Answer,Nikesh Arora,,Executives,41,"Thank you for your question. Let me answer 2 different parts of it. First is in terms of your question on local monetization. So I think we are clearly experimenting with new ad formats in Google Maps. But I think there's a broader way of thinking about local. It's not just about app, it's about location. And as the world begins to interact across multiple screens, you begin to look at location in a whole different way because you have a better understanding of where users are and how you can use that as a filter to provide them more precise information and, hopefully, much more relevant advertising, which requires both ends of the spectrum. It requires us to understand the user's location, but also requires the advertisers to make sure to give us the location of where their services are best utilized. So we need location extensions from advertisers, we need locations from users and we have to be able to marry them across not just Google Maps, but all -- across pretty much every experience that we have, whether it's Search, whether it's -- anything, whether it's YouTube, whatever service that the end user is using, we have to able to localize it because location is a great filter and it allows us to make things more relevant both from advertising and from an organic perspective. In terms of YouTube, I think we're very happy with the growth that YouTube is having and has had, both from a user perspective, as well as content provider perspective, and as well as from monetization perspective. In terms of content providers, we talk to content providers large and small, across entire spectrum, because we want YouTube to be the platform where creators of any size can build an audience. They can build an audience of scale, fans can find the content that they want. It's hard to comment in a particular piece of content because it starts a whole sea of conversations. But we would welcome any content on YouTube as long as people felt that it would add value to the end users and as long as there is a right economic model associated with it.",366
29096.0,"Google Inc., Q4 2013 Earnings Call, Jan 30, 2014",2014-01-30,48.0,Earnings Calls,Alphabet Inc.,3231.0,574794.0,26144343.0,Question and Answer Operator Message,Operator,,Operator,42,And we'll go next to Mark Mahaney with RBC Capital Markets.,12
29096.0,"Google Inc., Q4 2013 Earnings Call, Jan 30, 2014",2014-01-30,48.0,Earnings Calls,Alphabet Inc.,3231.0,574794.0,26144344.0,Question,Kevin Potterton,,Analysts,43,"This is Kevin on for Mark. Just wondering, are guys seeing Nielsen OCR measurement pushing more brand advertisers towards YouTube?",20
29096.0,"Google Inc., Q4 2013 Earnings Call, Jan 30, 2014",2014-01-30,48.0,Earnings Calls,Alphabet Inc.,3231.0,574794.0,26144345.0,Answer,Nikesh Arora,,Executives,44,"Thanks, Mark. Sorry, no, that was Kevin. Sorry. Thanks, Kevin. Kevin, as I mentioned earlier, we had a long spirited answer around measurement. We are seeing measurement as table stakes for brand advertisers because they want to understand what is the return of their brand spend. Now it's easier in performance advertising because you can see the number of clicks you get in a website, or you can measure the number of people who walked into your store. On brand, it's a different metric. So you want to actually try to understand how many people were you able to reach of a certain age or gender. And that's what Nielsen OCR allows you to do. It allows you to compare across various brand and media, so it sort of acts as table stakes. And as I said earlier, it is the early set of metrics that are sort of basic entry metrics into the space, but we hope that this market is going to evolve from a measurement perspective over the coming quarters, coming years, where we can have more sophisticated metrics and metrics that actually allow you to see the impact of this advertising on your brand.",198
29096.0,"Google Inc., Q4 2013 Earnings Call, Jan 30, 2014",2014-01-30,48.0,Earnings Calls,Alphabet Inc.,3231.0,574794.0,26144346.0,Question and Answer Operator Message,Operator,,Operator,45,We'll go next to Richard Kramer with Arete Research.,10
29096.0,"Google Inc., Q4 2013 Earnings Call, Jan 30, 2014",2014-01-30,48.0,Earnings Calls,Alphabet Inc.,3231.0,574794.0,26144347.0,Question,Richard Kramer,,Analysts,46,"Patrick, you've talked before about projects like Google Fiber needing to make returns. And you see acquisitions like Nest, getting replaced by disposals like Motorola. And you now passed the $50 billion mark in terms of net cash, so do you have any plans this year to address this sort of mounting cash pile and as a part of the Google business that needs to generate returns like the other businesses. And then for Nikesh, you've surely seen the various social networking messaging peers absorb some substantial volumes of advertising spend, how does that make you think about the evolution of Google+ and YouTube and some of the other social platforms you have as a complement to the Search-based business?",120
29096.0,"Google Inc., Q4 2013 Earnings Call, Jan 30, 2014",2014-01-30,48.0,Earnings Calls,Alphabet Inc.,3231.0,574794.0,26144348.0,Answer,Patrick Pichette,,Executives,47,"So I'll jump on the first one. As I've reiterated many times before, and we were with our board yesterday at the Audit Committee reviewing this issue. And so, clearly, the cash position of Google is seen as a strategic asset. It is an important asset to us, both in terms of offensive and defensive, given the world in which we live in. And in that context, it's being reviewed regularly and we make sure that actually we get the best return for investors on that asset as well. So we have a real strategy for that as well. So for now, we have nothing else to announce on it, but just to give comfort to our investors that we do take this issue seriously and it is reviewed on a regular basis by both ourselves, our management but also raised to the board for the right answer. So thanks for the question, thanks for asking it, it's always there. I'll turn it over to Nikesh for the second part of the question.",174
29096.0,"Google Inc., Q4 2013 Earnings Call, Jan 30, 2014",2014-01-30,48.0,Earnings Calls,Alphabet Inc.,3231.0,574794.0,26144349.0,Answer,Nikesh Arora,,Executives,48,"Thanks, Patrick. Thanks, Richard. Let's see, yes, I guess to your point, yes, there are other people who are beginning to absorb some amounts of digital ad spend. I think that $15.7 billion for this quarter with a majority of this being advertising I still think we have substantial advertising spend coming into us. But again, from a longer-term perspective, I think every piece of advertising becomes digital. So we're still at single -- I'd say at low double-digit numbers in terms of how much ad spend is digital versus non-digital. So we need more people in the digital space getting more and more advertisers to shift from what we call traditional old media. I think, over time, television becomes digital, I think every piece of advertising becomes digital because this provides so much efficiency, from a measurement perspective and a targeting perspective, if you take out a lot of the waste out of the system. So with that in mind, I think we're still in the very early days of how much advertising is going to move over to digital media. And I think you're right to identify that places like Google+, places like YouTube are still very, very sort of in their infancy in the amount of advertising they can support vis-à-vis the amount of usage we're getting. So we continue to work hard. We had to strike the right balance between user services -- end user services and the amount of advertising we represent to them because this continues to be sort of evolving space and what you don't want to do is you don't want to overwhelm users with tremendous amounts of advertising because that may be good in the short term, but creates a bad experience for the users in the long term. So you will notice that many of our products still do not have tremendous amounts of advertising because we still believe those products are evolving and the right form of advertising just hasn't been invented for those particular areas. So we remain hopeful in the long term for finding more and more ways of enabling advertising for users. And for sure, perhaps some of the products may not lend themselves to advertising and users will prefer to pay for an ad-less product as it relates to certain areas like applications or digital content, et cetera. So those models also exist out there. So I think there's tremendous amounts of scope in the future. And I think you've rightly identified some of the areas where we should be concentrating.",426
29096.0,"Google Inc., Q4 2013 Earnings Call, Jan 30, 2014",2014-01-30,48.0,Earnings Calls,Alphabet Inc.,3231.0,574794.0,26144350.0,Question and Answer Operator Message,Operator,,Operator,49,And we'll take our next question from Heather Bellini with Goldman Sachs.,13
29096.0,"Google Inc., Q4 2013 Earnings Call, Jan 30, 2014",2014-01-30,48.0,Earnings Calls,Alphabet Inc.,3231.0,574794.0,26144351.0,Question,Heather Bellini,,Analysts,50,"I was just wondering if you could share with us your strategy to try and reduce fragmentation of Android? And is the sale of Motorola a potential catalyst for this to start to happen? And, ultimately, do you think this even matters over the long term?",46
29096.0,"Google Inc., Q4 2013 Earnings Call, Jan 30, 2014",2014-01-30,48.0,Earnings Calls,Alphabet Inc.,3231.0,574794.0,26144352.0,Answer,Patrick Pichette,,Executives,51,"Well, I mean, again, Heather, certainly, the transaction with Motorola continues to support the ecosystem. So in that sense, right, I think that we have clear objectives to support -- we've always had a clear objectives to support all of our partners. And after this transaction, it's very clear that we'll continue to be kind of this impartial supporter of the entire ecosystem. As it relates to the detail fragmentation, we've taken a number of steps. We've talked a lot about this already in the past, that there's a number of steps taken to make sure that, in fact, there isn't fragmentation. And then just encourage you to kind of circle back to both the -- what's written, as well as circle back to the IR team for more of the details. But we've done a lot of progress already on this over the last kind of 18 months and a lot more to come. So thanks for your question. 
We have time for one more. So why don't we jump, Jamie, to the last question of the afternoon?",179
29096.0,"Google Inc., Q4 2013 Earnings Call, Jan 30, 2014",2014-01-30,48.0,Earnings Calls,Alphabet Inc.,3231.0,574794.0,26144353.0,Question and Answer Operator Message,Operator,,Operator,52,And we'll take our last question from Colin Sebastian with Robert W. Baird.,14
29096.0,"Google Inc., Q4 2013 Earnings Call, Jan 30, 2014",2014-01-30,48.0,Earnings Calls,Alphabet Inc.,3231.0,574794.0,26144354.0,Question,Colin Sebastian,,Analysts,53,"Just a question on Enterprise. Obviously, from a SaaS perspective, you already have a very good business. But in terms of the infrastructure and platform services, can you talk about how you're approaching the go-to-market, whether it's based on pricing since there are low-margin competitors already in the market? Or is this more of a broader platform approach to link the services together?",63
29096.0,"Google Inc., Q4 2013 Earnings Call, Jan 30, 2014",2014-01-30,48.0,Earnings Calls,Alphabet Inc.,3231.0,574794.0,26144355.0,Answer,Patrick Pichette,,Executives,54,Nikesh?,1
29096.0,"Google Inc., Q4 2013 Earnings Call, Jan 30, 2014",2014-01-30,48.0,Earnings Calls,Alphabet Inc.,3231.0,574794.0,26144356.0,Answer,Nikesh Arora,,Executives,55,"Thank you, Colin, for your question. I'm still trying to parse your question. Look, I think we have done really well from an Enterprise perspective, steadily growing revenues on our traditional Google Apps business. Outside of that, on the platform services, the Google Compute Engine the Google App end and stuff, we continue to make progress. I think we should -- we have more room to work harder over there. We understand there are other players out there, but again, that is such, such an early, early stage in that market. We think, over the long term, almost every business out there, existing and new, has to be on a cloud platform, has to be in a large-scale industrial-strength infrastructure platform. And there is still few players out there and there's lots and lots of room. So I'm not sure if price is the current factor on which people need to make a decision. People will make a decision based on robustness, based on security, based on availability, based on the breadth of services we can offer in that platform. I just think it's early days. So we should be working on all those things, and you should be hearing more from us in the future.",206
29096.0,"Google Inc., Q4 2013 Earnings Call, Jan 30, 2014",2014-01-30,48.0,Earnings Calls,Alphabet Inc.,3231.0,574794.0,26144357.0,Answer,Patrick Pichette,,Executives,56,"Thanks for that. So in closing, a couple of points. One is welcome to 2014, everyone. Having called out 2013, we're totally excited by this coming year. And just as Nikesh has said at the very beginning, thank you for the people in the financial community for your support. As well as to our Googlers, partners, I mean, these are the amazing people that make our job, Nikesh and my job, so easy to be on this call because of their superstar performances across all of our products and our markets. So again, congrats to the Googlers for a great 2013. And with that, Jamie, I'll let you close the call.",111
29096.0,"Google Inc., Q4 2013 Earnings Call, Jan 30, 2014",2014-01-30,48.0,Earnings Calls,Alphabet Inc.,3231.0,574794.0,26144358.0,Question and Answer Operator Message,Operator,,Operator,57,"Thank you, sir. That does conclude today's conference. We do thank everyone for your participation. Have a great day.",19
29096.0,"Google Inc., Q1 2014 Earnings Call, Apr 16, 2014",2014-04-16,48.0,Earnings Calls,Alphabet Inc.,3250.0,612164.0,27608643.0,Presentation Operator Message,Operator,,Operator,0,"Good day, everyone, and welcome to the Google Inc. Q1 2014 Earnings Call. Today's call is being recorded. At this time, I'd like to turn the conference over to Jane Penner, Director of IR. Please go ahead, ma'am.",38
29096.0,"Google Inc., Q1 2014 Earnings Call, Apr 16, 2014",2014-04-16,48.0,Earnings Calls,Alphabet Inc.,3250.0,612164.0,27608644.0,Presenter Speech,Jane Penner,,Executives,1,"Good afternoon, everyone, and welcome to Google's first quarter 2014 earnings conference call. With us are Patrick Pichette, Senior Vice President and Chief Financial Officer; and Nikesh Arora, Senior Vice President and Chief Business Officer.
Also, as you know, we distribute our earnings release through our Investor Relations website located at investor.google.com. So please refer to our IR website for our earnings releases, as well as the supplementary slides that accompany the call. You can also visit our Google+ Investor Relations page for the latest company news and updates. Please check it out. This call is also being webcast from investor.google.com. A replay of the call will be available on our website later today.
Now quickly -- now let me quickly cover the Safe Harbor. Some of the statements that we make today may be considered forward-looking, including statements regarding Google's future investments, our long-term growth and innovation, the expected performance of our businesses and our expected level of capital expenditures. These statements involve a number of risks and uncertainties that could cause actual results to differ materially. Please note that these forward-looking statements reflect our opinions only as of the date of this presentation and we undertake no obligation to revise or publicly release the results of any revisions to these forward-looking statements in light of new information or future events. Please refer to our SEC filings for more detailed descriptions of the risk factors that may affect our results.
Please note that certain financial measures that we use on this call, such as operating income and operating margin, are expressed on a non-GAAP basis and have been adjusted to exclude charges related to stock-based compensation and restructuring. We have also adjusted our net cash provided by operating activities to remove capital expenditures, which we refer to as free cash flow. Our GAAP results and reconciliations of non-GAAP to GAAP measures can be found in our earnings press release.
With that, I will turn the call over to Patrick.",330
29096.0,"Google Inc., Q1 2014 Earnings Call, Apr 16, 2014",2014-04-16,48.0,Earnings Calls,Alphabet Inc.,3250.0,612164.0,27608645.0,Presenter Speech,Patrick Pichette,,Executives,2,"Good afternoon, and thank you for joining us on our first quarter 2014 earnings call. Before we jump into my usual remarks, I'd like to bring 2 points to everybody's attention. First, a reminder that on April 2, we issued our Class C stock dividend. With twice as many shares outstanding, our usual per share information will look quite different starting this quarter. Also, second, and also as a reminder, our expected sale of the Motorola business, Mobile business, to Lenovo triggered discontinued operations accounting treatment, which means Motorola's quarterly results are shown separately from Google's net income. You'll see this new presentation in our financials starting this quarter. So with these 2 caveats noted, let's dive into the details of Google's financial performance in Q1.
Our gross total consolidated revenue grew a healthy 19% year-over-year to $15.4 billion, and it was down 2% quarter-over-quarter. Without currency fluctuations, our gross total consolidated revenue growth would in fact have been 21% year-over-year. Google site's revenue was up 21% year-over-year to $10.5 billion and was down 1% quarter-over-quarter, driven by the strength in our core Search Advertising business. Network revenue was up 4% year-over-year at $3.4 billion and was down 4% quarter-over-quarter, driven by improved year-over-year growth from our Ad Exchange and AdMob businesses.
Finally, Google's Other revenue grew 48% year-over-year to $1.6 billion and was down 6% quarter-over-quarter. Digital sales of apps and content in our Play Store drove year-over-year growth. Chrome cash sales were also strong. 
Our global aggregate paid-click growth was strong this quarter again, up 26% year-over-year and down just 1% quarter-over-quarter. Our aggregate cost per click was down 9% year-over-year and flat quarter-over-quarter. 
Currency fluctuations had a minimal impact on Q1 CPC growth. Our monetization metrics continue to be impacted by a number of factors discussed on previous calls, including geographic mix, device mix, property mix, as well as products and policy changes. And to help investors better understand the complex dynamics of these monetization metrics, we'll begin disclosing paid clicks and CPC growth by property in Q2. 
To be clear, this means that we'll disclose CPC and paid-click growth rates for both our sites and our network businesses. We will continue to disclose, obviously, the aggregate growth rates for CPC and paid clicks. 
Turning to the geographic performance. We saw strong performance in the U.S. and rest of world, solid performance in the U.K. In our earnings slides, which you can find on our Investor Relations website, you'll see that we have broken down our revenue by U.S., U.K. and rest of world to show the impact of FX and the benefits from our hedging programs. So please refer to those slides for the exact calculations. 
U.S. revenue was up 14% year-over-year to $6.7 billion. The U.K. was up 14% year-over-year to $1.6 billion and in fixed FX currency, grew 11% year-over-year. Our non-U.S. revenue, excluding the U.K., was up 25% year-over-year to $7.2 billion. This accounted for 47% of our total revenue, which includes a $8 million benefit from our hedging program. And in fixed-FX terms, the rest of world grew, in fact, 30% year-over-year.
Let me now turn to expenses. Traffic acquisition costs were $3.2 billion or 23% of total advertising revenue. Our non-GAAP other cost of revenue was 2.6% -- $2.6 billion in Q1, excluding our stock-based compensation. Non-GAAP operating expenses totaled $4.6 billion, again, excluding stock-based compensation. And as a result, our non-GAAP operating profit was $5 billion and our non-GAAP operating margins were 32% in Q1.
Just a quick word on a few items that may have created noise in our operating expenses this quarter. We had some discrete legal expenses that hit our G&A line, as well as one-time M&A-related costs that increased our operating expenses, particularly in R&D. So absent these discrete items, our expenses continue to demonstrate the same disciplined agenda we've always had.
Headcount was up roughly 2,100 people in Q1. In total, we ended the quarter with approximately 50,000 full-time employees. And please note that the headcount still includes approximately 3,700 full-time employees from the Motorola business, as well as the employees from the acquisitions completed in this quarter.
Our effective tax rate was 18% in Q1 and our tax rate this quarter was impacted, obviously, by the federal R&D credits, which expired in 2013. Let me now turn to cash management.
Other income and expense was $357 million for the quarter and realized gains on investments and interest income offset the continued impact of expenses from our FX hedging program. For more details on OI&E, please refer to the slides that accompany this call on our IR website. 
We continue to be happy with our strong operating cash flow at $4.4 billion. CapEx for the quarter was $2.3 billion. This quarter, again, the majority of CapEx was related to data center construction, production equipment and real estate purchases. 
As I mentioned last quarter during my remarks, we continue to invest in the long term and our infrastructure continues to be a key strategic area of investment for us. Our free cash flow was $2 billion for Q1. 
And before I close, I want to give a brief update on Motorola. Motorola had a great quarter in Q1, with the Moto G showing strong sales momentum, especially in emerging markets. The team continues to be hard at work, and we look forward to seeing them join up with Lenovo soon. 
So there you have it. Strong results and an optimism that provides us the confidence to fund strategic growth opportunities, including Android, Chrome, YouTube, Enterprise, just to name a few. 
And now I'll cover more details -- I'll let Nikesh, in fact, cover more details of our business performance in the quarter and after his remarks, we'll open up the phone lines for questions. 
Here you go, Nikesh.",972
