companyid,headline,mostimportantdateutc,keydeveventtypeid,keydeveventtypename,companyname,audiolengthsec,transcriptid,transcriptcomponentid,transcriptcomponenttypename,transcriptpersonname,companyofperson,speakertypename,componentorder,componenttext,word_count
24937.0,"Apple Inc., Q4 2013 Earnings Call, Oct 28, 2013",2013-10-28,48.0,Earnings Calls,Apple Inc.,3642.0,535195.0,24518096.0,Presenter Speech,Peter Oppenheimer,,Executives,3,"Thank you, Tim. We're pleased to report the results of the final quarter of Apple's fiscal year '13, with record fourth quarter iPhone sales, driving our highest September quarter revenue ever. Revenue for the quarter was $37.5 billion, up $1.5 billion, or 4% from the year-ago quarter, and slightly above the high end of our guidance range. Gross margin was 37%, at the high end of our guidance range, and operating margin was $10 billion, representing 26.8% of revenue. Net income was $7.5 billion, translating to diluted earnings per share of $8.26.
As for the details of the quarter, I'd like to begin with iPhone. We sold 33.8 million iPhones compared to 26.9 million in the year-ago quarter, an increase of 6.9 million, or 26%, and a new September quarter record. iPhone sales were ahead of our expectations and grew strongly year-over-year in each of our geographic segments. We were particularly pleased with growth in a number of developing markets, with unit sales up sharply year-over-year in Latin America, the Middle East, Russia and India. We were also very happy to add NTT DOCOMO to our carrier lineup in Japan, a country where demand for iPhone has been especially strong. iPhone sales remain very robust in the U.S. with comScore estimating that Apple was the leading smartphone manufacturer, with a 40.7% smartphone subscriber share for the 3 months ending in August. And among North American customers polled by ChangeWave late last month who plan to purchase a smartphone within 90 days, 63% indicated they plan to purchase an iPhone. We exited the quarter with about 14.3 million total iPhones in channel inventory, which represented a sequential increase of 3.3 million from the June quarter and placed us at the low end of our target range of 4 to 6 weeks of iPhone channel inventory on a look-forward basis.
Customers are loving their iPhones. Based on the most recently published research, ChangeWave measured a 96% customer satisfaction rate among iPhone users, and Kantar measured a 92% customer loyalty rate, significantly higher than the competition. And we believe that a great customer experience translates to much higher usage. In fact, Experian reported that iPhone users spend an average of 53% more time each day on their phones than Android phone users. iPhone continues to be a key productivity tool for organizations around the world, aided by apps from the App Store, as well as those custom-built for internal use. In fact, nearly 35,000 companies representing millions of employees worldwide are building custom apps that address specific workflow improvements for their iPhone and iPad users. In the U.S., over 14,000 employees of Johnson Controls are using iPhones for work. The company has created in-house apps that have enhanced field technician service delivery and customer communications. And China's AVIC International, a unit of Aviation Industry Corporation of China, has equipped 27,00 employees with iPhones to access internally developed apps for office administrative documentation, approval processes and key business intelligence systems.
Turning to iPad, we sold 14.1 million iPads during the quarter compared to 14 million in the year-ago quarter. iPad sales exceeded our expectations in the September quarter as we approached our new product introductions. We experienced robust year-over-year sales growth in Japan, Russia, the Middle East, and we were pleased with strong back-to-school demand for iPad in the U.S. and Canada. iPad sell-through was roughly equal to sell-in, so we exited the quarter with about 4.1 million units of iPad channel inventory, within our target range of 4 to 6 weeks on a look-back basis. Interest in iPad remains incredibly strong.
In an August survey by ChangeWave of consumers who intend to purchase tablets within 90 days, 55% indicated they plan to purchase iPads, more than 4x the rate of the next most popular alternative. And of those who already own iPads, the survey measured a 99% customer satisfaction rate. The momentum of iOS devices in enterprise also remains incredibly strong. In its latest mobility index report, Good Technology indicated that the iOS platform accounted for 95% of enterprise mobile app activations and 72% of all mobile device activations in the September quarter, while iPad accounted for 90% of total tablet activations. 
Companies around the world are using iPads with custom apps to reinvent their legacy business processes, improving efficiencies across organizations and job functions. For example, direct store delivery reps at Dr Pepper Snapple Group uses iPads to facilitate communication and streamline the product delivery process. East Japan Railway personnel use iPad minis to stay informed about schedule changes and access conductor manuals. And Swedish manufacturer, SKF, uses a custom iPad app to calculate the life of their ball bearing products, saving 10 to 15 minutes per calculation for every engineer several times per day.
Schools around the world continue to adopt iPad to transform teaching and learning in the classroom. In the U.K., the number of iPads sold to K-12 schools has more than doubled year-over-year. And in Latin America, over 70,000 iPads are being used by Sistema UNO students across 800 schools to improve their learning experience. Here in the U.S., school districts continue to roll out large iPad initiatives to students. The Coachella Valley School District in California is currently distributing over 19,000 iPads to its entire student body. And in South Carolina, every one of the Horry [ph] County school districts' 10,000 middle school students will receive an iPad this year.
These broad deployments are, in part, driven by the great educational content available on iPad, and we're pleased to report that iBooks textbooks are now available across the U.S., U.K. and Australian national high school curricula. Last week, we were thrilled to introduce new iPads featuring the A7 chip with 64-bit desktop-class architecture, ultrafast wireless and expanded LTE connectivity. The new iPad Air features a beautiful Retina display and an elegant unibody design that is 20% thinner and 28% lighter than the fourth generation iPad. And the iPad mini with Retina display packs all the pixels of the iPad Air into its stunning 7.9-inch display and runs over 475,000 iPad apps available from the App Store. 
Turning to Mac. Sales of 4.6 million Macs were above our expectations, which is a 7% decline from the year-ago quarter. IDC estimates the global personal computer market contracted by 10% during the September quarter, indicating that Macs continue to gain share, just as they have for 29 of the last 30 quarters. We were especially pleased with strong year-over-year growth in sales of MacBook Air, which we updated in June. And in late September, we updated iMac with fourth generation Intel Quad Core processors, new graphics, next-generation WiFi and faster PCIe flash storage options. Last week, we launched new versions of MacBook Pro with Retina display, featuring fourth generation Intel Core processors, faster graphics, longer battery life and a more affordable price.
Also last week, we launched Mavericks, the 10th major release of OS X, with more than 200 new features. Mavericks brings iBooks and Maps to the Mac, includes a new version of Safari, enhances multi-display support, introduces Finder Tabs and Tags and delivers core technologies for breakthrough power efficiency and performance and is now free. We ended the quarter with Mac channel inventory that was just below our 4- to 5-week target range.
We continue to be very pleased with the growth of iTunes software and services and the strength of the Apple ecosystem. Our iTunes Stores generated record billings of 4.4 billion in the September quarter, thanks to continuos strong growth in sales of apps. The quarter's iTunes billings translated to quarterly iTunes revenue of 2.4 billion, up 15% from the year-ago quarter. The strong iTunes sales, combined with other software and service revenue, resulted in total quarterly revenue of $4.3 billion from iTunes software and services, an increase of 22% year-over-year. Cumulative app downloads have reached 60 billion, and our app developers have now earned $13 billion from sales through the App Store, half of which they've earned in the last year.
We had a tremendously successful launch of iOS 7 last month, with hundreds of millions of downloads in the first few days alone, making it the fastest software upgrade ever. Last week, we reported that nearly 2/3 of iOS devices were already running iOS 7. That's significantly higher than the percentage of users running the latest versions of other mobile operating systems. This rapid transition to the latest version of iOS not only means that more customers are having the most advanced experience possible, but it also enables developers to offer their latest app innovations to hundreds of millions of users in a single software release. iOS offers something now for everyone with its great new design and features, such as Control Center, AirDrop and iTunes Radio. In fact, the number of unique listeners who have tried iTunes Radio is now 20 million and growing.
iOS 7 also include significant features that make iPhones and iPads more secure and easier to manage in corporate environments, offering new ways to configure and deploy devices at scale. New device management capabilities include controlled sharing of documents and attachments, App Store license management, wireless managed apps setup and streamlined mobile device management enrollment. And in terms of security, iOS 7 offers enterprise single sign-on, default third-party app data protection and per-app VPN to automatically connect storage, corporate apps to the network without the need for users to change complicated settings.
I'd now like to turn to the Apple retail stores. Revenue for the quarter was $4.5 billion, up 6% from the year-ago quarter. The stores produced very strong iPhone sales with unit growth of 36% per store per week compared to the September quarter last year. We completed the remodels of 2 stores and opened 8 new stores during the quarter, ending with a total of 416 stores, including 162 outside the United States. We are projecting a total of approximately 30 new store openings in fiscal year '14, about 2/3 of which will be outside the U.S. We also plan to remodel about 20 stores over the course of fiscal year '14. With an average of 411 stores open in the September quarter, average revenue per store was $10.9 million compared to $11.2 million in the year-ago quarter. Retail segment income was $709 million. We hosted 99 million visitors to stores during the quarter, which translates to 18,500 visitors per store per week. Operating expenses were $3.8 billion and included $467 million of stock-based compensation expense. OI&E was $113 million, and the tax rate for the quarter was 25.9%.
And turning to our cash, we ended the quarter with $146.8 billion in cash plus short-term and long-term marketable securities, a sequential increase of $100 million from the June quarter. Our domestic cash was $35.5 billion at the end of the September quarter, a sequential decline of $5.2 billion, largely attributable to our share repurchase activity. $111.3 billion, or 76% of our total cash was offshore at the end of the September quarter, and cash flow from operations was $9.9 billion. We paid $2.8 billion in dividends in the quarter, and we executed an additional $5 billion in repurchases of 10.4 million shares of Apple stock during the quarter. This brings us to a cumulative total of $36 billion in payments for dividends and share repurchases over the last 5 quarters, of which share buybacks were $23 billion. This has resulted in cumulative retirement of almost 47 million shares and represents 5% of the total shares outstanding prior to the launch of our repurchase program. More than 44 million of these shares have been retired in the past 2 quarters alone.
Finally, given that our capital return program must be funded from domestic cash and, as a result of our payments to date, the cash that we can invest domestically and return to shareholders to stop accumulating. In fact, we have returned to shareholders, or invested essentially all of the increase in available net cash generated since the beginning of our capital return program in 2012. Our Board of Directors has declared a dividend of $3.05 per common share payable on November 14, 2013, to shareholders of record as of the close of business on November 11, 2013.
Now as we move ahead into the December quarter, I'd like to review our outlook, which includes the types of forward-looking information that Nancy referred to in the beginning of the call. First, I want to explain a bit about revenue deferrals. We believe that our software and services play a tremendous role in delivering the overall experience that our customers have come to know and love. Over the last few years, we have added significantly to the offerings that we provide our customers at no incremental charge, from operating system upgrade rights to non-software services such as Siri and iCloud. The iLife and iWork apps have become as essential to the user experience as mail, messages and calendar, so we're now making iPhoto, iMovie, Pages, Numbers and Keynote available as free downloads to customers who've purchased new iOS devices. And we're also making Mavericks and future OS X upgrades, as well as iLife and iWork, free to our Mac customers. As a result of these additional rights and features, we are deferring a greater portion of the sale of each iOS device and Macs sold. We anticipate that the additional deferral per device sold, coupled with our sequentially greater unit volume expectation in the December quarter, will result in about a $900-million sequential increase in the net amount of revenue deferred for software upgrade rights and non-software services. In total, we expect revenue to be between $55 billion and $58 billion compared to $54.5 billion in the year-ago quarter. We expect gross margins to be between 36.5% and 37.5%, reflecting approximately $105 million related to stock-based compensation expense. We expect OpEx to be between $4.4 billion and $4.5 billion, including about $585 million related to stock-based compensation expense. We expect OI&E to be about $200 million, and we expect the tax rate to be about 26.25%.
In closing, we're very pleased with the results of the final quarter of our fiscal year '13. We enter fiscal year '14 with an incredible lineup of products, including our amazing new iPhones and iPads. We remain committed to delivering great innovative products and services that delight our customers to enhance their lives, and we are very confident in our new product pipeline. With that, I'd like to open the call to questions.",2421
24937.0,"Apple Inc., Q4 2013 Earnings Call, Oct 28, 2013",2013-10-28,48.0,Earnings Calls,Apple Inc.,3642.0,535195.0,24518097.0,Question and Answer Operator Message,Operator,,Operator,4,"[Operator Instructions]  First, we'll go to Katy Huberty with Morgan Stanley.",11
24937.0,"Apple Inc., Q4 2013 Earnings Call, Oct 28, 2013",2013-10-28,48.0,Earnings Calls,Apple Inc.,3642.0,535195.0,24518098.0,Question,Kathryn Huberty,,Analysts,5,"Peter, I'm a little surprised your December quarter gross margin guidance isn't even better, given the increased total iPhone mix and also iPhone 5s within the iPhone line. I imagine there's a lot of offsetting factors given the products that were launched last week, so I just wonder if you can walk through some of the gross margin headwinds that you see in the December quarter.",66
24937.0,"Apple Inc., Q4 2013 Earnings Call, Oct 28, 2013",2013-10-28,48.0,Earnings Calls,Apple Inc.,3642.0,535195.0,24518099.0,Answer,Peter Oppenheimer,,Executives,6,"Sure. We expect, as I said in my prepared remarks, our gross margins to be between 36.5% and 37.5%, so essentially in line with the September quarter. We're pleased to be guiding gross margin about flat sequentially, given all the new products that we have launched in the last few weeks. During the quarter, we expect gross margin to benefit from the leverage on the substantial sequential increase in revenue. Offsetting these benefits, we see a few factors, including the higher deferred revenue relating to the software that I talked about in my prepared remarks. And as I said, we expect the sequential increase in our deferral, which is not only revenue but affects margins as well to be $900 million; second, a richer mix of new iPads with higher cost structures and lower pricing; third, FX headwinds primarily from the yen; and fourth, the new lower priced MacBook Pro and iMac, which have higher cost structures than their predecessors. So those are 4 things that I would point out, Katy.",171
24937.0,"Apple Inc., Q4 2013 Earnings Call, Oct 28, 2013",2013-10-28,48.0,Earnings Calls,Apple Inc.,3642.0,535195.0,24518100.0,Question,Kathryn Huberty,,Analysts,7,"Okay, very helpful. Tim, the press and even some of your competitors are quite complimentary of the innovation in iPhone 5s, but it seems like investors are looking or glancing over the 64-bit ARM processor, the fingerprint sensors, the M7 processor, and part of this is that they're not exactly sure what those technologies enable, i.e. why do you need a 64-bit ARM processor in a phone? So just hoping you could enlighten us a little bit on that question.",80
24937.0,"Apple Inc., Q4 2013 Earnings Call, Oct 28, 2013",2013-10-28,48.0,Earnings Calls,Apple Inc.,3642.0,535195.0,24518101.0,Answer,Timothy Cook,,Executives,8,"Well, I think all of -- everything that you mentioned, Katy, is the front-end of a long road map. And so we have the first 64-bit smartphone, as you mentioned, and this is our first use of the fingerprint sensor. And if you've used it so far, you know that it's pretty profound to both use it from a security point of view and use it also to purchase apps or music or movies, et cetera. And so both of these, I think, are -- the most important person here, obviously, is what our customers think. And these new innovations on the 5s and the 5c combined led us to have our best iPhone launch ever, with -- selling about 9 million units through the weekend. So it was a -- we're off to a great start.",137
24937.0,"Apple Inc., Q4 2013 Earnings Call, Oct 28, 2013",2013-10-28,48.0,Earnings Calls,Apple Inc.,3642.0,535195.0,24518102.0,Question and Answer Operator Message,Operator,,Operator,9,We'll go to Bill Shope with Goldman Sachs.,9
24937.0,"Apple Inc., Q4 2013 Earnings Call, Oct 28, 2013",2013-10-28,48.0,Earnings Calls,Apple Inc.,3642.0,535195.0,24518103.0,Question,Bill Shope,,Analysts,10,"Looking at the iPhone business as well, for the 5c, there were some anticipation that the price point would be lower, and there was obviously some debate around that when you launched it. Now that you've had the device out there for a while, a few weeks, what type of response are you seeing from the more cost-sensitive regions? And can you remind us of some of the things you are doing to make the products increasingly affordable for the emerging regions in particular?",84
24937.0,"Apple Inc., Q4 2013 Earnings Call, Oct 28, 2013",2013-10-28,48.0,Earnings Calls,Apple Inc.,3642.0,535195.0,24518104.0,Answer,Timothy Cook,,Executives,11,"Yes, Bill, this is Tim. If you look at what we've done with our iPhone line, we're selling the iPhone 4S as our entry offer. We're selling the iPhone 5c as sort of a mid-tier offer and then of course, the iPhone 5s. And our goal is to, overall, have growth for total iPhone. But also within that, we want to have each of those categories grow as compared to the -- what we were doing previously. And so if you take a -- if you look at the total offers that we're making in the low-end space and mid-tier and high-end, the sum of all the price points we offer there, we'd like to grow in each one of those, and we're really pleased that we did that. And so that's how we measure -- partly measure success. Of course, the most important thing for us is to make a great product. But we do need growth, and we're happy that we've seen that. I realize that some people were reading rumors about -- that the entry phone would be the 5c, but that was never our intent, obviously. Our entry iPhone is the iPhone 4S. And as you know, from comments that I made previously, we were selling the iPhone 4 in very good volumes. And as we begin to experiment in different regions at somewhat lower price points, we saw a fair amount of price elasticity. And so we're hoping and thinking that, that will continue with the 4s.",252
24937.0,"Apple Inc., Q4 2013 Earnings Call, Oct 28, 2013",2013-10-28,48.0,Earnings Calls,Apple Inc.,3642.0,535195.0,24518105.0,Question,Bill Shope,,Analysts,12,"Okay. And then related to that somewhat, looking at the iPhone ASPs overall, last quarter, you reminded us that the iPhone ASP and mix tends to be at its highest levels in the first few months of a product cycle and then tends to trend downward throughout the product cycle. Do you think we should assume similar patterns hold for this cycle? Or are there some unique factors we should consider, particularly given the change in the product lineup?",79
24937.0,"Apple Inc., Q4 2013 Earnings Call, Oct 28, 2013",2013-10-28,48.0,Earnings Calls,Apple Inc.,3642.0,535195.0,24518106.0,Answer,Timothy Cook,,Executives,13,"All things being equal, what we would normally see on our products is that you have a large number of people that are early adopter-related that come into the market right after we announce and buy our very best product. And so other things being equal, that's what we would expect to see.",53
24937.0,"Apple Inc., Q4 2013 Earnings Call, Oct 28, 2013",2013-10-28,48.0,Earnings Calls,Apple Inc.,3642.0,535195.0,24518107.0,Question and Answer Operator Message,Operator,,Operator,14,"Next, we'll go to Toni Sacconaghi with Sanford Bernstein.",9
24937.0,"Apple Inc., Q4 2013 Earnings Call, Oct 28, 2013",2013-10-28,48.0,Earnings Calls,Apple Inc.,3642.0,535195.0,24518108.0,Question,Toni Sacconaghi,,Analysts,15,"Tim, you commented in your initial remarks about new product categories. I think this was also something you were explicit about in your April quarterly conference call, where you said that consumers and investors should expect new products, including new product categories in the second half of this year and first half of 2014. So can you reiterate that we should have that expectation? And when you talk about new product categories, I presume that since you made the statement in April, there have been none? I just want to make sure I understand the semantics of what you referred to as a new category.",105
24937.0,"Apple Inc., Q4 2013 Earnings Call, Oct 28, 2013",2013-10-28,48.0,Earnings Calls,Apple Inc.,3642.0,535195.0,24518109.0,Answer,Timothy Cook,,Executives,16,"Toni, I didn't say in April that you would see them in this year, in the first half of next year, so just to be clear on that. But what I have said is that you'll see -- I've said that you would see some exciting new products from us in the fall of this year and across 2014. And I obviously stand by that, and you've seen a lot of things over the last couple of months. In terms of new product categories, specifically, if you look at the skills that Apple has from hardware, software and services and an incredible app ecosystem, these set of things are very, very unique. I think no one has a set of skills like this. And we obviously believe that we can use our skills in building other great products that are in categories that represent areas where we do not participate today. And so we're pretty confident about that.",158
24937.0,"Apple Inc., Q4 2013 Earnings Call, Oct 28, 2013",2013-10-28,48.0,Earnings Calls,Apple Inc.,3642.0,535195.0,24518110.0,Question,Toni Sacconaghi,,Analysts,17,"And as a follow-up, I wanted to revisit the question of your pricing strategy. Last quarter, you spoke vary ebulliently about elasticity that you experienced on the iPhone 4, and you had lowered the price in many emerging markets to about $400. And yet, when the new products came out, the 4S was actually at a notably higher price than the 4 had been the previous quarter, and the 5c was obviously in line with what we had seen before with the 4S. And the 5s was in line with the 5. So if anything, one of the common themes that came out of the last earnings call was a desire to embrace the elasticity of the iPhone. But as best I can tell, price points across the board seem to be a little bit higher than they were 3 months ago despite the significant success you had there. So I'm wondering how we should think about what lessons you learned from the 4 pricing changes, why you didn't choose to keep the 4, given that it was an extraordinarily strong seller as best we could tell last quarter and how you proceed -- how you expect to try and continue to address lower-priced segments in the smartphone market.",210
