companyid,headline,mostimportantdateutc,keydeveventtypeid,keydeveventtypename,companyname,audiolengthsec,transcriptid,transcriptcomponentid,transcriptcomponenttypename,transcriptpersonname,companyofperson,speakertypename,componentorder,componenttext,word_count
24937.0,"Apple Inc., Q1 2013 Earnings Call, Jan 23, 2013",2013-01-23,48.0,Earnings Calls,Apple Inc.,3788.0,404588.0,19090194.0,Answer,Peter Oppenheimer,,Executives,54,"And, Keith, I'll add to that. For total iPad sales, we're not going to -- we don't provide a sub-level forecast. But we would expect a large year-over-year increase in iPad sales, but a post-holiday sequential decline for iPad sales, which I think is typical. And as Tim said, we expect to be able to meet demand for the mini.",60
24937.0,"Apple Inc., Q1 2013 Earnings Call, Jan 23, 2013",2013-01-23,48.0,Earnings Calls,Apple Inc.,3788.0,404588.0,19090195.0,Answer,Timothy Cook,,Executives,55,"Keith, it's probably worth pointing out just to be totally clear. For the last quarter, we had strong sales of iPad and iPad mini.",24
24937.0,"Apple Inc., Q1 2013 Earnings Call, Jan 23, 2013",2013-01-23,48.0,Earnings Calls,Apple Inc.,3788.0,404588.0,19090196.0,Question and Answer Operator Message,Operator,,Operator,56,We'll go to Scott Craig with Bank of America Merrill Lynch.,12
24937.0,"Apple Inc., Q1 2013 Earnings Call, Jan 23, 2013",2013-01-23,48.0,Earnings Calls,Apple Inc.,3788.0,404588.0,19090197.0,Question,Scott Craig,,Analysts,57,"Tim, can you maybe discuss the tablet market a little bit in relation to Macs and other PCs and sort of how you're thinking about the cannibalization of that market for the iPad relative to the PC market? And then secondly, typically, each quarter, you sort of talk about some of the component constraints? And you certainly talked about iPhone 4 being constrained and the iPad mini, et cetera. So as you enter into the quarter, where do you see the challenges for meeting demand for the calendar first quarter?",90
24937.0,"Apple Inc., Q1 2013 Earnings Call, Jan 23, 2013",2013-01-23,48.0,Earnings Calls,Apple Inc.,3788.0,404588.0,19090198.0,Answer,Timothy Cook,,Executives,58,"Sure. Let me take the second part of that first. I think overall, our team did just a fantastic job ramping a record number of new products during the quarter. We did have significant shortages due to robust demand on both iPad mini and both models of the iMac that persisted the entire quarter. And we are still short of both of those today, as a matter of fact. Additionally, supply of iPhone 5 was short to demand until late in the quarter, and iPhone 4 was short for the entire quarter. We believe that we can achieve a supply-demand balance on iPad mini during this quarter and on iPhone 4 during this quarter. On iMac, we are confident that we're going to significantly increase the supply. But the demand here is very strong, and we are not certain that we'll achieve a supply-demand balance during the quarter. In terms of cannibalization and how we think about this, I think cannibalization is a huge opportunity for us. One, our base philosophy is to never fear cannibalization. If we do, somebody else will just cannibalize it. And so we never fear it. We know that iPhone has cannibalized some iPod business. It doesn't worry us that it's done that. We know that iPad will cannibalize some Mac; that doesn't worry us. On iPad in particular, we have the mother of all opportunities here because the Windows market is much, much larger than the Mac market is. And I think it is clear that it's already cannibalizing some, and I think there's a tremendous amount, more opportunity there. And as you know, I've said for 2 or 3 -- actually 3 years now, I believe, that I believe the tablet market would be larger than the PC market at some point. I still believe that. And you can see by the growth in tablets and the pressure on PCs that those lines are beginning to converge. And I think the other thing for us, maybe not for others but for us, is if somebody will -- buys an iPad mini or an iPad and it's their first Apple product, we have great experience through the years of knowing that when somebody buys their first Apple product, that a percentage of these people wind up buying another type of Apple product. And so if you remember what we had termed the halo effect for some time with the iPod, with the Mac, we're very confident that, that will happen. And we've -- we're seeing some evidence of that on the iPad as well. And so I see cannibalization as a huge opportunity.",439
24937.0,"Apple Inc., Q1 2013 Earnings Call, Jan 23, 2013",2013-01-23,48.0,Earnings Calls,Apple Inc.,3788.0,404588.0,19090199.0,Question and Answer Operator Message,Operator,,Operator,59,And we'll go to Mark Moskowitz with JPMorgan.,9
24937.0,"Apple Inc., Q1 2013 Earnings Call, Jan 23, 2013",2013-01-23,48.0,Earnings Calls,Apple Inc.,3788.0,404588.0,19090200.0,Question,Mark Moskowitz,,Analysts,60,"Question, Tim, around the iPhone. Peter gave some transparency around the qualitative sequential and year-over-year potential increases in the iPad for the March quarter. How should we think about the iPhone family against that in terms of year-over-year and quarter-over-quarter potential increases or decreases? And are there any sort of dynamics around a slower pace of LTE rollouts by the network carriers having an impact?",65
24937.0,"Apple Inc., Q1 2013 Earnings Call, Jan 23, 2013",2013-01-23,48.0,Earnings Calls,Apple Inc.,3788.0,404588.0,19090201.0,Answer,Timothy Cook,,Executives,61,"The thing to consider on iPhone, Mark, is that in the year-ago quarter, we built 2.6 million units of channel inventory because we did the -- one reason was that we did the China launch in the March quarter instead of in the previous quarter. And so the underlying sell-through from the year-ago quarter was 32.5 million. The sell-in was 35 million, as you can probably see on the sheet in front of you. And so in thinking through the number of iPhones to predict, we looked at the 32.5 million number as a baseline. And we clearly believe that we're going to grow year-over-year. But I don't want to be more specific than that because Peter has already given you some top level guidance. And that's how we -- we guide in the aggregate instead of at the product level.",141
24937.0,"Apple Inc., Q1 2013 Earnings Call, Jan 23, 2013",2013-01-23,48.0,Earnings Calls,Apple Inc.,3788.0,404588.0,19090202.0,Question,Mark Moskowitz,,Analysts,62,"Okay. And then my follow-up is just around the pace of LTE buildouts across the globe, either in Europe or parts of Asia, have those slower-than-excepted rollouts from the networks' perspective, has that had any sort of impact, do you think, on your iPhone sales velocity? And could that change over the next 12 months as you see LTE capacity become more available elsewhere?",64
24937.0,"Apple Inc., Q1 2013 Earnings Call, Jan 23, 2013",2013-01-23,48.0,Earnings Calls,Apple Inc.,3788.0,404588.0,19090203.0,Answer,Timothy Cook,,Executives,63,"It's a good question. Today, we have 24 carriers around the world that provide LTE support for iPhone 5. And those are in countries like the U.S., Korea, the U.K., Germany, Canada, Japan, Australia and a few others. Next week, we're adding 36 more carriers for LTE support. And these carriers will be in countries that we're currently not supporting LTE. So the LTE coverage now in -- or as of next week in Italy, Denmark, Finland, Switzerland, Philippines, also several Middle Eastern countries. And so if you look at the total of all of these and the incremental subscribers that are in those countries, it's over 300 million. And so that's the next range of LTE rollouts that I'm pleased to tell you about today. Also, as you know, iPhone 5 also supports other ultrafast networks like HSPA+ and with download up to 42 mbs, which is 3x the speed of the iPhone 4S. And so we're -- we feel very good about the situation that we're in, particularly with these adds next week.",176
24937.0,"Apple Inc., Q1 2013 Earnings Call, Jan 23, 2013",2013-01-23,48.0,Earnings Calls,Apple Inc.,3788.0,404588.0,19090204.0,Question and Answer Operator Message,Operator,,Operator,64,"From Deutsche Bank, we'll go to Chris Whitmore.",8
24937.0,"Apple Inc., Q1 2013 Earnings Call, Jan 23, 2013",2013-01-23,48.0,Earnings Calls,Apple Inc.,3788.0,404588.0,19090205.0,Question,Chris Whitmore,,Analysts,65,"Just to follow up on the iPhone question and with respect to guidance. Just assuming there's some benefit from the Mac carryover effect and the iPad release, et cetera, and adjusting for the inventory, it seems you're guiding to kind of mid- to high-single-digit year-on-year unit growth for the iPhone business from a sell-through standpoint. Is that the right ballpark we should be thinking about? And why the big deceleration from the 25% plus kind of weekly sales rate you quoted in your intro comments?",85
24937.0,"Apple Inc., Q1 2013 Earnings Call, Jan 23, 2013",2013-01-23,48.0,Earnings Calls,Apple Inc.,3788.0,404588.0,19090206.0,Answer,Peter Oppenheimer,,Executives,66,"Sure. Chris. It's Peter. We're not going to talk about guidance at a specific product level. But let me give you some things we thought about in coming up with the range of $41 billion to $43 billion. It is -- that range is a 5% to 10% year-over-year increase. And there are a few factors that are impacting the year-over-year results, making the strong performance of the business a little bit harder to see, so let me point a few of these out. As we've -- first of all, as we talked about several times on the call, last year in the March quarter, we built 2.6 million units of iPhone channel inventory, which allowed us to get into our 4- to 6-week range. That increased the revenue in the year-ago quarter by $1.6 billion. And as Tim talked about, that was sell-in, that was not sell-through. We're thinking about the business on a sell-through basis. So don't lose sight of the $1.6 billion. Second, the iPhone 5 rollout this year has been our fastest ever. We're selling in 100 countries by the end of December. Last year, we did not achieve this country distribution until the March quarter, which included China that we launched in January. Third, we made a very good strategic decision to introduce the iPad mini, which customers love, and to keep the price-reduced iPad 2 in the line. As a result of this, we saw a reduction in our iPad ASPs of about $101 year-over-year in the December quarter. And you can see that our iPad units grew faster than our iPad revenue in the December quarter. We would expect iPad ASPs to be down quite a bit in the March quarter on a year-over-year basis for the same reasons. And then finally, the PC market grew 4% last year in the March quarter. And this year, IDC is projecting that to decline by 3%. So considering these factors, the underlying performance of the business is much stronger than the 5% to 10% year-over-year growth implies, and we remain very confident in our business and our new product pipeline.",355
24937.0,"Apple Inc., Q1 2013 Earnings Call, Jan 23, 2013",2013-01-23,48.0,Earnings Calls,Apple Inc.,3788.0,404588.0,19090207.0,Question,Chris Whitmore,,Analysts,67,"And for my follow-up, I wanted to come back to something Tim said earlier about not fearing cannibalization. I wanted to ask in context of your iPhone business, given the strength you're seeing at the low end of your product line, the iPhone 4 being stocked out during the quarter, there seems to be a lot of demand at lower price points for the iPhone. Why not get more aggressive at lower price bands and move down market in the iPhone business?",83
24937.0,"Apple Inc., Q1 2013 Earnings Call, Jan 23, 2013",2013-01-23,48.0,Earnings Calls,Apple Inc.,3788.0,404588.0,19090208.0,Answer,Timothy Cook,,Executives,68,"We -- I'm not going to go into our pricing strategy, but we feel great about the opportunity of getting products to customers and a percentage of those buying other Apple products. And we've obviously seen evidence of that through history and continue to see evidence of that today.",49
24937.0,"Apple Inc., Q1 2013 Earnings Call, Jan 23, 2013",2013-01-23,48.0,Earnings Calls,Apple Inc.,3788.0,404588.0,19090209.0,Answer,Nancy Paxton,,Executives,69,"Thank you, Chris. A replay of today's call will be available for 2 weeks as a podcast on the iTunes Store, as a webcast on apple.com/investor, and via telephone. And the numbers for the telephone replay are (888) 203-1112 or (719) 457-0820. Please enter confirmation code 1474555. And these replays will be available by approximately 5:30 p.m. Pacific Time today. Members of the press with additional questions can contact Steve Dowling at (408) 974-1896, and financial analysts can contact Joan Hoover or me with additional questions. Joan is at (408) 974-4570, and I'm at (408) 974-5420. Thanks again for joining us.",101
24937.0,"Apple Inc., Q1 2013 Earnings Call, Jan 23, 2013",2013-01-23,48.0,Earnings Calls,Apple Inc.,3788.0,404588.0,19090210.0,Question and Answer Operator Message,Operator,,Operator,70,"Ladies and gentlemen, that does conclude today's presentation. We do thank everyone for your participation.",15
24937.0,"Apple Inc., Q2 2013 Earnings Call, Apr 23, 2013",2013-04-23,48.0,Earnings Calls,Apple Inc.,3581.0,446488.0,20887075.0,Presentation Operator Message,Operator,,Operator,0,"Good day, ladies and gentlemen, and welcome to this Apple Inc. Second Quarter Fiscal Year 2013 Earnings Release Conference Call. Today's call is being recorded. At this time, for opening remarks and introductions, I would like to turn the call over to Nancy Paxton, Senior Director of Investor Relations. Please go ahead, sir.",53
24937.0,"Apple Inc., Q2 2013 Earnings Call, Apr 23, 2013",2013-04-23,48.0,Earnings Calls,Apple Inc.,3581.0,446488.0,20887076.0,Presenter Speech,Nancy Paxton,,Executives,1,"Thank you. Good afternoon, and thanks to everyone for joining us. Speaking today are Apple's CEO, Tim Cook; and CFO, Peter Oppenheimer. And they'll be joined by Treasurer, Gary Wipfler, for the Q&A session with analysts. 
Please note that some of the information you'll hear during our discussion today will consist of forward-looking statements, including, without limitation, those regarding revenues, gross margins, operating expenses, other income and expense, stock-based compensation expense, taxes, future products and capital allocation plans. Actual results or trends could differ materially from our forecasts. For more information, please refer to the risk factors discussed in Apple's Form 10-K for 2012, the Form 10-Q for the first quarter of 2013 and the Form 8-K filed with the SEC today along with the associated press releases. Apple assumes no obligation to update any forward-looking statements or information, which speak as of their respective dates. 
I'd now like to turn the call over to Tim Cook for introductory remarks.",160
24937.0,"Apple Inc., Q2 2013 Earnings Call, Apr 23, 2013",2013-04-23,48.0,Earnings Calls,Apple Inc.,3581.0,446488.0,20887077.0,Presenter Speech,Timothy Cook,,Executives,2,"Thank, Nancy. Hello, everyone, and thank you for joining us. We have a lot of news to share with you today about the details of our March quarter, as well as a significant increase to our capital return program. 
First, I'd like to talk about our business and the road ahead. We're now halfway through our fiscal 2013, and we've accomplished a tremendous amount. We've introduced and ramped production of an unprecedented number of new products, and we've set many new sales records. Our revenue for the first half was over $98 billion, and our net income was over $22 billion. During that time, we sold 85 million iPhones and 42 million iPads. These are very, very large numbers, unimaginable even to us just a few years ago. 
Despite producing results that met or beat our guidance as we have done consistently, we know they didn't meet everyone's expectations. And though we've achieved incredible scale and financial success, we acknowledge that our growth rate has slowed and our margins have decreased from the exceptionally high level we experienced in 2012. Our revenues grew about $13 billion in the first half of the fiscal year. Even though that's like adding the total first half revenue of 5 Fortune 500 companies, our average weekly growth slowed to 19%, and our gross margins are closer to the levels of a few years ago. 
Our fiscal 2012 results were incredibly strong, and that's making comparisons very difficult this year. Last year, our business benefited from both high growth and demand for our product and a corresponding growth in channel inventories, along with the richer mix of higher gross margin products, a more favorable foreign currency environment and historically low costs. These compares are made further challenging until we anniversary the launch of the iPad mini, which, as you know, we strategically priced at a lower margin. As Peter will discuss, we are guiding to flat revenues year-over-year for the June quarter along with a slight sequential decline in gross margins. 
The decline in Apple's stock price over the last couple of quarters has been very frustrating to all of us. But Apple remains very strong, and we will continue to do what we do best. We can't control items such as exchange rates and world economies and even certain cost pressures. But the most important objective for Apple will always be creating innovative products, and that is directly within our control. We will continue to focus on the long term, and we remain very optimistic about our future. We're participating in large and growing markets. We see great opportunities in front of us, particularly, given the long-term prospects of the smartphone and tablet markets; the strength of our incredible ecosystem, which we plan to continue to augment with new services; our plans for expanded distribution; and the potential of exciting new product categories. 
Take the smartphone market for example. IDC estimates that this market will double between 2012 and 2016 to an incredible 1.4 billion units annually. And Gartner estimates that the tablet market is growing at an even faster rate from 125 million units in 2012 to a projected 375 million by 2016. Our teams are hard at work on some amazing new hardware, software and services that we can't wait to introduce this fall and throughout 2014. We continue to be very confident in our future product plans. Apple has many distinct and unique advantages as the only company in the industry with world-class skills in hardware, software and services. We have the strongest ecosystem in the industry with App Stores in 155 countries, iTunes Music Stores in 119 countries, hundreds of millions of iCloud users around the world and most importantly, the highest loyalty and customer satisfaction rates in the business. And of course, we have a tremendous culture of innovation with a relentless focus on making the world's best products that change people's lives. This is the same culture and company that brought the world the iPhone and the iPad, and we've got a lot more surprises in the works. 
A little over a year ago, we announced a plan to return $45 billion to shareholders over 3 years. Since we began paying dividends last August and began share buybacks last October, we've already returned $10 billion under that program. But we continue to generate cash in excess of our needs to operate the business, invest in our future and maintain flexibility to take advantage of strategic opportunities. We remain firmly committed to our objective of delivering attractive returns to shareholders through both our business performance and the return of capital. So today, we are announcing an aggressive plan that more than doubles the size of the capital return program we announced last year to a total of $100 billion by the end of calendar year 2015. The vast majority of our incremental cash return will be in the form of share repurchases. As the board and management team deliberated among the various alternatives to returning cash, we concluded that investing in Apple was the best. 
In addition to share repurchases, we are increasing our current dividend by 15% to further appeal to investors seeking yield. And as part of our updated program, we will access the debt markets. Peter will provide more details about all of this in a moment. We appreciate the input that so many of our shareholders have provided us on how best to deploy our cash. We will review our cash allocation strategy each year. And we will continue to invest confidently in the business to bring great new products to market; strategically deploy capital in our supply chain, our retail stores and our infrastructure; and make acquisitions to expand our capabilities. We will be disciplined in what we do, but we will not under-invest. 
I'd now like to turn the call over to Peter to discuss the details of the March quarter. Peter?",989
