companyid,headline,mostimportantdateutc,keydeveventtypeid,keydeveventtypename,companyname,audiolengthsec,transcriptid,transcriptcomponentid,transcriptcomponenttypename,transcriptpersonname,companyofperson,speakertypename,componentorder,componenttext,word_count
25016048.0,"Broadcom Limited, Q2 2016 Earnings Call, Jun 02, 2016",2016-06-02,48.0,Earnings Calls,Broadcom Inc.,3281.0,995241.0,42060962.0,Question,Amit Daryanani,,Analysts,51,"Got it. I guess just as a follow-up, in your 10-K you guys disclosed you guys signed a multi-year agreement with your largest customer. Could you just talk about what led to that development? And what sort of parameters are there that give you comfort around maybe the content numbers or your allocation over the next several years along with pricing?",61
25016048.0,"Broadcom Limited, Q2 2016 Earnings Call, Jun 02, 2016",2016-06-02,48.0,Earnings Calls,Broadcom Inc.,3281.0,995241.0,42060963.0,Answer,Hock Tan,,Executives,52,"No, it's a combination of several factors. One is our overall business model in this company, and it applies across the multiple products lines. We sell franchises, I call it, is we compete basically on technology. We have technology. I mean, we are a walking example of lots and lots of technology in various areas -- not all areas, but in various areas that we feel we are very strong in technology, includes engineers and IP. And we pride ourselves in therefore using that technology to create, develop products, which are very differentiated for leading customers in the markets we participate in. We really do. And those customers, we take very seriously. We are very loyal. We go 100% in for the customer, and we invest to develop those products. In return, we ask for certainty. We ask for partnership, and we tend to like to enter into long-term strategic partnership with a customer where they will continue to use us for future generations of products, which enables us to continue to invest into developing technology and products, which enable them to be successful. And that investment is not just technology in the case of the 8-K -- the filing -- 10-K filing, sorry, that we talked about. It was also capacity -- unique capacity in FBAR. So it fits very, very nicely. But this is not an unusual kind of transaction. We do that with many of our major strategic customers who we like to call partners, but that would be rather presumptuous because they are customers and we are the supplier. But we give them technology, we give them value. And we hope we do enough of that, that they will sign up for a long-term partnership with us, which enable us to continue to invest and sustain that franchise, as we call it. And that's just a manifestation of one of many that we do.",318
25016048.0,"Broadcom Limited, Q2 2016 Earnings Call, Jun 02, 2016",2016-06-02,48.0,Earnings Calls,Broadcom Inc.,3281.0,995241.0,42060964.0,Answer,Ashish Saran,,Executives,53,Thank you for participating in today's earnings call. We look forward to talking with you again when we report our third quarter fiscal year 2016 financial results.,28
25016048.0,"Broadcom Limited, Q2 2016 Earnings Call, Jun 02, 2016",2016-06-02,48.0,Earnings Calls,Broadcom Inc.,3281.0,995241.0,42060965.0,Question and Answer Operator Message,Operator,,Operator,54,Thank you. That concludes Broadcom's conference call for today. You may now disconnect.,13
25016048.0,"Broadcom Limited, Q3 2016 Earnings Call, Sep 01, 2016",2016-09-01,48.0,Earnings Calls,Broadcom Inc.,3286.0,1040918.0,43748279.0,Presentation Operator Message,Operator,,Operator,0,"Welcome to Broadcom Limited's Third Quarter Fiscal Year 2016 Financial Results Conference Call. At this time, for opening remarks and introductions, I would like to turn the call over to Ashish Saran, Director of Investor Relations. Please go ahead, sir.",41
25016048.0,"Broadcom Limited, Q3 2016 Earnings Call, Sep 01, 2016",2016-09-01,48.0,Earnings Calls,Broadcom Inc.,3286.0,1040918.0,43748280.0,Presenter Speech,Ashish Saran,,Executives,1,"Thank you, operator, and good afternoon, everyone. Joining me today are Hock Tan, President and CEO; and Tom Krause, Acting Chief Financial Officer of Broadcom Limited.
After market closed today, Broadcom distributed a press release and financial tables describing our financial performance for the third quarter of fiscal year 2016. If you did not receive a copy, you may obtain the information from the Investors section of Broadcom's website at www.broadcom.com. 
This conference call is being webcast live, and a recording will be available via telephone playback for 1 week. It will also be archived in the Investors section of our website at broadcom.com.
During the prepared comments section of this call, Hock and Tom will be providing details of our third quarter fiscal year 2016 results, background to our fourth quarter fiscal year 2016 outlook and some commentary regarding the business environment. We will take questions after the end of our prepared comments.
In addition to U.S. GAAP reporting, Broadcom reports certain financial measures on a non-GAAP basis. A reconciliation between GAAP and non-GAAP measures is included in the tables attached to today's press release. Comments made during today's call will primarily refer to our non-GAAP financial results. Please refer to our press release today and our recent filings with the SEC for information on the specific risk factors that could cause our actual results to differ materially from the forward-looking statements made on this call.
At this time, I would like to turn the call over to Hock Tan. Hock?",252
25016048.0,"Broadcom Limited, Q3 2016 Earnings Call, Sep 01, 2016",2016-09-01,48.0,Earnings Calls,Broadcom Inc.,3286.0,1040918.0,43748281.0,Presenter Speech,Hock Tan,,Executives,2,"Thank you, Ashish. Good afternoon, everyone. Well, we did deliver very strong results for our third fiscal quarter 2016, with revenue at $3.8 billion, up 7% sequentially and above the midpoint of guidance. Earnings per share of $2.89 grew by a more impressive 14% sequentially as we benefited from the leverage inherent in our business model. 
I'm rather pleased with our execution on integrating classic Broadcom businesses and divesting several of its noncore businesses we had identified as assets held for sale. We've also made rapid progress in driving towards our target business model within the first 2 quarters after closing the acquisition, but we're not yet done with the full realization of expected acquisition-related cost synergies.
Let me now turn to a discussion of our third quarter segment results, starting with wired. In the third quarter, wired revenue came in at $2.07 billion, and the wired segment represented 54% of total revenues. Revenue for this segment was flat sequentially as the strong demand we had seen for wired products in the prior quarter continued to sustain into the third quarter. This was slightly weaker than we have expected due to lower-than-expected set-top box product shipments because of supply constraints. However, the reduction in set-top box revenue was offset by growth in our ASICs, particularly in Internet switching and fiber optic shipments into the Fiber-to-the-Home applications. We also benefited from strong demand for Fiber-to-the-Home products in our broadband access business. Switching and routing ASSPs sustained as data center operators continue to upgrade their infrastructure. Our Jericho routing product family, which is enabling a whole new set of switching and routing platforms for our core customers, had a strong ramp in this quarter. 
As we look in the fourth quarter for wired segment, similar to the prior quarter, we expect wired to sustain and come in -- and continue to come in flat sequentially. We continue to resolve supply constraints in this segment as we progress through the fourth quarter.
Moving on to wireless. In the third quarter, wireless revenue came in at about $1 billion, and this segment represented 27% of total revenues. Revenue for this segment was up 27% sequentially, somewhat stronger than expectations. Growth was primarily driven by the expected start of a ramp from a large North American smartphone customer as they transition to the next-generation platform, further enhanced by a substantial increase in Broadcom's content in the new handset. We also benefited from continued demand increases from our large Asian handset customer. 
Looking towards the fourth quarter fiscal 2016, we expect strong growth to continue in our wireless segment, and we are projecting revenue growth over 30% sequentially here. We expect this growth to result from the full ramp of the new phone model in our North American smartphone customer, partially offset by the annual product cycle rollover in our large Asian customer.
Let me now turn to enterprise storage. In the third quarter, enterprise storage revenue came in at $527 million, and this segment represented 14% of total revenue. Segment revenue came in flat sequentially compared to the large seasonal decline in the prior quarter. We had expected revenue in this segment to decline sequentially, but instead, we delivered better results as some stability returned to both the hard disk drive and server storage, SaaS connectivity businesses in the third quarter. 
Looking into the fourth quarter, we expect positive end-market seasonality to drive enterprise storage revenue growth in the low single digits sequentially. 
Finally, to our last segment, industrial. As I mentioned previously, this segment also includes our IP intellectual property licensing business. In the third quarter, industrial segment revenue came in at $202 million, up 11% sequentially, much better than expectations. Industrial segment represented 5% of our total revenue. In IP licensing, as expected, after a strong and lumpy second quarter, revenue dropped in the third quarter in IP licensing. 
In contrast, industrial product resales -- these are distributors selling to our end customers, their end customers, grew by a healthy 15% sequentially, with strong demand from all geographies. As a result, industrial product revenue also increased sequentially and significantly as we replenished depleted channel inventory during the third quarter. 
And accordingly, as we look into the fourth quarter and take into account the strong inventory replenishment in the third quarter, we plan on reducing shipments into the channel as we head towards the seasonally weaker end of the calendar year. Therefore, even as we focus resales to continuing to be firm and trend up mid-single digits, we expect an approximate 20% sequential decline in fourth quarter industrial revenue.
In summary, therefore, I'd like to say visibility to near-term projected demand remains very solid, and we anticipate continued momentum into the fourth quarter. We expect the ramp in our wireless segment to drive consolidated revenue growth of 8% sequentially. We expect our operating leverage to drive earnings per share growth of 16% sequentially, twice our projected revenue growth.
With that, let me now turn the call over to Tom for a more detailed review of our third quarter financials.",845
25016048.0,"Broadcom Limited, Q3 2016 Earnings Call, Sep 01, 2016",2016-09-01,48.0,Earnings Calls,Broadcom Inc.,3286.0,1040918.0,43748282.0,Presenter Speech,Thomas  Krause,,Executives,3,"Thank you, Hock, and good afternoon, everyone. My comments today will focus primarily on our non-GAAP results from continuing operations unless otherwise specifically noted. A reconciliation of our GAAP and non-GAAP data is included with the earnings release issued today and is also available on our website at broadcom.com. 
We continue to focus on our core businesses, or franchises as we call them, to drive a financial model that delivers sustainable mid-single-digit annual revenue growth at greater than 60% gross margin and greater than 40% operating margin. To that end, in the third quarter, we took another very positive step towards our target model. We achieved healthy top line growth with gross margin over 60% and operating margin at just over 39%. As our integration plans progress, we see a very clear line of sight to achieving our target model in fiscal year 2017. 
We were also able to improve our capital structure in the quarter. We completed both previously announced divestitures, collecting over $600 million in cash, and paid down $1.3 billion of our long-term debt. Finally, just after the quarter closed, we took advantage of favorable credit markets to refinance our outstanding term loans at substantially lower rates. I will touch on the details of the refinancing later in my prepared remarks.
Now let me turn to a summary of our results for the third quarter. Revenue for the third quarter came in at $3.8 billion, growing 6.7% sequentially. Foxconn was a greater-than-10% direct customer in the third fiscal quarter. Our third quarter gross margin from continuing operations was 60.4%, about 40 basis points above the midpoint of guidance, primarily due to better-than-expected operational efficiency.
Turning to operating expenses. R&D expenses were $667 million and SG&A expenses were $141 million. This resulted in total operating expenses for the third quarter of $808 million, in line with guidance. Operating expenses were flat sequentially as the benefits from the ongoing realization of acquisition-related cost synergies were offset by higher bonus accruals due to higher profitability. Our fourth quarter guidance for operating expenses anticipates a similar outcome. 
We expect our IT platform integration, which is scheduled to be completed in early fiscal year 2017, to continue to drive operating expense reductions next year as we work towards the full realization of projected acquisition-related cost synergies. 
On a percentage basis for the third quarter, total operating expenses were 21.3% of revenue. As a percentage of sales, R&D was 17.6% and SG&A was 3.7%. Operating income from continuing operations for the quarter was $1.5 billion approximately and represented 39.2% of net revenue.
Taxes came in at $61 million, slightly above our guidance. This was primarily due to higher-than-expected net income. Third quarter net income was $1.3 billion approximately, and earnings per diluted share was $2.89. Third quarter interest expense was $139 million; and other income, net, was $4 million. 
As I mentioned in the opening remarks on August 2 right after the quarter closed, the second day of the fourth fiscal quarter, in fact, we completed a refinancing of our outstanding term loans by upsizing our term loan A and reducing our term loan B by an equivalent amount and simultaneously repricing the remainder of the term loan B at a lower interest rate. The net effect is a reduction of our blended cost of debt based on current LIBOR from 3.5% to 2.9%. This refinancing significantly lowers our projected ongoing interest expenses starting with the fourth fiscal quarter of 2016. Keep in mind our indebtedness is 100% floating rate and is, therefore, subject to movement in short-term interest rates. 
Our share-based compensation expense in the third quarter was $213 million, which included the full impact from new grants issued to classic Broadcom employees after the close of the acquisition in the second quarter. In the fourth quarter of fiscal 2016, we anticipate share-based compensation expense will also be approximately $213 million. Just as a reminder, our definition of non-GAAP net income excludes share-based compensation expense. 
Moving on to the balance sheet. Our days sales outstanding were 52 days, an increase of 4 days from the prior quarter due to the timing of the seasonal ramp in our wireless revenues. Our inventory ended at $1.3 billion, down from $1.47 billion in the prior quarter. This was primarily due to depletion of wireless filter inventory we had built up in prior quarters to support the strong second half production ramp, which started as expected in the third quarter. 
We generated $963 million in operational cash flow, which reflected the impact of approximately $96 million of cash expended on restructuring activities. We ended the quarter with a cash balance of approximately $2 billion. 
In the third quarter, we spent $232 million on capital expenditures. For the fourth quarter, we expect CapEx to be approximately $325 million. As I had mentioned previously, we expect CapEx to run at an elevated level over the next several quarters, driven by campus construction primarily at our Irvine and San Jose locations, integration-related operations and IT investments and the ongoing RF filter fab capacity expansion we discussed in the past. 
A total of $211 million in cash was spent on company dividend partnership distribution payments in the third quarter. And as I think you've seen already, our board just recently declared a dividend of $0.51 per share to be paid later in this fourth fiscal quarter.
Now let me turn to our non-GAAP guidance for the fourth quarter of fiscal year 2016. This guidance reflects our current assessment of business conditions, and we do not intend to update this guidance. This guidance is for results from continuing operations only. Net revenue is expected to be $4.1 billion plus or minus $75 million. Gross margin is expected to be 60.5% plus or minus 1 percentage point. Operating expenses are estimated to be approximately $808 million. Taxes are forecasted to be approximately $71 million. Net interest expense and other is expected to be approximately $104 million, and the diluted share count forecast is for 448 million shares. 
Now that concludes my prepared remarks. Operator, if you could, please open up the call for questions.",1022
25016048.0,"Broadcom Limited, Q3 2016 Earnings Call, Sep 01, 2016",2016-09-01,48.0,Earnings Calls,Broadcom Inc.,3286.0,1040918.0,43748283.0,Question and Answer Operator Message,Operator,,Operator,4,[Operator Instructions] Our first question comes from the line of John Pitzer with Credit Suisse.,15
25016048.0,"Broadcom Limited, Q3 2016 Earnings Call, Sep 01, 2016",2016-09-01,48.0,Earnings Calls,Broadcom Inc.,3286.0,1040918.0,43748284.0,Question,John Pitzer,,Analysts,5,"Hock, my first question, just on the wired business. You talked about supply constraints in the set-top box area. Was that all of the miss in the July quarter? And then when you look at the non-set-top box portion of wired for both July and October, I'm just kind of curious if you could qualify how that business is trending, especially because some companies have been talking about a reacceleration in data center spending in the back half of the year. I would think that you guys would probably be an early leading indicator for that because you really don't want to buy CPUs if you don't have kind of your top-of-rack switches. So any kind of color on that would be helpful.",123
25016048.0,"Broadcom Limited, Q3 2016 Earnings Call, Sep 01, 2016",2016-09-01,48.0,Earnings Calls,Broadcom Inc.,3286.0,1040918.0,43748285.0,Answer,Hock Tan,,Executives,6,"Okay. Well, with regard to data center spending, yes, we do see strength. And we -- in fact, we saw the strength as early as Q2, our fiscal Q2, not calendar but our fiscal Q2. And that strength has continued into this current -- into Q3 and even as we sit here right now.",54
25016048.0,"Broadcom Limited, Q3 2016 Earnings Call, Sep 01, 2016",2016-09-01,48.0,Earnings Calls,Broadcom Inc.,3286.0,1040918.0,43748286.0,Question,John Pitzer,,Analysts,7,"And then, Hock, as my follow-up on the wireless business, you're guiding sequential growth higher in the October quarter than the July quarter, which is consistent with what you said on the last conference call. I'm just kind of curious if you can help us understand what's unit-driven versus content-driven. And now that we're sort of a quarter in to some new builds of new cell phones, can you talk a little bit about your content growth expectation on both the FBAR and the connectivity side for some of those new phones?",92
25016048.0,"Broadcom Limited, Q3 2016 Earnings Call, Sep 01, 2016",2016-09-01,48.0,Earnings Calls,Broadcom Inc.,3286.0,1040918.0,43748287.0,Answer,Hock Tan,,Executives,8,"Well, it's 2 -- one thing I have to preface. This is a -- what we're seeing in this quarter, Q3 fiscal quarter and Q4 -- most of Q4 fiscal quarter it's not all of it, that ends in October, that represents a period when it's still a ramp, okay. So it's how one constructs the ramp, and that's tied to orders required of our key customers. And it's not necessarily representative of volumes that would eventually be sold through the various channels into end customers. So with that preface, what we're always saying is with the build year-on-year we compare to back to a year ago, the build in unit terms has not significantly changed. It's largely all about content change -- changes.",124
25016048.0,"Broadcom Limited, Q3 2016 Earnings Call, Sep 01, 2016",2016-09-01,48.0,Earnings Calls,Broadcom Inc.,3286.0,1040918.0,43748288.0,Question and Answer Operator Message,Operator,,Operator,9,Our next question comes from the line of Blayne Curtis with Barclays.,12
25016048.0,"Broadcom Limited, Q3 2016 Earnings Call, Sep 01, 2016",2016-09-01,48.0,Earnings Calls,Broadcom Inc.,3286.0,1040918.0,43748289.0,Question,Blayne Curtis,,Analysts,10,"Just 2 questions on wireless. Can you just talk about -- Hock, obviously, you have one customer doing a big ramp. You mentioned one maybe flying [ph] out. Can you talk about the China market and what you're seeing there? And then on the connectivity side, can you just talk about the road map there for content increase? I know you're getting a little GPS this go-around. But just for WiFi combo chips, what's the road map and what's the opportunity to gain more content over the next couple of generations?",91
25016048.0,"Broadcom Limited, Q3 2016 Earnings Call, Sep 01, 2016",2016-09-01,48.0,Earnings Calls,Broadcom Inc.,3286.0,1040918.0,43748290.0,Answer,Hock Tan,,Executives,11,"Okay. Well, let's touch about WiFi, which is wireless connectivity with a combo -- a Bluetooth combo included in it. It's a -- what we're seeing now today is -- by the way, we are largely in the high-end phones, where we have -- where we are driving 802.11ac generation. And in that regard, we are seeing -- we are not seeing that much content increase, say, from a year ago. We expect to see that content increase as we move into next year as more functionality, higher performance multi-bands start to come into play, which includes not just 2.5 gigahertz but 5 gigahertz. We also expect to see beyond that 802.11ac moving into ax, which would be a big step up further in content gain. And in many ways, this is all about increasing capacity throughput of bandwidth of data transfers through these WiFi connections. A parallel situation to our LTE wireless situation were increasing bands, first LTE and then they're increasing the number of bands in LTE interconnectivity, leading to increasing FBAR content, very, very similar; may not match it to other as we move one generation to the other, but the overall trend upward is extremely alike. All right?",202
25016048.0,"Broadcom Limited, Q3 2016 Earnings Call, Sep 01, 2016",2016-09-01,48.0,Earnings Calls,Broadcom Inc.,3286.0,1040918.0,43748291.0,Question,Blayne Curtis,,Analysts,12,"Hock, maybe you could just talk about, on the cellular side, what you're seeing in China.",16
25016048.0,"Broadcom Limited, Q3 2016 Earnings Call, Sep 01, 2016",2016-09-01,48.0,Earnings Calls,Broadcom Inc.,3286.0,1040918.0,43748292.0,Answer,Hock Tan,,Executives,13,"Well, our visibility in China is not that good in a sense that we sell to OEMs, and they sell into all over the world. And our focus largely are on very high-end premium phones, be they premium phones from Chinese makers or U.S. makers or Korean makers. So it's not really a good representation of true end demand as others may see it in China.",66
25016048.0,"Broadcom Limited, Q3 2016 Earnings Call, Sep 01, 2016",2016-09-01,48.0,Earnings Calls,Broadcom Inc.,3286.0,1040918.0,43748293.0,Question and Answer Operator Message,Operator,,Operator,14,Our next question comes from the line of Vivek Arya with Bank of America.,14
25016048.0,"Broadcom Limited, Q3 2016 Earnings Call, Sep 01, 2016",2016-09-01,48.0,Earnings Calls,Broadcom Inc.,3286.0,1040918.0,43748294.0,Question,Vivek Arya,,Analysts,15,"For my first one, Hock, you mentioned supply constraints in your set-top box business, which I believe is around 500 million, 550 million a quarter or so. Can you quantify how much sales you are missing? Is it a 5% impact? Is it a 10% impact? And is there going to be a quarter in the future when you catch up with all of these sales that you're missing right now?",71
25016048.0,"Broadcom Limited, Q3 2016 Earnings Call, Sep 01, 2016",2016-09-01,48.0,Earnings Calls,Broadcom Inc.,3286.0,1040918.0,43748295.0,Answer,Hock Tan,,Executives,16,"Well, it's -- first of all, it's very hard for us to quantify because a customer comes in and place their request, they -- and we obviously modulate it with what we can ship, and so there'll be push and pull. And by the time it's all done, I'll be honest, I don't have a good idea what it is. And even I do, I probably wouldn't disclose it in this public forum. But that aside, we do -- we are very aware that we could ship more were it not for our supply constraints, and we've been improving that over the course of the last several months, actually, and we expect to be largely out of it by the end of this fiscal quarter Q4.",126
