companyid,headline,mostimportantdateutc,keydeveventtypeid,keydeveventtypename,companyname,audiolengthsec,transcriptid,transcriptcomponentid,transcriptcomponenttypename,transcriptpersonname,companyofperson,speakertypename,componentorder,componenttext,word_count
25016048.0,"Broadcom Limited, Q3 2016 Earnings Call, Sep 01, 2016",2016-09-01,48.0,Earnings Calls,Broadcom Inc.,3286.0,1040918.0,43748352.0,Question,Ambrish Srivastava,,Analysts,73,"No. In the foundry business, the other area besides the high-end handset business where they announced a partnership with ARM. The other area that they were talking about is the infrastructure networking, and they were other customers of yours that were also there at the forum that were talking to Intel's foray into that -- into that business. It's essentially going after a Cisco business.",65
25016048.0,"Broadcom Limited, Q3 2016 Earnings Call, Sep 01, 2016",2016-09-01,48.0,Earnings Calls,Broadcom Inc.,3286.0,1040918.0,43748353.0,Answer,Hock Tan,,Executives,74,"Well, to be honest, there is no bunch of -- neither know much about that, didn't hear much about that. But as you probably may know, the ASIC business, especially the high-end ASIC business, where one -- where your customer is requiring technology to where -- is pushing the limits of technology, be they SerDes, bandwidth, or be they IP in embedded processing that has very low power, very high performance and features -- IP features like that, it's not a business one gets into on an overnight basis. And your question is correct, it's a long-term basis, simply because first, you've got to get -- you have to have the strength of the IP portfolio, the capabilities, which we have in plentiful supply, if you don't mind my saying that. Number one, that's only a necessary condition. It's not even a sufficient. The sufficient one is that you are able to execute on silicon implementation. And you're talking about leading edge nodes related to foundries that have proven ability to deliver on those leading edge nodes and being able to execute your design well. And that comes -- the proof comes with the eating, which means you've got to have the confidence of your customers that you are able to do what they want you to do because if you don't, they are screwed, literally, simply because their road map depends on it. So they're not about to rush into any new opportunity even on a price, even on whatever nice stuff it is just because on the say so that might happen. It takes a long time. It's almost a catch-22. You want to get into this business, be it leading-edge nodes as a foundry or leading-edge SerDes or intellectual property in silicon, you have to convince your customer you can deliver. And your customer is putting their future at least in one next generation in your hands. Which customer in their right mind would easily do that? They won't. So they want you to prove it, but you can't prove it unless they try it. So it's a catch-22. So it's hard. And all I'm trying to say it's very hard. It's a long process. We have, fortunately -- we are fortunate to be in a position that we are -- we have proven ourselves, and so competition will come. It always does, and we will deal with it as we always have.",406
25016048.0,"Broadcom Limited, Q3 2016 Earnings Call, Sep 01, 2016",2016-09-01,48.0,Earnings Calls,Broadcom Inc.,3286.0,1040918.0,43748354.0,Question and Answer Operator Message,Operator,,Operator,75,Our next question comes from Vijay Rakesh with Mizuho.,9
25016048.0,"Broadcom Limited, Q3 2016 Earnings Call, Sep 01, 2016",2016-09-01,48.0,Earnings Calls,Broadcom Inc.,3286.0,1040918.0,43748355.0,Question,Vijay Rakesh,,Analysts,76,"Just on the wireless side, when you look at your 8-inch FBAR, it looks like on the wireless side, you seem to be gaining share. But with this 8-inch, are you able to get your cost down and compete more effectively with the FBAR or up and down that chain?",50
25016048.0,"Broadcom Limited, Q3 2016 Earnings Call, Sep 01, 2016",2016-09-01,48.0,Earnings Calls,Broadcom Inc.,3286.0,1040918.0,43748356.0,Answer,Hock Tan,,Executives,77,"We continue to do that. You know that every new generation, which is almost every year, we change our process. We just not only change our design. And I said that before, too, in several meetings, several calls of this nature, ago. Our FBAR process technology -- our FBAR technology grows or evolves on 2 fronts: on process as well as on the design so that a band 2 FBAR 3 years ago doesn't look like the band 2 FBAR today. And that band 2 FBAR 3 years from now will be also very different what it is today. And it improves on power, it improves on insertion law [ph]. It improves on performance. And so we continue to invest in that, and it's part of the reason why we go from 6-inch to 8-inch not only to gain more capacity, but to be able to improve the process we put into it. And yes, FBAR a bought technology or even sold technology temperature compensated continues to try to improve. We are very well aware of the development that continue in some of our competitors, and all I have to say is that we continue to maintain -- at least maintain, if not better our technology lead over those guys.",210
25016048.0,"Broadcom Limited, Q3 2016 Earnings Call, Sep 01, 2016",2016-09-01,48.0,Earnings Calls,Broadcom Inc.,3286.0,1040918.0,43748357.0,Question,Vijay Rakesh,,Analysts,78,"Got it, and I agree on that. But as you look at your 8-inch, as you ramp that, what's your mix -- what do you expect your mix of 8-inch FBAR to be exiting, let's say, calendar '16 and calendar '17?",41
25016048.0,"Broadcom Limited, Q3 2016 Earnings Call, Sep 01, 2016",2016-09-01,48.0,Earnings Calls,Broadcom Inc.,3286.0,1040918.0,43748358.0,Answer,Hock Tan,,Executives,79,"Calendar '16 is very low. As Tom said, we continue to spend money, CapEx. We are barely at the 50% milestone. Our concept at the end of the day is to convert 100% of our 6-inch into 8-inch. That will not happen until 2018. So we are barely 50%, and we continue to methodically, steadily, per plan, convert 6 to 8. So -- and exiting this fiscal '16, very low; '17, significantly higher; '18, maybe it gets done.",78
25016048.0,"Broadcom Limited, Q3 2016 Earnings Call, Sep 01, 2016",2016-09-01,48.0,Earnings Calls,Broadcom Inc.,3286.0,1040918.0,43748359.0,Question and Answer Operator Message,Operator,,Operator,80,And our last question comes from Stephen Chin with UBS.,10
25016048.0,"Broadcom Limited, Q3 2016 Earnings Call, Sep 01, 2016",2016-09-01,48.0,Earnings Calls,Broadcom Inc.,3286.0,1040918.0,43748360.0,Question,Stephen Chin,,Analysts,81,"Hock, if I could, I wanted to get a little more color on some of the demand trends within your switching ASSP business. If I recall correctly, the classic Broadcom, the switching demand was roughly 1/3, 1/3, 1/3 driven by cloud data center, enterprise and service providers. I was wondering if you could talk a bit more about how enterprise and the service provider verticals are performing in terms of demand in the recent quarter and the visibility into the current quarter.",82
25016048.0,"Broadcom Limited, Q3 2016 Earnings Call, Sep 01, 2016",2016-09-01,48.0,Earnings Calls,Broadcom Inc.,3286.0,1040918.0,43748361.0,Answer,Hock Tan,,Executives,82,"First and foremost, while we like to say it split up nicely as you put it to be that way, that tends to be very conceptual and a bit theoretical. At any point in time, sometimes we have a tough time knowing where the particular chip we ship ends up in. I mean, we ship a lot to OEMs. And as you know, many of the OEMs ship to -- could ship to service providers or enterprise or even to the cloud guys. And that's a part of it why we're not 100% sure. But to try to answer your question in substance, we're seeing a lot of strength, a lot of demand driven from service providers today as well as from the cloud guys. Enterprise tends to be more stable as opposed to strongly trending up.",137
25016048.0,"Broadcom Limited, Q3 2016 Earnings Call, Sep 01, 2016",2016-09-01,48.0,Earnings Calls,Broadcom Inc.,3286.0,1040918.0,43748362.0,Question,Stephen Chin,,Analysts,83,"Okay. I appreciate the color on that. And as my follow-up, just within enterprise storage, I appreciate that in the current quarter, you guys are seeing some good seasonality there, but I was wondering from a technology upgrade or road map perspective, can you talk about any other upcoming technologies that can continue to drive growth in the -- in enterprise storage in terms of the server storage products?",69
25016048.0,"Broadcom Limited, Q3 2016 Earnings Call, Sep 01, 2016",2016-09-01,48.0,Earnings Calls,Broadcom Inc.,3286.0,1040918.0,43748363.0,Answer,Hock Tan,,Executives,84,"Server storage, connectivity products, yes, there is. I know some of the trends are very interesting, but keep in mind I can tell you all of these, but enterprise storage is slow to change for good reason. People are very, very conservative, very careful in that area. And one of the biggest -- I mean, there is a cadence they go by, and the cadence go by in the CPU cadence. We're now shipping Grantley, as you know, and next year, we'll start shipping against Purley. So some of the interconnects expanding capacity though is -- for enterprise, it's -- a lot of it is SaaS and slowly, very slowly, perhaps considering a move into PCI Express or NVMe potentially as old flash arrays start coming into the picture. But to answer the question directly, it moves very slowly. Most enterprise today are still driven on SaaS.",147
25016048.0,"Broadcom Limited, Q3 2016 Earnings Call, Sep 01, 2016",2016-09-01,48.0,Earnings Calls,Broadcom Inc.,3286.0,1040918.0,43748364.0,Question and Answer Operator Message,Operator,,Operator,85,That concludes Broadcom's conference call for today. You may now disconnect.,12
25016048.0,"Broadcom Limited, Q4 2016 Earnings Call, Dec 08, 2016",2016-12-08,48.0,Earnings Calls,Broadcom Inc.,3342.0,1113228.0,46202563.0,Presentation Operator Message,Operator,,Operator,0,"Good day, ladies and gentlemen. Welcome to Broadcom Limited's Fourth Quarter and Fiscal Year 2016 Financial Results Conference Call. 
At this time, for opening remarks and introductions, I would like to turn the call over to Ashish Saran, Director of Investor Relations. Please go ahead, sir.",46
25016048.0,"Broadcom Limited, Q4 2016 Earnings Call, Dec 08, 2016",2016-12-08,48.0,Earnings Calls,Broadcom Inc.,3342.0,1113228.0,46202564.0,Presenter Speech,Ashish Saran,,Executives,1,"Thank you, operator, and good afternoon, everyone. Joining me today are Hock Tan, President and CEO; and Tom Krause, Chief Financial Officer of Broadcom Limited.
After market close today, Broadcom distributed a press release describing our financial performance for the fourth quarter and fiscal year 2016. GlobeNewswire inadvertently published our earnings release of today without the financial tables that typically accompany the release. GlobeNewswire is in the process of republishing the complete document, however, these tables are available for you to review in the copy of the earnings release we furnished to the SEC earlier today. Once updated by GlobeNewswire, you will also be able to obtain this information from the Investors section of Broadcom's website at www.broadcom.com.
This conference call is being webcast live, and a recording will be available via telephone playback for 1 week. It will also be archived in the Investors section of our website at broadcom.com.
During the prepared comments section of this call, Hock and Tom will be providing details of our fourth quarter and fiscal year 2016 results, background to our first quarter fiscal year 2017 outlook and some commentary regarding the business environment. We will take questions after the end of our prepared comments.
In addition to U.S. GAAP reporting, Broadcom reports certain financial measures on a non-GAAP basis. A reconciliation between GAAP and non-GAAP measures is included in the tables attached to today's press release. Comments made during today's call will primarily refer to our non-GAAP financial results. Please refer to our press release today and our recent filings with the SEC for information on the specific risk factors that could cause our actual results to differ materially from the forward-looking statements made on this call.
At this time, I would like to turn the call over to Hock Tan. Hock?",300
25016048.0,"Broadcom Limited, Q4 2016 Earnings Call, Dec 08, 2016",2016-12-08,48.0,Earnings Calls,Broadcom Inc.,3342.0,1113228.0,46202565.0,Presenter Speech,Hock Tan,,Executives,2,"Thank you, Ashish. Good afternoon, everyone. Fiscal 2016 was a very transformational year for our company as we complete the acquisition of Broadcom Corporation. This acquisition, the -- and integration significantly increased our scale, added 7 businesses to Avago's existing portfolio of 12 businesses and roughly double revenue.
Since closing the acquisition at the start of our second fiscal quarter, we have made great strides in integrating classic Broadcom. As you may recall, going into the Broadcom acquisition, we had introduced an operating model targeting 60% gross margin and 40% operating margin that we had expected -- planned, I should say, to progress over the long term. I'm very pleased that we were able to make good progress with this target in fiscal 2016, and in fact, since closing the acquisition February 1, 2016, we have driven significant improvement in product margin and spending and exited -- and in fact, exited the fiscal year, exceeding this long-term target. More recently also on November 28, we had also made good progress on another major milestone with the integration of the Avago's and Broadcom's financial reporting systems.
Looking at 2017 and beyond. We expect our business to be continuing to be sustainable and in fact, becoming much more profitable. We are raising our long-term operating margin target to 45%, a significant increase from our prior model. We expect to drive to this long-term target through a combination of the full realization of material cost synergies and operating leverage on a larger scale. Reflecting expected improvement in profitability, we announced earlier today a doubling of our dividends. We are comfortable that our projected free cash flow generation will support this significantly higher return to shareholders while still preserving flexibility on our balance sheet for future M&A opportunities. As and when these new M&A opportunities materialize, they will enable us to further increase capital returns to shareholders.
Let me now turn to a discussion of what happened in the fourth quarter. We delivered strong results for our fourth fiscal quarter of 2016 with revenue of -- with revenue at $4.15 billion, up 9% sequentially. This result was at the top end of our guidance, primarily due to better seasonality from our wireless and enterprise storage segments. Earnings per share of $3.47 grew by 20% sequentially.
Talking about wired, our largest segment. In the fourth quarter, revenue came in at $2.08 billion, meeting expectations totally, and the wired segment represented 50% of our total revenue. Revenue for this segment during the quarter was up slightly on a sequential basis. We benefited from increased demand for networking ASICs into data centers as well as strong fiber optic shipments into access and metro networks.
Our recently launched Jericho standard product line that target aggregation and edge routing applications continue its ramp during this quarter. We were also able to address the supply chain constraints we experienced in the prior quarter, allowing us to catch up to customer demand in our set-top box business. As we look to the first quarter for our wired segment, despite expected declines -- seasonal declines, I should say, in broadband carrier access and set-top box businesses, we anticipate continuing growth in fiber optics and strong increased demand from several cloud data center operators, which will keep our wired revenue in total at least flat sequentially.
Moving on to wireless. In the fourth quarter, wireless revenue came in at about $1.35 billion, and the wireless segment represented 32% of our total revenue. Revenue for this segment was up 34% sequentially, a bit stronger than expectations. Growth was primarily driven by the full ramp of the new phone generation at our North American smartphone customer, further enhanced by an increase in Broadcom's cellular RF content and wireless connectivity content in this new generation of phones. 
We made great progress in relieving FBAR filter capacity constraints we experienced in late 2015. Over the course of 2016 fiscal year, we were able to increase FBAR filter capacity in our Fort Collins fab by approximately 50%. This increase was enabled by our new 8-inch wafer manufacturing process that came online with very good yields. As we look forward, we intend to add more capacity by continuing to convert existing 6-inch lines to 8-inch lines. This very capital efficient conversion approach will allow us to theoretically add another 70% of capacity over our existing 6-inch footprint within Fort Collins fab over the next few years. Because of this, we no longer need to keep the idle facility we had purchased in 2005 in Eugene, Oregon as a backstop pending the outcome of this 6- to 8-inch capacity expansion.
Turning now to our projection for first quarter -- fiscal 2017. Similar to last year, we expect a seasonal decline in demand and expect our wireless revenue to sequentially decline in the mid-teens on a percentage basis at least. Turning to enterprise storage, which is going through something of a resurgence that we expect will continue into the first quarter fiscal 2017. In the fourth quarter, enterprise storage revenue came in at $561 million, and this segment represented 14% of our total revenue. Segment revenue grew 6% sequentially and came in better than expectation. We benefited from the strengthening demand, both for our HDD, hard disk drive, and RAID host bus adapter products.
Looking into the first quarter. We expect the strength in the storage end market to continue to show momentum and drive enterprise storage revenue growth to 20% on a sequential basis. We're expecting growth from all our enterprise storage products. In particular, we're expecting a strong ramp in shipments of our custom flash controllers for SaaS enterprise solid-state drives that are increasingly being used in place of high-performance hard disk drives in data centers.
Finally, let's move on to our last segment, industrial. In the fourth quarter, industrial segment revenue came in at $162 million, down 20% sequentially. This segment represented 4% of our total revenue as expected, reduced shipments sharply into our channel as we headed towards this seasonally weaker end of the calendar year. Industrial product resales did decline but only in the mid-single digits sequentially, resulting in a sharp reduction in our channel inventory. Accordingly, as we look into first quarter, we plan on rebuilding depleted channel inventory and anticipate increasing shipments to our distributors. As a result, we expect revenue in first quarter from our industrial segment to increase sequentially in the mid-single digits.
In summary, after a strong close to our fiscal year 2016, we expect a solid start to fiscal 2017, as the demand environment for our entire portfolio of products continues to be very firm. In fact, we expect in the first quarter to largely offset the seasonal decline in wireless revenue through sustained strength from wired products benefiting from growth in cloud, broad strength in enterprise storage and a recovery in industrial.
With that, let me now turn the call over to Tom for a more detailed review of fourth quarter and fiscal 2016 financials.",1166
