companyid,headline,mostimportantdateutc,keydeveventtypeid,keydeveventtypename,companyname,audiolengthsec,transcriptid,transcriptcomponentid,transcriptcomponenttypename,transcriptpersonname,companyofperson,speakertypename,componentorder,componenttext,word_count
266017.0,"Dell Inc., Q1 2014 Earnings Call, May 16, 2013",2013-05-16,48.0,Earnings Calls,Dell Technologies Inc.,2530.0,468325.0,21789570.0,Answer,Brian Gladden,,Executives,10,"Yes, Toni, look, I wouldn't -- without providing the details of the specific initiatives, I wouldn't say we haven't executed on the cost initiatives. I think we have continued to take cost out of the business. We are just choosing consciously to reinvest those dollars in sales resources, in R&D resources, in the Software business, things that we've talked about over time being important to the future of the company. So I think those things are going on concurrently. And in this time right now, we've chosen to reinvest those savings that we're driving as part of that initiative and the important investments for the future of the company. That's just what we've decided to do. In terms of profitability, and I assume you're talking about the EUC business, look, I think we're not managing that business for one quarter at a time. And I think there's a network effect to the impact of what we do there and the scale of that business and the customer relationships that we gain. We are clearly focused on cost in that business in this environment. We have been focused on gaining -- improving the growth of that business and gaining share. We've been able to do that. And as we execute on cost and continue to execute the strategy there, we're confident that will be an important part of the portfolio but not focused on a 90-day target relative to the profitability of that business.",243
266017.0,"Dell Inc., Q1 2014 Earnings Call, May 16, 2013",2013-05-16,48.0,Earnings Calls,Dell Technologies Inc.,2530.0,468325.0,21789571.0,Question and Answer Operator Message,Operator,,Operator,11,We'll take our next question from Brian Alexander with Raymond James.,12
266017.0,"Dell Inc., Q1 2014 Earnings Call, May 16, 2013",2013-05-16,48.0,Earnings Calls,Dell Technologies Inc.,2530.0,468325.0,21789572.0,Question,Brian Alexander,,Analysts,12,"I guess following up on pricing, Brian, maybe just talk about why Dell has embraced such an abrupt change in pricing strategy in the client business the last 2 quarters. What's really caused such a sharp change in management's thinking? And related to that, how much of this is self-inflicted to retain customers during this period of uncertainty, and how much of this would you say is market-driven?",68
266017.0,"Dell Inc., Q1 2014 Earnings Call, May 16, 2013",2013-05-16,48.0,Earnings Calls,Dell Technologies Inc.,2530.0,468325.0,21789573.0,Answer,Brian Gladden,,Executives,13,"I think it's hard to separate those 2, Brian, as you think about how market dynamics play out. Clearly, there are parts of the business, segments of the business, where we are being more aggressive, and we recognize that places where we have a strong foothold or historically have had a strong foothold and can ultimately build on these relationships and benefit the entire portfolio of solutions, those are places where clearly, we'd like to be a bit more aggressive and have over the last couple of quarters. I wouldn't say this has been an abrupt change, clearly recognizing as demand weakened over the course of the last year, we've recognize the need to stop shrinking at a rate faster than the market, and we've made those adjustments over the course of a few different quarters here and have seen the impact of that improve in terms of growth rates, and at the same time, impact short-term profitability for sure.",161
266017.0,"Dell Inc., Q1 2014 Earnings Call, May 16, 2013",2013-05-16,48.0,Earnings Calls,Dell Technologies Inc.,2530.0,468325.0,21789574.0,Question and Answer Operator Message,Operator,,Operator,14,We'll take our next question from Maynard Um with Wells Fargo.,12
266017.0,"Dell Inc., Q1 2014 Earnings Call, May 16, 2013",2013-05-16,48.0,Earnings Calls,Dell Technologies Inc.,2530.0,468325.0,21789575.0,Question,Maynard Um,,Analysts,15,Can you talk about your customer engagements and how those discussions are going in light of everything that's happening? How much of your time is being spent explaining kind of what's happening? And are customers showing any indication of potentially holding out or lengthening sales cycle just to wait and see what happens?,54
266017.0,"Dell Inc., Q1 2014 Earnings Call, May 16, 2013",2013-05-16,48.0,Earnings Calls,Dell Technologies Inc.,2530.0,468325.0,21789576.0,Answer,Brian Gladden,,Executives,16,"Yes, Maynard. I think in general, the customer base has been very supportive of the company, and long-term relationships, the quality of our solutions, the new solutions we're adding to the portfolio have really carried those relationships. And not to say there aren't some areas where we've seen questions that we've had to spend time with customers. We've looked at it as a chance to spend more time with our customers and to make sure they're comfortable with the strategy of the company and where we're taking it. And I would say for those conversations that I've been part of, those have been very good conversations that, in many cases, have resulted in more opportunities for the company.",118
266017.0,"Dell Inc., Q1 2014 Earnings Call, May 16, 2013",2013-05-16,48.0,Earnings Calls,Dell Technologies Inc.,2530.0,468325.0,21789577.0,Question and Answer Operator Message,Operator,,Operator,17,We'll take our next question from Shannon Cross with Cross Research.,12
266017.0,"Dell Inc., Q1 2014 Earnings Call, May 16, 2013",2013-05-16,48.0,Earnings Calls,Dell Technologies Inc.,2530.0,468325.0,21789578.0,Question,Shannon Cross,,Analysts,18,Could you talk more about your increased investment in sales and distribution in key regions and segments?,17
266017.0,"Dell Inc., Q1 2014 Earnings Call, May 16, 2013",2013-05-16,48.0,Earnings Calls,Dell Technologies Inc.,2530.0,468325.0,21789579.0,Answer,Brian Gladden,,Executives,19,"This isn't new, Shannon. I mean, we've been adding resources in the sales model really over the last couple of years, and some of that was adding specialist capability around key technologies that we've been adding to the portfolio and doing that organically. But also, many of the acquisitions, obviously, have brought capability from a commercial standpoint with them. That's been one primary focus. I think the other is some specific regions and subsegments of the market where we've got strong capability. And where we've seen good progress in terms of building out and adding salespeople, we have not hesitated to add more. And tracking the progress and productivity of those sales resources, making sure they're delivering and bringing new business to the company and really taking advantage of places where we have strength has been the focus. Clearly, the acquisition of Quest and the Software business has brought significant sales capacity to the company, and that's been one big area. And as you know and we've talked about a lot, I mean, the mid-market is a place where we have focused and added resources as well.",188
266017.0,"Dell Inc., Q1 2014 Earnings Call, May 16, 2013",2013-05-16,48.0,Earnings Calls,Dell Technologies Inc.,2530.0,468325.0,21789580.0,Question and Answer Operator Message,Operator,,Operator,20,We'll take our next question from Steve Milunovich with UBS.,11
266017.0,"Dell Inc., Q1 2014 Earnings Call, May 16, 2013",2013-05-16,48.0,Earnings Calls,Dell Technologies Inc.,2530.0,468325.0,21789581.0,Question,Steven Milunovich,,Analysts,21,"Back to the end user pricing question, could you give a sense how much of a strategic change this is, because in the proxy materials, one of your consultants suggested shifting from a margin to a margin dollar from a commodity-driven strategy. We're obviously seeing some of that. Michael Dell has indicated apparently that he's going to kind of endorse that approach in shift. So kind of on a scale from 0%, which is no change, to 100%, which is a complete change, are you kind of tweaking things now? Or do you feel like this is really taking it to the full extent that we're likely to see over time in terms of going after more of a low end strategy?",122
266017.0,"Dell Inc., Q1 2014 Earnings Call, May 16, 2013",2013-05-16,48.0,Earnings Calls,Dell Technologies Inc.,2530.0,468325.0,21789582.0,Answer,Brian Gladden,,Executives,22,"Yes. Look, Steve, I wouldn't say our strategy has changed really at all. I think tactically, we've recognized the need to be competitive. We've adjusted our pricing appropriately. We are expanding our offerings across the portfolio of really offerings at high-priced bands or higher-value products, mid-value products, lower-value products to play in key markets around the world, as we've done over time. And I think you'll continue to see us do that. It's not a -- this is not a new strategy. This is not a new business model for us. I would say it's adjusting tactics given what the market's doing and really where we need to be in the portfolio.",112
266017.0,"Dell Inc., Q1 2014 Earnings Call, May 16, 2013",2013-05-16,48.0,Earnings Calls,Dell Technologies Inc.,2530.0,468325.0,21789583.0,Answer,Thomas Sweet,,Executives,23,"Yes. And Steve, I would say that I think it's fair to say that when you think about our portfolio of customers, and the vast majority of those being commercial customers on a global basis, as we've thought through our -- and made decisions to increase our focus on those customers, there's acquisition business that you engage in. And as Brian alluded to earlier, you think it's absolutely the right thing to do for the long term. But these are accounts that you have to go out and take a different tactic and a pricing strategy with them that's often to provide an entry-level into that account. And so I think you're seeing a little bit of that in the P&L.",121
266017.0,"Dell Inc., Q1 2014 Earnings Call, May 16, 2013",2013-05-16,48.0,Earnings Calls,Dell Technologies Inc.,2530.0,468325.0,21789584.0,Question and Answer Operator Message,Operator,,Operator,24,We will take our next question from Kulbinder Garcha with Credit Suisse.,12
266017.0,"Dell Inc., Q1 2014 Earnings Call, May 16, 2013",2013-05-16,48.0,Earnings Calls,Dell Technologies Inc.,2530.0,468325.0,21789585.0,Question,Kulbinder Garcha,,Analysts,25,"Brian, just a couple of follow-ups from everything that's been asked today. One of them is just on the End User Computing side. I take the point you're not managing the business for the next 90 days, and that's kind of quite clear. I guess in terms of this pursuit of new customers, can you speak about where we are in that process? Have you put the investments in sales, pricing or otherwise you need to? Or is there significant more amount of effort to come through? That's kind of one question. And the second one is just the broad level. Given the uncertainty that's going on at Dell over the last few months, I understand that sales cycles may not have lengthened, but what financial impact would you say is happening -- having on either your results or on how you're managing your business from a cost perspective? I'm trying to understand, with the margins you're producing overall, now they are lower than we've seen for some time. And some of the markets, some of that, I think, has to be down to what's been going on with Dell. So any kind of insight there you can provide would be helpful.",202
266017.0,"Dell Inc., Q1 2014 Earnings Call, May 16, 2013",2013-05-16,48.0,Earnings Calls,Dell Technologies Inc.,2530.0,468325.0,21789586.0,Answer,Brian Gladden,,Executives,26,"Yes, I'll try to answer the second part first, Kulbinder. We haven't changed the way we're running the business. The strategy for the company has endured, and I would say we continue to adapt that strategy given the market conditions and things that we learn as we go. But we have made no changes to the strategy in how we're running the company as a result of this process. I think that's clear. In terms of -- and it's -- I would say it's very difficult to quantify what impact the process that we're going through has had on the results of the company. We did call out incremental costs that we're incurring, the transaction costs that we've excluded from our non-GAAP reporting. But clearly, there is a chance to spend more time with customers and some level of customer -- just uncertainty that we're working our way through. That said, we feel like we've done a good job with that during this period. In terms of the EUC business and where we're positioned and where we are in that, I think, look, we made a conscious decision here to improve the competitiveness and specifically the pricing. We've got a lot of ongoing work around the productivity and cost structure of that business that will continue to allow us to be competitive there. And I don't think this is something that we think about as an initiative. I think it's really how we run the business and quarter-to-quarter manage the market conditions and the demand environment that we're in.",259
266017.0,"Dell Inc., Q1 2014 Earnings Call, May 16, 2013",2013-05-16,48.0,Earnings Calls,Dell Technologies Inc.,2530.0,468325.0,21789587.0,Answer,Thomas Sweet,,Executives,27,"I would also offer that acquiring new customers and continuing to build that acquisition pipeline is an ongoing and continual effort. It's just not a 1-quarter or 2-quarter effort. You build the acquisition pipeline. You continue to acquire new customers, and you migrate those customers up through your business model and your other lots [ph] . So I think that process continues.",62
266017.0,"Dell Inc., Q1 2014 Earnings Call, May 16, 2013",2013-05-16,48.0,Earnings Calls,Dell Technologies Inc.,2530.0,468325.0,21789588.0,Answer,Brian Gladden,,Executives,28,"And to some extent, I mean, we, over some period of time, as we were driving the business, had, in some ways, lost that ability to do the acquisition investments that we really needed. So we've had, obviously, some success there, and we're getting a lot of very positive feedback from customers as we get back into that part of our business.",62
266017.0,"Dell Inc., Q1 2014 Earnings Call, May 16, 2013",2013-05-16,48.0,Earnings Calls,Dell Technologies Inc.,2530.0,468325.0,21789589.0,Question and Answer Operator Message,Operator,,Operator,29,We'll take our next question from Chris Whitmore with Deutsche Bank.,12
266017.0,"Dell Inc., Q1 2014 Earnings Call, May 16, 2013",2013-05-16,48.0,Earnings Calls,Dell Technologies Inc.,2530.0,468325.0,21789590.0,Question,Chris Whitmore,,Analysts,30,"Brian, I wanted to ask about servers and whether or not you see a similar type of opportunity to drive some elasticity of demand around pricing servers a bit more aggressively. And related to that and on a whole strategy of attaching incremental products to that base, I'm curious to understand what's happening in Storage. It doesn't seem like you're getting that attached to the installed base that you would hope for in Storage, particularly with the Dell-branded IP. Can you talk a little bit about that as well?",89
266017.0,"Dell Inc., Q1 2014 Earnings Call, May 16, 2013",2013-05-16,48.0,Earnings Calls,Dell Technologies Inc.,2530.0,468325.0,21789591.0,Answer,Brian Gladden,,Executives,31,"Yes, Chris. Clearly, the Server business has had a nice run, and this for us is the ninth consecutive quarter of solid growth there. The 12th generation servers that we launched about a year ago have contributed very nicely to the ramp in that business. They have, as we've talked about before, helped us improve our average selling price in that business, move to higher-end workloads within the Server space. And that's all been part of a very strong progress, and we think we're winning in the marketplace as a result of the technology and how we're positioned with that product. In addition, when you look at density optimized servers, that market is growing very, very quickly. And that's, as well, contributed to the growth in this business. We see that as an important part of our offering and continue to make investments there. So the Server business is in a good spot, and we feel good about the technology. And it's not really a place where you see us trading at the low end. We price [ph] for growth there. I think we're growing on the basis of the technology. The Storage business, I think a little bit different discussion. We feel like that business is growing about in line with the market. It's shrinking at the market. The market is shrinking, and we're seeing that from the data that we see in the market right now. I would say that's not what we'd like to see, obviously, and that's not acceptable to us. We've got some things from an execution standpoint in that business that we are working on. We're confident in the portfolio. We've added commercial resources over the last really 18 months in this business, and we feel like we're positioned to actually outperform the market. Again, there's some execution things we're working through, and we expect to see that as we move forward.",318
266017.0,"Dell Inc., Q1 2014 Earnings Call, May 16, 2013",2013-05-16,48.0,Earnings Calls,Dell Technologies Inc.,2530.0,468325.0,21789592.0,Question and Answer Operator Message,Operator,,Operator,32,We'll take our next question from Keith Bachman with Bank of Montréal.,13
266017.0,"Dell Inc., Q1 2014 Earnings Call, May 16, 2013",2013-05-16,48.0,Earnings Calls,Dell Technologies Inc.,2530.0,468325.0,21789593.0,Question,Keith Bachman,,Analysts,33,"Number one, Brian, can you talk a little bit about how your M&A strategy might differ if this transaction goes through versus would not, how might the incremental debt make you think about conducting M&A? And just a clarification to add on to that, can you talk about what your employee retention has been during this time of uncertainty, shall we say, over the last few months while this deal is being contemplated?",73
266017.0,"Dell Inc., Q1 2014 Earnings Call, May 16, 2013",2013-05-16,48.0,Earnings Calls,Dell Technologies Inc.,2530.0,468325.0,21789594.0,Answer,Robert Williams,,Executives,34,"Keith, it's Rob. I appreciate your question and your interest. But given the current situation and the pending transaction, we're really not going to comment on that or any of the material information that's related to the transaction. So you're welcome to take another crack and another question or you can drop back in the queue and we'll come back to you.",62
266017.0,"Dell Inc., Q1 2014 Earnings Call, May 16, 2013",2013-05-16,48.0,Earnings Calls,Dell Technologies Inc.,2530.0,468325.0,21789595.0,Question,Keith Bachman,,Analysts,35,"How about just the employee retention over the last 3 months, Rob? Can you address that? Are the employees sticking on board?",22
266017.0,"Dell Inc., Q1 2014 Earnings Call, May 16, 2013",2013-05-16,48.0,Earnings Calls,Dell Technologies Inc.,2530.0,468325.0,21789596.0,Answer,Brian Gladden,,Executives,36,"Keith, it's Brian. I would say attrition has been about normal for us, so we haven't seen unusual attrition.",19
266017.0,"Dell Inc., Q1 2014 Earnings Call, May 16, 2013",2013-05-16,48.0,Earnings Calls,Dell Technologies Inc.,2530.0,468325.0,21789597.0,Question and Answer Operator Message,Operator,,Operator,37,We'll take our next question from Ananda Baruah with Brean Capital.,12
266017.0,"Dell Inc., Q1 2014 Earnings Call, May 16, 2013",2013-05-16,48.0,Earnings Calls,Dell Technologies Inc.,2530.0,468325.0,21789598.0,Question,Ananda Baruah,,Analysts,38,"Brian, I was wondering if we could just get your thoughts on, I guess, the PC market over the next 4 to 6 quarters. Do you think it would get softer? Do you think it would get stronger? And if it were to get, I guess, meaningfully softer from here, would that move you to reconsider the pricing strategy that you've sort of employed the last couple of quarters?",69
266017.0,"Dell Inc., Q1 2014 Earnings Call, May 16, 2013",2013-05-16,48.0,Earnings Calls,Dell Technologies Inc.,2530.0,468325.0,21789599.0,Answer,Brian Gladden,,Executives,39,"Yes. Look, I think it's a good question, and it's one we spend a lot of time debating and talking about. There are multiple dynamics playing out. I think you continue to see a Win 7 on the commercial side of the business that's driving a refresh cycle. But at the same time -- and I would say even recently, we're seeing improved demand on the corporate and SMB markets. But you look at consumer, you look at government, you look at federal, those have been rather challenged. And it's some of the things we've been talking about over the last few quarters where you have competing devices. In some cases Windows 8 has been, from our standpoint, not necessarily the catalyst to drive accelerated growth that we had hoped it would be. We're encouraged by what's going to play out with new chipsets and some of the work that's going on, even within the Windows ecosystem to hopefully, over the next few months, create some catalysts. But you look at the recent external data from any of the third-party sources, we would expect to continue to see, over the next few quarters, year-over-year declines in PC demand. And I think that's -- we're trying to run the business based on that and be in a position where we're in this thing for the long term and we position the business for success for the long term.",237
266017.0,"Dell Inc., Q1 2014 Earnings Call, May 16, 2013",2013-05-16,48.0,Earnings Calls,Dell Technologies Inc.,2530.0,468325.0,21789600.0,Question and Answer Operator Message,Operator,,Operator,40,We'll take our next question from Aaron Rakers with Stifel.,11
266017.0,"Dell Inc., Q1 2014 Earnings Call, May 16, 2013",2013-05-16,48.0,Earnings Calls,Dell Technologies Inc.,2530.0,468325.0,21789601.0,Question,Aaron Rakers,,Analysts,41,"Just real quickly on your software -- your new Software segment group. Last quarter, you talked about Quest actually performing better than your initial plan of $180 million to $200 million. Can you update us on the performance of Quest in the quarter? And then also, how do we think about the profitability in that segment with a negative 29% operating margin this quarter?",64
266017.0,"Dell Inc., Q1 2014 Earnings Call, May 16, 2013",2013-05-16,48.0,Earnings Calls,Dell Technologies Inc.,2530.0,468325.0,21789602.0,Answer,Brian Gladden,,Executives,42,"Yes. Look, I think it's progressing as we expected. And as we said in the talking points, we expect to be accretive to the company in the first quarter next fiscal year. That was the plan we talked about when we announced the acquisition, and we're tracking towards that. I think we are -- the plan that we put together for that business with John Swainson clearly does have incremental investment, as we look at adding R&D resources, as we look at more sales capacity in that business, and it's got to grow into the cost structure that we have in the Software business. That's the way we're thinking about it. I would say we're tracking to that, and the team is making good progress there and we still feel good about this. Now, the operating loss in the quarter, that's sort of what we had expected as we put this business together and really got it started up. So we feel good about it.",165
266017.0,"Dell Inc., Q1 2014 Earnings Call, May 16, 2013",2013-05-16,48.0,Earnings Calls,Dell Technologies Inc.,2530.0,468325.0,21789603.0,Question and Answer Operator Message,Operator,,Operator,43,We'll take our next question from Bill Shope with Goldman Sachs.,12
266017.0,"Dell Inc., Q1 2014 Earnings Call, May 16, 2013",2013-05-16,48.0,Earnings Calls,Dell Technologies Inc.,2530.0,468325.0,21789604.0,Question,Bill Shope,,Analysts,44,"I wanted to get some color on how you're targeting these pricing actions we've been discussing. Can you give us perhaps an example of how you determine which accounts are strategic enough for aggressive client pricing, at least the pricing that's beyond the norm in terms of discounting, and then what areas you may be more focused on profit preservation? I'm just trying to figure out where you draw the line, so to speak, in terms of profit versus market share focus.",83
266017.0,"Dell Inc., Q1 2014 Earnings Call, May 16, 2013",2013-05-16,48.0,Earnings Calls,Dell Technologies Inc.,2530.0,468325.0,21789605.0,Answer,Brian Gladden,,Executives,45,"Yes, I mean, I'll give you a couple of thoughts, Bill. I think we know where long-term strategic accounts are that -- where we can really leverage the relationship, and being in as a leader on the client side creates nice pull-through in other parts of the portfolio. In many cases, those are places that we've been before and had that business and in some -- in many ways, over the last couple of years walked away. So I would say those are obvious places that we know we can actually create a nice network effect for us and sell the broader set of solutions as well, including the services. So I think we've been somewhat selective and try to focus in that part of the business. There are clearly unit volume opportunities in places like consumer through indirect channels where we could sell a lot of units. But those don't really create, for us, any other profit or cash flow kind of benefits, and therefore, we're going to prioritize accounts where we can get that broader network benefit.",179
266017.0,"Dell Inc., Q1 2014 Earnings Call, May 16, 2013",2013-05-16,48.0,Earnings Calls,Dell Technologies Inc.,2530.0,468325.0,21789606.0,Question and Answer Operator Message,Operator,,Operator,46,We'll take our next question from Abhey Lamba with Mizuho Securities.,12
