companyid,headline,mostimportantdateutc,keydeveventtypeid,keydeveventtypename,companyname,audiolengthsec,transcriptid,transcriptcomponentid,transcriptcomponenttypename,transcriptpersonname,companyofperson,speakertypename,componentorder,componenttext,word_count
266017.0,"Dell Inc., Q2 2013 Earnings Call, Aug 21, 2012",2012-08-21,48.0,Earnings Calls,Dell Technologies Inc.,3081.0,349738.0,16898954.0,Answer,Michael Dell,,Executives,63,"That sounds good, but I don't have a particular rule that I'm ready to give you today about that. I think your mileage could vary dramatically depending on the type of solution. But certainly, we have a broad set of capabilities across services, security, software, enterprise, all manner of client devices. And so we're able to bring a much fuller suite of solutions and capture a much larger share of the opportunity.",72
266017.0,"Dell Inc., Q2 2013 Earnings Call, Aug 21, 2012",2012-08-21,48.0,Earnings Calls,Dell Technologies Inc.,3081.0,349738.0,16898955.0,Question and Answer Operator Message,Operator,,Operator,64,Our next question will come from the line of Chris Whitmore with Deutsche Bank.,14
266017.0,"Dell Inc., Q2 2013 Earnings Call, Aug 21, 2012",2012-08-21,48.0,Earnings Calls,Dell Technologies Inc.,3081.0,349738.0,16898956.0,Question,Chris Whitmore,,Analysts,65,"I wanted to ask about the demand trends you're seeing in the corporate client business. It looked awfully weak to me, yet you didn't really call it out as an area of weakness. For example, back-in-the-envelope SMB clients looked like they were down mid-teens, public down double digit. Why are you seeing such soft demand in corporate client given your comments around Windows 7? Just help us understand that.",70
266017.0,"Dell Inc., Q2 2013 Earnings Call, Aug 21, 2012",2012-08-21,48.0,Earnings Calls,Dell Technologies Inc.,3081.0,349738.0,16898957.0,Answer,Brian Gladden,,Executives,66,"Yes, I would say, Chris, that as you think about that, there has been a bit of a pause. I think as you think about corporate budgets and IT spending, the discretionary spending has been, to some extent, put on a back burner, and some of these -- clearly, these refresh activities have to continue, but there just taking a pause given the current environment and all the uncertainty in the environment. That's just kind of what we're seeing.",79
266017.0,"Dell Inc., Q2 2013 Earnings Call, Aug 21, 2012",2012-08-21,48.0,Earnings Calls,Dell Technologies Inc.,3081.0,349738.0,16898958.0,Answer,Michael Dell,,Executives,67,"Yes. And I'll add to that, Chris. I mean, when you think about the fact that China is down as a -- in total for the country for the first time as far back as I can remember and the declines in APJ in general and in Western Europe, those -- that happened in the commercial accounts as well. And that's a tough one to overcome when you've got a big impact in a region like that. Those are the types of things Brian talked about when you think about those are markets that are likely to snap back once we kind of work through what is a cautious environment. I think a lot of commercial customers are looking at their discretionary spend right now and saying, ""Hey, I'm going to put some additional dollars to work in some of these enterprise solutions, but if I've got a decision to make, I might pull back a little bit on some of these client transitions and wait to see how things play out at a macro level."" So I think you're seeing a little of that.",185
266017.0,"Dell Inc., Q2 2013 Earnings Call, Aug 21, 2012",2012-08-21,48.0,Earnings Calls,Dell Technologies Inc.,3081.0,349738.0,16898959.0,Question,Chris Whitmore,,Analysts,68,"And to follow up, I wanted to follow up on the storage question with the Dell-owned IP business. It looks like your server attach, thinking about Dell-owned IP attached to servers, it looks like it's actually declining. Yet Michael, in your comments, you talked about increasingly winning these whole data center sales. So can you help us understand? Is there a timing issue between the server and storage spend as they’re upgrading server versus storage? Or are you seeing some incremental and competition translate into a decreasing win rate in that storage business?",93
266017.0,"Dell Inc., Q2 2013 Earnings Call, Aug 21, 2012",2012-08-21,48.0,Earnings Calls,Dell Technologies Inc.,3081.0,349738.0,16898960.0,Answer,Michael Dell,,Executives,69,"I think we can definitely do more there. What I'd also tell you is that the line that separates what the server and what the storage is not as clear as it might have been a few years ago. If you look at our 12th generation servers, you'll notice that they have enormous -- huge capacities. And so you're seeing words of mouth. The storage show up inside the server itself. But 12G is certainly strong. Storage was not as strong as we'd like, and there's definitely room to grow that faster.",92
266017.0,"Dell Inc., Q2 2013 Earnings Call, Aug 21, 2012",2012-08-21,48.0,Earnings Calls,Dell Technologies Inc.,3081.0,349738.0,16898961.0,Question and Answer Operator Message,Operator,,Operator,70,"The final question will come from the line of Aaron Rakers with Stifel, Nicolaus.",14
266017.0,"Dell Inc., Q2 2013 Earnings Call, Aug 21, 2012",2012-08-21,48.0,Earnings Calls,Dell Technologies Inc.,3081.0,349738.0,16898962.0,Question,Aaron Rakers,,Analysts,71,"So one question and one quick follow-up. When we look at your guidance and you look at the various factors impacting the gross margin mix of the business, you talked about potentially more deflationary pricing environment component-wise. Can you help us understand what you're assuming on a growth margin perspective, particularly around the product gross margin, over the next 2 quarters as it relates to those 2 items? Or put another way, are you assuming that a consistent solutions and PC imply gross margin trend?",86
266017.0,"Dell Inc., Q2 2013 Earnings Call, Aug 21, 2012",2012-08-21,48.0,Earnings Calls,Dell Technologies Inc.,3081.0,349738.0,16898963.0,Answer,Brian Gladden,,Executives,72,"Yes. Aaron, obviously, we don't provide specific outlooks for gross margin or OpEx in detail. But I would -- so I'll give you a sense of the drivers and how we're thinking about them and maybe talk about the second quarter and then maybe how it moves forward. Clearly, we got the benefit in the quarter of improved mix. We saw the higher-margin elements in the business grow faster. The Services business has expanded margins, as we said, 6 quarters in a row, and that obviously helps. Given their lower margin -- the Consumer elements of the portfolio which would have the lower margins had the most sort of revenue weakness. The [indiscernible] prices were kind of a push in the quarter. And then as I said, pricing was generally mixed and a headwind in some parts of the business, but in some places, not so much. And I think also, currency in the quarter was a bit of a headwind at the margin line. And as we sort of move prices up around that, we clearly would expect that to be less of an issue as we move forward. So I think those are the dynamics. And as you think about the second half, it's -- I would say a lot of the same dynamics would be what we would expect to continue to play out, so.",228
266017.0,"Dell Inc., Q2 2013 Earnings Call, Aug 21, 2012",2012-08-21,48.0,Earnings Calls,Dell Technologies Inc.,3081.0,349738.0,16898964.0,Question,Aaron Rakers,,Analysts,73,"Okay. And then, Brian, if I can, a quick follow-up. In the context of your 20% to 35% spend on dividend and share repo, you also added a comment about strategic investments. I don't know if I misheard that, but I just want to understand. That 20% to 35%, is that specifically just share repurchase and dividend? Or is there something else that you might be thinking about? Okay.",69
266017.0,"Dell Inc., Q2 2013 Earnings Call, Aug 21, 2012",2012-08-21,48.0,Earnings Calls,Dell Technologies Inc.,3081.0,349738.0,16898965.0,Answer,Brian Gladden,,Executives,74,"Yes. Got it. In the broader capital allocation sort of program that we have, obviously has an element which is continued strategic investments and M&A as part of that, but that's beyond the 20% to 35%. 20% to 35% is for dividends and buyback.",44
266017.0,"Dell Inc., Q2 2013 Earnings Call, Aug 21, 2012",2012-08-21,48.0,Earnings Calls,Dell Technologies Inc.,3081.0,349738.0,16898966.0,Question and Answer Operator Message,Operator,,Operator,75,We'll now turn the call over to Mr. Williams for closing remarks.,13
266017.0,"Dell Inc., Q2 2013 Earnings Call, Aug 21, 2012",2012-08-21,48.0,Earnings Calls,Dell Technologies Inc.,3081.0,349738.0,16898967.0,Answer,Robert Williams,,Executives,76,"Yes, thanks, Regina. I look forward to seeing everyone. We'll be at the Citi conference. And the week of Labor Day in New York, we'll be at Deutsche in Las Vegas and CLSA in Hong Kong. So we look forward to speaking to everyone over the coming quarter, and thanks for joining us today.",54
266017.0,"Dell Inc., Q2 2013 Earnings Call, Aug 21, 2012",2012-08-21,48.0,Earnings Calls,Dell Technologies Inc.,3081.0,349738.0,16898968.0,Question and Answer Operator Message,Operator,,Operator,77,This concludes today's conference call. We appreciate your participation. You may disconnect at this time.,16
266017.0,"Dell Inc., Q3 2013 Earnings Call, Nov 15, 2012",2012-11-15,48.0,Earnings Calls,Dell Technologies Inc.,3320.0,388551.0,18496079.0,Presentation Operator Message,Operator,,Operator,0,"Good afternoon, and welcome to the Dell Inc. Third Quarter Fiscal Year 2013 Earnings Conference Call. I'd like to inform all participants, this call is being recorded at the request of Dell. This broadcast is the copyrighted property of Dell Inc. Any rebroadcast of this information in whole or part without the prior written permission of Dell Inc. is prohibited. As a reminder, Dell is also simulcasting this presentation with slides at www.dell.com/investor. Later, we will conduct a question-and-answer session. [Operator Instructions] 
I'd like to turn the call over to Rob Williams, Head of Investor Relations. Mr. Williams, you may begin.",101
266017.0,"Dell Inc., Q3 2013 Earnings Call, Nov 15, 2012",2012-11-15,48.0,Earnings Calls,Dell Technologies Inc.,3320.0,388551.0,18496080.0,Presenter Speech,Robert Williams,,Executives,1,"Thanks, Regina. With me today are Michael Dell, Brian Gladden and Steve Felice. The Web deck and our DellShares VLog, with Brian and Steve, featuring more insights on the quarter, are posted to our website in advance of the call. I encourage you to review these materials for additional perspective.
Next, I'd like to remind you that all statements made during this call that relate to future results and events are forward-looking statements that are based on current expectations. Additional results and events could differ materially from those projected in the forward-looking statements because of a number of risks and uncertainties, which are discussed in our annual and quarterly SEC filings and in the cautionary statement and our press release and Web deck. We assume no obligation to update our forward-looking statements.
Please also note that we will be referring to non-GAAP financial measures, including non-GAAP gross margin, operating expenses, operating income, net income and earnings per share. Historical non-GAAP measures are reconciled to the most directly comparable GAAP measures in the Web deck posted in the Investor Relations section at dell.com, and in our press release and 8-K filed today. I encourage you to review these documents. Please also note that unless otherwise mentioned, all growth percentages referred to are year-over-year.
Now I'd like to turn it over to Brian.",221
266017.0,"Dell Inc., Q3 2013 Earnings Call, Nov 15, 2012",2012-11-15,48.0,Earnings Calls,Dell Technologies Inc.,3320.0,388551.0,18496081.0,Presenter Speech,Brian Gladden,,Executives,2,"Thanks, Rob. Four years ago this month, we embarked on our strategy to deliver end-to-end solutions to our customers with a scalable design point. Since then, we've made great strides in executing this strategy and continue to add to our capabilities. 
In the third quarter, our Enterprise Solutions and Services business revenue was $4.8 billion, up 3%, led by 11% growth in our server and networking business. These businesses, which were about $14 billion in FY '08, are now at an annual run rate approaching $20 billion. Year-to-date, they're up 4% and have generated more than 50% of our non-GAAP gross margin over that period of time. 
Year-to-date, we've added AppAssure, SonicWALL, Wyse, Make, Clerity and Quest, bringing enhanced capabilities to a portfolio of software and services that address many of our customers' most pressing needs, including security, cloud, data backup and protection, systems management and application modernization. 
Specifically, the addition of Quest Software during the quarter provides us with a foundational asset for our software business, which will contribute to a higher mix of solutions with more predictable revenue and margin streams. 
While there's no question that we're in a challenging global IT demand environment, especially in the core PC business, we're fully committed to our strategy. We continue to make key investments to drive our transformation and we're seeing important progress in building a strong Enterprise franchise as we move through the year. 
Moving to the quarter, we delivered revenue of $13.7 billion, down 11% and at the low end of the revenue range we provided in August. I'll refer to non-GAAP financial measures going forward. Our gross margin was 22%, down 60 basis points sequentially. As a reminder, gross margins in the second quarter benefited from approximately $70 million or 50 basis points, primarily resulting from a vendor settlement. When you normalize for this benefit, the mix to ES&S is helping stabilize margins as we see incremental margin pressure in our client business. 
We continue to be disciplined in managing our discretionary spend. OpEx dollars were down $20 million sequentially to 15.5% of revenue as we absorbed about $60 million of OpEx associated with Quest and another $90 million of strategic spend in R&D associated with recent acquisitions and organic investments. 
Operating income was $886 million or 6.5% of revenue. Earnings per share of $0.39 declined 28%. We generated strong cash flow from operations of $1.3 billion, with an ending cash and investments balance of $14.2 billion. Our cash conversion cycle of negative 32 days, improved 2 days sequentially, driven by better inventory and receivables management. Our cash flow will continue to benefit from the changes in our business model as we migrate to more software and services-based solutions. 
With our solid cash flow and commitment to a strong balance sheet, we've invested $4.7 billion this year to acquire new capabilities and intellectual property. We've paid out $139 million dividend distribution in the third quarter, and including our stock repurchase program, we returned almost $900 million to shareholders year-to-date. 
Turning to our lines of business. Our server and networking business grew 11%, representing the 12th consecutive quarter of growth. Servers increased 4%, driven by strong growth in our hyper-scale data center solutions business and continued traction with our 12th generation servers. 12G servers now represent 2/3 of our server revenue at ASPs and margins that are a premium to our previous generation servers. Collectively, our differentiated intellectual property and solutions has resulted in a growing share position. 
Our networking business increased 40% as it continues to benefit from the 12G servers and native 10-gigabyte Ethernet on the motherboard. During the quarter, we launched our active infrastructure converged offering. This brings together Dell hardware, software and services under a common design architecture that offers customers a robust and easy-to-manage data center infrastructure for application, personal desktop infrastructure and cloud deployments. By making these deployments simpler and easier to manage, we're addressing key customer needs in this growing market opportunity. 
Dell Storage was down 3% to $378 million in a challenging environment, and this was below our expectations. Over the past 6 months, we've introduced enhancements to the portfolio, including new backup recovery and replication solutions, new storage compression and dedupe technologies, improved Compellent management software, 2 new converged data center solutions and NAS capability on the fiber channel. We believe these enhancements position us well when industry demand in this important business segment improves. 
The Services business was down 1% year-over-year and flat sequentially at $2.1 billion and 5% growth in support and deployment and 16% growth in our security business. Our Services backlog increased 2% to $15.8 billion. Gross margin percent increased sequentially for the sixth consecutive quarter as we continue to improve our cost structure and focus on higher-margin areas of the Services landscape. In Apps & BPO, we continue to make progress on improving profitability, which is having a short-term impact on our revenue growth. 
Our Dell software business continues to introduce innovative solutions focusing on security, application, systems management and business intelligence. For example, we sold more SonicWALL Supermassive next-generation firewalls during the quarter than at any time before. With 96 cores, Supermassive's full deep-packet inspection provides the highest level of malware detection and elimination than any firewall in the market. We also updated our security management tool, enabling the management of up to 5,000 firewalls from this single console. 
Finally, Quest vFoglight Storage 2.0 is an integrated solution that provides application-to-disk performance monitoring and enables server and storage teams to jointly resolve virtualization performance issues. These all represent competitively differentiated capabilities we did not have a year ago. 
Our third-party software and peripheral revenue was down 11%, driven by the contraction of desktop and mobility products. Our desktop and mobility business was down 19%. Our results here were mixed. Our desktop business held share relative to last year, while notebooks lost share and did not perform to our expectations. We're launching new cloud-based client solutions based on our Wyse IP. Last week, we unveiled the Wyse Cloud Client Manager, which gives IT managers the ability to expand beyond the firewall to manage multiple mobile and fixed line devices regardless of the operating system. This provides customers the ability to more effectively and securely manage BYOD implementations. 
Going forward, we're focused on selling client and virtualization solutions in our custom and commercial accounts. We enhanced our focus on our client acquisition business, including a simplified pricing strategy, and we're driving more than $1 billion in cost out initiatives specific to the client business. 
Now I'll turn it over to Steve Felice to give an update on business segment results.",1105
266017.0,"Dell Inc., Q3 2013 Earnings Call, Nov 15, 2012",2012-11-15,48.0,Earnings Calls,Dell Technologies Inc.,3320.0,388551.0,18496082.0,Presenter Speech,Stephen Felice,,Executives,3,"Thank you, Brian. Large Enterprise revenue was down 8%. Enterprise Solutions and Services grew 5%, including 14% growth in servers and networking. Operating income was down 170 basis points sequentially to 7.8% of revenue. Here, we saw a reduction in the number of client opportunities as many large commercial customers continue to defer purchases of discretionary IT hardware. We are seeing success in winning new business, but given the long-term nature of these opportunities, they will not impact revenue in the short term. 
Our Public business was down 11%. We did see the expected end of fiscal year ramp for the U.S. Federal business. But also, as expected, we saw a significant contraction in spending in October. We continue to see budgetary constraints in Western Europe government spending and global, state and local government spending. But despite this, we remain disciplined as, sequentially, we were able to increase gross margin percent and reduce OpEx spend. Public operating income was down 10 basis points sequentially to 9.2% of revenue. 
SMB continues to be the most stable customer set for Dell as revenue declined 1%. Similar to Large Enterprise, we saw Enterprise Solutions and Services growth of 15%, including 22% growth in Services and 16% growth in servers and networking. Operating income was down 110 basis points sequentially to 10.6% of revenue. This business continues to exemplify the progress of our transformation. And despite the macro backdrop, we feel it's important to invest through this macro cycle. 
Enterprise Solutions and Services mix has improved for 6 consecutive quarters, with expanding margins over that period of time. 
The Consumer business continues to be a challenge, with revenue down 23%. The operating loss was $65 million or minus 2.7% of revenue. Industry growth in this space continues to occur predominantly in the low-value and entry level desktop and notebooks, where we've chosen not to participate, and in tablets. 
With the launch of Windows 8, we have new tablets and convertibles, including the XPS 10, XPS 12 and Latitude 10. In addition, we have 2 touch-enabled all-in-one desktops. While it's too early to share specific demand numbers, we are encouraged by the initial customer interest in our touch-enabled computing. 
With that, I'll turn it back to Brian to discuss our outlook.",376
266017.0,"Dell Inc., Q3 2013 Earnings Call, Nov 15, 2012",2012-11-15,48.0,Earnings Calls,Dell Technologies Inc.,3320.0,388551.0,18496083.0,Presenter Speech,Brian Gladden,,Executives,4,"Thanks, Steve. Consistent with our comments last quarter and with what you're hearing from many other technology companies, we continue to see a challenging global macroeconomic and IT spending environment which is clearly impacting our results. We don't expect that to improve much in the fourth quarter. 
For revenue, we expect sequential growth of 2% to 5%. You should also remember that last year's fourth quarter included a 14th week. For the full year, we continue to outlook at least $1.70 in earnings per share on a non-GAAP basis, which works out to at least $0.38 for the fourth quarter. This incorporates a $0.01 to $0.02 dilutive impact from the inclusion of Quest Software to the fourth quarter. We expect our full year non-GAAP tax rate to be approximately 20%. 
Before we take questions, let me close with a couple -- few summary points. We're pleased with the Enterprise Solutions and Services business. With a revenue run rate approaching $20 billion, growing at roughly mid-single digits and strong profit, this is a business where we'll continue to invest and accelerate our growth. 
In end-user computing, we have work to do but are encouraged by early interest in our new Windows 8 touch portfolio and the new opportunities we see in our commercial and consumer businesses. As always, we'll be balancing liquidity, profitability and growth to optimize the company for long-term success. 
Now let me turn it over to Rob.",239
266017.0,"Dell Inc., Q3 2013 Earnings Call, Nov 15, 2012",2012-11-15,48.0,Earnings Calls,Dell Technologies Inc.,3320.0,388551.0,18496084.0,Presenter Speech,Robert Williams,,Executives,5,"Thanks, Brian. Just a quick reminder to limit your questions to one with one follow-up. Regina, can we have the first question?",22
266017.0,"Dell Inc., Q3 2013 Earnings Call, Nov 15, 2012",2012-11-15,48.0,Earnings Calls,Dell Technologies Inc.,3320.0,388551.0,18496085.0,Question and Answer Operator Message,Operator,,Operator,6,[Operator Instructions] Your first question will come from the line of Scott Craig with Bank of America.,17
266017.0,"Dell Inc., Q3 2013 Earnings Call, Nov 15, 2012",2012-11-15,48.0,Earnings Calls,Dell Technologies Inc.,3320.0,388551.0,18496086.0,Question,Scott Craig,,Analysts,7,"Can you guys maybe walk us through the consumer business. The operating profit there was obviously challenged this quarter. And I know you guys have been more selective recently. But can you maybe give us your thoughts on restructuring that business or maybe walking away from more business there? And then my second question goes around the Large Enterprise side, and what sort of margin pressure are we seeing there on the PC business?",74
266017.0,"Dell Inc., Q3 2013 Earnings Call, Nov 15, 2012",2012-11-15,48.0,Earnings Calls,Dell Technologies Inc.,3320.0,388551.0,18496087.0,Answer,Brian Gladden,,Executives,8,"Scott, I'll start on Consumer and Steve can jump in. Clearly, in Consumer, it's been a more challenging environment. Emerging markets have slowed. They've moved to lower-value products. We also saw, in the quarter, expected channel dynamics around the Windows 8 launch. I would say we're sticking to our focus on mid- to high-value segments of that business and not really chasing the lower end of that space. We said last quarter that we didn't think the consumer market would improve until after the Windows 8 launch and then definitely we've seen that. So we're committed to the strategy here. We understand the importance of the business and the importance of scale that comes with that. And as we've talked about, and Jeff Clarke talked about this summer, we continue to focus on cost reductions that are important to stay competitive here. So maybe Steve can give a couple of comments.",151
