companyid,headline,mostimportantdateutc,keydeveventtypeid,keydeveventtypename,companyname,audiolengthsec,transcriptid,transcriptcomponentid,transcriptcomponenttypename,transcriptpersonname,companyofperson,speakertypename,componentorder,componenttext,word_count
266017.0,"Dell Inc., Q4 2013 Earnings Call, Feb 19, 2013",2013-02-19,48.0,Earnings Calls,Dell Technologies Inc.,1696.0,418767.0,19754659.0,Question,Jayson Noland,,Analysts,29,"Brian, just to clarify, you referenced April 2014. I think that was an XP end of life statement. What percentage of the install base for Dell today is XP?",29
266017.0,"Dell Inc., Q4 2013 Earnings Call, Feb 19, 2013",2013-02-19,48.0,Earnings Calls,Dell Technologies Inc.,1696.0,418767.0,19754660.0,Answer,Brian Gladden,,Executives,30,"I think that's really tough to get at, Jayson, but the data that we've seen would suggest there's still somewhere in the range of 40% of the corporate installed base for PCs that is XP or Vista that needs to be upgraded. So that's I think pretty consistent with the data that we see for our installed base and for what we hear from our corporate customers.",68
266017.0,"Dell Inc., Q4 2013 Earnings Call, Feb 19, 2013",2013-02-19,48.0,Earnings Calls,Dell Technologies Inc.,1696.0,418767.0,19754661.0,Question and Answer Operator Message,Operator,,Operator,31,Our next question will come from the line of Brian Marshall with ISI Group.,14
266017.0,"Dell Inc., Q4 2013 Earnings Call, Feb 19, 2013",2013-02-19,48.0,Earnings Calls,Dell Technologies Inc.,1696.0,418767.0,19754662.0,Question,Brian Marshall,,Analysts,32,"Your Server & Networking business, obviously up almost 20% year-over-year, doing well. And you highlighted hyper-scale data centers as one of the key drivers of that. But one of the world's largest consumer internet companies has recently talked about building a third data center in Sweden based on 100% non-OEM servers. So I guess question is how do you feel like you're going to be positioning going forward if we do see more of this white box market start to emerge at some of the biggest service providers out there?",89
266017.0,"Dell Inc., Q4 2013 Earnings Call, Feb 19, 2013",2013-02-19,48.0,Earnings Calls,Dell Technologies Inc.,1696.0,418767.0,19754663.0,Answer,Brian Gladden,,Executives,33,"Yes, Brian, it's not a new dynamic. I mean this is something that we've seen for the last few years. It is relatively isolated to a few number of large-scale customers who can make the economics work. And given that, we're still seeing strong growth in our business and significant opportunities to continue to grow the hyper-scale business. So I don't think it's a new dynamic. I think it's one that we've seen, and the differentiation that we've shown in the 12G products actually is showing very well and helped us to gain share -- continue to gain share in service.",101
266017.0,"Dell Inc., Q4 2013 Earnings Call, Feb 19, 2013",2013-02-19,48.0,Earnings Calls,Dell Technologies Inc.,1696.0,418767.0,19754664.0,Answer,Thomas Sweet,,Executives,34,"Brian, the -- it's Tom Sweet. The other thing I would add is that yes, there is a push on certain old -- certain hyper-scale people to provide their own boxes. But the benefit that we drive is around the engineering and logistics and some of the other service capabilities that come along with our suite of solutions.",58
266017.0,"Dell Inc., Q4 2013 Earnings Call, Feb 19, 2013",2013-02-19,48.0,Earnings Calls,Dell Technologies Inc.,1696.0,418767.0,19754665.0,Question and Answer Operator Message,Operator,,Operator,35,Our next question will come from the line of Amit Daryanani with RBC Capital Markets.,15
266017.0,"Dell Inc., Q4 2013 Earnings Call, Feb 19, 2013",2013-02-19,48.0,Earnings Calls,Dell Technologies Inc.,1696.0,418767.0,19754666.0,Question,Amit Daryanani,,Analysts,36,Just a question on the Services side. It looks like revenues were down about 3% year-over-year. Can we just talk about what was driving that and also to the extent you can talk about Services revenues that were client-centric? And how did that perform versus the non-client-centric services revenues? That will be helpful.,53
266017.0,"Dell Inc., Q4 2013 Earnings Call, Feb 19, 2013",2013-02-19,48.0,Earnings Calls,Dell Technologies Inc.,1696.0,418767.0,19754667.0,Answer,Brian Gladden,,Executives,37,"Yes, Amit, the Services business in general, I would say from our standpoint, the Apps & BPO space is the place that we've been continuing to really exit legacy contracts and focus and improve business profitability. That's continued, and you see that in the results in the quarter. We've seen good growth to the security element of infrastructure, cloud and security, with security. And that's really the SecureWorks business driving 17% growth in the quarter. Support & Deployment, I would say, again, that is obviously going to feel the impact of the unit declines that we're seeing on the client business. To keep that business flat, obviously, it's taken some good work from the teams around the tax rates, around pricing. And so I think we've continued to see very favorable performance, especially on the Enterprise-type services side. So clearly, in a flat number there, we would've seen the client side of Support & Deployment down. And we saw significantly better Enterprise growth as we implement a lot of the support capabilities around some of the acquired Enterprise hardware capabilities in the business. So that's really how it's playing out. I would say we feel pretty good about the progress in the Apps & BPO, infrastructure side of the business in terms of improving profitability. And I think we'll continue to see progress with that as we move into the early part of the year.",235
266017.0,"Dell Inc., Q4 2013 Earnings Call, Feb 19, 2013",2013-02-19,48.0,Earnings Calls,Dell Technologies Inc.,1696.0,418767.0,19754668.0,Answer,William Gray,,Executives,38,"And I'd also point out that the deferred services revenue balance on the balance sheet grew 3%, and further evidence of some of that long-term annuity that's building on the balance sheet given the good work that the teams have done around the tax rate.",46
266017.0,"Dell Inc., Q4 2013 Earnings Call, Feb 19, 2013",2013-02-19,48.0,Earnings Calls,Dell Technologies Inc.,1696.0,418767.0,19754669.0,Question and Answer Operator Message,Operator,,Operator,39,Our final question will come from the line of Brian White with Topeka.,13
266017.0,"Dell Inc., Q4 2013 Earnings Call, Feb 19, 2013",2013-02-19,48.0,Earnings Calls,Dell Technologies Inc.,1696.0,418767.0,19754670.0,Question,Brian White,,Analysts,40,"I'm wondering, Brian, if you could talk a little bit about the trends you saw in Europe in the quarter and what you see looking forward?",27
266017.0,"Dell Inc., Q4 2013 Earnings Call, Feb 19, 2013",2013-02-19,48.0,Earnings Calls,Dell Technologies Inc.,1696.0,418767.0,19754671.0,Answer,Brian Gladden,,Executives,41,"Yes, Europe has, I would say, over the last couple of quarters, been relatively stable at a relatively low level. So you look at the declines we saw in the fourth quarter, pretty similar to what we saw in the second and third quarter in Europe. And so it stabilized at a relatively low level, still some good progress around the Enterprise side of our business in Europe and saw some good growth there. Clearly better in Eastern Europe than Western Europe. But I think we're sort of bracing for a similar environment in Europe as we sort of move forward. Don't see anything that's going to make that a whole lot different as we move into fiscal year '14.",120
266017.0,"Dell Inc., Q4 2013 Earnings Call, Feb 19, 2013",2013-02-19,48.0,Earnings Calls,Dell Technologies Inc.,1696.0,418767.0,19754672.0,Question and Answer Operator Message,Operator,,Operator,42,This concludes today's conference call. We appreciate your participation. You may disconnect at this time.,16
266017.0,"Dell Inc., Q1 2014 Earnings Call, May 16, 2013",2013-05-16,48.0,Earnings Calls,Dell Technologies Inc.,2530.0,468325.0,21789560.0,Presentation Operator Message,Operator,,Operator,0,"Good afternoon, and welcome to the Dell Inc. First Quarter Fiscal 2014 Earnings Conference Call. I'd like to inform all participants, this call is being recorded at the request of Dell. This broadcast is the copyrighted property of Dell Inc. Any rebroadcast of this information in whole or part without the prior written permission of Dell Inc. is prohibited. As a reminder, Dell is also simulcasting this presentation with slides at www.dell.com/investor. [Operator Instructions] I'd like to turn the call over to Rob Williams, Head of Investor Relations. Mr. Williams, you may begin.",93
266017.0,"Dell Inc., Q1 2014 Earnings Call, May 16, 2013",2013-05-16,48.0,Earnings Calls,Dell Technologies Inc.,2530.0,468325.0,21789561.0,Presenter Speech,Robert Williams,,Executives,1,"Thanks, McKenzie. With me today are Brian Gladden and Tom Sweet. The web deck is posted to our website in advance of the call, and I encourage you to review this and the related materials for additional perspective.
Next, I'd like to remind you that all statements that are made during this call that relate to future results and events are forward-looking statements that are based on current expectations. Actual results and events could differ materially from those projected in the forward-looking statements because of a number of risks and uncertainties, which are discussed in our annual and quarterly SEC filings and in the cautionary statement and our press release and web deck. We assume no obligation to update our forward-looking statements.
Note that we will be referring to non-GAAP financial measures, including non-GAAP gross margin, operating expenses, operating income, net income and earnings per share. Historical non-GAAP measures are reconciled to the most directly comparable GAAP measures in the web deck posted in the Investor Relations section at dell.com and in our press release and 8-K filed today. I encourage you to review these documents. Please also note that unless otherwise mentioned, all growth percentages refer to year-over-year progress.
Consistent with last quarter, we will not take any questions on the pending transaction to take the company private. Now I'll turn it over to Brian.",226
266017.0,"Dell Inc., Q1 2014 Earnings Call, May 16, 2013",2013-05-16,48.0,Earnings Calls,Dell Technologies Inc.,2530.0,468325.0,21789562.0,Presenter Speech,Brian Gladden,,Executives,2,"Thanks, Rob. As we head into the new fiscal year, we continue to execute our strategy to be the leading provider of end-to-end scalable solutions. Our strategy is differentiated based on our focus on practical innovation, efficient and affordable solutions and our superior customer relationship model. 
For the first quarter of fiscal year 2014, we delivered revenue of $14.1 billion, down 2%. The Enterprise Solutions, Services and Software business was up 12% to $5.5 billion. Our continued focus on our customers and our ability to meet their needs with differentiated solutions is evident in numerous customer wins that Tom will highlight in the segment section later.
Over the past few years, we've acquired many new capabilities in areas like scalable storage solutions, application migration and software. We continue to invest in strategic capabilities additionally, and less than 2 weeks ago, we announced and closed the acquisition of Enstratius, which improves our end-to-end solutions capabilities by enabling our customers to more effectively manage and integrate their cloud environments. 
I'll refer to non-GAAP financial measures going forward. Gross margin was $2.9 billion at 20.6% of revenue, which was down 40 basis points sequentially when adjusting for last quarter's vendor settlements. We continue to face a competitive pricing environment and have aligned our pricing strategy to invest in growth ahead of planned reductions in our cost structure, and this has affected our profitability. We remain focused on pursuing strategic revenue opportunities that will drive long-term profitability and cash flow. 
SG&A increased 4% and as a percentage of revenue increased 20 basis points sequentially to 14.2%. R&D spending increased 33% and as a percent of revenue increased 10 basis points sequentially to 2.2%. Of note, there were almost $90 million in expenses related to the pending go-private transactions that were excluded from our non-GAAP results. 
Operating income was $590 million or 4.2% of revenue. Our non-GAAP tax rate of 28.7% is driven by a greater portion of our business in higher tax jurisdictions during the quarter. 
Earnings per share were $0.21, declining 51%. Cash used in operations in the quarter was $39 million as the first quarter is typically a seasonal low for cash flow. On a trailing 12-month basis, cash flow from operations was $3.4 billion, down 31%. Our cash and investments balance ended at $13.2 billion as we repaid approximately $2 billion in debt during the quarter. 
Now let me turn to our operating segment results. As we announced in February, this is the first quarter we're reporting results under the new segment structure. We've aligned our operating segments to our end-to-end solutions portfolio in the Enterprise Solutions Group, Dell Services, Dell Software and End User Computing Group. 
Enterprise Solutions Group and the End User Computing Group received revenue from Dell Services to align our reporting structure and drive accountability in each of the respective operating segments. As a result, the sum of our operating segment revenue will not equal our consolidated non-GAAP results. 
In addition, there are unallocated costs that remained at the corporate level that are reconciling items between the total segment and consolidated operating income. The reconciliation of all these items to our consolidated results can be found in the tables that are available on the Dell Investor Relations website. 
Now let me turn it over to Tom Sweet who will take you through our new business segment results.",560
266017.0,"Dell Inc., Q1 2014 Earnings Call, May 16, 2013",2013-05-16,48.0,Earnings Calls,Dell Technologies Inc.,2530.0,468325.0,21789563.0,Presenter Speech,Thomas Sweet,,Executives,3,"Thanks, Brian. Let me take you through the financial results for each segment, and I will also share a few important customer wins. Let's start with the Enterprise Solutions Group, or ESG. This business includes servers, networking, storage and ESG-related peripherals. 
We continue to see strong growth in ESG of 10% on revenue of $3.1 billion and operating income of $136 million or 4.4% of revenue. Within ESG, our server, networking and enterprise peripheral business delivered revenue of $2.7 billion, which equates to 14% growth. This was driven by strong growth in our hyperscale data center servers. In this space, Dell servers power 4 of the top 5 search engines and 75% of the top social media sites worldwide. Our networking business increased 24% on strong Force10 results. This represents the ninth straight quarter of both year-over-year and sequential growth in this business. 
Dell Storage revenue was down 10% to $424 million. We are focused on continuing to more effectively position the right solutions based on customer needs and optimizing our selling motion to improve revenue momentum. While we have made progress, we have more work to do in this area. 
The ESG market is rapidly changing and migrating to converged solutions that blur the lines between traditional product sets. A great example of this was a win with Statoil in Norway as our global capabilities and converged solution displaced legacy vendors in each of the traditional product sets. We are now rolling out a solution that includes Dell branded servers, storage and networking for their new data centers in 70 locations worldwide. 
The Services business includes a broad range of IT and business services, including support and deployment services, infrastructure, cloud, security services, applications and business process services. This business was up 2% to $2.1 billion. Op inc for this business increased to $370 million or 17.6% of revenue, up from 16.3% of revenue in the first quarter of last year. We have been reshaping this portfolio to focus on more profitable solutions that are aligned to our strategic capabilities, and we continue to improve our cost structure. 
Within Services, support and deployment increased 2%, with revenue of $1.2 billion. Enhanced and new solutions such as ProSupport Plus are adding capabilities to our portfolio that focus on proactively improving the performance and stability of critical systems by leveraging our expertise and deep understanding of the customer's IT environment. These solutions and strong attach rates have resulted in revenue streams partially mitigating the downward pressure caused by the decline in EUC hardware sales. 
Infrastructure, cloud and security services were up 11% to $612 million, which includes an increase of 20% in our security business. Security continues to be one of the top concerns of our customers, and we have continued to develop and deliver new and innovative solutions to accommodate the constantly changing threats. We had a 15% decline in our apps and BPO business, driven by a divestiture and select contract expirations [ph] as we continue working to improve the profitability of this business. 
Our Services capabilities, combined with our vertical expertise, continue to position us well to address the needs of our customers. A great example of this was a win with U.K.-based Locala Community Partnerships, a social enterprise that delivers community health care to over 400,000 people. Our solution focused on improving the management of patient records and simplifying their IT environment by delivering customized services, hardware and software through a cloud-based solution. 
Our Software business includes systems management, security software solutions and information management. This business delivered revenue of $295 million and an operating loss of $85 million for the quarter. Consistent with our prior communication and business plans, we remain confident that the Quest acquisition will be accretive in the first quarter of fiscal year '15 as we invest to grow the business. We're enhancing our software capabilities and increasing our investment in this business with additional sales capacity and R&D. Software is a glue for many of our end-to-end solutions, and it will play an increasingly important role in our competitive differentiation. 
Our End User Computing business, or EUC, includes desktops including thin client, notebooks including tablets, third-party software and client-related peripherals. This business delivered revenue of $8.9 billion, down 9%. Operating income of $224 million was down 65% at 2.5% of revenue. 
As we discussed last quarter, we are investing in acquiring new customer accounts that will benefit our long-term profitability and cash flow. We continue to expect relatively weak demand in this business and continued market competitiveness. These dynamics reinforce the importance of our cost-out initiatives for EUC, where we are targeting greater than $1 billion in savings by the end of fiscal 2015. 
In addition, during the quarter, we increased our investment to improve sales coverage for key areas of the business. The desktop and thin client business revenue was $3.3 billion, down 2%. The trajectory of the desktop business continues to improve as we maintain a strong position in the traditional desktop space and are seeing good traction with new desktop form factors such as our innovative all-in-one designs. 
Mobility revenue of $3.6 billion was down 16% as demand in this space continues to be pressured by customers diverting spending to alternative mobile solutions. We are encouraged by the industry-based enhancements coming to the notebook touch ecosystem, and we will bring new and innovative solutions to the market to enhance our position in this space. 
We are seeing a good ramp in our tablet-based solutions, led by our Latitude 10 business-focused tablet. Our third-party software in EUC peripherals delivered revenue of $2 billion, down 6%. A great example of our ability to deliver differentiated solutions to our customers is a recently awarded $60 million client refresh with Marsh & McLennan. We were able to offer a broad array of EUC solutions between our Latitude notebooks, OptiPlex desktops, as well as precision workstations and XPS systems for higher-end users. Our warranty, product quality, value and partnership were all key points of differentiation. We will be rolling out these solutions to 55,000 end users globally, displacing a key competitor that was a longtime incumbent. 
Before I turn it back to Rob, I want to remind everyone that consistent with last quarter, given our pending merger agreement, we will not be providing an outlook. Now I'll turn it back to Rob to begin Q&A.",1061
266017.0,"Dell Inc., Q1 2014 Earnings Call, May 16, 2013",2013-05-16,48.0,Earnings Calls,Dell Technologies Inc.,2530.0,468325.0,21789564.0,Presenter Speech,Robert Williams,,Executives,4,"Thanks, Tom. [Operator Instructions] McKenzie, can we have the first question?",11
266017.0,"Dell Inc., Q1 2014 Earnings Call, May 16, 2013",2013-05-16,48.0,Earnings Calls,Dell Technologies Inc.,2530.0,468325.0,21789565.0,Question and Answer Operator Message,Operator,,Operator,5,[Operator Instructions] We'll take our first question from Katy Huberty with Morgan Stanley.,13
266017.0,"Dell Inc., Q1 2014 Earnings Call, May 16, 2013",2013-05-16,48.0,Earnings Calls,Dell Technologies Inc.,2530.0,468325.0,21789566.0,Question,Kathryn Huberty,,Analysts,6,"Given the significant change in profitability, can you just take a step back and talk about whether the margin deterioration this quarter is what you expected when you rolled out a more aggressive pricing strategy? And if it was what you expected, can you just go into a little more detail around what it is you're trying to accomplish given that segment operating income dollars were almost cut in half and it still didn't drive top line growth?",78
266017.0,"Dell Inc., Q1 2014 Earnings Call, May 16, 2013",2013-05-16,48.0,Earnings Calls,Dell Technologies Inc.,2530.0,468325.0,21789567.0,Answer,Brian Gladden,,Executives,7,"Yes, Katy, I would say we've been talking about this for a couple of quarters about our need to adjust pricing. We did that. You saw some of that last quarter. It was affected by the settlements that we had as well, and it wasn't quite as apparent in the P&L. But clearly, we've been focused on this for a while. I think there are parts of the business where we are beginning to see some elasticity. Demand has been, I would say, weaker than we expected as we headed into the year. And I think the reality is, in many cases, these are accounts that we're gaining that we feel very good about the long-term profitability and the impact on our cash flow over time. So while we may not see that showing up as a positive in the P&L in the short term, we think for the long term, it's the right thing to do to get ourselves back in price position, to scale the business. And I think as you look at the share dynamics that played out in the first quarter, we actually did improve our position on a share basis in a market that's pretty tough. So fairly conscious effort to position the business and something we've been working on for a few quarters now.",220
266017.0,"Dell Inc., Q1 2014 Earnings Call, May 16, 2013",2013-05-16,48.0,Earnings Calls,Dell Technologies Inc.,2530.0,468325.0,21789568.0,Question and Answer Operator Message,Operator,,Operator,8,We'll take our next question from Toni Sacconaghi with Sanford Bernstein.,12
266017.0,"Dell Inc., Q1 2014 Earnings Call, May 16, 2013",2013-05-16,48.0,Earnings Calls,Dell Technologies Inc.,2530.0,468325.0,21789569.0,Question,Toni Sacconaghi,,Analysts,9,"I just wanted to follow up on that. Is there a minimum acceptable level of profitability in the End User Computing Group that you are willing to sustain on an ongoing basis in your effort to hold or gain share? And related to that, you talked about making investments in advance of your cost cutting. I think a year ago, at your Analyst Day, you talked about this cost cutting. Given that you've started to be more price aggressive, why have you not been able to undertake any of this cost cutting to date? What's holding you back? And wouldn't it make a lot more sense to be doing the cost cutting and more aggressive pricing concurrently?",117
