companyid,headline,mostimportantdateutc,keydeveventtypeid,keydeveventtypename,companyname,audiolengthsec,transcriptid,transcriptcomponentid,transcriptcomponenttypename,transcriptpersonname,companyofperson,speakertypename,componentorder,componenttext,word_count
266017.0,"Dell Inc., Q4 2012 Earnings Call, Feb 21, 2012",2012-02-21,48.0,Earnings Calls,Dell Technologies Inc.,3277.0,275885.0,13654784.0,Answer,Brian Gladden,,Executives,59,"Well, I would say without giving you specifics that we're through the majority of this. We told you about $3 billion this past year was what we were working our way through and that's still a good number. It would be a smaller number as we move forward. And primarily focused in the S&P business is the primary element that we move forward with.",64
266017.0,"Dell Inc., Q4 2012 Earnings Call, Feb 21, 2012",2012-02-21,48.0,Earnings Calls,Dell Technologies Inc.,3277.0,275885.0,13654785.0,Question and Answer Operator Message,Operator,,Operator,60,Your next question comes from the line of Maynard Um with UBS.,12
266017.0,"Dell Inc., Q4 2012 Earnings Call, Feb 21, 2012",2012-02-21,48.0,Earnings Calls,Dell Technologies Inc.,3277.0,275885.0,13654786.0,Question,Maynard Um,,Analysts,61,"Can you just talk about how you're measuring the R&D and sales and marketing investments that you've made over the last year into the businesses? What metrics, in particular, you're looking at and how that's tracking so far relative to your original expectations?",44
266017.0,"Dell Inc., Q4 2012 Earnings Call, Feb 21, 2012",2012-02-21,48.0,Earnings Calls,Dell Technologies Inc.,3277.0,275885.0,13654787.0,Answer,Brian Gladden,,Executives,62,"Well, I think we've done -- we've really bifurcated the way we think about OpEx and clearly have begun to look at some of these product lines relative to competitive benchmarks. If you think about the storage business, you think about where we are on enterprise in total. And we've basically set some targets around the right levels of investment. Clearly, those teams have commitments around growth, they have commitments around the product portfolio and launching new products. But I think we've got a real sense for what's required to be successful in these kinds of businesses, and we're committed to get there. And I think at the same point, we're going to be tough in other parts of the business whether it's in G&A or other less profitable parts of the business in terms of investment. And that's how we can fund those things.",145
266017.0,"Dell Inc., Q4 2012 Earnings Call, Feb 21, 2012",2012-02-21,48.0,Earnings Calls,Dell Technologies Inc.,3277.0,275885.0,13654788.0,Question,Maynard Um,,Analysts,63,"Well, I guess specifically to the specialists that you hired, how are you measuring those guys and how's that, in particular, tracking?",22
266017.0,"Dell Inc., Q4 2012 Earnings Call, Feb 21, 2012",2012-02-21,48.0,Earnings Calls,Dell Technologies Inc.,3277.0,275885.0,13654789.0,Answer,Brian Gladden,,Executives,64,"Yes, we have a series of key performance indicators and for competitive reasons, I'm not going to share the details of them. But we can measure how much growth we're getting in the way we define a solution. We can measure the pipeline that's generated, that our multiline of business for example. We can measure where we've added services content to the sale. We can look at the revenue productivity per specialist. So we've got a number of metrics that we're pretty maniacally focused on. And so we know how we're progressing here, and that's why I said earlier I'm pleased with the improvement in productivity as we go into this new year.",113
266017.0,"Dell Inc., Q4 2012 Earnings Call, Feb 21, 2012",2012-02-21,48.0,Earnings Calls,Dell Technologies Inc.,3277.0,275885.0,13654790.0,Question,Maynard Um,,Analysts,65,Got it. And then just lastly on the services business. Can you just talk about what the big growth drivers are there and whether you think you're sufficiently scaled in that business?,32
266017.0,"Dell Inc., Q4 2012 Earnings Call, Feb 21, 2012",2012-02-21,48.0,Earnings Calls,Dell Technologies Inc.,3277.0,275885.0,13654791.0,Answer,Brian Gladden,,Executives,66,"Yes, I think it's really across-the-board. I mean, we've shared some of the progress we've made in new contracts on the non-support side of that business. But I think we've also made progress with the patch rates on support. And overall, really across-the-board, some nice growth. In terms of scale, I think that's the place that you'll see us continue to invest to support that business. It's clearly one of the strategic priorities for us.",75
266017.0,"Dell Inc., Q4 2012 Earnings Call, Feb 21, 2012",2012-02-21,48.0,Earnings Calls,Dell Technologies Inc.,3277.0,275885.0,13654792.0,Question and Answer Operator Message,Operator,,Operator,67,Your next question comes from the line of Brian Marshall with ISI.,12
266017.0,"Dell Inc., Q4 2012 Earnings Call, Feb 21, 2012",2012-02-21,48.0,Earnings Calls,Dell Technologies Inc.,3277.0,275885.0,13654793.0,Question,Brian Marshall,,Analysts,68,"If you look at your storage business, obviously Dell-owned IP storage has been doing extremely well, but we haven't seen much growth in that business as the third-party reseller comes down, so we've kind of been hovering $500 million in revs for -- on a quarterly basis for quite some time. It seems to me that still, commodity hardware represents a majority of the company's revenue and that's been the case for obviously the past couple of years as we really try to move the strategic revenue sources. Can you discuss a little bit about how this is -- how we're going to see some of the trends that we've seen in storage and your networking as well as your Software business going forward as we transition to more Dell-owned IP and stop the resell of third party? And then the follow-up question is could you give us the unit number as well?",153
266017.0,"Dell Inc., Q4 2012 Earnings Call, Feb 21, 2012",2012-02-21,48.0,Earnings Calls,Dell Technologies Inc.,3277.0,275885.0,13654794.0,Answer,Brian Gladden,,Executives,69,"Yes, Brian. Just on the third-party storage, on the total year, that was down about 64%. We still have some more work to do there as you move into the first quarter. It was down in the fourth quarter 83%, and there's still a fair amount from a comparison standpoint in prior-year first quarter results. So as we head into the second half of the year, we're pretty comfortable that we'll be completely through that probably even into the second quarter, and we'll have overall storage business begin to move forward in a growth mode. As you think about that model, it's really almost the same exact framework we would expect to see in the networking business. And as that gets to a scale that's larger, we'll begin to give you a little more visibility to that and probably in the Analyst Meeting as well.",145
266017.0,"Dell Inc., Q4 2012 Earnings Call, Feb 21, 2012",2012-02-21,48.0,Earnings Calls,Dell Technologies Inc.,3277.0,275885.0,13654795.0,Answer,Michael Dell,,Executives,70,"Yes, Brian. I would just add that the focus is clearly on continuing to add Dell Intellectual Property that we think is disruptive and that can provide real value for our customers. So if you look at this past year, there's a lot of clear indications of that in SecureWorks, in Compellent and in some of the other acquisitions that we made, Force10 and then the integration of things like Ocarina, an excellent add into our storage portfolio. So yes, no question that we're going to continue to be in the end-user computing business for the foreseeable future and a long time to come, and it's a great business to be in, if we can grow it appropriately and attach the services and kind of drive that business appropriately, so that's kind of how we're thinking about it.",138
266017.0,"Dell Inc., Q4 2012 Earnings Call, Feb 21, 2012",2012-02-21,48.0,Earnings Calls,Dell Technologies Inc.,3277.0,275885.0,13654796.0,Question,Brian Marshall,,Analysts,71,"Sure, understood. And the unit number, if possible?",8
266017.0,"Dell Inc., Q4 2012 Earnings Call, Feb 21, 2012",2012-02-21,48.0,Earnings Calls,Dell Technologies Inc.,3277.0,275885.0,13654797.0,Answer,Michael Dell,,Executives,72,I don't think we disclose units anymore. We've moved off of that about one year ago.,17
266017.0,"Dell Inc., Q4 2012 Earnings Call, Feb 21, 2012",2012-02-21,48.0,Earnings Calls,Dell Technologies Inc.,3277.0,275885.0,13654798.0,Question and Answer Operator Message,Operator,,Operator,73,Our final question will come from the line of Brian Alexander with Raymond James.,14
266017.0,"Dell Inc., Q4 2012 Earnings Call, Feb 21, 2012",2012-02-21,48.0,Earnings Calls,Dell Technologies Inc.,3277.0,275885.0,13654799.0,Question,Brian Alexander,,Analysts,74,"Brian, based on the information you've given on buybacks and other income and tax rate, et cetera, it's still possible to drive EPS growth without driving growth in operating income. So it's still not clear to me whether you expect to drive operating income growth in fiscal '13. And I'm still confused as to why you aren't specifically discussing an op income growth objective for the year whereas last year you did?",72
266017.0,"Dell Inc., Q4 2012 Earnings Call, Feb 21, 2012",2012-02-21,48.0,Earnings Calls,Dell Technologies Inc.,3277.0,275885.0,13654800.0,Answer,Brian Gladden,,Executives,75,"Well, we spent some time benchmarking and looked at peer companies and what they do, and we were really the only company out there providing operating income outlook, so we decided to be consistent with other companies, so that's why we moved to EPS. I think your math is right. I think given everything we see right now as we head into the year, that's the number that we're calling. And I think as we move throughout the year and things become a little bit more certain around the demand environment, around where we are in the investments we need to make, we'll obviously give you little more clarity on that. But we do think we can grow earnings per share and that's our focus.",125
266017.0,"Dell Inc., Q4 2012 Earnings Call, Feb 21, 2012",2012-02-21,48.0,Earnings Calls,Dell Technologies Inc.,3277.0,275885.0,13654801.0,Question,Brian Alexander,,Analysts,76,"All right. Just maybe one final follow-up, if I could. In terms of capital allocation, you talked about buybacks at 10% to 30% of cash flow. You talked about CapEx for the year. Can you say whether Dell is more seriously considering the issuance of a dividend? And if not, what are the key arguments against the dividend as you talk about this option with your board, given the company is generating a lot of cash? It's pretty consistent, and you're sitting on a large pile of cash as well.",90
266017.0,"Dell Inc., Q4 2012 Earnings Call, Feb 21, 2012",2012-02-21,48.0,Earnings Calls,Dell Technologies Inc.,3277.0,275885.0,13654802.0,Answer,Brian Gladden,,Executives,77,"Yes, I think we talked about this last quarter in a specific question. I would just say that the one big area of uncertainty that we obviously have to manage through, and this is something we think about and talk about from time to time with the board, is really around U.S. liquidity and access to capital in the U.S. And as that gets clearer, I think we would obviously be in a position to talk more about that. But that's probably the biggest thing that we think through as we consider that alternative, Brian.",95
266017.0,"Dell Inc., Q4 2012 Earnings Call, Feb 21, 2012",2012-02-21,48.0,Earnings Calls,Dell Technologies Inc.,3277.0,275885.0,13654803.0,Question and Answer Operator Message,Operator,,Operator,78,"Ladies and gentlemen, this does conclude today's conference. Thank you all for participating and you may now disconnect.",18
266017.0,"Dell Inc., Q1 2013 Earnings Call, May 22, 2012",2012-05-22,48.0,Earnings Calls,Dell Technologies Inc.,3232.0,312255.0,15232701.0,Presentation Operator Message,Operator,,Operator,0,"Good afternoon, and welcome to the Dell Inc. First Quarter Fiscal Year 2013 Earnings Conference Call. I'd like to inform all participants, this call is being recorded at the request of Dell. This broadcast is a copyrighted property of Dell Inc. Any rebroadcast of this information in whole or part without the prior written permission of Dell Inc. is prohibited. As a reminder, Dell is also simulcasting this presentation with slides at www.dell.com/investor. [Operator Instructions] I'd like to turn the call over to Rob Williams. Mr. Williams, you may begin.",90
266017.0,"Dell Inc., Q1 2013 Earnings Call, May 22, 2012",2012-05-22,48.0,Earnings Calls,Dell Technologies Inc.,3232.0,312255.0,15232702.0,Presenter Speech,Robert Williams,,Executives,1,"Thanks, Regina. With me today are Michael Dell, Brian Gladden and Steve Felice. During the Q4 earnings call, we discussed our initiatives to create a more streamlined and efficient earnings process. Effectively, we are reducing prepared comments and increasing the content in the web deck. The web deck, along with our DellShares VLog, are posted to our website in advance of the call, and I encourage you to review these for additional perspective.
Next, I'd like to remind you that all statements made during this call that relate to future results and events are forward-looking statements that are based on current expectations. Actual results and events could differ materially from those projected in the forward-looking statements because of a number of risks and uncertainties, which are discussed in our annual and quarterly SEC filings and in the cautionary statements in our press release and web deck. We assume no obligation to update our forward-looking statements.
Please also note that we will be referring to non-GAAP financial measures during -- including non-GAAP gross margin, operating expenses, operating income, net income and earnings per share. Historical non-GAAP measures are reconciled to the most directly comparable GAAP measures in the web deck posted in the Investor Relations section of dell.com and in our press release and 8-K filed today. I encourage you to review these documents as well. Please also note that unless otherwise mentioned, all growth percentages refer to year-over-year progress.
Now, I'll turn it over to Brian.",246
266017.0,"Dell Inc., Q1 2013 Earnings Call, May 22, 2012",2012-05-22,48.0,Earnings Calls,Dell Technologies Inc.,3232.0,312255.0,15232703.0,Presenter Speech,Brian Gladden,,Executives,2,"Thanks, Rob. While we continue to make strong progress in the transformation of the company, our first quarter results were mixed, and we fell short of our own expectations. There were some areas where our execution was not as expected, and there also are some market dynamics that created some headwinds for us. We want to be clear that we remain committed to our strategy, and we want to acknowledge that our progress will not always be linear. 
Our commitment to build a broader set of end-to-end solutions and shift the mix of our business continues to be our top priority, and we're making progress. Our mix of enterprise solutions and services is now 50% of our margin and 31% of our revenue. Dell-owned IP storage, which is a key component of our enterprise solutions and an area where we made significant investment, grew at 24%. And we've announced 5 and closed 3 acquisitions year-to-date, all of which will help drive higher value mix and more predictable revenue and marginal -- margin streams going forward. Specifically, the acquisitions of SonicWALL and AppAssure further enhance our portfolio of Dell security and software solutions. 
For the quarter, we delivered revenue of $14.4 billion, down 4%. This was below our outlook. There are a few key causes to the shortfall. Our sales execution was not up to our expectations, and we've made changes to improve this as we head into the second quarter. Additionally, the demand environment was tougher than we planned, and I'd specifically highlight weaker demand in markets like EMEA and parts of Asia, in addition to public markets. Finally, we're seeing a more challenging competitive environment in a few areas of the business. We'll address these items in more detail in a moment. 
I'll refer to non-GAAP financial measures going forward. Our gross margin was 22%, up 30 basis points sequentially. While we saw improved enterprise solutions and services margins and mix and a sequential business shift from consumer to commercial, margins were impacted by a tougher pricing environment in client products. OpEx was down $183 million sequentially, driven by one less week in the first quarter versus the fourth quarter, combined with reductions in G&A and sales compensation. 
Operating income was $1 billion or 7% of revenue. Cash flow from operations was a negative $138 million. While Q1 is normally a seasonal low for cash flow, the sequential revenue decline, coupled with a 14th week in Q4, negatively impacted our accounts payable balance in the quarter. Our trailing 12-month cash flow from operations was $4.9 billion, up 17%. We allocated $300 million of capital to repurchase 17 million shares of Dell's stock and ended the quarter with $17.2 billion in cash and investments. 
Turning to our lines of business. Servers and networking grew by 2%, as we saw the typical pause in server purchases ahead of the launch of our next-generation servers. The initial demand for the products is tracking ahead of our plans, and the pipeline is strong heading into the second quarter. We're seeing good traction in our networking business, as PowerConnect revenue was up 46% year-over-year and Force10 increased 69% sequentially. Dell IP Storage was up 24% to $423 million, as the Compellent pipeline continues to strengthen and EqualLogic grew at 14%. Total storage declined 8%, as third-party storage now represents less than 5% of our storage business. 
Our notebook business contracted 10%, as we saw a more aggressive competitive environment, particularly in the entry level and emerging markets. We believe some of the tougher competitive environment can be attributed to channel inventory rebuilding, following the hard disk issues of the past 2 quarters. In addition, we're seeing more consumer IT spending diverted to alternative mobile computing devices. These dynamics impacted both our revenue and margins for the quarter. In the short term, we believe our client business is well positioned on cost, and we'll focus our efforts on growth on higher-margin, higher-value segments, with a priority on profit over unit share. 
The services business continues to be a highlight. The business grew 4% to $2.1 billion, driven by 8% growth in support and deployment. The security business was up 31%, driven by our SecureWorks acquisition. Operating margins are up as we continue to improve our cost structure and increase our attach rates of premium support and deployment services. 
Revenue for our software and peripheral business declined 7% for the quarter to $2.4 billion. Consistent with our prior commentary, this continues to be an area where we'll see pruning of the nonstrategic elements of the portfolio. 
Before I turn it over to Steve, I want to mention that at the beginning of the fiscal year, we realigned some customers between business units, with the biggest impact in SMB and Consumer. The details behind this change are included in Slide 19 in the web deck and the tables in our press release. 
Now I'll turn it over to Steve.",822
266017.0,"Dell Inc., Q1 2013 Earnings Call, May 22, 2012",2012-05-22,48.0,Earnings Calls,Dell Technologies Inc.,3232.0,312255.0,15232704.0,Presenter Speech,Stephen Felice,,Executives,3,"Thanks, Brian. Before I get into the results by business unit, I want to provide a more detailed view of factors which impacted Q1 results, as well as some proof points supporting progress in our transformation. We believe these changes will position us for long-term success. 
Let's start with sales force productivity, where execution was below our expectations and impacted our Q1 results. As you all know, we took action last year to accelerate our transformation by hiring sales specialists to focus on our enterprise business solutions. While we've seen progress here, we still have more to do to improve our sales execution. Exiting the quarter, we've made some modifications to our selling model that will improve results going forward. 
First of all, we've moved sales resources to better optimize coverage within specific customer sets and geographies. In addition to that, we're increasing our focus on integrated solution offerings rather than overspecializing on specific products and emphasizing a strong focus on our servers, storage and notebook products. We implemented many of these changes headed into Q2 as we substantially completed the consolidation of our global sales and marketing organizations, and we're confident these actions will improve our sales execution as we move through the year. 
Now looking externally, the environment remains challenging. Consumer spending on desktops and notebooks continues to be under pressure, and much of the growth in Consumer has migrated to entry-level products in emerging markets, where we've chosen not to participate. We're also seeing some IT spending prioritized to purchase other mobile devices. Now this is mostly a consumer dynamic, but there is clearly some impact in areas of commercial as well. 
Growth markets were flat despite growth in China of 9%. We navigated these emerging markets more cautiously in Q1, and we're optimizing for profit given the economic uncertainty. Now there are also many positive indicators that our strategy to deliver converged and easy-to-manage solutions to our customers is gaining traction. Our enterprise solutions and services growth, excluding EMC, was 5%, and several products are growing at rates faster than the market. 
We're also seeing a strong response to our next-generation servers. The mix of these servers was over 25% exiting the quarter. We're seeing strong momentum in many of our acquired technologies, like Compellent and Force10, where we've added almost 1,000 new customers during the quarter. 
And our service business continues to show strength and is building a good pipeline and signing new business that should position us well going forward. Our new signings for the trailing 12 months was $1.8 billion, which is up almost 80%, and our services backlog was up 9%. 
Now I'd like to turn to our business unit results. Large Enterprise revenue was down 3%, driven by developed markets, which declined 6%. We see a good pipeline here but some customers are delaying their IT spending. Public continues to see spending pressure and was down 4%. We are starting to see improvements in U.S. federal spending, but our K-12 and health care businesses were lower than expected. 
SMB revenue was up 4%, driven by enterprise service and solution growth of 17%. SMB continues to be a solid business for us, given our scalable-solutions focus and strong relationships with these customers. The growth was broad-based geographically, as all 3 regions grew, which was led by APJ, up 10%. 
In total, for these 3 commercial businesses, we saw gross margins increase sequentially and overall operating income was at 9.3%. The Consumer business was our biggest challenge in the quarter, with Consumer notebook revenue down 15% as we limited our participation in the profit-challenged entry-level systems. On the channel front, we expanded to over 103,000 channel partners in Q1. These partners are becoming increasingly important as we provide a broader set of converged solutions on a global basis. And finally, we are confident that we are positioning ourselves well for profitable growth, and we believe the recent changes we've made in our global go-to-market processes and organization model will position us better for execution in the coming quarters. 
Now I'll turn it back over to Brian to discuss the outlook.",687
266017.0,"Dell Inc., Q1 2013 Earnings Call, May 22, 2012",2012-05-22,48.0,Earnings Calls,Dell Technologies Inc.,3232.0,312255.0,15232705.0,Presenter Speech,Brian Gladden,,Executives,4,"Thanks, Steve. Despite the good progress we're making with our enterprise solutions and services, our overall revenue performance wasn't where it needed to be in the first quarter. As Steve said, we're confident that we have action plans in place to fix our execution and improve our top line growth as we move through the year. 
In addition, the investments we've made position us well as we strengthen our execution. While we believe spending has been delayed in some areas, we have a healthy pipeline of business and expect to gain growth momentum as the year progresses. We do have concerns about the impact of the competitive pricing environment. We'll continue to monitor these dynamics and adjust our tactics to optimize operating income and cash flow for the company based on how this -- how the market plays out. 
While we're not off to the start we expected for the year, it's too early in the year to adjust our FY '13 EPS outlook. We intend to provide an update on the total year outlook during our second quarter earnings call in August. For the second quarter, we expect revenue to be in line with normal seasonality of a sequential increase of 2% to 4%, mostly driven by our public business seasonality. 
Before we take questions, let me close with a few summary points. We're fully committed to our strategy, and we'll continue to make investments in building end-to-end solutions capability. This is a long-term strategy and will take time. We're making progress and have several areas where our results are strong, proof points that our strategy's working. And we look forward to providing a more detailed strategic update in our upcoming investor analyst meeting in 3 weeks. 
Now let me turn it back over to Rob.",297
