companyid,headline,mostimportantdateutc,keydeveventtypeid,keydeveventtypename,companyname,audiolengthsec,transcriptid,transcriptcomponentid,transcriptcomponenttypename,transcriptpersonname,companyofperson,speakertypename,componentorder,componenttext,word_count
266017.0,"Dell Inc., Q1 2013 Earnings Call, May 22, 2012",2012-05-22,48.0,Earnings Calls,Dell Technologies Inc.,3232.0,312255.0,15232746.0,Question,Shannon Cross,,Analysts,45,And that's still on track in terms of timing?,10
266017.0,"Dell Inc., Q1 2013 Earnings Call, May 22, 2012",2012-05-22,48.0,Earnings Calls,Dell Technologies Inc.,3232.0,312255.0,15232747.0,Answer,Michael Dell,,Executives,46,"It's on timing -- it's on track for Microsoft's launch, yes.",12
266017.0,"Dell Inc., Q1 2013 Earnings Call, May 22, 2012",2012-05-22,48.0,Earnings Calls,Dell Technologies Inc.,3232.0,312255.0,15232748.0,Question and Answer Operator Message,Operator,,Operator,47,We'll take our next question from Aaron Rakers with Stifel Nicolaus.,12
266017.0,"Dell Inc., Q1 2013 Earnings Call, May 22, 2012",2012-05-22,48.0,Earnings Calls,Dell Technologies Inc.,3232.0,312255.0,15232749.0,Question,Aaron Rakers,,Analysts,48,"Most of my questions have been asked, but looking at the product gross margin line, 19.2% from 19.4%, I know that we talked about PC gross margin being down moderately on a sequential basis. Can you help us understand how we should think about product gross margin in the context of both the PC side of this division as well as the ongoing mix shift in the enterprise? Do we maintain a mid-30% implied gross margin on enterprise is kind of where I'm trying to get at, as well the implied 15% to 16% PC gross margin.",97
266017.0,"Dell Inc., Q1 2013 Earnings Call, May 22, 2012",2012-05-22,48.0,Earnings Calls,Dell Technologies Inc.,3232.0,312255.0,15232750.0,Answer,Brian Gladden,,Executives,49,"Well, I think it goes back to -- our overall strategy, clearly, Aaron, will drive faster growth in the higher-margin enterprise part of the business. There are still areas where we're building scale in some of the acquired assets, and you should see gross margins continue to expand there. I think as we move through some of the next generation products here, we would also expect some of those enterprise solutions to have higher margins. So we would expect that will ultimately ride -- rise as we introduce those products and expand that business and grow it faster. On the client side, I think, to be honest, we feel like we're in a good cost position, and we feel like we're in a place where we can manage that for-profit, and that's how we'll do that. That's how we'll run that part of the business.",145
266017.0,"Dell Inc., Q1 2013 Earnings Call, May 22, 2012",2012-05-22,48.0,Earnings Calls,Dell Technologies Inc.,3232.0,312255.0,15232751.0,Question,Aaron Rakers,,Analysts,50,"And then, as a follow-up on the storage side, you basically have now anniversary-ed your acquisition of Compellent. How do we think about that as you fully effectively as well burnt off the EMC side of the business there? How do we think about the growth in that division as the comps start to get a little bit tougher on a year-over-year basis?",63
266017.0,"Dell Inc., Q1 2013 Earnings Call, May 22, 2012",2012-05-22,48.0,Earnings Calls,Dell Technologies Inc.,3232.0,312255.0,15232752.0,Answer,Brian Gladden,,Executives,51,"Well, I think they get tougher, but they get easier too. I mean, we had, in the quarter, a total of less than $25 million of EMC revenue. So for all intents and purposes, I think we've burnt through the headwinds associated with that for the total storage measurement for all of the storage business. So we would expect to see continued strong growth, double-digit growth clearly in Compellent and the EqualLogic businesses as we move forward. And over the next couple of quarters, I think that will translate into the total storage business growing at double digits.",98
266017.0,"Dell Inc., Q1 2013 Earnings Call, May 22, 2012",2012-05-22,48.0,Earnings Calls,Dell Technologies Inc.,3232.0,312255.0,15232753.0,Answer,Michael Dell,,Executives,52,Yes. We're seeing a strong pipeline in storage and feel very good about the product line that we have there.,20
266017.0,"Dell Inc., Q1 2013 Earnings Call, May 22, 2012",2012-05-22,48.0,Earnings Calls,Dell Technologies Inc.,3232.0,312255.0,15232754.0,Question and Answer Operator Message,Operator,,Operator,53,We'll take our next question from Brian Marshall with ISI Group.,12
266017.0,"Dell Inc., Q1 2013 Earnings Call, May 22, 2012",2012-05-22,48.0,Earnings Calls,Dell Technologies Inc.,3232.0,312255.0,15232755.0,Question,Brian Marshall,,Analysts,54,"Brian, with respect to the 3 reasons you cited for the revenue disappointment in the April quarter, I was wondering if you could talk a little bit more in terms of granularity with respect to how much of that was associated with kind of walking away from some of that low-margin business. With the revenue disappointment, we'll assume that if that were a significant portion of it, that we would actually see margins a little bit better than 7% on a pro forma operating basis. Then I've got a follow-up as well.",92
266017.0,"Dell Inc., Q1 2013 Earnings Call, May 22, 2012",2012-05-22,48.0,Earnings Calls,Dell Technologies Inc.,3232.0,312255.0,15232756.0,Answer,Brian Gladden,,Executives,55,"Yes, Brian, I think there were really 2 areas where we would talk about pruning activities in the quarter. Clearly, in the software and peripherals business, that was down 7% in the quarter. As we've said a couple of times, that's probably the biggest area where you'll continue to see us do that. Some of that, to be honest, as we acquire IP and build our own intellectual property, there are parts of that business where we want to sell our own stuff that's going to have much higher margins. There are other parts of the business that will continue to be unattractive in the grand scale of the overall portfolio that will continue to shrink. I think the second one is really in the Consumer business. And if you think about the overall growth that we saw there or the lack of growth was really driven by us making conscious decisions not to participate in business. So I would isolate those 2 areas in terms of the big impact on revenue.",172
266017.0,"Dell Inc., Q1 2013 Earnings Call, May 22, 2012",2012-05-22,48.0,Earnings Calls,Dell Technologies Inc.,3232.0,312255.0,15232757.0,Question,Brian Marshall,,Analysts,56,"Okay. And then, with respect to the pace of M&A going forward, is it safe to assume that we should expect that to slow down a little bit here? And if so, kind of the similar size deals going forward?",40
266017.0,"Dell Inc., Q1 2013 Earnings Call, May 22, 2012",2012-05-22,48.0,Earnings Calls,Dell Technologies Inc.,3232.0,312255.0,15232758.0,Answer,Brian Gladden,,Executives,57,"Yes. Not really going to provide an outlook in terms of M&A activity. As you think about over the last 3 years, we've had a relatively steady pace of activity there, and I think that's -- clearly, one of the elements of our growth strategy will be to continue to do that. But we feel good about the 5 that we announced in the quarter, and we've closed 3 of those thus far. We have 2 more, and we think they're very, very good and additive to the portfolio.",89
266017.0,"Dell Inc., Q1 2013 Earnings Call, May 22, 2012",2012-05-22,48.0,Earnings Calls,Dell Technologies Inc.,3232.0,312255.0,15232759.0,Question and Answer Operator Message,Operator,,Operator,58,We'll take our next question from Kulbinder Garcha with Credit Suisse.,12
266017.0,"Dell Inc., Q1 2013 Earnings Call, May 22, 2012",2012-05-22,48.0,Earnings Calls,Dell Technologies Inc.,3232.0,312255.0,15232760.0,Question,Kulbinder Garcha,,Analysts,59,A question for Brian really about the second half of the year. I appreciate you're not providing full year guidance anymore. But can you just on a high-level -- or maybe Michael could speak about half-over-half drivers. I get the server business seeing a refresh. You guys don't seem too convinced about Windows 8 having a meaningful impact immediately at least this fiscal year. Is there an impact of acquisitions that you're  counting on? I'm just trying to understand what can really change the second half apart from a better macro and server business for you guys?,97
266017.0,"Dell Inc., Q1 2013 Earnings Call, May 22, 2012",2012-05-22,48.0,Earnings Calls,Dell Technologies Inc.,3232.0,312255.0,15232761.0,Answer,Brian Gladden,,Executives,60,"Yes, look, I think the combined impact of the 5 acquisitions that we've announced is relatively small. For the total year, it probably contributes in the order of 1% growth in revenue, that clearly, assuming we can close the deals, will happen and contribute. The server business, we should see a pickup as a result of the launch of the next-generation products, and we would expect to see that move into the second quarter. I think other than that, clearly, there's Windows 8 dynamic, but that's much more of a Consumer business impact relatively late in the year but won't necessarily impact our overall commercial business.",106
266017.0,"Dell Inc., Q1 2013 Earnings Call, May 22, 2012",2012-05-22,48.0,Earnings Calls,Dell Technologies Inc.,3232.0,312255.0,15232762.0,Question,Kulbinder Garcha,,Analysts,61,"Okay, great. I guess just one thing on the whole sales force productivity and everything else that you guys are trying to push through and maybe a question for Michael. Are you thinking that this may be -- I know you have very lean OpEx already, but is there any way to actually lower the cost base even further you think as you go through this process?",67
266017.0,"Dell Inc., Q1 2013 Earnings Call, May 22, 2012",2012-05-22,48.0,Earnings Calls,Dell Technologies Inc.,3232.0,312255.0,15232763.0,Answer,Michael Dell,,Executives,62,"You kind of broke up, Kulbinder, in that last -- any way to what?",14
266017.0,"Dell Inc., Q1 2013 Earnings Call, May 22, 2012",2012-05-22,48.0,Earnings Calls,Dell Technologies Inc.,3232.0,312255.0,15232764.0,Question,Kulbinder Garcha,,Analysts,63,Can you lower the cost base or on the OpEx side going forward during the sales force productivity process you're going through?,23
266017.0,"Dell Inc., Q1 2013 Earnings Call, May 22, 2012",2012-05-22,48.0,Earnings Calls,Dell Technologies Inc.,3232.0,312255.0,15232765.0,Answer,Brian Gladden,,Executives,64,"Well, I'll take a first crack at that. I mean, I think there are parts of our cost structure that clearly are variable. In a lower-revenue environment, clearly, we had variable sales compensation that was impacted in the quarter and that shows up. I think there are other places where we're clearly going to stick to the strategy and continue to make investments that drive the long-term transformation of the business.",71
266017.0,"Dell Inc., Q1 2013 Earnings Call, May 22, 2012",2012-05-22,48.0,Earnings Calls,Dell Technologies Inc.,3232.0,312255.0,15232766.0,Answer,Michael Dell,,Executives,65,"Well, yes. I mean, we do see productivity potential on a per-sales maker  basis that we will leverage throughout the year, so we believe they underperformed to their capacity this quarter. So we're not expecting to have to add to get to this revenue growth. We think we can leverage the resources we have if we better utilize them and put -- from the points I made earlier.",68
266017.0,"Dell Inc., Q1 2013 Earnings Call, May 22, 2012",2012-05-22,48.0,Earnings Calls,Dell Technologies Inc.,3232.0,312255.0,15232767.0,Question and Answer Operator Message,Operator,,Operator,66,We'll take our next question from Mark Moskowitz with JPMorgan.,11
266017.0,"Dell Inc., Q1 2013 Earnings Call, May 22, 2012",2012-05-22,48.0,Earnings Calls,Dell Technologies Inc.,3232.0,312255.0,15232768.0,Question,Mark Moskowitz,,Analysts,67,"This question is either for Steve or Michael. The SMB revenue and operating margin held up fairly well relative to the other segments. The question really is, is this a function of Dell maybe having greater early success with your value-add solution sale? And if this is the case, how long will it take to replicate in the Larger Enterprise business or Public?",63
266017.0,"Dell Inc., Q1 2013 Earnings Call, May 22, 2012",2012-05-22,48.0,Earnings Calls,Dell Technologies Inc.,3232.0,312255.0,15232769.0,Answer,Brian Gladden,,Executives,68,"Well, you hit it on the head, I believe. I mean, if you really look at this, the amount of complexity and change has probably been the least in the SMB space because the sales motion is simpler. Even when you're selling a more sophisticated solution, you're usually dealing with one person on the other end of the selling chain here. So it's typically a one-to-one relationship and you bring experts in as required. As we move into these much larger spaces, it's definitely a longer sales cycle. You're dealing with more constituents, it's a longer process. And I think we're still feeling our way through that. And so that's why we do have confidence that what we're building here is definitely scalable. We just got to get refinement in it to make sure we're doing it the right way.",140
266017.0,"Dell Inc., Q1 2013 Earnings Call, May 22, 2012",2012-05-22,48.0,Earnings Calls,Dell Technologies Inc.,3232.0,312255.0,15232770.0,Answer,Michael Dell,,Executives,69,"Yes. And the results clearly point to that, and if you look at the enterprise solutions and services and SMB, we're up 17%. It was led by services, which were up 23% in SMB, and we're bolstering the kind of offerings that those customers will latch onto quickly in backup, replication, network security with the SonicWALL acquisition. So we're feeling confident in our ability to expand that part of the business.",71
266017.0,"Dell Inc., Q1 2013 Earnings Call, May 22, 2012",2012-05-22,48.0,Earnings Calls,Dell Technologies Inc.,3232.0,312255.0,15232771.0,Question,Mark Moskowitz,,Analysts,70,"Okay. And then, my follow-up is really just around the Large Enterprise commentary earlier, Brian, in terms of the delayed IT spending that you talked about or deferrals. Can you provide us some more details just on the timing? When does this manifest? Was that just in the month of April and is that continuing? And what's kind of the breadth? I mean, is this just targeting PCs? Or is it servers, networking, security, even outside of your own business, are you hearing about other parts of software being impacted as well?",92
266017.0,"Dell Inc., Q1 2013 Earnings Call, May 22, 2012",2012-05-22,48.0,Earnings Calls,Dell Technologies Inc.,3232.0,312255.0,15232772.0,Answer,Brian Gladden,,Executives,71,"Yes, I can take that one. And the reason we said that was because we did see healthy pipeline building going on throughout the quarter and then, we did see it slip. So as the quarter went by, so yes, in April, we thought we would convert a lot more business. But we did see it slip, but we didn't see the pipelines go away. The pipelines remain healthy. And we have lots of anecdotes of customers just saying they're cautious, they're trying to spread out their budget and things like that. So we had enough evidence of that to feel like this is a bit of a pattern going on. The pipeline remains healthy. We are seeing some conversion happen, so these things aren't going away, and that's why we're trying to be patient here. It did happen across the board. It wasn't just notebooks. As good as our storage business was, we probably could've even done better in storage based on the pipeline that we have. So I think it's a broad-based budget concerns by customers, and we're watching this on a month-to-month basis.",186
266017.0,"Dell Inc., Q1 2013 Earnings Call, May 22, 2012",2012-05-22,48.0,Earnings Calls,Dell Technologies Inc.,3232.0,312255.0,15232773.0,Answer,Michael Dell,,Executives,72,"Yes. And as we mentioned earlier, we first looked to our own execution. We see opportunities to improve there, but we tend to be closer to the action in terms of customer spending. I can tell you, my own interactions with larger customers, we are seeing kind of delay and pause in spending activity. But the pipelines are healthy, and we're very focused on bringing that business to closure.",69
266017.0,"Dell Inc., Q1 2013 Earnings Call, May 22, 2012",2012-05-22,48.0,Earnings Calls,Dell Technologies Inc.,3232.0,312255.0,15232774.0,Question and Answer Operator Message,Operator,,Operator,73,We'll take our next question from Keith Bachman with Bank of Montréal.,13
266017.0,"Dell Inc., Q1 2013 Earnings Call, May 22, 2012",2012-05-22,48.0,Earnings Calls,Dell Technologies Inc.,3232.0,312255.0,15232775.0,Question,Keith Bachman,,Analysts,74,"Two questions, please. First, I wanted to get your take on the Windows 8 impact on the Consumer business. And the area I was hoping you could address are mix. How do you think the mix, let's say, tablets versus Ultrabooks will unfold? An then, also on Consumer behavior, with consumers having to get used to or acclimated to the Metro interface and the applications that may or may not be supported leading to also the potential impact of Windows 8 on margins, if you do have more tablets and/or higher-cost touchscreen notebooks, how that might impact your margins. And then I have a follow-up, please.",106
266017.0,"Dell Inc., Q1 2013 Earnings Call, May 22, 2012",2012-05-22,48.0,Earnings Calls,Dell Technologies Inc.,3232.0,312255.0,15232776.0,Answer,Michael Dell,,Executives,75,"Well, those are great questions. I don't think we have all the answers to those questions. But what I can tell you is that we think that the touchscreen products will certainly cost more. They're more in the price points and price bands that we tend to operate in. We will have a full complement of products around the time of Windows 8 being announced and available. We think there will be -- unlike other Windows transitions, this is a transition where you generally are going to need a new PC, whether it's a tablet or an Ultrabook with touch or a notebook with touch or a PC with touch or some derivative hybrid of all of the above type of products, the product refresh cycle associated with this release of Windows is likely to be very different from other releases. But it's hard to know exactly what that looks like. We're preparing a full complement of products, and we'll be ready with those, as we said earlier, at the time of the Windows 8 release.",176
266017.0,"Dell Inc., Q1 2013 Earnings Call, May 22, 2012",2012-05-22,48.0,Earnings Calls,Dell Technologies Inc.,3232.0,312255.0,15232777.0,Question,Keith Bachman,,Analysts,76,"Okay, fair enough then. My follow-up is on the services side. If I look at the breakout, infrastructure and cloud and applications and BPO were, add them together, roughly flat, and support was still up nicely. How should we be thinking about if unit growth slows here, it indeed has slowed, the combined growth rate of services as we look out over the next couple of quarters, given what I just mentioned that 2 of the buckets look like the revenue categories are running about flat, and unit growth, I would think, was slow the support and deployment. But any kind of color on the aggregate growth rate of services would be helpful.",113
266017.0,"Dell Inc., Q1 2013 Earnings Call, May 22, 2012",2012-05-22,48.0,Earnings Calls,Dell Technologies Inc.,3232.0,312255.0,15232778.0,Answer,Brian Gladden,,Executives,77,"Yes, Keith, on the support side, I mean, we've been living with a lower unit growth environment for a while. The team has done a very good job of driving growth in that business with improved attach rates, as well as just execution. I would also say that as you think about infrastructure cloud, security apps, BPO, these are places we're making investments today. We're doing, in some cases, some pruning in those businesses to improve profitability. We've seen that actually happen. And I would say that, that's the place that we would expect to see increasing growth as we move forward.",102
266017.0,"Dell Inc., Q1 2013 Earnings Call, May 22, 2012",2012-05-22,48.0,Earnings Calls,Dell Technologies Inc.,3232.0,312255.0,15232779.0,Question and Answer Operator Message,Operator,,Operator,78,We'll now take our final question from Ananda Baruah with Brean Murray.,13
266017.0,"Dell Inc., Q1 2013 Earnings Call, May 22, 2012",2012-05-22,48.0,Earnings Calls,Dell Technologies Inc.,3232.0,312255.0,15232780.0,Question,Ananda Baruah,,Analysts,79,"Brian, just going back to gross margin. If I sort of wrap all your comments together, it actually sounds like you feel pretty good about where you stand with regards to the margins at this point in the year relative to your expectations. I guess, you mentioned you're getting pressured by PC ASPs obviously. But you said you actually think components feel maybe a little bit better than they did 3 months ago, and Enterprise should help you as go through the year. So is that an accurate assessment of your comments, I guess? And if so, should we actually still expect your margins to improve as you move through the year on the gross margin side?",117
266017.0,"Dell Inc., Q1 2013 Earnings Call, May 22, 2012",2012-05-22,48.0,Earnings Calls,Dell Technologies Inc.,3232.0,312255.0,15232781.0,Answer,Brian Gladden,,Executives,80,"Yes, I think Ananda, you hit some of the tailwinds that I think should help here. Clearly, the mix of the business and driving stronger growth in enterprise solutions and services has to be a key element of the story. The biggest challenge or the new dynamic that we're facing into is really client pricing and the competitiveness that we see there. So if we can balance those things as we move forward, we would expect to see gross margins relatively stable or improving.",84
266017.0,"Dell Inc., Q1 2013 Earnings Call, May 22, 2012",2012-05-22,48.0,Earnings Calls,Dell Technologies Inc.,3232.0,312255.0,15232782.0,Question,Ananda Baruah,,Analysts,81,"And just a follow-up, if I could. Have you gotten a sense -- pretty clear, you guys walked away from some lower-end business on the PC side. Do you have any sense of how you did relative to the market in the midrange and higher end PC ASP bands that you're focused on?",54
266017.0,"Dell Inc., Q1 2013 Earnings Call, May 22, 2012",2012-05-22,48.0,Earnings Calls,Dell Technologies Inc.,3232.0,312255.0,15232783.0,Answer,Brian Gladden,,Executives,82,"Yes. We think we fared well in the mid and high-priced band. One good example is we know we're doing really well with our XPS 13, our first Ultrabook. We know we're taking a lot of share with that, and I think even if you look at some industry data like what's selling in retail in the U.S., you'll see those results. So we think we're faring well there. And in certain geographies, we know we're holding our own. So where we are losing share, it's in places where the profitability is very low.",94
266017.0,"Dell Inc., Q1 2013 Earnings Call, May 22, 2012",2012-05-22,48.0,Earnings Calls,Dell Technologies Inc.,3232.0,312255.0,15232784.0,Question and Answer Operator Message,Operator,,Operator,83,I will now turn the call over to Mr. Williams for closing remarks.,13
266017.0,"Dell Inc., Q1 2013 Earnings Call, May 22, 2012",2012-05-22,48.0,Earnings Calls,Dell Technologies Inc.,3232.0,312255.0,15232785.0,Answer,Robert Williams,,Executives,84,Thank you. I don't have any closing remarks.,8
266017.0,"Dell Inc., Q1 2013 Earnings Call, May 22, 2012",2012-05-22,48.0,Earnings Calls,Dell Technologies Inc.,3232.0,312255.0,15232786.0,Question and Answer Operator Message,Operator,,Operator,85,"This concludes today's conference call. We appreciate your participation, and you may disconnect at this time.",17
266017.0,"Dell Inc., Q2 2013 Earnings Call, Aug 21, 2012",2012-08-21,48.0,Earnings Calls,Dell Technologies Inc.,3081.0,349738.0,16898891.0,Presentation Operator Message,Operator,,Operator,0,"Good afternoon, and welcome to the Dell Inc. Second Quarter Fiscal Year 2013 Earnings Conference Call. I'd like to inform all participants this call is being recorded at the request of Dell. This broadcast is the copyrighted property of Dell Inc. Any rebroadcast of this information in whole or part without the prior written permission of Dell Inc. is prohibited. As a reminder, Dell is also simulcasting this presentation with slides at www.dell.com/investor. [Operator Instructions] I'd like to turn the call over to Rob Williams, head of Investor Relations. Mr. Williams, you may begin.",94
