companyid,headline,mostimportantdateutc,keydeveventtypeid,keydeveventtypename,companyname,audiolengthsec,transcriptid,transcriptcomponentid,transcriptcomponenttypename,transcriptpersonname,companyofperson,speakertypename,componentorder,componenttext,word_count
18749.0,"Amazon.com, Inc., Q2 2018 Earnings Call, Jul 26, 2018",2018-07-26,48.0,Earnings Calls,"Amazon.com, Inc.",1899.0,1511734.0,59787637.0,Answer,Dave Fildes,,Executives,28,"Yes, this is Dave. Just quickly on Music, as you mentioned, tens of millions of paid customers are enjoying Amazon Music. When you look at the Amazon Music Unlimited subscription, it continues to grow very quickly. We've got those offerings in more than 30 countries now, and the catalog, there's tens of millions of songs, and a lot of rich playlists, personalized stations, those kinds of things. Of course, we started in Music with Prime Music a little bit earlier in that space, and I think that's been a great way for Prime members to enjoy some of that catalog for free, and then as they enjoy that, be able to move into the Amazon Music Unlimited scale. One of the great things that's also part of that, I think, you alluded to is just Alexa, and one of the most popular features we see, as you probably imagine, for using those devices or just interacting with Alexa wherever you may be is being able to listen to music, so that's proven to be, I think, a good skill for folks to be able to enjoy, in addition to a really kind of rich and growing Amazon skill set. We now have more than 45,000 skills available to customers.",209
18749.0,"Amazon.com, Inc., Q2 2018 Earnings Call, Jul 26, 2018",2018-07-26,48.0,Earnings Calls,"Amazon.com, Inc.",1899.0,1511734.0,59787638.0,Question and Answer Operator Message,Operator,,Operator,29,Our next question comes from Youssef Squali with SunTrust Robinson Humphrey.,11
18749.0,"Amazon.com, Inc., Q2 2018 Earnings Call, Jul 26, 2018",2018-07-26,48.0,Earnings Calls,"Amazon.com, Inc.",1899.0,1511734.0,59787639.0,Question,Youssef Squali,,Analysts,30,"On the new Supreme Court decision, you guys have been collecting state taxes in all 45 states where it's applicable for 1P. And for 3P, I think it was in 2 states. Have you seen any slowdown to growth in these 2 states since you began collecting taxes? I think you started maybe last 12 months or so. When will you start collecting taxes in the rest of the other -- in the rest of the country? And will you charge for it? Because my understanding is that in those 2 states, you do not collect or you do not charge to help these 3P sellers file taxes or collect state taxes.",112
18749.0,"Amazon.com, Inc., Q2 2018 Earnings Call, Jul 26, 2018",2018-07-26,48.0,Earnings Calls,"Amazon.com, Inc.",1899.0,1511734.0,59787640.0,Answer,Dave Fildes,,Executives,31,"Yes, hey, Youssef, this is Dave. So right now, as you mentioned, 45 states that have state-imposed sales tax, first-party products, we do our own collection on that. For 3P sellers, right now, it's 3 states. So Washington State started as of January 1, Pennsylvania as of April 1, and most recently, Oklahoma on July 1. So those are the ones where we're collecting in and remitting. We haven't said -- and to your second point, we've not talked about any kind of trends. As you imagine, some of these are still really early days.",95
18749.0,"Amazon.com, Inc., Q2 2018 Earnings Call, Jul 26, 2018",2018-07-26,48.0,Earnings Calls,"Amazon.com, Inc.",1899.0,1511734.0,59787641.0,Question and Answer Operator Message,Operator,,Operator,32,Our final question comes from Jason Helfstein with Oppenheimer & Co.,10
18749.0,"Amazon.com, Inc., Q2 2018 Earnings Call, Jul 26, 2018",2018-07-26,48.0,Earnings Calls,"Amazon.com, Inc.",1899.0,1511734.0,59787642.0,Question,Jason Helfstein,,Analysts,33,"Given the focus in the press release about Alexa Voice Services, any thoughts about how you would monetize on third-party devices? And then just a follow-up, Amazon Prime Video channels, any plans to offer standard skinny bundles to become a cable replacement thing?",43
18749.0,"Amazon.com, Inc., Q2 2018 Earnings Call, Jul 26, 2018",2018-07-26,48.0,Earnings Calls,"Amazon.com, Inc.",1899.0,1511734.0,59787643.0,Answer,Brian Olsavsky,,Executives,34,"Yes, let me start with Alexa. So right now, our emphasis is around expanding the reach of Alexa and the usefulness. So as Dave mentioned, we're now up over 45,000 skills. We have a developer network that's expanded, and we have over 13,000 smart home devices from 2,500 unique brands. You're seeing things like expansion into the hotel space, where we're partnering with hotels to allow you to experience Alexa while you're traveling. And you saw from the quote that was in our press release that Jeff -- from Jeff, the number of Alexa-enabled devices has tripled in the past year, including some really large companies like Polk, Sonos, Acer, Hewlett-Packard, Lenovo, BMW, Ford, Toyota, to name a few. So that's the biggest emphasis, is getting the expansion of Alexa to places where it can be useful. We also are developing new machine learning tools to help developers more easily build Alexa skills. We feel like we're getting great traction there. So I think your original question was about monetization of Alexa, but right now, the biggest thing we can do is to make it as useful as possible and make devices that can use the skills.",197
18749.0,"Amazon.com, Inc., Q2 2018 Earnings Call, Jul 26, 2018",2018-07-26,48.0,Earnings Calls,"Amazon.com, Inc.",1899.0,1511734.0,59787644.0,Answer,Dave Fildes,,Executives,35,"Yes, and then just on the second question, I mean, I can't speculate on what we might do in the future, but I'd say today, with Prime channels, I think we're very pleased with the growth we're seeing. We've seen some good channels come online over the last few quarters and have seen some good traction there. So we'll keep focusing on building out even better selection because it's clear to us that customers want that option to be able to add that content as part of their Prime memberships.
Thanks for joining us today on the call and for your questions. A replay will be available on our Investor Relations website at least through the end of the quarter. We appreciate your interest in Amazon and look forward to talking with you again next quarter.",136
18749.0,"Amazon.com, Inc., Q3 2018 Earnings Call, Oct 25, 2018",2018-10-25,48.0,Earnings Calls,"Amazon.com, Inc.",1869.0,1580659.0,62368705.0,Presentation Operator Message,Operator,,Operator,0,"Thank you for standing by. Good day, everyone, and welcome to the Amazon.com Q3 2018 Financial Results Teleconference. [Operator Instructions] Today's call is being recorded. 
For opening remarks, I will be turning the call over to the Director of Investor Relations, Dave Fildes. Please go ahead.",46
18749.0,"Amazon.com, Inc., Q3 2018 Earnings Call, Oct 25, 2018",2018-10-25,48.0,Earnings Calls,"Amazon.com, Inc.",1869.0,1580659.0,62368706.0,Presenter Speech,Dave Fildes,,Executives,1,"Hello, and welcome to our Q3 2018 financial results conference call. Joining us today to answer your questions is Brian Olsavsky, our CFO. 
As you listen to today's conference call, we encourage you to have our press release in front of you, which includes our financial results as well as metrics and commentary on the quarter. 
Please note, unless otherwise stated, all comparisons in this call will be against our results for the comparable period of 2017. Our comments and responses to your questions reflect management's views as of today, October 25, 2018, only and will include forward-looking statements. Actual results may differ materially. Additional information about factors that could potentially impact our financial results is included in today's press release and our filings with the SEC, including our most recent annual report on Form 10-K and subsequent filings. 
During this call, we may discuss certain non-GAAP financial measures in our press release, slides accompanying this webcast and our filings with the SEC, each of which is posted on our IR website. You will find additional disclosures regarding these non-GAAP measures, including reconciliations of these measures with comparable GAAP measures. 
Our guidance incorporates the order trends that we've seen to date and what we believe today to be appropriate assumptions. Our results are inherently unpredictable and may be materially affected by many factors, including fluctuations in foreign exchange rates, changes in global economic conditions and customer spending, world events, the rate of growth of the Internet, online commerce and cloud services, and the various factors detailed in our filings with the SEC. 
Our guidance also assumes, among other things, that we don't conclude any additional business acquisitions, investments, restructurings or legal settlements. It's not possible to accurately predict demand for our goods and services, and therefore, our actual results could differ materially from our guidance. 
With that, we'll move to Q&A. Operator, please remind our listeners how to initiate a question.",321
18749.0,"Amazon.com, Inc., Q3 2018 Earnings Call, Oct 25, 2018",2018-10-25,48.0,Earnings Calls,"Amazon.com, Inc.",1869.0,1580659.0,62368707.0,Question and Answer Operator Message,Operator,,Operator,2,[Operator Instructions] Our first question comes from the line of Justin Post with Merrill Lynch.,15
18749.0,"Amazon.com, Inc., Q3 2018 Earnings Call, Oct 25, 2018",2018-10-25,48.0,Earnings Calls,"Amazon.com, Inc.",1869.0,1580659.0,62368708.0,Question,Justin Post,,Analysts,3,"I guess the big one is the deceleration in unit growth or online stores which is probably related to that. I know it's a tough Q3 comp, but could you comment a little bit about that? And then kind of what initiatives could be most interesting to maybe reaccelerate that over the next couple of years, what categories?",58
18749.0,"Amazon.com, Inc., Q3 2018 Earnings Call, Oct 25, 2018",2018-10-25,48.0,Earnings Calls,"Amazon.com, Inc.",1869.0,1580659.0,62368709.0,Answer,Brian Olsavsky,,Executives,4,"Thank you, Justin. Yes, let me just remind you a couple of things from last year. We had 2 reductions on our super saver shipping threshold in the first half of the year between February and May. That did spur a lot of unit growth in the second and third quarter. We also have issue with digital content -- not an issue, but the fact that digital content is moving to subscriptions, Amazon Music Unlimited and Kindle Unlimited, in particular. It's been really popular. I'll just remind you just the units, those do not count in our unit totals nor do the units from Whole Foods Market. So yes, I would say, essentially with that backdrop, we're still very encouraged by the demand and the reception from customers. On the consumer side, we have -- Amazon-fulfilled units are still growing faster than paid units. 3P is now up to 53% of total paid units. In-stock is very strong, especially as we head into the holiday period. I think we're well positioned for the holiday. We have over 100 million Prime-eligible items available for free 2-day shipping for Prime members. And again, all -- a lot of -- when I'm talking about the unit deceleration, a lot of the fastest-growing areas, things like subscription services, AWS and advertising, are not caught in that metric.",223
18749.0,"Amazon.com, Inc., Q3 2018 Earnings Call, Oct 25, 2018",2018-10-25,48.0,Earnings Calls,"Amazon.com, Inc.",1869.0,1580659.0,62368710.0,Answer,Dave Fildes,,Executives,5,"Yes. And Justin, this is Dave. Just to add on that, you mentioned the online stores, just a reminder there is a little bit of impact from the revenue recognition. So you see the online stores revenue growing about 11% ex FX, could be up higher than that, but -- for the adoption ad standard. So there's a little bit of a headwind there as well.",66
18749.0,"Amazon.com, Inc., Q3 2018 Earnings Call, Oct 25, 2018",2018-10-25,48.0,Earnings Calls,"Amazon.com, Inc.",1869.0,1580659.0,62368711.0,Question and Answer Operator Message,Operator,,Operator,6,Our next question comes from the line of Mark Mahaney of RBC Capital Markets.,14
18749.0,"Amazon.com, Inc., Q3 2018 Earnings Call, Oct 25, 2018",2018-10-25,48.0,Earnings Calls,"Amazon.com, Inc.",1869.0,1580659.0,62368712.0,Question,Mark Mahaney,,Analysts,7,"Okay, I was going to also then ask you to drill down a little bit on the international retail business that seemed to slow down, I guess, that -- whatever, 15% or something year-over-year. Any particularly color? Any markets that would've led to that? Though the comp was tougher, but anything else you'd call out there?",56
18749.0,"Amazon.com, Inc., Q3 2018 Earnings Call, Oct 25, 2018",2018-10-25,48.0,Earnings Calls,"Amazon.com, Inc.",1869.0,1580659.0,62368713.0,Answer,Brian Olsavsky,,Executives,8,"Sure. So on a year-over-year basis, I think you have to look at 2 things. We did the Souq acquisition last year in May, so the full pick up on that year-over-year was in 2017, and now, we're lapping that. There's also material change in the Diwali calendar in India. About half of our Diwali sales last year were in Q3. This year, they'll be fully in Q4. So those are a couple of factors that hit the international growth area, particularly. But I'll also point out that we launched Turkey in the quarter, and now we have 17 Amazon websites globally. So we're still very pleased again with the international business, continuing to invest in Prime Benefits, international expansion, as I just mentioned, and we're still seeing very good pick up. Story is different country-by-country, obviously. Some are much further along than others, but overall, we're very happy. India, although Diwali moved into Q4, so far, that's going really well. We've seen great response from customers. We've had 60% growth in new customers during the period. Orders are coming in from 99% of the pin codes in the country. So a great first wave of the -- what we call the Amazon's Great Indian Festival, which leads into Diwali.",210
18749.0,"Amazon.com, Inc., Q3 2018 Earnings Call, Oct 25, 2018",2018-10-25,48.0,Earnings Calls,"Amazon.com, Inc.",1869.0,1580659.0,62368714.0,Question and Answer Operator Message,Operator,,Operator,9,Our next question comes from the line of Douglas Anmuth with JPMorgan.,12
18749.0,"Amazon.com, Inc., Q3 2018 Earnings Call, Oct 25, 2018",2018-10-25,48.0,Earnings Calls,"Amazon.com, Inc.",1869.0,1580659.0,62368715.0,Question,Douglas Anmuth,,Analysts,10,"You had significant operating income upside in 3Q relative to your guide. Could you just talk about the biggest drivers there in terms of out-performance? And then when you think about your 4Q outlook, how should we think about the minimum wage increase that you've talked about? And any other one-time or special items that might be weighing on that operating income outlook?",63
18749.0,"Amazon.com, Inc., Q3 2018 Earnings Call, Oct 25, 2018",2018-10-25,48.0,Earnings Calls,"Amazon.com, Inc.",1869.0,1580659.0,62368716.0,Answer,Brian Olsavsky,,Executives,11,"Sure. Let me start with Q3. And this will be a commentary pretty much on the whole year. That was especially true in Q4. So first of all, we've had very strong growth in some very profitably businesses that we have, most notably AWS and advertising. But we've also had great cost performance this year in 3 specific areas I'll call out. So first, on headcount. If you'll remember, we grew headcount 48% in 2016 and 38% last year, if you adjust for Whole Foods. With Whole Foods, it was 66%. But without Whole Foods, we still grew 38%. We have looked to really leverage our investment from the last couple of years. And as we funded and moved, invested in a lot of new areas, as we've talked about, AWS, devices, digital content, we've had a lot of movement within the company that has filled a lot of these roles. So we're only up 13% on headcount through 9 months year-over-year, so a real step-down in that. Again, the theme here is going to be banking some of the investments from prior years and looking to gain greater control. In the fulfillment center world, we had grown square footage for our fulfillment center and shipping areas by over 30% the last 2 years, 2016 and 2017. I've talked about that in prior calls. It's -- we're making that investment to match up with very strong Fulfilled by Amazon demand and AFN, or Amazon-Fulfilled Network units, that are growing at a faster rate than our paid units. This year, we're only adding about 15% to our square footage. So again, getting better efficiencies on what we have and banking the multi-year investment that we've been making. And the last one which is really significant is on the infrastructure side. You see the operating margin for AWS is up to 31% this quarter. A lot of that is based on efficiencies of our data centers, not only for the AWS business but also for our Amazon consumer businesses, which is AWS' biggest customer. If you look at capital leases, which is where we spend money for the data centers, it's up only 9% year-over-year trailing 12 months, and it was up 69% last year at the end of the year. So those 3 areas have driven a lot of the cost performance and a lot of the deviation from probably the estimates that I've come up with this year. So we are really happy that, again, we're seeing great cost performance in a number of areas across the business.",428
18749.0,"Amazon.com, Inc., Q3 2018 Earnings Call, Oct 25, 2018",2018-10-25,48.0,Earnings Calls,"Amazon.com, Inc.",1869.0,1580659.0,62368717.0,Question and Answer Operator Message,Operator,,Operator,12,Our next question comes from the line of Mark May with Citi.,12
18749.0,"Amazon.com, Inc., Q3 2018 Earnings Call, Oct 25, 2018",2018-10-25,48.0,Earnings Calls,"Amazon.com, Inc.",1869.0,1580659.0,62368718.0,Question,Mark May,,Analysts,13,"A question on AWS. Obviously, in the last few quarters, you've seen accelerating revenue growth. This quarter, 46%. Still quite strong. But dollar and percentage growth did slow. And I'm just kind of curious, are you just reaching a point in terms of law of large numbers, where it will be more difficult to sustain, not only accelerating growth but sustain kind of the 40-plus-percent growth levels where we've been recently? Or was there something else going on kind of in the quarter that maybe drove that?",87
18749.0,"Amazon.com, Inc., Q3 2018 Earnings Call, Oct 25, 2018",2018-10-25,48.0,Earnings Calls,"Amazon.com, Inc.",1869.0,1580659.0,62368719.0,Answer,Brian Olsavsky,,Executives,14,"No -- yes, thanks for your question. This growth rate's going to bounce around. We've had sequential increase in growth rate the last prior 3 quarters, I believe, it was. This quarter is slightly down, but still, 46% growth is very strong. We are at an annualized run rate above $26 billion, and that was about $18 billion this time last year. So we're very happy with the growth in the business, the momentum that we're seeing with enterprise customers. So -- and let me mention, on the cost side, it's been a very good year from gaining greater efficiencies in our infrastructure costs.",104
18749.0,"Amazon.com, Inc., Q3 2018 Earnings Call, Oct 25, 2018",2018-10-25,48.0,Earnings Calls,"Amazon.com, Inc.",1869.0,1580659.0,62368720.0,Question and Answer Operator Message,Operator,,Operator,15,Our next question comes from the line of Brian Nowak with Morgan Stanley.,13
18749.0,"Amazon.com, Inc., Q3 2018 Earnings Call, Oct 25, 2018",2018-10-25,48.0,Earnings Calls,"Amazon.com, Inc.",1869.0,1580659.0,62368721.0,Question,Brian Nowak,,Analysts,16,"I have 2. The first one, the fourth quarter revenue guide and the fourth quarter revenue deceleration, maybe can you just help us understand a little bit any of the specific categories or countries that have been the largest contributors to revenue growth throughout the course of this year? And which of those are really slowing down sort of driving this potential deceleration that you're guiding to? Then the second one, you've applied robotics to the warehouses now around Kiva. Curious of your thoughts about the need or desire to invest in autonomous driving technologies as you think about some of the other retailers partnering with Waymo and other players, et cetera.",112
18749.0,"Amazon.com, Inc., Q3 2018 Earnings Call, Oct 25, 2018",2018-10-25,48.0,Earnings Calls,"Amazon.com, Inc.",1869.0,1580659.0,62368722.0,Answer,Brian Olsavsky,,Executives,17,"Sure. Let me talk about guidance. So our guidance for the fourth quarter implies 10% to 20% growth. It includes an 80 basis point unfavorable impact from foreign exchange. I wouldn't point to any specific country. Once you adjust for the fact that Whole Foods -- it was purchased in August of last year, and that has impacted every quarter since then. Q4 will be -- the first solid non-Whole Foods comp since before we bought them in Q2 of -- since Q2 of last year. So if you -- even factoring that in. We're looking at Q4 and -- we often have very high error bars on the quarter. Much of our -- not only our revenue for the quarter but also for the year comes in that very tight window between middle of November and the end of the year. So it's always a very difficult period for us to estimate. What I would say is that we feel like we're in great shape for the holiday. The warehouses are very clean. We feel like we're going to have great capacity, not only for retail products but also for FBA. We're going to have great capacity for shipping to our customers. So we're very ready to go. Selection should be at its highest point, especially for Prime members. So we're very bullish on the fourth quarter. We'll just have to see how revenue comes in. I will say there's one housekeeping item on Prime revenue recognition that you should be aware of and may have -- remember it from prior quarters. This year, we took Prime subscription revenue and amortized it over the quarters on a straight-line method. Previously, we had done it on a -- it's tilted more to Q4, was based more on shipping units. So what you've seen is a push of revenue and income from Q4 into Q1, 2 and 3 that we've mentioned on each call. This is the quarter where that will reverse. That is, to scale it for you, under the old methodology, we would have had $300 million more of both revenue and operating income in the quarter. That has, again, been caught up for in prior quarters. But again, not a huge factor on the growth rate for revenue, but just another item to consider. On the robotics, I don't have much to say on autonomous driving. We are putting most of our efforts right now -- continue to -- into our robotics program. We think it's been a great addition to our fulfillment capacity. It makes the jobs in our warehouse that much better. It makes the people around the robots that much more productive. It allows us to have much greater density of product storage and a number of other benefits. It has some additional capital intensity, but it has good return on invested capital from our standpoint.",481
18749.0,"Amazon.com, Inc., Q3 2018 Earnings Call, Oct 25, 2018",2018-10-25,48.0,Earnings Calls,"Amazon.com, Inc.",1869.0,1580659.0,62368723.0,Question and Answer Operator Message,Operator,,Operator,18,Our next question comes from the line of Eric Sheridan with UBS.,12
18749.0,"Amazon.com, Inc., Q3 2018 Earnings Call, Oct 25, 2018",2018-10-25,48.0,Earnings Calls,"Amazon.com, Inc.",1869.0,1580659.0,62368724.0,Question,Eric Sheridan,,Analysts,19,"With a lot of offline retailers talking more about omnichannel, I wanted to understand some of the investments you might be making around unifying the efforts with Whole Foods and Amazon Prime Now, speeding up delivery, giving consumers as much choice as possible and moving SKUs closer to households. How should we be thinking about that push in '19 and '20 and how that might open up new areas of wallet share for the company?",75
18749.0,"Amazon.com, Inc., Q3 2018 Earnings Call, Oct 25, 2018",2018-10-25,48.0,Earnings Calls,"Amazon.com, Inc.",1869.0,1580659.0,62368725.0,Answer,Brian Olsavsky,,Executives,20,"Sure. Yes, I think we started to show our strategy on the Whole Foods side. You'll see, even in this quarter, we started to have greater expansion of our grocery delivery out of Whole Foods using Prime Now. We're now in 60 cities that's -- in the U.S. giving customers delivery in as fast as an hour, thousands of great organic products from Whole Foods. We've also expanded grocery pick up, and that's available in 10 cities, so the customers can pick up at the Whole Foods store. You'll see that we've started to tie Whole Foods into Alexa. You can order -- you can build your cart using Alexa and then checkout using the Prime Now app. So there's going to be a lot of, as you say, omnichannel overlap, especially in the grocery business. On the storefront, we're also, as you can see, experimenting with numerous store formats. Amazon Go is now up to 6 stores. We opened 5 in the quarter. We're getting great feedback on that. Customers love the ability to quickly walk in, select items they want and leave without waiting in a checkout line. We opened up an Amazon 4-star location in New York City, where we're going to test the concept of a highly curated selection of top categories across Amazon. We, of course, have Amazon bookstores, 18 bookstores in the U.S. So we're going to experiment with multiple ways of reaching the customer wherever they happen to be.",246
18749.0,"Amazon.com, Inc., Q3 2018 Earnings Call, Oct 25, 2018",2018-10-25,48.0,Earnings Calls,"Amazon.com, Inc.",1869.0,1580659.0,62368726.0,Question and Answer Operator Message,Operator,,Operator,21,Our next question comes from the line of Ross Sandler with Barclays.,12
