companyid,headline,mostimportantdateutc,keydeveventtypeid,keydeveventtypename,companyname,audiolengthsec,transcriptid,transcriptcomponentid,transcriptcomponenttypename,transcriptpersonname,companyofperson,speakertypename,componentorder,componenttext,word_count
18749.0,"Amazon.com, Inc., Q4 2017 Earnings Call, Feb 01, 2018",2018-02-01,48.0,Earnings Calls,"Amazon.com, Inc.",1994.0,1379289.0,55129758.0,Answer,Brian Olsavsky,,Executives,25,"Yes. And on new businesses or expansion of categories, as you discussed, I would not talk to anything that's not been publicly announced, but on some of the ones you mentioned, they are underway and are continuing. I'd say logistics, we will continue to build our logistics capability, both the -- and that will be all the way to end delivery. We've been able to increase service levels in many cases by delivering it ourselves. And although we have a strong partner network here, we will always be able to leverage our strength and our knowledge about where shipments are going, both within our network and to final customers that will create opportunities for us there as we increase or better the customer experience as well. We continue -- I would say on the category side, the biggest effort will be on continuing to be on groceries and consumables with the Whole Foods acquisition. And again, we continue to look at our whole offering of AmazonFresh, Prime Now, Whole Foods, how can they work together to create better and better offerings for our customer base. To a lesser extent, versus grocery, I would say, we continue to build our business, B2B businesses, and very happy with the initial performance there with a number of the companies and universities that we've been working with and their initial results.",227
18749.0,"Amazon.com, Inc., Q4 2017 Earnings Call, Feb 01, 2018",2018-02-01,48.0,Earnings Calls,"Amazon.com, Inc.",1994.0,1379289.0,55129759.0,Question and Answer Operator Message,Operator,,Operator,26,Our next question comes from the line of Scott Mushkin with Wolfe Research.,13
18749.0,"Amazon.com, Inc., Q4 2017 Earnings Call, Feb 01, 2018",2018-02-01,48.0,Earnings Calls,"Amazon.com, Inc.",1994.0,1379289.0,55129760.0,Question,Scott Mushkin,,Analysts,27,"So I want to go back to -- and I think you said one of the big focuses of the year is going to be on the consumables, Now, Fresh, Whole Foods. There's been a lot of press on the Whole Foods front, the out-of-stock issue and then clearly in the Now as we've been testing it and Fresh has the same issue. So I was wondering if you guys could talk about what the company plans to do. I mean, there is obviously the reputational risk that could come from that to kind of correct some of these issues and kind of what the view of the company is on the out-of-stock issues, not just at Whole Foods, but just generally across the consumables business in Fresh and Now.",130
18749.0,"Amazon.com, Inc., Q4 2017 Earnings Call, Feb 01, 2018",2018-02-01,48.0,Earnings Calls,"Amazon.com, Inc.",1994.0,1379289.0,55129761.0,Answer,Brian Olsavsky,,Executives,28,"Yes. I'm not -- let me just back it to a more general statement. I'd say, Whole Foods has not lessened their commitment to providing the best selection of high-quality products and having them in stock for customers. We've made no changes post the acquisition that would have impacted anything related to in-stock, except perhaps the fact that price decreases have brought up demand and there's an amount of rebalancing related to that. So I think the out-of-stock issues that may be getting press are tied more to the increased demand that we're seeing and also selective weather-related restocking issues. But stepping beyond any short-term issues, the commitment is -- remains to have healthy, high-quality selection in stock for products. That's what the Whole Foods team is committed to. That's what the Amazon team, with them, is committed to. And also across any delivery channel that we have, AmazonFresh, Prime Now or Whole Foods. So where there's issues, they'll be corrected. Where there's areas we can improve our selection and delivery for customers, we'll do so. But it'll be something that we're working on. So the immediacy, the perishability are all challenges everyone has in this area, but we're confident that we will have a good service and continue to delight customers.",212
18749.0,"Amazon.com, Inc., Q4 2017 Earnings Call, Feb 01, 2018",2018-02-01,48.0,Earnings Calls,"Amazon.com, Inc.",1994.0,1379289.0,55129762.0,Question and Answer Operator Message,Operator,,Operator,29,Our next question comes from the line of Youssef Squali with SunTrust Robinson Humphrey.,14
18749.0,"Amazon.com, Inc., Q4 2017 Earnings Call, Feb 01, 2018",2018-02-01,48.0,Earnings Calls,"Amazon.com, Inc.",1994.0,1379289.0,55129763.0,Question,Youssef Squali,,Analysts,30,"We've seen that the number of private-label products on the site has increased pretty dramatically over the last 12, 18 months. Could you speak to your private-label strategy in general? How big is that segment today? How big can it become? And just broadly speaking, how are the margins in that segment versus comparable third-party products?",57
18749.0,"Amazon.com, Inc., Q4 2017 Earnings Call, Feb 01, 2018",2018-02-01,48.0,Earnings Calls,"Amazon.com, Inc.",1994.0,1379289.0,55129764.0,Answer,Dave Fildes,,Executives,31,"Yes. Thanks for the question. This is Dave. I think broadly, when we look at our strategy, it's focused on, number one, providing a broad selection for customers across a number of categories so that they can find and buy exactly what they're looking for. When you look at private brands, it's very much meant to supplement that great selection. And we look for ways to be able to find private-label items that have a high caliber of quality, but also can bring that selection and that convenience for customers and really supplement what vendors and sellers are already providing to customers in many cases. We've not broken out kind of how significant or how large that is. I think for a lot of these initiatives, when you look across categories that we offer, many of them are still earlier stage and have been around even from kind of infancy for shorter period of time, a year, a couple of years in some cases. Amazon Fashion is one area where you're seeing us offer a number of private apparel brands. Some of the more sort of popular lines with customers have been things like Goodthreads, Amazon Essentials, which is men's and women's basics. Consumables is, of course, another big area where we have the benefit of working with some of the Whole Foods private label, but also doing some of our other Amazon brands, things like Happy Belly and Wickedly Prime and others. So I think we'll continue to iterate on those and try to find different areas. And certainly, there's other verticals that I didn't mention there that we're interested in continuing to kind of learn from customers what they want and what they're looking for there. And so we'll keep adding selection.",294
18749.0,"Amazon.com, Inc., Q4 2017 Earnings Call, Feb 01, 2018",2018-02-01,48.0,Earnings Calls,"Amazon.com, Inc.",1994.0,1379289.0,55129765.0,Question and Answer Operator Message,Operator,,Operator,32,Our next question comes from the line of Ken Sena with Wells Fargo.,13
18749.0,"Amazon.com, Inc., Q4 2017 Earnings Call, Feb 01, 2018",2018-02-01,48.0,Earnings Calls,"Amazon.com, Inc.",1994.0,1379289.0,55129766.0,Question,Kenneth Sena,,Analysts,33,"Maybe if you could just remind us of the thinking that -- behind keeping AWS and retail under 1 corporate structure, and does it make sense given the scale of where AWS is right now? And then -- and I'm sorry I have a little bit of an echo, I don't know why, but -- and we're hearing from marketers just how important Amazon is to their media strategy. So I don't know if you could just maybe talk about that a little bit more broadly in terms of the approach and your philosophy to that business.",97
18749.0,"Amazon.com, Inc., Q4 2017 Earnings Call, Feb 01, 2018",2018-02-01,48.0,Earnings Calls,"Amazon.com, Inc.",1994.0,1379289.0,55129767.0,Answer,Brian Olsavsky,,Executives,34,"Sure. We see a lot of value in all of our businesses. And AWS is a key component as is the physical consumer business. The -- what I'll point out is the management team is a common management team. The consumer business, if you will, is, if not the biggest, one of the largest customers of AWS. So we see a lot of commonality there where we as -- depending on a position in the company. On the consumer side, the use of AWS has driven great infrastructure efficiencies, just like other companies see when they use AWS, turning fixed cost into variable cost and pooling resources and not having a lot of trapped capacity throughout the company and taking advantage of all the new services and features. So as a internal customer, the consumer business is very happy with AWS. And I think AWS is also very benefited by the fact that they have a large internal beta customer that tries out and uses a lot of their products and services. So it's a good combination for a lot of reasons, and we see no reason to change the structure that we have.",194
18749.0,"Amazon.com, Inc., Q4 2017 Earnings Call, Feb 01, 2018",2018-02-01,48.0,Earnings Calls,"Amazon.com, Inc.",1994.0,1379289.0,55129768.0,Answer,Dave Fildes,,Executives,35,"Yes. And sorry, Ken, your second question was?",8
18749.0,"Amazon.com, Inc., Q4 2017 Earnings Call, Feb 01, 2018",2018-02-01,48.0,Earnings Calls,"Amazon.com, Inc.",1994.0,1379289.0,55129769.0,Question,Kenneth Sena,,Analysts,36,"Yes. The second question was just on the advertising side. And just -- we're just hearing so much more how important Amazon is to broader media budgets. And so just hoping to get maybe a little bit more color just on your approach to the business right now, some of the drivers behind the recent success and just maybe just more of a sort of, as you look out over the next few years, kind of how important do you see this business becoming in the grand scheme of things?",90
18749.0,"Amazon.com, Inc., Q4 2017 Earnings Call, Feb 01, 2018",2018-02-01,48.0,Earnings Calls,"Amazon.com, Inc.",1994.0,1379289.0,55129770.0,Answer,Dave Fildes,,Executives,37,"Yes. I mean, I think right now, we're really just focused on finding ways to work with those companies, whether it's vendors or sellers that are coming to us and offer them a great experience on the website and an ability to be able to reach customers. So I think there's more to come on that side. As we said, we're definitely seeing some strong growth in our advertising revenue as part of the other revenue line item. And I think we're going to keep building more new tools based on what we're learning from our customers there to better serve in the future.",104
18749.0,"Amazon.com, Inc., Q4 2017 Earnings Call, Feb 01, 2018",2018-02-01,48.0,Earnings Calls,"Amazon.com, Inc.",1994.0,1379289.0,55129771.0,Answer,Brian Olsavsky,,Executives,38,"Yes, I think we're also part of the key lean in from a lot of brands and agencies into the e-commerce marketing space. So whether it's our site alongside search or social marketing, it's really helping them engage customers on a high, efficient -- highly efficient manner.",47
18749.0,"Amazon.com, Inc., Q4 2017 Earnings Call, Feb 01, 2018",2018-02-01,48.0,Earnings Calls,"Amazon.com, Inc.",1994.0,1379289.0,55129772.0,Answer,Dave Fildes,,Executives,39,Thanks for joining us on the call today and for your questions. A replay will be available on our IR website at least through the end of the quarter. We appreciate your interest in Amazon.com and look forward to talking with you again next quarter.,45
18749.0,"Amazon.com, Inc., Q1 2018 Earnings Call, Apr 26, 2018",2018-04-26,48.0,Earnings Calls,"Amazon.com, Inc.",1951.0,1441411.0,57353521.0,Presentation Operator Message,Operator,,Operator,0,"Thank you for standing by. Good day, everyone, and welcome to the Amazon.com Q1 2018 Financial Results Teleconference. [Operator Instructions] Today's call is being recorded.
For opening remarks, I'll be turning the call over to the Director of Investor Relations, Dave Fildes. Please go ahead.",45
18749.0,"Amazon.com, Inc., Q1 2018 Earnings Call, Apr 26, 2018",2018-04-26,48.0,Earnings Calls,"Amazon.com, Inc.",1951.0,1441411.0,57353522.0,Presenter Speech,Dave Fildes,,Executives,1,"Hello, and welcome to our Q1 2018 financial results conference call. Joining us today to answer your questions is Brian Olsavsky, our CFO. 
As you listen to today's conference call, we encourage you to have our press release in front of you, which includes our financial results as well as metrics and commentary on the quarter. Please note, unless otherwise stated, all comparisons in this call will be against our results for the comparable period of 2017. 
Our comments and responses to your questions reflect management's views as of today, April 26, 2018, only and will include forward-looking statements. Actual results may differ materially. Additional information about factors that could potentially impact our financial results is included in today's press release and our filings with the SEC, including our most recent annual report on Form 10-K and subsequent filings.
During this call, we may discuss certain non-GAAP financial measures. In our press release, slides accompanying this webcast and our filings with the SEC, each of which is posted on our IR website, you will find additional disclosures regarding these non-GAAP measures, including reconciliations of these measures with comparable GAAP measures.
Our guidance incorporates the order trends that we've seen to date and what we believe today to be appropriate assumptions. Our results are inherently unpredictable and may be materially affected by many factors, including fluctuations in foreign exchange rates, changes in global economic conditions and customer spending, world events, the rate of growth of the Internet, online commerce and cloud services, and the various factors detailed in our filings with the SEC. 
Our guidance also assumes, among other things, that we don't conclude any additional business acquisitions, investments, restructurings or legal settlements. It's not possible to accurately predict the demand for our goods and services, and therefore, our actual results could differ materially from our guidance. 
With that, we'll move to Q&A. Operator, please remind our listeners how to initiate a question.",322
18749.0,"Amazon.com, Inc., Q1 2018 Earnings Call, Apr 26, 2018",2018-04-26,48.0,Earnings Calls,"Amazon.com, Inc.",1951.0,1441411.0,57353523.0,Question and Answer Operator Message,Operator,,Operator,2,[Operator Instructions] Our first question comes from the line of Eric Sheridan with UBS.,14
18749.0,"Amazon.com, Inc., Q1 2018 Earnings Call, Apr 26, 2018",2018-04-26,48.0,Earnings Calls,"Amazon.com, Inc.",1951.0,1441411.0,57353524.0,Question,Eric Sheridan,,Analysts,3,"I wanted to ask if you had any update on the state of the advertising business. Sort of the state of conversations with advertisers, what product uptake you're seeing out in the marketplace? And sort of how that's looking now as we move out of '17 and into 2018, broadly, for the platform?",53
18749.0,"Amazon.com, Inc., Q1 2018 Earnings Call, Apr 26, 2018",2018-04-26,48.0,Earnings Calls,"Amazon.com, Inc.",1951.0,1441411.0,57353525.0,Answer,Brian Olsavsky,,Executives,4,"Yes. Sure, Eric. I would say, advertising continues to be a bright spot, both from a product standpoint, and also, financially. It was -- continued to be a strong contributor to profitability in Q1. It's now a multibillion-dollar program. You can see the -- in our supplemental revenue disclosure, it's in other revenue, and it's the majority of the other revenue in that line item. So we -- our philosophy there, again, is we're continuing to focus on finding valuable ways to make our advertising opportunities better for customers, showing them new products that they may not have seen otherwise, and also for emerging and established brands, helping them to reach customers. I think the advertisers, generally, are all shapes and sizes, and their common theme is they all want to reach our customers, generally, to drive brand awareness, discovery, and eventually, purchase. Before I go on to the second question, I want to make a comment about the Prime program. Prime program continues to drive great strength in our top line, as you've seen over the last few years, actually. We continue to increase the value of Prime, including speed selection and digital entertainment options. We've been expanding FREE Same-Day Shipping and 1-day options. And our 2-day shipping, it's now available on over 100 million items, up from 20 million as recently as 2014. And we continue to add digital benefits, like Prime Video. The value of Prime to customers has never been greater. And the cost is also high. As we pointed out especially with shipping options and digital benefits, we continue to see rises in costs. So effective May 11, we're going to increase the price of our U.S. annual plan from $99 to $119, for new members. The new price will apply to renewals starting on June 16. Prime provides a unique combination of benefits, and we continue to invest in making this Prime program even more valuable for our members. As a reminder, we haven't increased the U.S. annual price Prime since our single increase, which was in March of 2014.",346
18749.0,"Amazon.com, Inc., Q1 2018 Earnings Call, Apr 26, 2018",2018-04-26,48.0,Earnings Calls,"Amazon.com, Inc.",1951.0,1441411.0,57353526.0,Answer,Dave Fildes,,Executives,5,"Yes. And Eric, sorry to just go back to your initial question too, just to hop back on that, I just want to remind folks that we've mentioned this last quarter on the call, but on January 1, we adopted an accounting standard update that amended our revenue recognition policies. So the net impact to revenue in the first quarter was not material, but I do want to highlight a few areas. As part of the adoption beginning in Q1, certain advertising services are classified as revenue, rather than a reduction of costs to sales. So the impact of this change was an increase of $560 million to other revenue in Q1, which is the other revenue was, of course, part of our supplemental sales disclosure. So you'll see that other revenue, in total, increased 132% ex FX year-over-year to about $2 billion in the first quarter, again, $560 million is included in there, and the majority of that is -- would be included in the North America segment. As you look at the other supplemental line items, just a few items of note. The line item online stores revenue increased about 13%, ex FX. Beginning in the first quarter, sales of apps, in-app content and certain digital media content, are now presented on a net revenue basis and included in third-party seller services revenue, rather than that online stores revenue. So in the first quarter, online stores revenue would have been higher, but for this new standard. And then, the line item, subscription services revenue, that increased about 56% ex FX year-over-year. Prime members are -- Prime memberships are included in that line. Again, beginning in the first quarter, we now recognize annual Prime membership revenue straight line over the 12-month period. Prior to 2018, we recognized this revenue over the 12-month period with more revenue allocated to the fourth quarter each year. So in Q1 of this year's subscription services revenue would have been lower, but for this new standard.",332
18749.0,"Amazon.com, Inc., Q1 2018 Earnings Call, Apr 26, 2018",2018-04-26,48.0,Earnings Calls,"Amazon.com, Inc.",1951.0,1441411.0,57353527.0,Question and Answer Operator Message,Operator,,Operator,6,Our next question comes from Brian Nowak with Morgan Stanley.,10
18749.0,"Amazon.com, Inc., Q1 2018 Earnings Call, Apr 26, 2018",2018-04-26,48.0,Earnings Calls,"Amazon.com, Inc.",1951.0,1441411.0,57353528.0,Question,Brian Nowak,,Analysts,7,"So the first one, on Prime, let me ask you this. As you think about your U.S. Prime penetration, there's some data that shows you're doing a very good job at capturing a lot of the middle to higher income households and now you're raising price. Talk about the tension point you need to solve to sort of reach some of the lower income households and even households that are not yet Prime. What are the main reasons why people in the U.S. are not signing on for Prime at this point? And the second one, on early learnings from the integration of Prime Now and Whole Foods, recognizing it's only in a few cities. What can you share about what you're seeing about purchase behavior, early learnings? And what are the main signposts you're watching as you determine how quickly to roll that out to more cities in the U.S., and hopefully, New York soon?",156
18749.0,"Amazon.com, Inc., Q1 2018 Earnings Call, Apr 26, 2018",2018-04-26,48.0,Earnings Calls,"Amazon.com, Inc.",1951.0,1441411.0,57353529.0,Answer,Brian Olsavsky,,Executives,8,"Sure. On your first question about Prime penetration, without getting into any statistics on penetration and by country, I would say we do have other options for, if you'll notice, there's the monthly option, obviously provides more flexibility for people who want to try out Prime before committing to the annual plan. There's discounted student plans. There's also discounts for other groups. So we do feel it's still the best deal in retail, and we just work to make it better and better each day. The second thing you mentioned is a good example. So the ability in 10 cities to get Prime Now deliveries of Whole Foods groceries is an added benefit for people in that market using Prime -- those markets using Prime Now. So as far as the Whole Foods, specifically on the question of what'll -- what we'll look at as far as expanding that grocery delivery, we're going to use the 10 cities as a test and see how customers respond, just like we always do, and make sure that our deliveries are great for those people, and then we'll announce expansion plans once we digest that, the feedback we get from customers.",198
18749.0,"Amazon.com, Inc., Q1 2018 Earnings Call, Apr 26, 2018",2018-04-26,48.0,Earnings Calls,"Amazon.com, Inc.",1951.0,1441411.0,57353530.0,Question and Answer Operator Message,Operator,,Operator,9,Our next question comes from the line of Heath Terry with Goldman Sachs.,13
18749.0,"Amazon.com, Inc., Q1 2018 Earnings Call, Apr 26, 2018",2018-04-26,48.0,Earnings Calls,"Amazon.com, Inc.",1951.0,1441411.0,57353531.0,Question,Heath Terry,,Analysts,10,"I was just wondering if you could give us a sense. The accelerating growth that we saw in the U.S. business in Q1, how much of that or how would you sort of segment that in terms of specific categories? Are there any specific categories that you would call out in terms of driving that? And then, as we look at the like acceleration in the AWS business, any sense that you can give us in terms of what volumes or customer you specifically call out sort of customer additions in some of your comments, what customer additions have looked like in terms of driving that business, particularly against sort of the comp against last year's price cuts?",118
18749.0,"Amazon.com, Inc., Q1 2018 Earnings Call, Apr 26, 2018",2018-04-26,48.0,Earnings Calls,"Amazon.com, Inc.",1951.0,1441411.0,57353532.0,Answer,Brian Olsavsky,,Executives,11,"Sure. So first, with the -- you've mentioned North America revenue growth, and you can calculate that with and without the impact of Whole Foods, I'm sure, but the general drivers continues to be Prime and the Prime flywheel, so we see strong customer demand, not only for the benefits that we associate with Prime, we're seeing better engagement with Prime benefits, especially digital and benefits, and that is always good news for eventual sales of other things. We're also selling more subscriptions, Amazon Music Unlimited, multiple, Kindle Unlimited, there's a number of services. So there's different revenue streams that we see. So not much more I can add by product line to North America. Now I talk about AWS revenue, again, we're -- we are accelerating. We've accelerated for the last 2 quarters. The FX-neutral growth was 48% in Q1, up from 44% on the same basis in Q4 and 42% in Q3. And now nearly a $22 billion run rate. So what we're seeing is just continued strong usage, both by existing customers and signing new customers for -- see an increased pace of enterprise migrations as customers are having success with AWS and increasingly trying new services. We are seeing people move more and more of their workloads to AWS and at a faster pace. And customers are moving databases to AWS as Aurora continues to grow at a very rapid clip. So stepping back, I would say, what is driving the growth, we believe, again, it's the value that we create for AWS customers. We have the functionality and pace of innovation that others don't. We have partner and ecosystem that others don't, and we have proven operational capability and security expertise that's highly valued to AWS customer base.",293
18749.0,"Amazon.com, Inc., Q1 2018 Earnings Call, Apr 26, 2018",2018-04-26,48.0,Earnings Calls,"Amazon.com, Inc.",1951.0,1441411.0,57353533.0,Question and Answer Operator Message,Operator,,Operator,12,Our next question comes from the line of Mark May with Citi.,12
