companyid,headline,mostimportantdateutc,keydeveventtypeid,keydeveventtypename,companyname,audiolengthsec,transcriptid,transcriptcomponentid,transcriptcomponenttypename,transcriptpersonname,companyofperson,speakertypename,componentorder,componenttext,word_count
18749.0,"Amazon.com, Inc., Q1 2023 Earnings Call, Apr 27, 2023",2023-04-27,48.0,Earnings Calls,"Amazon.com, Inc.",2738.0,2788795.0,104054373.0,Presenter Speech,Brian Olsavsky,,Executives,2,"Thank you for joining today's call. As Dave mentioned earlier, I'm joined today by Andy Jassy, our CEO. Before we move on to take your questions, I'll make some comments regarding our Q1 results. Let's begin with revenue. For the first quarter, our worldwide net sales were $127.4 billion, up 9% year-over-year, or 11% excluding approximately 210 basis points of unfavorable impact from changes in foreign exchange rates. This was above the top end of our guidance range.
Overall, we are pleased with the growth that we're seeing in worldwide stores businesses, including quarter-over-quarter revenue acceleration in the International segment, which is helped by easing macroeconomic pressures in Europe. Across the geographies we serve, customers appreciate our focus on staying sharp on pricing, having strong selection and easier convenience, including delivery speeds, which continued to improve throughout the first quarter. That said, the uncertain economic environment and ongoing inflationary pressures continue to be a factor, and we believe it's continuing to drive cautious spending across consumers. This means our customers are looking to stretch their budgets further and are focused on value.
We saw moderated spending on discretionary categories as well as shifts to lower-priced items and healthy demand in everyday essentials, such as consumables and beauty. Third-party sellers, including businesses who elect to utilize Fulfillment by Amazon for their storage and shipping services are a key contributor to the selection offered to customers. We also continued to invest meaningfully in brand protection efforts, including industry-leading technology so that sellers can trust we will provide a great selling experience free from bad actors. Sellers comprise 59% of overall unit sales in Q1, up from 55% 1 year ago.
We also saw strong engagement in our advertising services with revenue up 23% year-over-year, excluding the impact from changes in foreign exchange rates. In particular, our sponsored product and brand offerings remain a key driver of growth as we work with advertisers to help customers make more informed purchase decisions. 
Our teams remain focused on delivering performance through our comprehensive and flexible measurement capabilities along with insights that allow advertisers the ability to measure the return on their advertising spend and help them grow their business.
In AWS, net sales were $21.4 billion in the first quarter, up 16% year-over-year and representing an annualized sales run rate of more than $85 billion. Given the ongoing economic uncertainty, customers of all sizes in all industries continue to look for cost savings across their businesses, similar to what you've seen us doing at Amazon. As expected, customers continue to evaluate ways to optimize their cloud spending in response to these tough economic conditions in the first quarter. And we are seeing these optimizations continue into the second quarter with April revenue growth rates about 500 basis points lower than what we saw in Q1. 
As a reminder, we're not trying to optimize for any one quarter or year. We're working to build customer relationships and a business that will outlast all of us. Therefore, our AWS sales and support teams continue to spend much of their time helping customers optimize their AWS spend so that they can better weather this uncertain economy. This customer orientation is built into our DNA and how we think about our customer relationships and business over the long term.
Now let's shift to worldwide operating income. For the first quarter, we reported $4.8 billion in operating income, above the top end of our guidance range. This operating income was negatively impacted by an estimated employee severance charge of approximately $470 million in Q1, including $270 million related to AWS. As we finalized our annual planning process and considered the ongoing economic environment, we made the difficult decision to eliminate 9,000 roles, impacting our AWS business as well as Twitch, devices, advertising and our human resources teams.
In Q1, our year-over-year growth in stores revenue and unit sales outpaced growth in both our fulfillment expense and our outbound shipping costs. Inflationary pressures continued to ease quarter-over-quarter, primarily driven by reductions in linehaul shipping rates as well as lower diesel fuel and electricity costs. We also built on the progress we made throughout 2022 in improving productivity in our fulfillment network through continued process and tech improvements. We exited Q4 with a good balance of labor throughout the network and leveraged that throughout Q1 with customer demand patterns remaining more stable compared to Q1 of last year.
As labor availability has stabilized and inventory supply chain challenges have moderated, we're able to implement some significant structural changes to transition our U.S. fulfillment network to a regionalized model. We believe these improvements put us in a good position to improve both delivery speed and our cost to serve customers over time.
We reported overall net income of $3.2 billion in the first quarter. While we primarily focus our comments on operating income, I'd point out that this net income includes a pretax valuation loss of $467 million included in nonoperating expense from our common stock investment in Rivian Automotive. As we've noted in recent quarters, this activity is not related to Amazon's ongoing operations but rather to quarter-to-quarter fluctuations in Rivian's stock price.
Turning to cash flows. We remain focused on building long-term sustainable growth in free cash flow, including our efforts towards a strong cash flow accretive working capital cycle. Our operating cash flow for the trailing 12 months ended March 31 increased to $54.3 billion, up 38% versus the comparable period year-over-year. 
Besides the cash benefit of improved profitability year-over-year, we've also seen supply chains easing up and made progress to improve our inventory purchasing and payment cycles, which in turn has a positive impact on working capital.
Now let's turn to our capital investments. We define our capital investments as the combination of CapEx plus equipment finance leases. For the full year 2023, we expect capital investments to be lower than our $59 billion investment level in 2022, primarily driven by an expected year-over-year decrease in fulfillment network investments. We're continuing to invest in infrastructure to support AWS customer needs, including investments to support large language models and generative AI.
Before we open the call up for your questions, I'll hand it over to Andy to share some high-level perspectives on the first quarter.",1046
18749.0,"Amazon.com, Inc., Q1 2023 Earnings Call, Apr 27, 2023",2023-04-27,48.0,Earnings Calls,"Amazon.com, Inc.",2738.0,2788795.0,104054374.0,Presenter Speech,Andrew Jassy,,Executives,3,"Thanks, Brian. I'll share a few thoughts before opening up for questions. From my perspective, I think there's a fair bit to like about how our teams are delivering for customers and the results we're starting to see. 
In our storage business, we've been very focused on reducing our cost to serve in our fulfillment network. As we shared in the past, given the unexpected surge in demand during the pandemic, we doubled the size of our fulfillment center footprint and largely built a transportation network the size of UPS in a couple of years. This ended up substantially changing the number of nodes and connections in our fulfillment network. And as a result, we spent the last several months not only redesigning dozens of processes to drive better productivity but also re-architecting our placement approach and larger fulfillment center footprint to move from a national fulfillment network in the U.S. to a regional one.
It means we've created 8 interconnected regions in geographic areas with each of these regions having broad relevant selection to operate in a largely self-sufficient way while still being able to ship nationally when necessary. We just recently completed this rollout and are quite bullish on the early results. Not surprisingly, shorter travel distances means lower cost to serve and customers getting their orders faster. And while on the topic of delivery speed, we're really excited about our progress in providing customers more 1-day and same-day deliveries and are on track to have our fastest Prime delivery speeds ever in 2023.
On the advertising side, we're continuing to buck wider advertising trends and deliver robust growth. I think there are a few reasons for it. First, even in difficult economies, most people still shop. And with the largest e-commerce shopping venue, we have a lot of customers that companies seek to reach. That, coupled with our very substantial investment in machine learning to make sure customers see relevant ads when they're looking for various items, have meant that these advertisements have performed unusually well for brands, which makes them want to advertise in Amazon.
It's also worth noting that we're still very early in our efforts to find a way to thoughtfully place ads in our broader video, live sports, audio and grocery properties. We have a lot of upside still in advertising.
In AWS, what we're seeing is enterprises continuing to be cautious in their spending in this uncertain time. Customers are looking for ways to save money however they can right now. They tell us that most of it is cost optimizing versus cost cutting, which is an interesting distinction because they say they're cost optimizing to reallocate those resources on new customer experiences. One of the great attributes of the cloud is that you can scale seamlessly up or down as demand dictates, which is not the case with on-premises infrastructure.
Customers want help finding ways to spend less during this challenging time, and given that it's best for customers long term, we've been actively helping customers make these adjustments. We've spent a fair bit of time analyzing what we're seeing, and I've spent a good chunk of time myself looking as well, and we like the fundamentals of what we're seeing in AWS. 
The new customer pipeline looks strong. The set of ongoing migrations of workloads to AWS is strong. The product innovation and delivery is rapid and compelling, and people sometimes forget that 90-plus percent of global IT spend is still on-premises. If you believe that equation is going to flip, which we do, it's going to move to the cloud and having the cloud infrastructure offering with the broadest functionality by a fair bit, the best security and operational performance and the largest partner ecosystem bodes well for us moving forward.
But we're not close to being done inventing in AWS. Our recent announcement on large language models and generative AI and the chips and managed services associated with them is another recent example. And in my opinion, few folks appreciate how much new cloud business will happen over the next several years from the pending deluge of machine learning that's coming.
This past year has seen us do a fair bit of cost streamlining. As I mentioned in my recent shareholder letter, we took a deep look across the company and asked ourselves whether we had conviction about each initiative's long-term potential to drive enough revenue, operating income, free cash flow and return on invested capital. 
In some cases, it led us to shuttering certain businesses like our physical bookstores, 4-star stores, Amazon Fabric, Amazon Care and certain devices where we didn't see a path to meaningful returns. In other cases, we've looked at some programs that weren't producing the returns we'd hoped, example, free shipping for all online grocery orders over $35 and changed them. We also made the very difficult decision to eliminate about 27,000 corporate roles. Like most leadership teams, we'll continue to evaluate what we're seeing in our business and proceed adaptively. 
But while we've taken several actions to streamline our costs, we've been able to do so while still pursuing the key strategic long-term investments that we believe can meaningfully make customers' lives better and potentially change what Amazon is. These are investments both in our larger businesses mentioned earlier as well as in areas like international expansion in our stores business, large retail market segments in which we're still nascent, like grocery and business-to-business, allowing consumers to use Prime off of Amazon in our Buy with Prime program, entertainment, devices, health care and our low Earth orbit satellite for the hundreds of millions of households, companies and government entities that have limited to no connectivity. 
It's hard to predict that all of these will be successful but only 1 or 2 working would change our business over the long term. We have a lot of work in front of us, but I like the direction we're headed and strongly believe our best days are in front of us. 
And with that, I'll open it up for questions.",1015
18749.0,"Amazon.com, Inc., Q1 2023 Earnings Call, Apr 27, 2023",2023-04-27,48.0,Earnings Calls,"Amazon.com, Inc.",2738.0,2788795.0,104054375.0,Question and Answer Operator Message,Operator,,Operator,4,[Operator Instructions] Our first question comes from the line of Doug Anmuth with JPMorgan.,14
18749.0,"Amazon.com, Inc., Q1 2023 Earnings Call, Apr 27, 2023",2023-04-27,48.0,Earnings Calls,"Amazon.com, Inc.",2738.0,2788795.0,104054376.0,Question,Douglas Anmuth,,Analysts,5,"Andy, you talked about the continued optimization. Just curious, can you talk about the degree to which optimization has been done in AWS versus what you think could still lie ahead? And when do you start to lap some of those efforts? 
And then also on the CapEx side, I think you said overall CapEx would be down in '23. Can you just help us understand that a little bit better between retail and AWS? And then what's required on CapEx from a generative AI and large language model perspective?",90
18749.0,"Amazon.com, Inc., Q1 2023 Earnings Call, Apr 27, 2023",2023-04-27,48.0,Earnings Calls,"Amazon.com, Inc.",2738.0,2788795.0,104054377.0,Answer,Brian Olsavsky,,Executives,6,"This is Brian. I'll take the first -- or the second part of that question first. On CapEx, we spent $59 million -- $59 billion, excuse me, last year. And we -- on our core fulfillment and transportation areas, we actually are spending less year-over-year, and those estimates are going down, the gap or the increases in AWS and infrastructure and we are adding more dollars to the -- for large language models and generative AI. So we're creating some space in our fulfillment and transportation number that has been repurposed over to AWS. We still think the combined CapEx will be lower year-over-year.",104
18749.0,"Amazon.com, Inc., Q1 2023 Earnings Call, Apr 27, 2023",2023-04-27,48.0,Earnings Calls,"Amazon.com, Inc.",2738.0,2788795.0,104054378.0,Answer,Andrew Jassy,,Executives,7,"Just on your first question, Doug. It's hard to say exactly where we are in the process. I think that what we continue to see when we talk with customers is that they're appropriately cautious about what they're seeing in the economy. They're trying to find ways to save money, as most companies are, including our own. And -- we have a long track record, which we continue to pursue, which I think makes sense for customers and for our business long term that we're not trying to optimize for a quarter or for a year. 
We're going to do whatever it takes to help customers be successful over a long period of time because we're trying to build relationships in a business that outlasts all of us. And so we're spending a lot of time with customers, trying to help them think of smart ways, not short-term ways, but smart ways to optimize their costs and to be able to scale up and down. 
And again, one of the big advantages of the cloud is that if you grow quickly, you can seamlessly scale up. But when you don't have the demand, you can give it back to us and stop paying for it, and that is not true with what you see on premises. And so we're trying to work hard to help customers with that. 
I think it's important to remember that customers are pretty explicitly telling us that this is not a cost-cutting effort where we intend on spending less money on technology or on the cloud. This is our reprioritizing what matters most to our business at this time and trying to reallocate resource so we can build new customer experience of the change what's possible. 
And so I think if you think about -- those projects, by the way, take time to build. When you're reallocating, you're reprioritizing, you're redefining what you're going to build, you got to actually go build it before you can implement it. And we're working pretty carefully and closely with customers on those initiatives. I think it's important to remember that there's still so much growth ahead of the cloud, 90-plus percent of the global IT spend is on premises. And so if you believe that equation is going to flip, it's mostly moving to the cloud. 
And I also think that there are a lot of folks that don't realize the amount of nonconsumption right now that's going to happen and be spent in the cloud with the advent of large language models and generative AI. I think so many customer experiences are going to be reinvented and invented that haven't existed before. And that's all going to be spent, in my opinion, on the cloud.",458
18749.0,"Amazon.com, Inc., Q1 2023 Earnings Call, Apr 27, 2023",2023-04-27,48.0,Earnings Calls,"Amazon.com, Inc.",2738.0,2788795.0,104054379.0,Question and Answer Operator Message,Operator,,Operator,8,Our next question comes from the line of Eric Sheridan with Goldman Sachs.,13
18749.0,"Amazon.com, Inc., Q1 2023 Earnings Call, Apr 27, 2023",2023-04-27,48.0,Earnings Calls,"Amazon.com, Inc.",2738.0,2788795.0,104054380.0,Question,Eric Sheridan,,Analysts,9,"Andy, you've talked a lot in the letter -- the shareholder letter on the last earnings call about driving greater levels of efficiencies in the company and also possibly returning to some of the margin structures we saw pre pandemic and absorbing overcapacity that built up during the pandemic. Can you give us an update on where you think you are in those broad efforts to match margins versus pre-pandemic levels and strike the right balance between profitability and driving your growth initiatives over the next couple of years?",89
18749.0,"Amazon.com, Inc., Q1 2023 Earnings Call, Apr 27, 2023",2023-04-27,48.0,Earnings Calls,"Amazon.com, Inc.",2738.0,2788795.0,104054381.0,Answer,Brian Olsavsky,,Executives,10,"Eric, this is Brian. Let me start on the financial part of that question. So I think we would describe ourselves as like along on the journey and making solid progress on recovering our cost structure and getting it back to pre-pandemic levels. Andy's talked about the efforts in operations and the regionalization of our operations. We've obviously taken a hard look at all of our businesses that we're in over the last 6 to 9 months and have made adjustments there. 
But there's still a lot ahead of us, especially on the operational side that if you look at our operating margin in North America, for example, in North America segment, it was 1.2% this quarter. Pre-pandemic, that number was in the 4% to 6% range broadly. So it's a bit of a marker on how much upside. But there's a lot of moving parts in that number. Obviously, there's the advertising. There's investments going on for future growth and there's the core profitability and cost structure that our operations are achieving. So making progress, working hard at it, but it's a -- it's a longer road than bouncing back in 1 or 2 quarters.",196
18749.0,"Amazon.com, Inc., Q1 2023 Earnings Call, Apr 27, 2023",2023-04-27,48.0,Earnings Calls,"Amazon.com, Inc.",2738.0,2788795.0,104054382.0,Answer,Andrew Jassy,,Executives,11,"Yes. I would just add to that, that we have looked pretty hard at every single one of our businesses. And I think that while it's probably most visible, given the size of it, what's the improvement in the operating margin, the efficiency in our stores business, I think every business is working really hard on finding ways to be more efficient. And as Brian said, I think we're making really good progress in the fulfillment costs in our operations network and our stores business. But one of the things that's been interesting and frankly pretty encouraging to all of us is that as we -- over the last 6 to 9 months, as the network fundamentally changed -- remember, when you go through as much growth as we went through and you add -- you double your fulfillment center footprint and you also build a last-mile transportation network the size of UPS in a couple of years, there's a lot that you have to work on to get that as productive as you want. And we've spent a lot of time working on that the last 6 to 9 months. 
But some of the ways that you operated before, which worked through several elbows of the curve and scale, when they become inefficient, because the network fundamentally changes, they become inefficient in a significant way. And so it's part of what led to the regionalization effort that I talked about. 
But it also caused us to really reevaluate virtually everything we do in operations over the last 6 to 9 months. And we have found a lot more opportunities than we even thought were there before. So I'm pretty optimistic that we have a chance not just to recover to where we were pre pandemic in terms of operating margin, but I think there's additional upside with some of the opportunities we've identified.",314
18749.0,"Amazon.com, Inc., Q1 2023 Earnings Call, Apr 27, 2023",2023-04-27,48.0,Earnings Calls,"Amazon.com, Inc.",2738.0,2788795.0,104054383.0,Question and Answer Operator Message,Operator,,Operator,12,And the next question comes from the line of Brian Nowak with Morgan Stanley.,14
18749.0,"Amazon.com, Inc., Q1 2023 Earnings Call, Apr 27, 2023",2023-04-27,48.0,Earnings Calls,"Amazon.com, Inc.",2738.0,2788795.0,104054384.0,Question,Brian Nowak,,Analysts,13,"I have 2, Andy. The first one, you talked a lot about the long-term AI and large language model potential out of AWS. I think there's a lot of discussion about AWS' competitive positioning when it comes to these tools. Could you just sort of walk us through 2 or 3 of the key points of differentiation that you think AWS offers in AI tools versus some of the competitors? 
And then the second 1 around Echo and Alexa. The neural networks may not be a leading edge of technology now with the rapid emergence of some of these new large language models. How do you think about the key investment priorities for Echo and Alexa going forward? And what's your view on ROIC around that division?",127
