companyid,headline,mostimportantdateutc,keydeveventtypeid,keydeveventtypename,companyname,audiolengthsec,transcriptid,transcriptcomponentid,transcriptcomponenttypename,transcriptpersonname,companyofperson,speakertypename,componentorder,componenttext,word_count
18749.0,"Amazon.com, Inc., Q4 2017 Earnings Call, Feb 01, 2018",2018-02-01,48.0,Earnings Calls,"Amazon.com, Inc.",1994.0,1379289.0,55129733.0,Presentation Operator Message,Operator,,Operator,0,"Thank you for standing by. Good day, everyone, and welcome to the Amazon.com Q4 2017 Financial Results Teleconference. [Operator Instructions] Today's call is being recorded.
For opening remarks, I'll be turning the call over to the Director of Investor Relations, Dave Fildes. Please go ahead.",45
18749.0,"Amazon.com, Inc., Q4 2017 Earnings Call, Feb 01, 2018",2018-02-01,48.0,Earnings Calls,"Amazon.com, Inc.",1994.0,1379289.0,55129734.0,Presenter Speech,Dave Fildes,,Executives,1,"Hello, and welcome to our Q4 2017 financial results conference call. Joining us today to answer your questions is Brian Olsavsky, our CFO. As you listen to today's conference call, we encourage you to have our press release in front of you, which includes our financial results as well as metrics and commentary on the quarter. Please note, unless otherwise stated, all comparisons in this call will be against our results for the comparable period of 2016. 
Our comments and responses to your questions reflect management's views as of today, February 1, 2018, only and will include forward-looking statements. Actual results may differ materially. Additional information about factors that could potentially impact our financial results is included in today's press release and our filings with the SEC, including our most recent annual report on Form 10-K and subsequent filings.
During this call, we may discuss certain non-GAAP financial measures. In our press release, slides accompanying this webcast and our filings with the SEC, each of which is posted on our IR website, you will find additional disclosures regarding these non-GAAP measures, including reconciliations of these measures with comparable GAAP measures.
Our guidance incorporates the order trends that we've seen to date and what we believe today to be appropriate assumptions. Our results are inherently unpredictable and may be materially affected by many factors, including fluctuations in foreign exchange rates, changes in global economic conditions and customer spending, world events, the rate of growth of the Internet, online commerce and cloud services and the various factors detailed in our filings with the SEC.
Our guidance also assumes, among other things, that we don't conclude any additional business acquisitions, investments, restructurings or legal settlements. It's not possible to accurately predict demand for our goods and services, and therefore, our actual results could differ materially from our guidance.
I'd also like to update you on the impact of the recent U.S. tax reform legislation. In our fourth quarter results, we recorded a provisional tax benefit for the impact of the new tax legislation of approximately $789 million, which is primarily driven by the remeasurement of federal net deferred tax liabilities, resulting from the permanent reduction in the U.S. statutory corporate tax rate to 21% from 35%. As we complete our analysis of this new legislation, we may make adjustments to the provisional amounts. Those adjustments may materially impact our provision for income taxes in the period in which the adjustments are made.
With that, we will move to Q&A. Operator, please remind our listeners how to initiate a question.",426
18749.0,"Amazon.com, Inc., Q4 2017 Earnings Call, Feb 01, 2018",2018-02-01,48.0,Earnings Calls,"Amazon.com, Inc.",1994.0,1379289.0,55129735.0,Question and Answer Operator Message,Operator,,Operator,2,[Operator Instructions] Our first question comes from the line of Mark Mahaney with RBC Capital Markets.,16
18749.0,"Amazon.com, Inc., Q4 2017 Earnings Call, Feb 01, 2018",2018-02-01,48.0,Earnings Calls,"Amazon.com, Inc.",1994.0,1379289.0,55129736.0,Question,Mark Mahaney,,Analysts,3,"I'd like to focus on the North American retail operating margins. That 4.5% was the highest, I think, we've seen in a couple of years, maybe the highest since you've actually broken that segment out. So could you just go through the drivers behind that? I know you called out Alexa as being better than expected. Was that one of the factors? Was it the full quarter of the Whole Foods impact? Was it advertising revenue? Just what drove that result and how sustainable is it?",87
18749.0,"Amazon.com, Inc., Q4 2017 Earnings Call, Feb 01, 2018",2018-02-01,48.0,Earnings Calls,"Amazon.com, Inc.",1994.0,1379289.0,55129737.0,Answer,Brian Olsavsky,,Executives,4,"Sure, Mark. Let me address your question by answering the entire company. I'll note where the North America elements are strongest. So for the quarter, we came in at the highest end of our revenue range, $60.5 billion, 26 -- 36% FX-neutral growth and 25% FX-neutral growth, excluding the Whole Foods acquisition. So the fact that we came in at the high end of the range, volume was high, especially in North America, and a lot of times in Q4 and other quarters actually, we see better efficiencies when the warehouses are busy. So it was a very clean operational quarter, I would say. The ops team did a great job handling record volumes in Q4 and also incorporating all the new capacity we had opened in 2017. If you'll remember, we have added over 30% to our fulfillment square footage in 2017, coming off a similar increase in 2016. So amid all these opening of new buildings, many of them late in the year, the ops team did a fantastic job. Advertising was also a key contributor as we're continuing to make more value -- the offerings more valuable, both to customers and advertisers alike, and that was particularly strong in North America. Although not in the North America segment, I would also point out, AWS had a strong quarter, accelerating growth versus Q3 and also expanding operating margins by 100 basis points. So particularly in North America, I would say it was the -- the strong volume -- top line volume, combined with increased advertising revenues and also a very clean operational performance. Obviously, there's a lot of things that can happen in Q4 from weather to demand patterns changing. We've seen additional costs creep in, in the name of customer experience in prior years. And this was, in hindsight, probably one of the cleaner Q4s recently.",309
18749.0,"Amazon.com, Inc., Q4 2017 Earnings Call, Feb 01, 2018",2018-02-01,48.0,Earnings Calls,"Amazon.com, Inc.",1994.0,1379289.0,55129738.0,Question and Answer Operator Message,Operator,,Operator,5,Our next question comes from the line of Douglas Anmuth with JP Morgan.,13
18749.0,"Amazon.com, Inc., Q4 2017 Earnings Call, Feb 01, 2018",2018-02-01,48.0,Earnings Calls,"Amazon.com, Inc.",1994.0,1379289.0,55129739.0,Question,Douglas Anmuth,,Analysts,6,"Brian, I was hoping you could talk about how you're thinking about your primary investment areas in 2018 and perhaps if you could put it in context of '17. Are there things that are notably different this year relative to last year and also how you would think about the margin trajectory relative to what we saw last year?",59
18749.0,"Amazon.com, Inc., Q4 2017 Earnings Call, Feb 01, 2018",2018-02-01,48.0,Earnings Calls,"Amazon.com, Inc.",1994.0,1379289.0,55129740.0,Answer,Brian Olsavsky,,Executives,7,"Sure. I -- we'll be giving you guidance quarter by quarter, but I can talk to the general trends in the large investment areas. Let me start with AWS infrastructure and growth in technical and sales teams. That will continue. We're at a $20 billion run rate in top line revenues for AWS, up from 18% -- or, excuse me, $18 billion last quarter. So we're very happy with the -- both the progression in new services and features that we've been able to bring to customers and also their response. We'll continue geographic expansion and continuing to, again, build on our tech teams and our sales teams. So that would -- that expense is going to continue and likely increase. Prime benefits will continue to increase as well. Prime Now -- excuse me, Prime Video, Prime Now, AmazonFresh, all of our major Prime benefits we continue to expand globally. Devices, as Jeff said in the press release, we are very happy with the results of Alexa. It's a very positive surprise for us, both on a -- adding a little bit more to that, we had record device sales. We had very high levels of customer engagement, including increased levels of voice shopping, growth in functionality, growth in our partner -- partners we work with. The skills layer, we've increased rapidly. We're over 30,000 skills for Alexa. We've got 4,000-plus smart home devices from 1,200 unique brands. So the relationships we're having with external companies is actually helping to accelerate the adoption of Alexa with customers. So really strong usage of Prime -- excuse me, Alexa with our devices. Obviously, Echo, Echo Show and the Echo family all directly tied to Alexa, but also Fire TV and tablets. And we're seeing more and more engagement. Alexa usage on Fire TV is up 9x year-over-year. Music listening time on Alexa was 3x higher this holiday season. So that's what we mean when we said far exceeding our expectations. Those are the things I would point to. And that is an area, again, where we'll continue to invest heavily and as you say, double down on that. Fulfillment, again, is -- fulfillment capacity, especially to fuel strong top line growth and growth in Amazon fulfilled units, which, again, is growing much quicker than our unit growth rate, we expect that and hope that to continue as well into 2018. Video content, we spoke about on the last call, we do like the results we're seeing with engagement on customers, their buying habits, their engagement with the video content, their use of it on devices. And we will continue to increase our budget in that area. But I'll be release -- yes, I'll incorporate that into the guidance each quarter as we move through the year.",464
18749.0,"Amazon.com, Inc., Q4 2017 Earnings Call, Feb 01, 2018",2018-02-01,48.0,Earnings Calls,"Amazon.com, Inc.",1994.0,1379289.0,55129741.0,Question and Answer Operator Message,Operator,,Operator,8,Our next question comes from the line of Ross Sandler with Barclays.,12
18749.0,"Amazon.com, Inc., Q4 2017 Earnings Call, Feb 01, 2018",2018-02-01,48.0,Earnings Calls,"Amazon.com, Inc.",1994.0,1379289.0,55129742.0,Question,Ross Sandler,,Analysts,9,"Just 2 questions. AWS reaccelerated again this quarter. Can you just give us some color on what were the key drivers there? Was it lapping some of the price activity from a year ago? Was it higher utilization, moving up the stack? Any color there would be helpful. And then a question on shipping costs. So it looks like it grew about 31% up on shipping costs in the quarter, and that's been kind of moving in tandem with the Amazon fulfilled unit growth. Is that the right way to think about it? It looks like it might be getting a little bit of leverage in the model right now as -- is that -- what's driving that, the shipping cost leverage?",122
18749.0,"Amazon.com, Inc., Q4 2017 Earnings Call, Feb 01, 2018",2018-02-01,48.0,Earnings Calls,"Amazon.com, Inc.",1994.0,1379289.0,55129743.0,Answer,Brian Olsavsky,,Executives,10,"Sure. Let me start with that last one. Yes, shipping costs are going to be very tied to AFN unit growth and also the impact of greater Prime adoption and faster shipping methods. So yes, we consider that a very strong quarter, down sequentially in the growth that we've seen recently. That will fluctuate quarter to quarter. Again, it was a very strong operational quarter in Q4, and we've expanded the number of items that ship free. We're now over 100 million items in the U.S. So yes, shipping cost is always going to be a strong part of our offering, and we're -- it's going to be increasing due to our business model. And we, at the same time, look to minimize the cost by getting more and more efficient in that area. AWS, yes, if you remember last year, we did have price increases in December of last year towards the end, so it had a partial impact on the quarter. But generally, just strong usage growth. Usage growth continues to be strong, growing at a higher rate than our revenue growth rate and customers continue to add workloads and expand. And as I said, we're adding new services and features all the time, over 1,400 in 2017 alone. So it's a number of factors, I would say. It's not as simple as lapping a cost there -- excuse me, a price decrease last year, but very happy with the performance in -- of the AWS business. Now over a $20 billion run rate.",256
18749.0,"Amazon.com, Inc., Q4 2017 Earnings Call, Feb 01, 2018",2018-02-01,48.0,Earnings Calls,"Amazon.com, Inc.",1994.0,1379289.0,55129744.0,Question and Answer Operator Message,Operator,,Operator,11,Our next question comes from the line of Mark May with Citi.,12
18749.0,"Amazon.com, Inc., Q4 2017 Earnings Call, Feb 01, 2018",2018-02-01,48.0,Earnings Calls,"Amazon.com, Inc.",1994.0,1379289.0,55129745.0,Question,Mark May,,Analysts,12,"Brian, if you look back historically, your Q1 operating income guidance is typically about $300 million, $400 million lower than your Q4. Obviously, it's significantly greater than that this quarter. Maybe if you could shed a little light on why that is so and what are some of the key drivers there. And AWS and cloud pricing appears to have been more subtle in recent quarters. Maybe if you could talk a little bit about the pricing environment and why that has been the case, at least compared to trends from back in '14, '15 and previously.",97
18749.0,"Amazon.com, Inc., Q4 2017 Earnings Call, Feb 01, 2018",2018-02-01,48.0,Earnings Calls,"Amazon.com, Inc.",1994.0,1379289.0,55129746.0,Answer,Brian Olsavsky,,Executives,13,"Sure. Let me start with guidance. So yes, the operating income guidance is $300 million to $1 billion. Operating income last year was $1 billion. Q1 is generally when we see the volume drop off from Q4, obviously, but a lot of the costs remain from the year-over-year buildup in costs, particularly in the fulfillment network. So it's generally a headwind every Q1. It's -- given the 30%-plus growth in square footage last year that we've built, that's one major headwind from Q4 to Q1. But we also continue to invest, particularly in Alexa and our device area. As I mentioned in a number of comments earlier, we're very happy with the results, the customer adoption, the device sales that we're seeing and general customer acceptance there. So we will continue to invest there. Those are probably the 2 largest factors in Q1, I would say.",146
18749.0,"Amazon.com, Inc., Q4 2017 Earnings Call, Feb 01, 2018",2018-02-01,48.0,Earnings Calls,"Amazon.com, Inc.",1994.0,1379289.0,55129747.0,Answer,Dave Fildes,,Executives,14,"Yes. This is Dave. Just on the second piece on just pricing. I think in the pricing environment, I mean, nothing really to call out there. I guess, just a reminder on our pricing philosophy for AWS. I mean periodic price reductions are a normal part of our business. We reduced prices more than 60 times with AWS since launching. So really, our kind of goal and philosophy here is to drive efficiencies in our ops and pass those savings on to customers. And some of that's through, again, with the more than 60 price reductions, but also finding through new service and feature launches better options for a customer that present -- customers to present more efficient features for them to be able to run their businesses.",128
18749.0,"Amazon.com, Inc., Q4 2017 Earnings Call, Feb 01, 2018",2018-02-01,48.0,Earnings Calls,"Amazon.com, Inc.",1994.0,1379289.0,55129748.0,Question and Answer Operator Message,Operator,,Operator,15,Our next question comes from Dan Salmon with BMO Capital Markets.,11
18749.0,"Amazon.com, Inc., Q4 2017 Earnings Call, Feb 01, 2018",2018-02-01,48.0,Earnings Calls,"Amazon.com, Inc.",1994.0,1379289.0,55129749.0,Question,Daniel Salmon,,Analysts,16,"First, Brian, any comments on the impact of ASC 606 accounting changes on your first quarter guidance here? And then just second on the advertising business. In particular, the ads that we see in the search results on the site, the headline search ads, sponsored product ads. Do you aim for a certain particular ad load across the entire platform? Do you look at sort of tailoring it based on user's activity, maybe a combination of both? Would just be interested in your thoughts on that.",86
18749.0,"Amazon.com, Inc., Q4 2017 Earnings Call, Feb 01, 2018",2018-02-01,48.0,Earnings Calls,"Amazon.com, Inc.",1994.0,1379289.0,55129750.0,Answer,Dave Fildes,,Executives,17,"Yes. This is Dave. I'll take the first part of that question just around the new revenue recognition standard. We did adopt the new standard on January 1 of this year, 2018. You'll see that reflect in our financials for the first quarter coming up. There -- it touches on a number of different parts of our business in terms of how we recognize revenue. In terms of in the aggregate and the impacts to our expectations for the revenue guidance for the first quarter, it's not material. There's a number of different areas, at least, that we've called out in our filings with the 10-Q in the past and the 10-K that will be on file shortly that talk about the different areas that are impact to this, but again, not material in the aggregate.",136
18749.0,"Amazon.com, Inc., Q4 2017 Earnings Call, Feb 01, 2018",2018-02-01,48.0,Earnings Calls,"Amazon.com, Inc.",1994.0,1379289.0,55129751.0,Answer,Brian Olsavsky,,Executives,18,"And on advertising, I would say our strategy is to make the customer experience additive by the ad process. We want customers to be able to see new brands and have easier time discovering products that they're looking for. For brands, we think the value proposition is that we can find ways for them, especially emerging brands, to reach new customers. So we're working with advertisers of all types and sizes to help them reach our customer base and the goal of driving brand awareness, discovery and better purchase decisions by the customer.",93
18749.0,"Amazon.com, Inc., Q4 2017 Earnings Call, Feb 01, 2018",2018-02-01,48.0,Earnings Calls,"Amazon.com, Inc.",1994.0,1379289.0,55129752.0,Question and Answer Operator Message,Operator,,Operator,19,Our next question comes from Justin Post with Bank of America Merrill Lynch.,13
18749.0,"Amazon.com, Inc., Q4 2017 Earnings Call, Feb 01, 2018",2018-02-01,48.0,Earnings Calls,"Amazon.com, Inc.",1994.0,1379289.0,55129753.0,Question,Justin Post,,Analysts,20,"I think I have 2 questions. First, Whole Foods, you've got over a quarter under your belt. How's it going versus your expectations? And what can Amazon really bring now that you've been there for a while, how you're thinking about that? And then secondly, international decelerated a little bit this quarter, just wondering if there was any country to call out or anything going on there. And we know that you spend about $3 billion international investment, I guess, last year. Where do you think the high watermark is on that? So just maybe a little bit more color on your international business.",104
18749.0,"Amazon.com, Inc., Q4 2017 Earnings Call, Feb 01, 2018",2018-02-01,48.0,Earnings Calls,"Amazon.com, Inc.",1994.0,1379289.0,55129754.0,Answer,Brian Olsavsky,,Executives,21,"Sure. Let me start with the Whole Foods question. We're continuing to be very excited about the opportunities we have to innovate with the Whole Foods and Amazon teams together in our physical stores. If you look at our supplemental disclosure, the physical stores revenue was $4.5 billion in Q4, which is primarily comprised of Whole Foods and was slightly better than what was built into our guidance that I gave you last call. So, so far, our focus has been on continuing to lower prices even beyond the initial ones that we discussed at the close of the deal in late August. We've launched Whole Foods products on our Amazon website. And the technical work continues to make Prime the Whole Foods customer rewards program. And we expect to have more on that later in the year. We've also added Lockers and much more to come. So we're very happy with the initial results out of the team in Whole Foods down in Austin. Also, I will mention that we did see a small operating income loss for the quarter from Whole Foods. At the time of the acquisition, we had stepped up the fair market value of certain assets on the balance sheet. This is going to increase the amortization. It's a noncash charge, but it will increase the amortization over the useful life. And a lot of that is forward front-loaded, so we'll see higher amortization in the first few years and then it reverses later. So excluding these noncash expense items, Whole Foods had a positive operating income in Q4, but you'll see in the 10-K that the operating income, including the charges, was slightly negative in Q4. International growth, your comment about slowing down, I think there's a slowdown versus Q4 -- 3, if that was your point. 28% growth in Q3, FX neutral, was helped quite a bit by Prime Day and kind of the strengthening of Prime Day in a number of locales. Although we've had Prime Day in most of those countries, it's really starting to gain more and more traction there. So that is probably more of a help to Q3 than a discussion of any weakness in Q4. So we're -- continue to be pursuing the same strategy as we have in North America, adding Prime benefits, adding devices, adding video content, adding AmazonFresh, Prime Now, giving a lot of value to the Prime customers in international countries as well. And also in that number is India. And India continues to be a good story for us. We feel that it's had a lot of growth in the past year. In fact, more Prime members joined India's Prime program in the first year than we've seen in any other country in the history of the world, our world. So the selection is also increasing. Prime eligible selection is up over 25 million items, launching video there and also continuing to add other Prime benefits such as Prime Music will be coming soon. Amazon Family is there. As I said, Prime Video, and we had our first Prime Day in India. So that's a little bit on international growth.",528
18749.0,"Amazon.com, Inc., Q4 2017 Earnings Call, Feb 01, 2018",2018-02-01,48.0,Earnings Calls,"Amazon.com, Inc.",1994.0,1379289.0,55129755.0,Question and Answer Operator Message,Operator,,Operator,22,Our next question comes from Brian Nowak with Morgan Stanley.,10
18749.0,"Amazon.com, Inc., Q4 2017 Earnings Call, Feb 01, 2018",2018-02-01,48.0,Earnings Calls,"Amazon.com, Inc.",1994.0,1379289.0,55129756.0,Question,Brian Nowak,,Analysts,23,"I have 2. The first one, in the press release, you talk about the strength of the Prime member growth in 2017. Could you talk a little bit about to the -- what you're seeing in growth in Prime subscribers in the United States at this point? And are you still seeing a similar tick up in consumer spending as they come into Prime as you have in the past? And the second one, Brian, to go back to an earlier question on areas of investment this year, you didn't talk a whole lot about kind of new categories to expand into beyond the old retail business. Curious to hear about investment needed to go into logistics, health care and kind of new areas you haven't really cracked into as hard yet.",132
18749.0,"Amazon.com, Inc., Q4 2017 Earnings Call, Feb 01, 2018",2018-02-01,48.0,Earnings Calls,"Amazon.com, Inc.",1994.0,1379289.0,55129757.0,Answer,Dave Fildes,,Executives,24,"Yes. This is Dave. Thanks for the question, Brian. Just on the first piece, in terms of just Prime membership and Prime behavior, we continue to see that we're seeing sign-ups for memberships at a strong clip. When we look at the year-over-year growth in paid Prime members on a global basis, it's been consistent in Q4 year-over-year, similar growth rates year-over-year to what we've seen in some of the earlier quarters of this year. So that's, of course, a mix of strength in the U.S. and also strength in some of the newer markets that we've launched or introduced the Prime program in. We continue to see that as Prime members sign up and engage into the program, their purchasing patterns change and they do spend more as they move into the program. And of course, our focus is -- continues to be on adding some of the features around Prime that Brian's been talking about, but also importantly, making sure we're adding more selection to the offering through our own efforts, first party, but also programs like Fulfillment by Amazon, which is -- continues to be a fast grower for us.",193
