companyid,headline,mostimportantdateutc,keydeveventtypeid,keydeveventtypename,companyname,audiolengthsec,transcriptid,transcriptcomponentid,transcriptcomponenttypename,transcriptpersonname,companyofperson,speakertypename,componentorder,componenttext,word_count,sentiment_value,complexity_value,normalized_sentiment,normalized_complexity
32307.0,"NVIDIA Corporation, Q2 2016 Earnings Call, Aug 06, 2015",2015-08-06,48.0,Earnings Calls,NVIDIA Corporation,5166.0,851956.0,36759601.0,Presenter Speech,Colette Kress,,Executives,2,"Thanks, Arnab. Second quarter revenue was $1.15 billion, up 5% from a year earlier and well above our forecast of $1.01 billion. Growth was driven by our GTX gaming platform's continued momentum, the gaming market's underlying strength and increased automotive sales. Viewed from a segment perspective, GPU revenue was $959 million, up 9% year-over-year. Tegra processor revenue was $128 million, down 19% from a year earlier.
In the face of challenges on both the macro and semiconductor fronts, NVIDIA is executing well, helped by our sharp focus and strong market positions. Our strategy for creating platforms for gaming, enterprise graphics and virtualization, HPC and cloud and automotive continues to serve us well as visual computing becomes increasingly more important in these industries. In Q2, these 4 platforms contributed 85% of our revenue, up from 68% a year earlier.
First, let's start with gaming, a market that's global and growing. Sales of PC gaming systems this year are estimated at $28 billion with continued expansion expected. eSports professional online gaming competitions is now a major entertainment category with a growing audience of 130 million. This week's championship tournament of DOTA 2 offers a purse of $18 million compared with $10 million for the PGA Open Golf event, and there are now over 80 million people enjoying multiplayer online battle arena games, twice that of 3 years ago. Our gaming revenue rose 59% year-on-year to $661 million. This exceptional performance reflects the buoyant gaming market as well as the continued strength of our Maxwell-based GeForce GPUs for the enthusiast and performance categories.
The newly launched flagship GTX 980 Ti has received outstanding reviews. AnandTech, for example, called it the card that all other high-end video cards are measured against. Across all regions, gamers are flocking to advanced GPUs to play enormously popular games with high production values like Grand Theft Auto V and Witcher 3. Demand is also being driven by excitement around new gaming technologies, including 4K, VR and DirectX 12.
During the quarter, we rolled out SHIELD Android TV, a revolutionary device that connects your TV to an infinite world of entertainment. The world's first 4K smart TV, SHIELD was created for a new age of television, where movie, music, games and apps are delightfully simple to enjoy on one platform. SHIELD is the first of the next-generation smart TV devices. The first were streamers like Chromecast and Roku. The next will feature 4K, powerful processors and rich app stores. We are excited to take SHIELD globally as supply comes online and exciting applications become available.
Moving to enterprise. Our enterprise graphics and virtualization revenue declined 14% year-on-year to $187 million. Our Quadro business was hampered by the weak refresh cycle and workstation market. We look forward to launching the year's second half of workstations based on Windows 10, Intel's Skylake and new Quadro GPUs. We continue to make good headway with our GRID virtualization platform, which enables companies to deliver graphic-rich applications, like design tools from Adobe and Autodesk, to employees on any device anywhere. The number of GRID customers has more than tripled in the past year to over 300 from a broad range of industries. Among the more than 40 customers added this quarter are the University of Southern California; Textron, the maker of Bell Helicopters; and Gensler, the global architecture firm. Nearly 1/4 of the Fortune 100 are now in trials or in deploying GRID.
In HPC and cloud, revenue declined 15% year-on-year to $62 million, reflecting lumpiness from major deep learning projects. We strengthened our offerings in the rapid-growing field of deep learning, building on momentum from our March GPU Technology Conference. We launched DIGITS 2, CUDA N3, GPU-accelerated software that doubles deep learning performance for data scientists and researchers. Deep learning adoption continues to grow with multiple developers for voice-recognition platforms serving vast numbers of consumers. We are now engaged with more than 3,300 developers and companies interested in this area. Moreover, nearly 30,000 professionals on LinkedIn identified themselves as having proficiency in CUDA, our language for programming GPUs. In addition, GPU computing in the cloud continues to gather momentum, with multiple leading cloud services providers offering GPU computing resources. We are also excited by the opportunities presented by President Obama's call last week for the U.S. to build an exascale supercomputer, one 30x faster than today's most powerful systems. Just as GPU technologies are being used to build the pre-exascale computers coming online in the years ahead, we believe they will be important for exascale.
Finally, automotive revenue rose 76% year-over-year to $71 million. Momentum here continues with new designs at new and existing customers. Hitting the road this quarter in North America, for example, is Audi's TT sports car, which features a full digital dashboard power by Tegra. In addition to our infotainment cockpit business, we are working with more than 50 companies interested in using NVIDIA DRIVE PX in their autonomous driving efforts.
Last quarter, we announced our intention to sell or wind down our Icera modem operations. In the absence of a viable buyer, we are winding it down. Accordingly, we have incurred this quarter $103 million in restructuring charges net of tax. GAAP gross margin was 55.0% and incorporates our warranty provision for SHIELD tablet. Non-GAAP gross margins was 56.6%, in line with our outlook. Margins were slightly lower than the previous quarter, as the strength of GeForce GTX revenue was offset by a lower mix of enterprise and accelerated computing GPUs. GAAP operating expenses for the second quarter were $558 million, inclusive of $89 million of restructuring and other expenses associated with the wind-down of Icera modem operations. Non-GAAP operating expenses were $421 million, including litigation charges, slightly below our outlook. GAAP net income was $26 million and GAAP earnings per diluted share was $0.05, including $0.19 charge for Icera and $0.02 charge for the recall. Non-GAAP net income was $190 million and non-GAAP EPS was $0.34. Earnings grew 13% year-over-year.
Now turning to some key balance sheet items. In Q2, our cash and marketable securities balance was $4.51 billion. During the second quarter, we paid $52 million in cash dividends and $400 million associated with an accelerated repurchase agreement. As a result, we returned an aggregate of $452 million to shareholders following $99 million in the first quarter.
Now turning to the outlook for the third quarter of fiscal 2016. We expect revenue for the third quarter of 2016 to be $1.18 billion, plus or minus 2%. We remain excited about our business prospects. Gaming continues to accelerate, and 4K, VR, Windows 10 and a pipeline of exciting games will lift it further. GPU-accelerated data centers are expanding, deep learning is a new exciting application and the market for car computers is expanding. We have excellent positions in each of these growth markets. Our GAAP and non-GAAP gross margins are expected to be 56.2% and 56.5%, respectively, plus or minus 50 basis points. This outlook is slightly below Q2 margins, reflecting our product mix. GAAP operating expenses are expected to be $484 million. Non-GAAP operating expenses are expected to be approximately $435 million. We expect fiscal 2016 non-GAAP operating expenses to be approximately flat with fiscal year 2015, excluding litigation costs, which are anticipated to be in the range of $70 million to $90 million as we defend our intellectual property. GAAP and non-GAAP tax rates for the third quarter of fiscal 2016 are expected to be 22% and 20%, respectively, plus or minus 1%. The above GAAP outlook amounts exclude restructuring charges, which are expected to be in the range of $15 million to $25 million in the second half of fiscal 2016.
We will now open the call for questions. Operator, will you please poll for questions.",1292,8.0,6.0,0.9444444444444444,0.6
32307.0,"NVIDIA Corporation, Q2 2016 Earnings Call, Aug 06, 2015",2015-08-06,48.0,Earnings Calls,NVIDIA Corporation,5166.0,851956.0,36759602.0,Question and Answer Operator Message,Operator,,Operator,3,[Operator Instructions] And our first question comes from the line of Harlan Sur with JPMorgan.,15,4.0,6.0,0.7222222222222222,0.6
32307.0,"NVIDIA Corporation, Q2 2016 Earnings Call, Aug 06, 2015",2015-08-06,48.0,Earnings Calls,NVIDIA Corporation,5166.0,851956.0,36759603.0,Question,Harlan Sur,,Analysts,4,"If I look at the pipeline of blockbuster games coming down the pipe in October and November: Rainbow 6, Fallout 4, Black Ops III and so on, I mean, this is shaping up to be a stellar year for new game releases. And then on top of that, GTX 980 Ti seems to be doing very well in the market. Why wouldn't we expect more seasonal growth in the business here for October? I guess, the question is, maybe offsetting that, are you guys still seeing headwinds in the enterprise and cloud or PC OEM segments in Q3?",98,6.0,5.0,0.8333333333333334,0.5
32307.0,"NVIDIA Corporation, Q2 2016 Earnings Call, Aug 06, 2015",2015-08-06,48.0,Earnings Calls,NVIDIA Corporation,5166.0,851956.0,36759604.0,Answer,Jen-Hsun Huang,,Executives,5,"Yes, Harlan, there are several -- I would say, 4 major drivers in the gaming industry. The first one is the blockbuster titles that you mentioned. The installed base of game platforms is growing so greatly that developers can now invest an enormous amount in the production value of great games. In the second half, you're going to see some pretty amazing games. I mean, you didn't mention Star Wars. Myself along with everybody else are practically out of our minds waiting for it, and I think this is going to be a huge game, Call of Duty, of course; Assassin's Creed, of course; Metal Gear Solid is going to be huge. The second half of the year, we're going to see some really huge games. The second dynamic is just eSports. eSports is probably the most social gaming platform that we have, and the reason for that is because you want to play with your friends. And it's also a form of gaming where milliseconds could make the difference between winning or losing. So performance of your platform matters a great deal. And it's a solely PC phenomenon, and it's a global phenomenon. In just a few years' time, eSports has doubled to almost 100 million gamers around the world. And this is, as I mentioned, is social, and so therefore, the network effect is quite important. And that's why you can imagine it doubling in just a few short years. And the larger the numbers, it just seems like the larger the numbers become. And the third driver for gaming this holiday season is the combination of several platforms coming together, finally. 4k is here, the pricing is fantastic now. Windows 10 is great, and the Skylake platform from Intel is going into production now. And then the fourth driver is a driver that we all have heard a great deal about, and surely the experience is as wonderful as the promise, is VR. VR will go into production in the second half of the year. Each one of these drivers are pretty large scale, and so I would agree with you that my expectation would be that gaming is going to continue to grow and high-end gaming, particularly, is going to grow nicely. The guidance that we provided is the guidance that we think makes sense at this time, and then we will report on how it turns out at the end of the quarter.",408,8.0,6.0,0.9444444444444444,0.6
32307.0,"NVIDIA Corporation, Q2 2016 Earnings Call, Aug 06, 2015",2015-08-06,48.0,Earnings Calls,NVIDIA Corporation,5166.0,851956.0,36759605.0,Question,Harlan Sur,,Analysts,6,"Okay. And then, the team has got this great pipeline of auto design wins, and with the new model changeover that's happening now that you guys mentioned in your prepared remarks, how is this expanding the number of new models that are rolling out here in the second half of the year that are using the Tegra platform and that you would also be recognizing revenue on, on a go-forward basis? I guess what I'm trying to figure out is, is auto contributing to the growth in Q3 and second half of this year.",94,7.0,6.0,0.8888888888888888,0.6
32307.0,"NVIDIA Corporation, Q2 2016 Earnings Call, Aug 06, 2015",2015-08-06,48.0,Earnings Calls,NVIDIA Corporation,5166.0,851956.0,36759606.0,Answer,Jen-Hsun Huang,,Executives,7,"Let's see, well, auto is growing over 70% a year. We have 8 million cars on the road now. We have 30 million more cars coming with our Tegra platform in it. And our recent initiative of utilizing deep learning in our CUDA processors, the Tegra processors for autonomous driving, is really gaining a lot of traction. We're now engaged with about 50 companies around the world developing autonomous vehicles. The advantage that we have is the ability to capture camera inputs from all around the car, in addition to other sensors from LiDAR to radar to sonar. And sensor fusion is just such an important part of autonomous driving that this Tegra platform, we call it the DRIVE PX platform, is really incredibly valuable to the car companies. And so we're developing autonomous driving vehicles with many, many of them at the moment. So I expect the car business to continue to grow, and hard to exactly to say how it's going to do the second half. It depends on how many cars get sold. But there's no question at all that, year-over-year, the growth is going to be steady, and it's going to keep going for several years.",201,7.0,6.0,0.8888888888888888,0.6
32307.0,"NVIDIA Corporation, Q2 2016 Earnings Call, Aug 06, 2015",2015-08-06,48.0,Earnings Calls,NVIDIA Corporation,5166.0,851956.0,36759607.0,Question and Answer Operator Message,Operator,,Operator,8,Our next question comes from the line of Stephen Chin with UBS.,12,7.0,5.0,0.8888888888888888,0.5
32307.0,"NVIDIA Corporation, Q2 2016 Earnings Call, Aug 06, 2015",2015-08-06,48.0,Earnings Calls,NVIDIA Corporation,5166.0,851956.0,36759608.0,Question,Stephen Chin,,Analysts,9,"Jen-Hsun, first one for you, if I could. In terms of VR, as you mentioned, some of the new products will go into production this year. As far as a bigger demand inflection for that technology goes, approximately when would you think that would be really taking off in terms of unit volumes, and also helping to uplift your GPU business further? And related to that, just given that you have a lot of development on the software side as well as on the hardware products in terms of your SHIELD products, does it make sense for NVIDIA to go more vertically integrated for VR products?",107,6.0,7.0,0.8333333333333334,0.7
32307.0,"NVIDIA Corporation, Q2 2016 Earnings Call, Aug 06, 2015",2015-08-06,48.0,Earnings Calls,NVIDIA Corporation,5166.0,851956.0,36759609.0,Answer,Jen-Hsun Huang,,Executives,10,"So the first question is, it's hard to say, but we know that several hundred thousand development kits were sold of the Oculus glasses. And if we just take a couple, 200,000, 300,000, they tend to require higher-end GPUs because you're driving stereo, you need to have extremely low latency, and you need to have 90 frames a second so that you don't see flicker. And so those factors combined requires you to have a relatively high-end GPU. Several hundred thousand new high-end GPUs at several hundred dollars apiece adds up a bit. And that would be for the first year. It's hard to say exactly how big the VR market becomes ultimately. But if you had a chance to try it, it's really a whole new experience. Being immersive, it just doesn't begin to explain how wonderful it is. And so, I think, the buzz around VR from all the people that have experienced it and the content developers that have spoken so highly of it is consistent with the reality at this point. It's taken many years -- many decades, frankly, several decades to have brought VR to this point. And I think that it surely it looks like it's ready. As to the question of what can we do more in VR, there's quite a bit that we can do in VR, and we're working with Oculus and we're working with Valve to really integrate the entire rendering pipeline, the entire experience into a seamless one. That's an extraordinary amount of work to do already. In the other industries, we're going to see a lot of adoption in VR. This is an area where our workstation business, our Quadro business is going to get a really great lift. And the reason for that, of course, is being able to see and experience a product in virtual reality before you manufacture it. And so whether you're designing a building or designing a car or creating a showroom, the ability to be able to put it on VR and experience it before you build it is quite an extraordinary benefit. And so we're going to see some exciting adoption in the design community as well. So there's plenty of work to do, plenty of innovation at the rendering layer for us to do. So I think that's plenty for now.",391,7.0,6.0,0.8888888888888888,0.6
32307.0,"NVIDIA Corporation, Q2 2016 Earnings Call, Aug 06, 2015",2015-08-06,48.0,Earnings Calls,NVIDIA Corporation,5166.0,851956.0,36759610.0,Question,Stephen Chin,,Analysts,11,"As my follow-up for Colette, on the OpEx side for the October quarter, can you talk about some of the puts and takes for the OpEx spend and sort of what the main driver for the sequential increase for non-GAAP OpEx is?",43,2.0,6.0,0.6111111111111112,0.6
32307.0,"NVIDIA Corporation, Q2 2016 Earnings Call, Aug 06, 2015",2015-08-06,48.0,Earnings Calls,NVIDIA Corporation,5166.0,851956.0,36759611.0,Answer,Colette Kress,,Executives,12,"Sure, Stephen. So when we look at Q3, Q3 has a couple key things in it as we get ready for the holiday season. Revenue-related OpEx, as we think of marketing and others, is also in our Q3. It is also the time that we take the opportunity to look at the salaries of our employees. So our overall salary increases for worldwide do take place in Q3.",68,6.0,4.0,0.8333333333333334,0.4
32307.0,"NVIDIA Corporation, Q2 2016 Earnings Call, Aug 06, 2015",2015-08-06,48.0,Earnings Calls,NVIDIA Corporation,5166.0,851956.0,36759612.0,Question and Answer Operator Message,Operator,,Operator,13,And our next question comes from the lines of Vivek Arya calling from Bank of America Merrill Lynch.,18,6.0,7.0,0.8333333333333334,0.7
32307.0,"NVIDIA Corporation, Q2 2016 Earnings Call, Aug 06, 2015",2015-08-06,48.0,Earnings Calls,NVIDIA Corporation,5166.0,851956.0,36759613.0,Question,Vivek Arya,,Analysts,14,"Jen-Hsun, I just wanted to go back to the quarter you reported. I'm wondering what changed versus your original expectations? Where you just too conservative before or what changed in the quarter to really create this kind of positive surprise? And how are you making sure there is no build-up of excess inventory given just broad macro conditions seem so volatile right now?",64,6.0,5.0,0.8333333333333334,0.5
32307.0,"NVIDIA Corporation, Q2 2016 Earnings Call, Aug 06, 2015",2015-08-06,48.0,Earnings Calls,NVIDIA Corporation,5166.0,851956.0,36759614.0,Answer,Jen-Hsun Huang,,Executives,15,"Yes. Well, answering the second part first. We monitor sell-out in the channel literally every day, and so that's how we manage inventory. We don't manage inventory on sell-in, we manage inventory on sell-out. And so having our own specialized platforms instead of selling into OEMs gives us a lot more visibility, frankly, than we've ever had before. As you know, we really changed our business model. From a company that sold components to PC OEMs and OEMs -- mobile OEMs, we're now focused on specialized platforms for specialized applications. And we have identified 4 applications where we could add a lot value. And in each one of these 4 applications, we're so much closer to the marketplace that the visibility is just surely better. If you go back to the first part of your question, I think 90 days ago, just about everybody was rather uncertain about what was happening. There were a lot of changes going on around the world. Surely, there's still changes around the world, but for 
[Technical Difficulty]
Vivek, I think you're plane is here. It's all right. So anyways, it's just -- that was the best we could see it at the time, and we provided the best judgment we had, and it turned out to have been much better than that.",218,7.0,6.0,0.8888888888888888,0.6
32307.0,"NVIDIA Corporation, Q2 2016 Earnings Call, Aug 06, 2015",2015-08-06,48.0,Earnings Calls,NVIDIA Corporation,5166.0,851956.0,36759615.0,Question,Vivek Arya,,Analysts,16,"Got it. Jen-Hsun, as my follow-up, could you talk about your average content in the car? Where is it now? Where can it get to? Because I think you mentioned that 30 million cars -- I think you have mentioned 25 million before, and if I take the 30 million cars [indiscernible], it means it's roughly 10% share of all the cars that are sold in a given year. So you're penetrating just the high end of the car. So please talk about like what the direction is? If you could quantify, that'll be very useful. And then, in terms of penetration, is it just the high-end or are you able to get it to the midrange and mass-market as well?",121,7.0,5.0,0.8888888888888888,0.5
32307.0,"NVIDIA Corporation, Q2 2016 Earnings Call, Aug 06, 2015",2015-08-06,48.0,Earnings Calls,NVIDIA Corporation,5166.0,851956.0,36759616.0,Answer,Jen-Hsun Huang,,Executives,17,"Well, we're trying to win as much as we can while delivering value to the customers that we select. And our value proposition, as you can imagine, tends to be where visual computing is really important, and it could be because of large surround and dynamic infotainment systems, virtual cockpits where you've got the digital dashboard, and it's rich and it's moving, and infotainment's integrated into it and maps integrated into it. You might have several virtual machines that are running at the same time so that infotainment and digital clusters are not integrated into one computer and provide a safety among itself. It could be, in the future, several computers inside the car, some in the front, some in the back, as displays become more affordable and people's expectation for rich graphics continue to grow. You could expect us to have infotainment systems, virtual clusters as well as drive computers that are used for driver assistance or autonomous driving. And so there's a lot of different ways that a computer is going to be included in cars. I think, largely, the trend is very, very clear that in the future, the best way to add value to products is to connect them to the Internet and make them computerized, make it a software-defined product. And I think your car is going to become a software-defined car and the amount of processing inside will continue to grow at an exponential level. And as a visual computing company, we think we can add a lot of value here. And so I think our software content is going to continue to grow. This isn't like our parents' car industry anymore. This is really a computerized car industry. And cars are going to be supercomputers in the future.",295,7.0,6.0,0.8888888888888888,0.6
32307.0,"NVIDIA Corporation, Q2 2016 Earnings Call, Aug 06, 2015",2015-08-06,48.0,Earnings Calls,NVIDIA Corporation,5166.0,851956.0,36759617.0,Question,Vivek Arya,,Analysts,18,"All right, and one last one for Colette, if I may. Cash is almost 40% of the market cap now, a lot of buybacks. I'm wondering, Colette, is still that the best use of cash or are there other options for the large cash that you've built up?",48,5.0,3.0,0.7777777777777778,0.3
32307.0,"NVIDIA Corporation, Q2 2016 Earnings Call, Aug 06, 2015",2015-08-06,48.0,Earnings Calls,NVIDIA Corporation,5166.0,851956.0,36759618.0,Answer,Colette Kress,,Executives,19,"Thanks for the question. We tend to look at our cash balance net of our debt as well, as we have about $1.5 billion outstanding debt. And then with our synthetic lease that we also just completed, we'll add on top of that. So our net is probably a pretty good -- better barometer of what percentage of our value is associated. We've looked at our capital return program heavily. We are excited at the amount that we are returning this year, close to $800 million, which is nearly in the high percentage of our free cash flow. And we'll continue to look of opportunities for our cash, whether that be investment in the business, more capital return and/or M&A. Thanks for the question.",124,6.0,7.0,0.8333333333333334,0.7
32307.0,"NVIDIA Corporation, Q2 2016 Earnings Call, Aug 06, 2015",2015-08-06,48.0,Earnings Calls,NVIDIA Corporation,5166.0,851956.0,36759619.0,Question and Answer Operator Message,Operator,,Operator,20,And our next question comes from the line of Deepon Nag calling from Macquarie Research.,15,5.0,7.0,0.7777777777777778,0.7
