companyid,headline,mostimportantdateutc,keydeveventtypeid,keydeveventtypename,companyname,audiolengthsec,transcriptid,transcriptcomponentid,transcriptcomponenttypename,transcriptpersonname,companyofperson,speakertypename,componentorder,componenttext,word_count,sentiment_value,complexity_value,normalized_sentiment,normalized_complexity
32307.0,"NVIDIA Corporation, Q2 2016 Earnings Call, Aug 06, 2015",2015-08-06,48.0,Earnings Calls,NVIDIA Corporation,5166.0,851956.0,36759678.0,Answer,Jen-Hsun Huang,,Executives,79,"Well, I think that first of all, it's, I guess, at this point, a foregone conclusion that accelerated computing is an essential part of future scaling in the what is called the post-Moore's Law era, and accelerated computing can come in a lot of different forms. An FPGA is a configurable computer and so if you don't have that many different types of algorithms and you can afford the expense and the difficulty of designing an FPGA, you can get results. It's basically designing your own custom chip that runs slower because ASICs are faster, but still you're designing a custom chip. On the other hand, a GPU is not about designing. It's about programming. And so if you a have large -- different types of algorithms, you're changing your algorithms on a regular basis, the throughput that you get with a GPU that we built, which is arguably already the most complex that any processor has ever been built anyhow, and so it gives you a lot more flexibility. And so these are all spectrums, if you will, of accelerated computing. But the thing that is really fantastic is, finally, on a very, very large scale and across the industry, the recognition that accelerated computing is the path forward.",210,6.0,8.0,0.8333333333333334,0.8
32307.0,"NVIDIA Corporation, Q2 2016 Earnings Call, Aug 06, 2015",2015-08-06,48.0,Earnings Calls,NVIDIA Corporation,5166.0,851956.0,36759679.0,Question and Answer Operator Message,Operator,,Operator,80,Our next question comes from the line of C.J. Muse with Evercore.,13,5.0,6.0,0.7777777777777778,0.6
32307.0,"NVIDIA Corporation, Q2 2016 Earnings Call, Aug 06, 2015",2015-08-06,48.0,Earnings Calls,NVIDIA Corporation,5166.0,851956.0,36759680.0,Question,Christopher Muse,,Analysts,81,"I guess first question, Jen-Hsun, when you look at PC gaming and strength and sustainability in the back half, it looks like you came in about $150 million more than what you were thinking at least initially for the guidance and curious if there's any sort of color you can provide there in terms of mix, higher ASP strength geographically. And then looking at the second half of the year, first half fiscal '16 is growing about 40% year-over-year. How should we think about the second half versus the first half, particularly given those 4 drivers that you outlined at the early part of the call?",106,5.0,6.0,0.7777777777777778,0.6
32307.0,"NVIDIA Corporation, Q2 2016 Earnings Call, Aug 06, 2015",2015-08-06,48.0,Earnings Calls,NVIDIA Corporation,5166.0,851956.0,36759681.0,Answer,Jen-Hsun Huang,,Executives,82,"Yes, let me answer the second one first, and maybe Colette can help you with the first one. On the second one, the thing that I feel much more confident in answering is our position in the market and the health of that market. I am pretty sure that gaming is a large-scale phenomenon and growing. I'm pretty sure that MOBA is a social network that when you -- when you're playing games, you're hanging out with your friends. And when some of your friends are hanging out on MOBA, you've got to join in, otherwise, you don't get to hang out. And so it's the reason why these large markets get larger. The benefit of a very large market is that finally developers, publishers can invest several hundred million dollars in building a new game of extraordinary production value and launch it into a very large market. The benefit of a large production-value game to us is that it needs really, really great GPUs. So those positive feedback systems, those positive feedback effects are things that I understand very, very well. How's the seasonal buying in the second half and exactly how many percent and how many we're going to sell is kind of harder for me to tell, but I do know that our gaming business is quite robust. On the other extreme, I know what I know about the autonomous vehicles and the processing that is necessary to achieve and realize that dream and where we are on that dream. We're still quite a ways from it, in fact, to do something that we can really, really count on. And then on accelerated computing, I'm pretty confident at this point that accelerated computing has reached the tipping point and that it has been recognized around the industry and globally that this is a very good approach forward, both for supercomputing, already adopted by our nation's fastest supercomputer, but -- and also the recognition by the presidential initiative to adopt methods to bring exascale to the marketplace in the next several years. Accelerated computing will surely be required. And so I think that those things I feel very strongly about and I think it's pretty clear, our position within each one of those are very good.",378,7.0,6.0,0.8888888888888888,0.6
32307.0,"NVIDIA Corporation, Q2 2016 Earnings Call, Aug 06, 2015",2015-08-06,48.0,Earnings Calls,NVIDIA Corporation,5166.0,851956.0,36759682.0,Answer,Colette Kress,,Executives,83,"Yes, and to help answer your question regarding our performance in the quarter on gaming and how well it did and where did it come from in terms of is that ASP, is that volume, is it region. And the answer to that is yes, yes and yes. At the value that we delivered in our high GTX cards, we're truly well received by the market. That high value affords us a great ASP and a great revenue growth. We've seen tremendous volume over this quarter as well, which has helped us. But thirdly, which I think is important, is all regions, from a sell-through, are also performing very well.",110,8.0,5.0,0.9444444444444444,0.5
32307.0,"NVIDIA Corporation, Q2 2016 Earnings Call, Aug 06, 2015",2015-08-06,48.0,Earnings Calls,NVIDIA Corporation,5166.0,851956.0,36759683.0,Question and Answer Operator Message,Operator,,Operator,84,The last question comes from the line of Matthew Ramsay from Canaccord Genuity.,13,2.0,6.0,0.6111111111111112,0.6
32307.0,"NVIDIA Corporation, Q2 2016 Earnings Call, Aug 06, 2015",2015-08-06,48.0,Earnings Calls,NVIDIA Corporation,5166.0,851956.0,36759684.0,Question,Matt Ramsay,,Analysts,85,"Jen-Hsun, as you may appreciate, there's been a little bit of angst in the investor community regarding the Chinese consumer given all that's going on over there in the stock market, et cetera, and it seems like your gaming business has obviously done quite well. And maybe you could talk a little bit about the concentration of your gaming business that maybe ends up in China and how the trends are playing out in that market overall since it seems you guys are doing much better than folks might have feared?",92,7.0,5.0,0.8888888888888888,0.5
32307.0,"NVIDIA Corporation, Q2 2016 Earnings Call, Aug 06, 2015",2015-08-06,48.0,Earnings Calls,NVIDIA Corporation,5166.0,851956.0,36759685.0,Answer,Jen-Hsun Huang,,Executives,86,"Yes, I appreciate the question. About 40%, I guess, just shy of 40% of our total gaming business is in China. The Chinese market is surprisingly resilient because most of the games are free to play. It is probably one of the most affordable forms of entertainment that you can possibly imagine. And as I mentioned earlier, these network games are really social environments, they are social networks, and one of the reasons why Tencent grew so fast in China. Once you -- once the social network gets traction, it grows faster than linear. And so there are some reasons why the Chinese market is more resilient, the gaming market is more resilient than expected. We're also seeing a shift to higher-end GPUs in China. Some of that probably has to do with the dramatic change and improvement in production value of games in China. There was a time when the Chinese games were enjoyed and fun. However, the production value weren't very good. But now if you take a look at the Tencent games, the production value are just absolutely phenomenal. They're beautiful, they're artistic and in those cases, require a lot more GPU capability. And so we're seeing multiple dynamics happening in China, and they all seem to be quite healthy.",213,6.0,5.0,0.8333333333333334,0.5
32307.0,"NVIDIA Corporation, Q2 2016 Earnings Call, Aug 06, 2015",2015-08-06,48.0,Earnings Calls,NVIDIA Corporation,5166.0,851956.0,36759686.0,Question and Answer Operator Message,Operator,,Operator,87,I will now turn it back to the speakers for their closing remarks.,13,5.0,2.0,0.7777777777777778,0.2
32307.0,"NVIDIA Corporation, Q2 2016 Earnings Call, Aug 06, 2015",2015-08-06,48.0,Earnings Calls,NVIDIA Corporation,5166.0,851956.0,36759687.0,Answer,Jen-Hsun Huang,,Executives,88,"Thank you, everybody, and I'll talk to you next week -- next quarter.",13,2.0,2.0,0.6111111111111112,0.2
32307.0,"NVIDIA Corporation, Q2 2016 Earnings Call, Aug 06, 2015",2015-08-06,48.0,Earnings Calls,NVIDIA Corporation,5166.0,851956.0,36759688.0,Answer,Colette Kress,,Executives,89,Thank you.,2,-3.0,3.0,0.3333333333333333,0.3
32307.0,"NVIDIA Corporation, Q2 2016 Earnings Call, Aug 06, 2015",2015-08-06,48.0,Earnings Calls,NVIDIA Corporation,5166.0,851956.0,36759689.0,Question and Answer Operator Message,Operator,,Operator,90,"Ladies and gentlemen, that does conclude the conference call for today. We do thank you for your participation, and ask that you please disconnect your lines.",26,1.0,2.0,0.5555555555555556,0.2
32307.0,"NVIDIA Corporation, Q3 2016 Earnings Call, Nov 05, 2015",2015-11-05,48.0,Earnings Calls,NVIDIA Corporation,5103.0,894759.0,38354916.0,Presentation Operator Message,Operator,,Operator,0,"Good afternoon. My name is Mike, and I will be your conference operator today. At this time, I would like to welcome everyone to the NVIDIA financial results conference call. [Operator Instructions] As a reminder, this call is being recorded, Thursday, November 5, 2015. I will now turn the call over to Arnab Chanda, Vice President of Investor Relations at NVIDIA. You may begin your conference.",66,7.0,3.0,0.8888888888888888,0.3
32307.0,"NVIDIA Corporation, Q3 2016 Earnings Call, Nov 05, 2015",2015-11-05,48.0,Earnings Calls,NVIDIA Corporation,5103.0,894759.0,38354917.0,Presenter Speech,Arnab Chanda,,Executives,1,"Thank you. Good afternoon, everyone, and welcome to NVIDIA's conference call for the third quarter of fiscal 2016. 
With me on the call today from NVIDIA our Jen-Hsun Huang, President and Chief Executive Officer; and Colette Kress, Executive Vice President and Chief Financial Officer.
I'd like to remind you that today's call is being webcast live on NVIDIA's Investor Relations website. It is also being recorded. You can hear a replay by telephone until the 12th of November 2015. The webcast will be available for replay up until next quarter's conference call to discuss Q4 financial results. The content of today's call is NVIDIA's property. It cannot be reproduced or transcribed without our prior written consent.
During the course of this call, we may make forward-looking statements based on current expectations. These forward-looking statements are subject to a number of significant risks and uncertainties, and our actual results may differ materially.
For a discussion of factors that could affect our future financial results and business, please refer to the disclosure in today's earnings release, our most recent Forms 10-K and 10-Q and the reports that we may file on Form 8-K with the Securities and Exchange Commission.
All our statements are made as of today, the 5th of November 2015, based on information currently available to us. Except as required by law, we assume no obligation to update any such statements.
During this call, we will discuss non-GAAP financial measures. You can find a reconciliation of these non-GAAP financial measures to GAAP financial measures in our CFO Commentary, which is posted on our website.
With that, let me turn the call over to Colette.",274,6.0,5.0,0.8333333333333334,0.5
32307.0,"NVIDIA Corporation, Q3 2016 Earnings Call, Nov 05, 2015",2015-11-05,48.0,Earnings Calls,NVIDIA Corporation,5103.0,894759.0,38354918.0,Presenter Speech,Colette Kress,,Executives,2,"Thanks, Arnab. Third quarter revenue was a record $1.305 billion, up 7% from a year earlier, up 13% sequentially and substantially above our outlook of $1.18 billion. Growth was driven by record revenue for gaming, particularly for our GTX platform and automotive infotainment systems.
From a reporting segment perspective, GPU revenue was $1.11 billion, up 12% from a year earlier. Tegra processor revenue was $129 million, down 23% from a year earlier.
Our strategy remains focused on creating platforms for gaming, professional visualization, data center and automotive. Our progress is the result of product innovation, our strong position in growing markets and disciplined execution.
In Q3, our 4 market platforms contributed 85% of our revenue, up from 71% a year earlier.
First, let's start with our gaming platform. Gaming revenue rose 44% year-on-year to $761 million. Growth is being fueled by a number of factors, among them: the significant increase in graphics production value, the rise of eSports, the anticipation of blockbuster games for the holiday season and the emergence of new technologies like VR for richer, more immersive game play.
Professional gaming competitions, or eSports, are well on their way to becoming a global entertainment category, with an audience of 188 million viewers. There were 30 million viewers alone for last month's League of Legends World Championship.
The launch of great gaming titles drives gaming platform sales. We are excited by the strong pipeline of AAA games ready for the holiday season, including Star Wars Battlefront, Call of Duty: Black Ops III, Rainbow Six and Fallout 4. Meanwhile, we are looking forward to the launch of virtual reality, with the approaching availability of VR headsets from Oculus, HTC and others as well as new VR games such as EVE: Valkyrie. 
During the quarter, we enabled a new category of high-capable enthusiast-class gaming notebooks, with the launch of GTX 980. For the first time, notebooks are able to deliver the same gaming experience as desktops and have the processing power to drive frame rates needed for VR. 
Our long-term bet on Android gaming is SHIELD. During the quarter, we extended the reach of SHIELD Android TV, the market's most advanced 4K smart TV console, in 2 key European markets. We launched GeForce NOW, which provides Netflix-like service for streaming games from the cloud to your SHIELD device. 
Moving to professional visualization. Quadro revenue increased 8% sequentially to $190 million, a decline of 8% year-over-year. At the SIGGRAPH professional computer design conference, we introduced NVIDIA DesignWorks. This suite of algorithm libraries and tools enables developers to easily incorporate photorealistic visualization of product and building designs. And with DesignWorks VR, developers can easily provide the amazing experience for such areas as theme park design, product design, telepresence and surgical training.
In data center, inclusive of Tesla and GRID, revenue rose 13% sequentially to $82 million, reflecting demand in deep learning, high-performance computing and graphic virtualization. Revenue declined 8% year-on-year due to lumpiness from large deep-learning projects. Most of the world's leading web services companies have adopted Tesla for deep learning to power next-generation services. In addition to using our GPUs for training servers on massive datasets, companies like Baidu are using them for inference for such work as real-time voice recognition.
In high-performance computing, we increasingly find that GPUs are moving from the domain of researchers to commercial use, in such areas as weather forecasting and seismic processing. We continue to make progress as well, with our GRID virtualization platform, which enables companies to deliver graphic-rich applications to employees on any device anywhere. At VMworld in San Francisco, we launched GRID 2.0, with twice the user density and application performance of its predecessor and support for both Linux and Blade servers. A dozen Fortune 100 companies are completing trials of GRID 2.0 and more than 125 OEM-offered servers are qualified to run it.
Also reflecting momentum for NVIDIA data center offerings, Microsoft Azure announced that it has integrated NVIDIA GRID into its rapidly growing cloud service in response to customer demand for GPU acceleration in the cloud.
Finally, automotive revenue rose 51% year-on-year to a record 79% -- $79 million. At last month's international auto show in Frankfurt, Mercedes Benz, Audi, Porsche, Bentley and Honda all showcased a range of production vehicles and concept cars with NVIDIA-powered digital cockpits. And our partner, Tesla Motors, just introduced its Falcon Wing Model X, like the Model S, the Model X is equipped with both a multi-touch infotainment system and a digital instrument cluster powered by NVIDIA. 
Finally, we are continuing deeper collaborations with over 50 companies that are developing self-driving car technologies using NVIDIA DRIVE PX. These include car manufacturers, Tier 1 OEMs, start-ups and research institutions. DRIVE PX is an advanced autonomous driving platform that fuses data from cameras, LIDARs, radar and ultrasonic sensors to determine the path forward using deep learning techniques. We look forward to sharing more details about this work at CES 2016. 
Our OEM and IP business was $192 million, up 11% sequentially, driven by seasonal demand for notebooks.
Now turning to the rest of the income statement. GAAP gross margin was 56.3%. Non-GAAP gross margin was 56.5%, in line with our outlook. GAAP and non-GAAP gross margin increased from a year ago, reflecting our strong gaming revenue. GAAP gross margin increased sequentially as the previous quarter included a charge related to the NVIDIA SHIELD tablet recall. Non-GAAP gross margin was nearly flat sequentially.
GAAP operating expenses for the third quarter were $489 million, inclusive of $8 million of restructuring and other charges. Non-GAAP operating expenses including litigation charges were $430 million, slightly lower than our outlook. We continue to focus on operating efficiencies and we manage investment growth while growing operating margins.
GAAP operating income for the third quarter was $245 million, up 15% from $213 million a year earlier, reflecting strong revenue growth. Non-GAAP operating income was $308 million, up 17% from $264 million a year earlier.
GAAP net income was $246 million. GAAP earnings per diluted share were $0.44, including $0.01 of restructuring and other charges as well as a benefit of $0.09 from a tax reserve release. Non-GAAP net income was $255 million. Non-GAAP earnings per diluted share were $0.46, an increase of 18% year-over-year.
Now turning to some key balance sheet items. In Q3, our cash and marketable securities balance was $4.73 billion. During the third quarter, we paid $53 million in cash dividends and we closed our accelerated repurchasing agreement with an additional 4.6 million shares returned. As a result, we have returned to shareholders an aggregate of $604 million fiscal year-to-date of our full year intent to return $800 million.
As part of our ongoing commitment to deliver shareholder value through capital return, we have announced an 18% increase to our quarterly cash dividend to $0.115 per share to be paid on December 14 to all shareholders of record on November 20.
In addition, we are pleased to announce our intention in fiscal 2017 to return approximately $1 billion to shareholders through ongoing quarterly cash dividends and share repurchases.
Now turning to the outlook for the fourth quarter of fiscal 2016. We remain excited about our business prospects. Gaming continues to accelerate, and eSports, VR and a pipeline of exciting games will lift it further. GPU-accelerated data centers are expanding in both high-performance computing and cloud, driven by the acceptance of deep-learning techniques. And the transition to autonomous driving is well underway. We had excellent positions in each of these growth markets.
We expect revenue for the fourth quarter of 2016 to be $1.3 billion, plus or minus 2%. Our non-GAAP and GAAP gross margins are -- our GAAP and non-GAAP gross margins are expected to be 56.7% and 57%, respectively, plus or minus 50 basis points.
GAAP operating expenses are expected to be approximately $503 million. Non-GAAP operating expenses are expected to be approximately $445 million. For fiscal 2016, we expect non-GAAP operating expenses, excluding litigation costs, to be approximately flat with fiscal 2015. Litigation costs are anticipated to be in the range of $70 million to $80 million as we defend our intellectual property.
GAAP and non-GAAP tax rates for the fourth quarter of fiscal 2016 are both expected to be 20%, plus or minus 1%. The above GAAP outlook excludes restructuring charges, which are expected to be in the range of $25 million to $35 million as we finalize the wind-down of the Icera operations in the fourth quarter of fiscal 2016. 
Further financial details, including the CFO Commentary and revenue by market platforms, are available on our IR website. 
With that, we will now open the call for questions. Operator, will you please poll for questions?",1448,8.0,6.0,0.9444444444444444,0.6
32307.0,"NVIDIA Corporation, Q3 2016 Earnings Call, Nov 05, 2015",2015-11-05,48.0,Earnings Calls,NVIDIA Corporation,5103.0,894759.0,38354919.0,Question and Answer Operator Message,Operator,,Operator,3,[Operator Instructions] One moment please for the first question which comes from the line of Vivek Arya with Bank of America.,21,6.0,3.0,0.8333333333333334,0.3
32307.0,"NVIDIA Corporation, Q3 2016 Earnings Call, Nov 05, 2015",2015-11-05,48.0,Earnings Calls,NVIDIA Corporation,5103.0,894759.0,38354920.0,Question,Vivek Arya,,Analysts,4,"As for my first question, the last 2 quarters, you have substantially exceeded your original outlook, and PC gaming has been an important part of that. And I'm wondering, the strength that you're seeing or the upside surprise that you have seen in both these quarters, has that come more from units? Has that come more from better mix or ASPs or share gains? And more importantly, how sustainable is this kind of upside trajectory?",75,7.0,6.0,0.8888888888888888,0.6
32307.0,"NVIDIA Corporation, Q3 2016 Earnings Call, Nov 05, 2015",2015-11-05,48.0,Earnings Calls,NVIDIA Corporation,5103.0,894759.0,38354921.0,Answer,Jen-Hsun Huang,,Executives,5,"Yes. Vivek, first of all, thanks. Well, I think that we've been consistent that our PC gaming business is driven by several factors. The first factor is the great AAA titles that are coming out with ever increasingly graphics production value. The second is just the number of eSports players that are growing around the world, and it's a very social phenomenon. The more of your friends are joining eSports, the more you have to join eSports so that you could hang out with your friends. The third is the developing countries. One of the things about PC gaming and overall gaming is that you really need to have broadband access anymore so that you can download these amazing games. And so as broadband adoption continues to grow in the developing countries, the PC is really the best way to get into gaming. It's a platform that you need for your daily lives, anyways. And surely, most young people need it for school. And so that's been helpful. All of those factors have increased both the units as well as the ASPs that we're enjoying. If you look at the size of the overall market, I think it's probably fair to say that we're not fully penetrated. And our expectation is that as we look into next year, all of the great games that are coming out, whether it's Call of Duty that's coming out or Star Wars that's coming out or Assassin's Creed or Tomb Raider. And surely, everybody's quite excited about VR coming out in the beginning of next year. So I think there are several growth drivers that are still quite powerful. And our expectations is that this is going to be a large market going forward.",290,7.0,6.0,0.8888888888888888,0.6
32307.0,"NVIDIA Corporation, Q3 2016 Earnings Call, Nov 05, 2015",2015-11-05,48.0,Earnings Calls,NVIDIA Corporation,5103.0,894759.0,38354922.0,Question,Vivek Arya,,Analysts,6,"And for my follow-up question, not to quibble, but when I look at your Q4 guidance, it's strong, better than expectation. But it sort of implies flattish trends in what is usually a seasonally stronger quarter. If you could just give us some color on what segments, just directionally, do you think would be up or down versus Q3.",60,-5.0,7.0,0.2222222222222222,0.7
32307.0,"NVIDIA Corporation, Q3 2016 Earnings Call, Nov 05, 2015",2015-11-05,48.0,Earnings Calls,NVIDIA Corporation,5103.0,894759.0,38354923.0,Answer,Jen-Hsun Huang,,Executives,7,"Well, the guidance that we provided is the guidance that we think is best and balanced. And we'll see how the quarter plays out. But they're -- the growth drivers in our business overall -- gaming is a growth driver, and we just mentioned some of the dynamics that are underlying it. Data centers is a growth driver for us, and I'm sure we'll be talking more about that during the conference call. And then third, the automotive business is a growth driver for us. And so we have several growth drivers. And -- but at this point, our guidance is the best we have to offer.",107,7.0,6.0,0.8888888888888888,0.6
