companyid,headline,mostimportantdateutc,keydeveventtypeid,keydeveventtypename,companyname,audiolengthsec,transcriptid,transcriptcomponentid,transcriptcomponenttypename,transcriptpersonname,companyofperson,speakertypename,componentorder,componenttext,word_count,sentiment_value,complexity_value,normalized_sentiment,normalized_complexity
32307.0,"NVIDIA Corporation, Q3 2016 Earnings Call, Nov 05, 2015",2015-11-05,48.0,Earnings Calls,NVIDIA Corporation,5103.0,894759.0,38354970.0,Question,Matt Ramsay,,Analysts,54,"Jen-Hsun, you had mentioned, I think earlier in the call in response to a question, that obviously you guys are not fully penetrated in gaming with the eSports phenomenon and more broadband coming to the emerging markets. Maybe you can help us understand and break down the growth between unit growth or overall installed base growth versus upgrade sales from the current installed base? And I guess what I'm trying to get at is the segment, the growth between that and what's the upgrade cycle you see from someone, say, that bought a high-end GPU from you a year ago, what's the upgrade cycle and link them, what are the real drivers to that upgrade cycle for someone that has already engaged with you and your installed base?",129,6.0,8.0,0.8333333333333334,0.8
32307.0,"NVIDIA Corporation, Q3 2016 Earnings Call, Nov 05, 2015",2015-11-05,48.0,Earnings Calls,NVIDIA Corporation,5103.0,894759.0,38354971.0,Answer,Jen-Hsun Huang,,Executives,55,"Yes. So, of course, one of the most important -- one of the most important drivers is the combination -- it's the combination of really, really high-production value games and our installed base. Because our installed base are already gamers, our installed base are already GeForce customers. And when new games come out, new amazing games come out, the installed base wants to upgrade their GPUs to support it. And so I -- if you look at our installed base, just take a look at our, if you will, first base, the mainstream GTX, let's take the GTX 950. The GTX 950 class installed base represents probably less than 1/4 of our installed base. Another way of thinking about it is that 3/4 of our installed base really needs to get upgraded, so that they can enjoy today's exciting AAA titles. And so the installed base alone is a really exciting opportunity for our growth. And that's only possible because of the amazing AAA titles. It's the Star Wars of the world, the Call of Duty of the world, the Assassin's Creed and the Batmans that really, really causes our installed base, inspires our installed base upgrade to new GPUs. And so that alone has really great growth opportunity. And not to mention the other factors that you started with, which was eSports and developing countries having broadband and then, of course, what we hope to be a big driver in the next, in the coming year with VR. And so the installed base, I think, is a big growth driver for us, okay?",264,6.0,6.0,0.8333333333333334,0.6
32307.0,"NVIDIA Corporation, Q3 2016 Earnings Call, Nov 05, 2015",2015-11-05,48.0,Earnings Calls,NVIDIA Corporation,5103.0,894759.0,38354972.0,Question and Answer Operator Message,Operator,,Operator,56,[Operator Instructions] The next question comes from the line of Rajvindra Gill with Needham & Company.,16,5.0,6.0,0.7777777777777778,0.6
32307.0,"NVIDIA Corporation, Q3 2016 Earnings Call, Nov 05, 2015",2015-11-05,48.0,Earnings Calls,NVIDIA Corporation,5103.0,894759.0,38354973.0,Question,Rajvindra Gill,,Analysts,57,"And a lot of this has been talked about before. But I just wanted to get a sense of kind of a normalized revenue growth rate, at least as much as you can discuss, with some of the headwinds that you experienced this year, potentially abating next year, namely, the PC OEM business, maybe not -- might not decline as fast or at the same rate at this year. So just wondering if you could maybe discuss a little bit about the -- more of a normalized growth rate. It seems like this year you're going to end up with a 5% growth rate, given the fact that PC has fallen pretty significantly. So any color there will be helpful.",120,7.0,6.0,0.8888888888888888,0.6
32307.0,"NVIDIA Corporation, Q3 2016 Earnings Call, Nov 05, 2015",2015-11-05,48.0,Earnings Calls,NVIDIA Corporation,5103.0,894759.0,38354974.0,Answer,Jen-Hsun Huang,,Executives,58,"Yes, I appreciate it. I think, first of all, just the recognition that our PC OEM or OEM businesses has largely, the decline has abated. We are still -- we obviously still work on OEM projects. And we're selective about the OEM projects. We're thoughtful about the projects we're working on, and so we care very much about working with our strategic partners. For example, some of the really amazing projects that have been announced recently, the Microsoft Surface Book. I mean, holy cow, what a great laptop. Mine should be arriving any day now. And so I'm super excited about that. I thought Panos and the guys over at -- over a Microsoft just did a killer job on that laptop. And it was incredibly challenging. And we love to work and we love building groundbreaking work. And then the other project over at Google, with Google Pixel C, I thought it was amazing. I mean, it's just a fantastic laptop and it's based on our latest generation Tegra, Hiroshi and the team did a great job building it, and what a fantastic new tablet model. And so we're going to continue to work on these type of OEM projects. And so we have excited once that we're in the project -- in the process of working on. And so my expectation is that the PC OEM business and the Tegra OEM business is going to be here. But it's just not, it's not a huge focus of ours. Our focus -- focus is not the right word. It's not where we expect our growth drivers to come from. Our major growth drivers are the 4 that we've talked about several times during the call. In terms of growth rate, I think it's -- I think it's going to take potentially a couple of years for us to have some kind of a feeling for growth rate. Let me tell you why. In no time in the history of our company did we have a brand-new business model, right? First of all. We have a brand-new business model. This new business model leverages one architecture but instead of going towards just serving OEMs, we've largely engaged the vertical markets ourselves. It's a platform strategy. It's an ecosystem strategy. We engage the markets directly ourselves. So this new business model transition and approach in this market is really working and accelerating. Because we're engaging the markets directly and we're looking at some very large markets, I mean, the autonomous driving market is going to be a large market. The accelerated data center market is going to be a large market. AI is going to be large. VR is going to be large. PC gaming is going to be large. And so we're now working -- we're now engaging large markets and we have multiple growth drivers. And so I think that the TAM for the company is larger than any time than we have ever enjoyed. And so that's kind of the second thing. We have multiple growth drivers and they have large TAMs. And then finally, gosh, we're just doing really exciting and important work that will shape the future of computing. I don't know any time in the history of our company that we're working on things like AI and VR and self-driving cars and cloud computing, all the same time. And so all of that leveraging one fundamental architecture, which gave us the ability to simultaneously engage these vertical markets with a very powerful singular investment behind it. And so I think our business model is very different. The vertical markets we engage are very different and I hope that as a result, our growth will continue to surprise.",622,7.0,6.0,0.8888888888888888,0.6
32307.0,"NVIDIA Corporation, Q3 2016 Earnings Call, Nov 05, 2015",2015-11-05,48.0,Earnings Calls,NVIDIA Corporation,5103.0,894759.0,38354975.0,Question and Answer Operator Message,Operator,,Operator,59,The next question comes from the line of David Wong with Wells Fargo.,13,5.0,7.0,0.7777777777777778,0.7
32307.0,"NVIDIA Corporation, Q3 2016 Earnings Call, Nov 05, 2015",2015-11-05,48.0,Earnings Calls,NVIDIA Corporation,5103.0,894759.0,38354976.0,Question,David Wong,,Analysts,60,"In your gaming GPUs, do you have any estimate of what market share you currently control? And how that has been changing over the last few quarters?",27,6.0,7.0,0.8333333333333334,0.7
32307.0,"NVIDIA Corporation, Q3 2016 Earnings Call, Nov 05, 2015",2015-11-05,48.0,Earnings Calls,NVIDIA Corporation,5103.0,894759.0,38354977.0,Answer,Jen-Hsun Huang,,Executives,61,"Well, David, thanks for the question. We don't really control anything. Our products are purchased by our gamers freely. And so it's not really a matter of control. And I mean that in a way that, look, we've got to earn, we've got to earn the love and loyalty of our customers every single day. And whereby -- whereas we used to be a PC OEM company, an OEM company where that responsibility lies on our OEMs, today, the responsibility really lies with us. And we take it really, really seriously. We have 70 million gamers that are connected with us. I hope that we add value to them on a continuous basis and that we earn their trust and their loyalty over time. The beauty of this model, the beauty of this model, of course, it's much, much harder. It requires much, much greater understanding of the software stack. The way that you digitally connect and engage your community has to be very different than before. Obviously, the PC OEM model is simple. The selling motion is simple, the marketing motion is simple. Everything we do today, the selling motion is much more complicated and the marketing motion is much more complicated. But the end result is that the promise that we made to them, whether it's Quadro's ability to help you realize your imagination, to GeForce that helps you enjoy your game to the fullest, these promises, we have the ability to deliver on a day-to-day basis. And so over time, I believe it allows us to create much deeper connections with our customers, which in business talk, is stickiness, but we don't think of it that way. We think of it as earning the loyalty and the trust and hopefully, the passion of our customers. Okay?",299,6.0,7.0,0.8333333333333334,0.7
32307.0,"NVIDIA Corporation, Q3 2016 Earnings Call, Nov 05, 2015",2015-11-05,48.0,Earnings Calls,NVIDIA Corporation,5103.0,894759.0,38354978.0,Question and Answer Operator Message,Operator,,Operator,62,The next question comes from the line of Ian Ing with MKM Partners.,13,4.0,7.0,0.7222222222222222,0.7
32307.0,"NVIDIA Corporation, Q3 2016 Earnings Call, Nov 05, 2015",2015-11-05,48.0,Earnings Calls,NVIDIA Corporation,5103.0,894759.0,38354979.0,Question,Ian Ing,,Analysts,63,"A question for Colette here. A lot of interesting opportunities and investments there. I mean, could you update us in terms of where you are in terms of identifying and implementing the operating synergies? I think, at the Analyst Day, you talked about some software synergies unifying the silicon architecture?",50,6.0,7.0,0.8333333333333334,0.7
32307.0,"NVIDIA Corporation, Q3 2016 Earnings Call, Nov 05, 2015",2015-11-05,48.0,Earnings Calls,NVIDIA Corporation,5103.0,894759.0,38354980.0,Answer,Colette Kress,,Executives,64,"Thanks for the question. Yes, I think our focus over this last several years has really been focusing around one single unified architecture and investment. That's really helped us to make the appropriate investments that we need in these 4 different markets that we're going after. But allowing us also to really focus on a single architecture, that allows the efficiencies that we are seeing in our operating expenses. That is still going to be our focus as we move into the current quarter, Q4, and as we move forward into fiscal year '17. As our financial performance is very important to us and improving that financial performance in the short term. So thanks for the recognition of noting our work on our investment portfolio and ensuring that our investments are rightsized for our top line.",136,8.0,6.0,0.9444444444444444,0.6
32307.0,"NVIDIA Corporation, Q3 2016 Earnings Call, Nov 05, 2015",2015-11-05,48.0,Earnings Calls,NVIDIA Corporation,5103.0,894759.0,38354981.0,Question and Answer Operator Message,Operator,,Operator,65,The next question comes from the line of Chris Rolland with FBR & Co.,13,5.0,6.0,0.7777777777777778,0.6
32307.0,"NVIDIA Corporation, Q3 2016 Earnings Call, Nov 05, 2015",2015-11-05,48.0,Earnings Calls,NVIDIA Corporation,5103.0,894759.0,38354982.0,Question,Christopher Rolland,,Analysts,66,"So the current leader in ADAS, they are autonomous driving, I guess, is where they are going with this. They're running their platform off of what is essentially like a $5 microcontroller and they really talk down the importance of hardware. So Jen-Hsun, maybe I would get -- if I could get your idea on what you think this hardware platform? I know the importance of software. But what this hardware platform might look like for these future generations that you're talking about?",83,6.0,6.0,0.8333333333333334,0.6
32307.0,"NVIDIA Corporation, Q3 2016 Earnings Call, Nov 05, 2015",2015-11-05,48.0,Earnings Calls,NVIDIA Corporation,5103.0,894759.0,38354983.0,Answer,Jen-Hsun Huang,,Executives,67,"Yes, Chris, I appreciate that. If we can get a $5 microcontroller to drive, and it's just a matter of software, and driving is like one of the most complicated things we do, I think humans can be replaced in just about everything we do with a $3 microcontroller. And so it seems unlikely. It -- I agree that smart microcontrollers could be used to enhance smart cameras and do some -- to do computer vision. I think that for ADAS, it is really, really good, I mean, just to be serious here. I think that smart cameras, whether it's from Tier 1s or from companies in Japan or various companies around the world, ADAS driver -- better cruise control to automatic braking, to lane keeping, those things are all important things. And it improves our driver experience. But autonomous driving is just a whole different thing. Autonomous driving, nobody's figured out. And obviously, there are several companies that we know who have real cars on the market, who are doing autonomous driving and there's no pretense. Nobody's saying that all it takes is a $5 microcontroller to make that happen. It takes a lot of computing to make that possible. And so our strategy is not driver assistance, I've been consistent about that. I appreciate all of the people's work that are enhancing driver assistance, whether it's radar or ultrasonics or cameras to move all -- driver assistance forward. Our strategy is really a computing platform for autonomous driving and it's going to take a lot of software. And it's going to take a lot of software that it's going to be owned by the car companies themselves. And our strategy is to provide a platform by which we provide a lot of the capabilities of artificial intelligence whereby they can embrace it, modify it, enhance it so that they can make their personality of the driver experience in their own software long term. I just can't imagine how every single car company in the world will have exactly the same driver experience. The way that the car responds to you, the way that the car responds at all is something that I believe, long term, is going to require a lot of computing. This is an area that's just far from being done, and I think it's a -- it's very complicated stuff. And we don't even know what we don't know yet. But the one thing that we do know, it's going to need a lot of computing horsepower. It's going to need a lot of software. Artificial intelligence is going to be the core of it. And I think if we succeed in doing so, we're going to make the world a much, much better place. I mean, there are a lot of people that shouldn't drive. There are a lot of people that would love to get around but they can't drive. And I think we're going to keep a lot of people out of harm's way, okay? So I think the work is incredibly important. It's far from being over and so there's lots to do.",522,7.0,6.0,0.8888888888888888,0.6
32307.0,"NVIDIA Corporation, Q3 2016 Earnings Call, Nov 05, 2015",2015-11-05,48.0,Earnings Calls,NVIDIA Corporation,5103.0,894759.0,38354984.0,Question and Answer Operator Message,Operator,,Operator,68,The last question comes from the line of Joseph Zaccaria with Oppenheimer.,12,3.0,6.0,0.6666666666666666,0.6
32307.0,"NVIDIA Corporation, Q3 2016 Earnings Call, Nov 05, 2015",2015-11-05,48.0,Earnings Calls,NVIDIA Corporation,5103.0,894759.0,38354985.0,Question,Joseph Zaccaria,,Analysts,69,"I just wanted to circle back on the automotive part of the business. I know you've done a lot of work with the VW Group, specifically with Audi and Porsche. I was just wondering if you have seen any of the impact from the potential R&D clawbacks or any sort of comments on what you're seeing out of Germany would be helpful.",62,2.0,5.0,0.6111111111111112,0.5
32307.0,"NVIDIA Corporation, Q3 2016 Earnings Call, Nov 05, 2015",2015-11-05,48.0,Earnings Calls,NVIDIA Corporation,5103.0,894759.0,38354986.0,Answer,Jen-Hsun Huang,,Executives,70,"The area where we worked with VW and Porsche and Audi are really about advancing the state-of-the-art in their cars. If you look at the work that we do, it's really about -- it's really about innovation. And it's about the technology that they want to be world's first at bringing to market. This is a company -- this is an organization that believes at technology leadership and leaning forward -- leaning into the software-defined car and leaning into the computerized car and leaning into driver -- autonomous driving and leaning into electric vehicles is a good thing. And this is a company that is very forward thinking as everybody is very well aware of. And so our work with them are really along those areas. And if anything at all, we see quite a significant heightened desire to move the company forward and do something great.",148,7.0,5.0,0.8888888888888888,0.5
32307.0,"NVIDIA Corporation, Q3 2016 Earnings Call, Nov 05, 2015",2015-11-05,48.0,Earnings Calls,NVIDIA Corporation,5103.0,894759.0,38354987.0,Question and Answer Operator Message,Operator,,Operator,71,There are no further questions at this time. I'll now turn the call back to you. Please continue with the presentation and/or closing remarks.,24,4.0,2.0,0.7222222222222222,0.2
32307.0,"NVIDIA Corporation, Q3 2016 Earnings Call, Nov 05, 2015",2015-11-05,48.0,Earnings Calls,NVIDIA Corporation,5103.0,894759.0,38354988.0,Answer,Jen-Hsun Huang,,Executives,72,"Well, thanks, everybody, for joining us today. There are several things that we wanted to say. We wanted to say that our new business model transition and push to market is working and accelerating. We talked about our multiple-growth market drivers, PC gaming, data center and automotive are all growing nicely. We talked about the fact that we are working at the center of some big developments that are shaping the future of computing. AI, VR, accelerated cloud computing and autonomous driving cars. These are really exciting things, and we're doing that with one singular leveraged investment around one architecture. And that allows us to bring the might of this company and the expertise that we have to help solve some of the problems that I've mentioned. 
NVIDIA is the world leader in visual computing and is becoming more important than ever in the growing number of industries. Our strategy is to leverage this one core investment to 4 growth markets: gaming, professional visualization, data center and auto. And is delivering good results and gaining momentum. And so our goal is to balance those investments, our investment, to capture the enormous opportunity ahead while maintaining a keen focus on improving near-term financial performance. Thank you all for joining us today.",210,7.0,6.0,0.8888888888888888,0.6
32307.0,"NVIDIA Corporation, Q3 2016 Earnings Call, Nov 05, 2015",2015-11-05,48.0,Earnings Calls,NVIDIA Corporation,5103.0,894759.0,38354989.0,Question and Answer Operator Message,Operator,,Operator,73,"Ladies and gentlemen, that does conclude the conference call for today. We thank you for participation and ask that you please disconnect your line.",24,0.0,1.0,0.5,0.1
32307.0,"NVIDIA Corporation, Q4 2015 Earnings Call, Feb 11, 2015",2015-02-11,48.0,Earnings Calls,NVIDIA Corporation,4001.0,1758143.0,68841479.0,Presentation Operator Message,Operator,,Operator,0,"Good afternoon. My name is George, and I will be your conference operator today. At this time, I would like to welcome everyone to the NVIDIA financial results conference call. [Operator Instructions] As a reminder, this conference is being recorded, Wednesday, February 11, 2015. 
I will now turn the call over to Ms. Colette Kress, Executive Vice President and Chief Financial Officer with NVIDIA. Ms. Kress, you may begin your conference.",71,5.0,3.0,0.7777777777777778,0.3
