companyid,headline,mostimportantdateutc,keydeveventtypeid,keydeveventtypename,companyname,audiolengthsec,transcriptid,transcriptcomponentid,transcriptcomponenttypename,transcriptpersonname,companyofperson,speakertypename,componentorder,componenttext,word_count,sentiment_value,complexity_value,normalized_sentiment,normalized_complexity
32307.0,"NVIDIA Corporation, Q1 2016 Earnings Call, May 07, 2015",2015-05-07,48.0,Earnings Calls,NVIDIA Corporation,3969.0,807921.0,35149798.0,Presentation Operator Message,Operator,,Operator,0,"Good afternoon. My name is George, and I will be your conference operator today. At this time, I would like to welcome everyone to the NVIDIA Financial Results Conference Call. [Operator Instructions] As a reminder, this call is being recorded Thursday, May 7, 2015.
I will now turn the call over to Mr. Arnab Chanda, Head of Investor Relations at NVIDIA. Mr. Chanda, you may begin your conference.",68,7.0,3.0,0.8888888888888888,0.3
32307.0,"NVIDIA Corporation, Q1 2016 Earnings Call, May 07, 2015",2015-05-07,48.0,Earnings Calls,NVIDIA Corporation,3969.0,807921.0,35149799.0,Presenter Speech,Arnab Chanda,,Executives,1,"Thank you. Good afternoon, everyone, and welcome to NVIDIA's conference call for the first quarter of fiscal 2016. With me on the call today from NVIDIA are Jen-Hsun Huang, President and Chief Executive Officer; and Colette Kress, Executive Vice President and Chief Financial Officer. I'd like to remind you that today's call is being webcast live on NVIDIA's Investor Relations website. It is also being recorded. You can hear a replay via telephone until the 14th of May, 2015. The webcast will be available for replay up until next quarter's conference call to discuss Q2 financial results. The content of today's call is NVIDIA's property. It cannot be reproduced or transcribed without our prior written consent. During the course of this call, we may make forward-looking statements based on current expectations. These forward-looking statements are subject to a number of significant risks and uncertainties, and our actual results may differ materially. For a discussion of factors that could affect our future financial results and business, please refer to the disclosure in today's earnings release, our most recent Form 10-K and the reports that we may file on Form 8-K with the Securities and Exchange Commission. All our statements are made as of today, the 7th of May, 2015, based on information currently available to us. Except as required by law, we assume no obligation to update any such statements.
During this call, we will discuss non-GAAP financial measures. You can find a reconciliation of these non-GAAP financial measures to GAAP financial measures in our CFO commentary, which is posted on our website.
With that, let me turn the call over to Colette.",272,2.0,6.0,0.6111111111111112,0.6
32307.0,"NVIDIA Corporation, Q1 2016 Earnings Call, May 07, 2015",2015-05-07,48.0,Earnings Calls,NVIDIA Corporation,3969.0,807921.0,35149800.0,Presenter Speech,Colette Kress,,Executives,2,"Thanks, Arnab. First quarter revenue increased 4% year-over-year to $1.15 billion. Growth was driven by the strength in gaming, high-performance computing and cloud and automotive. Viewed from a segment perspective, GPU revenue was $940 million, up 5% year-over-year. Tegra processor revenue was $145 million, up 4% year-over-year. NVIDIA's business performed within expectations within the quarter. Our strategy of creating specialized platforms for gaming, enterprise, high-performance computing and cloud and automotive continues to gain traction, and we continue to reshape our organization to focus on them.
In Q1, these 4 growth platforms contributed to more than 80% of revenue, up from 68% a year ago. Gaming revenue was $587 million, up 25% year-over-year, powered by the strength of our Maxwell GPU architecture. Helping our performance was the launch of Titan X, the world's fastest GPU. Titan X, introduced at the Game Developers Conference, sets a new standard with the outstanding capabilities to drive 4K games and virtual reality titles. It delivers twice the performance and double the power efficiency of its predecessor. We also announced SHIELD, the world's first 4K smart TV device. SHIELD delivers video, music apps and high-quality games and uses Google voice search. It's powered by our Tegra X1 processor. The gaming market continues to expand. In the second half, we look forward to multiple drivers, including 4K, which quadruples the number of pixels to process; virtual reality; and the launch of Windows 10. Enterprise revenue was $190 million, down 4% year-over-year due to the weakness in European currencies. We continue to maintain strong market leadership with our Quadro products. During the quarter, we shared our vision for physically based rendering, which allows for the accurate simulation of real-life materials and their interaction with light. In the enterprise data center, NVIDIA's GRID graphics virtualization platform continues to hit key milestones. We now have over 250 enterprise customers with production deployment, up from just over 30 customers a year ago. In March, VMware, the virtualization market leader, shipped the latest versions of Horizon and vSphere with full support for NVIDIA GRID vGPU technology. More than 400 customers have signed on to the GRID early access program. HPC and cloud revenue was $79 million, up 57% year-on-year, with continued strength in the HPC market and among cloud service providers. Tesla products continue to benefit from widespread Internet interest in deep learning. One indication of our traction was the success in March of the GPU Technology Conference, or GTC, where we drew a record 4,000 attendees. Two of the world's most renowned deep learning experts, Google's Jeff Dean and Baidu's Andrew Ng, delivered keynotes at the event. A growing number of companies are now using Tesla GPUs for deep learning, including the world's leading cloud service providers like Baidu, Facebook, Flickr, Microsoft and Twitter, as well as a broad range of startups. Another indication of our traction is the success of our library for developers who implement deep neural networks. Since its March release, it has been downloaded by more than 5,000 deep learning developers.
During the quarter, we also hit a milestone for CUDA, our parallel computing platform. It's now been downloaded 3 million times since its 2006 launch, with 1 million downloads in the past 18 months alone. Automotive revenue had a record quarter at $77 million, growing 121% year-over-year. Our design wins in digital clusters and infotainment continue to ramp over multiple automotive OEMs. At GTC, 25 global automakers and Tier 1 suppliers were represented, including developers and researchers from such companies as Audi, BMW, Delphi and Elektrobit. Their enthusiasm reflects the interest, increasing importance of visual computing for automotive and our position as a key technology provider for this market. We also announced the availability of our DRIVE PX deep learning development platform. It will provide researchers with the computing platform and software tools to develop algorithms for self-driving cars. We have started shipping DRIVE PX to developers around the world. The OEM and IT platform had revenue of $218 million, down 38% year-over-year. This reflected a combination of end-of-life for Tegra OEM design as well as continued weakness in PC OEM sales. The weakness in PC OEMs has been broadly reported and attributed to foreign exchange rates and delays in purchasing leading up to the launch of Windows 10.
Regarding IP. Our case is progressing against Samsung and Qualcomm. Last month, NVIDIA received a favorable pretrial claim construction ruling in the case. The case is set to be heard at the U.S. International Trade Commission beginning next month.
Moving to gross margins. GAAP gross margins was a record 56.7%, above our outlook for the quarter and up 80 basis points from the previous quarter. Non-GAAP gross margins was 56.9%, also above our outlook and up 70 basis points sequentially. Our strong margins resulted from a richer product mix. GAAP operating expenses for the first quarter were $477 million. Non-GAAP operating expenses were $425 million, in line with our outlook and inclusive of $16 million of legal fees associated with our litigation against Samsung and Qualcomm. GAAP net income was $134 million, down 2% from a year ago. GAAP earnings per diluted share of $0.24 was similar to a year ago.
Now turning to some key balance sheet items. In Q1, our cash and marketable securities balance grew to $4.79 billion. During the first quarter, we paid $46 million in cash dividends, and we repurchased 2.4 million shares. As a result, we returned an aggregate of $99 million to shareholders. Today, we announced a 15% increase in our quarterly cash dividend to $0.0975 per share. We have also announced our intent to increase our capital return to shareholders to $800 million in fiscal year 2016 from $600 million through cash dividends and share repurchases. Further, our Board of Directors has extended the previously authorized repurchase program through to December 2018 and authorized an additional $1.62 billion for an aggregate of $2 billion available for repurchase. We are committed to capital returns as an essential component in delivering shareholder value.
Now turning to the outlook for the second quarter of fiscal 2016. We expect revenue for the second quarter of 2016 to be $1.01 billion, plus or minus $2 billion -- I mean, 2%.
In addition to seasonality, 2 factors informed our Q2 guidance. European currency weakness is affecting overall demand. Also, as widely reported by OEMs, a combination of seasonality and a lull ahead of Windows 10 launch are impacting the PC market. The overall dynamics of our business are great. Gaming is expanding and 4K, virtual reality and Windows 10 will lift it further. GPU-accelerated data centers are expanding, and deep learning is a new, exciting application. And the market for car computers is expanding. We have an excellent position in each of these growth markets. Our GAAP and non-GAAP gross margins are expected to be 55.7% and 56%, respectively, plus or minus 50 basis points. This outlook is slightly below Q1 margins, reflecting our product mix. GAAP operating expenses are expected to be approximately $474 million. Non-GAAP operating expenses are expected to be $425 million, flat with last quarter. We announced earlier this week that we will begin to wind down our Icera modem operations in the second quarter of fiscal 2016. We are open to the sale of the technology or operations. We estimate restructuring target -- charges to our GAAP results in the range of $100 million to $125 million, primarily during fiscal 2016. These charges will consist of severance and other employee termination benefits, tax expense items and other costs associated with the wind-down if we are unable to sell the modem operations. The Icera wind-down or sale is expected to benefit non-GAAP operating expenses in the second half of the year, and we will carefully invest in our growth initiatives of deep learning, self-driving cars and gaming. We expect our fiscal year '16 non-GAAP operating expenses to be approximately flat with fiscal year '15, excluding litigation costs. Fiscal year '16 litigation costs are expected to be in the range of $70 million to $90 million as we defend our intellectual property. GAAP and non-GAAP tax rates for the second quarter of fiscal year '16 are expected to be 23% million and 21%, plus or minus 1%. The above GAAP outlook amounts exclude restructuring charges associated with the wind-down if the company is unable to sell the modem operations.
We will now open the call for questions. Operator, will you please pull for questions?",1412,7.0,6.0,0.8888888888888888,0.6
32307.0,"NVIDIA Corporation, Q1 2016 Earnings Call, May 07, 2015",2015-05-07,48.0,Earnings Calls,NVIDIA Corporation,3969.0,807921.0,35149801.0,Question and Answer Operator Message,Operator,,Operator,3,[Operator Instructions] And our first question comes from the line of Blayne Curtis with Barclays.,15,6.0,6.0,0.8333333333333334,0.6
32307.0,"NVIDIA Corporation, Q1 2016 Earnings Call, May 07, 2015",2015-05-07,48.0,Earnings Calls,NVIDIA Corporation,3969.0,807921.0,35149802.0,Question,Blayne Curtis,,Analysts,4,"Colette, just on the outlook, and I appreciate all the color by segments. It sounded like that you're still seeing weakness in the OEM segment. I was wondering if that read was right into June. And then on gross margin, in terms of the mix, what are the moving parts there?",51,-3.0,6.0,0.3333333333333333,0.6
32307.0,"NVIDIA Corporation, Q1 2016 Earnings Call, May 07, 2015",2015-05-07,48.0,Earnings Calls,NVIDIA Corporation,3969.0,807921.0,35149803.0,Answer,Colette Kress,,Executives,5,"Yes, it is true that we're still seeing a decline in our PC OEM and our Tegra OEM business, as we reported within our Q1 results. Again, we still see this as a business that we're going to still try our hardest for the overall growth. But what we see going into Q2 is a very soft market with the PC OEMs, and we do see probably a seasonal decline as we go into Q2. From a gross margin perspective, on the outlook and what we see, that is really driven from a mix perspective of decline in revenue from Q1 to Q2, and we still expect gaming to be great during that time and add value to our gross margins. But just because of the overall mix of what else is in the portfolio, we do expect it to come down to about 56%.",145,-4.0,7.0,0.2777777777777778,0.7
32307.0,"NVIDIA Corporation, Q1 2016 Earnings Call, May 07, 2015",2015-05-07,48.0,Earnings Calls,NVIDIA Corporation,3969.0,807921.0,35149804.0,Question,Blayne Curtis,,Analysts,6,"And then just finally on Icera, is there any meaningful -- or not meaningful, but is there any revenue that would be material if you did shut it down that to be cognizant of?",34,-4.0,6.0,0.2777777777777778,0.6
32307.0,"NVIDIA Corporation, Q1 2016 Earnings Call, May 07, 2015",2015-05-07,48.0,Earnings Calls,NVIDIA Corporation,3969.0,807921.0,35149805.0,Answer,Colette Kress,,Executives,7,We wouldn't expect any material change to our revenue associated with the wind-down of Icera. That is correct.,19,5.0,4.0,0.7777777777777778,0.4
32307.0,"NVIDIA Corporation, Q1 2016 Earnings Call, May 07, 2015",2015-05-07,48.0,Earnings Calls,NVIDIA Corporation,3969.0,807921.0,35149806.0,Question and Answer Operator Message,Operator,,Operator,8,Our next question comes from the line of Sanjay Chaurasia with Nomura.,12,6.0,7.0,0.8333333333333334,0.7
32307.0,"NVIDIA Corporation, Q1 2016 Earnings Call, May 07, 2015",2015-05-07,48.0,Earnings Calls,NVIDIA Corporation,3969.0,807921.0,35149807.0,Question,Sanjay Chaurasia,,Analysts,9,"Colette, my question is on OEM as well. AMD recently launched some new products in the OEM category. And my question is, would you -- if they're willing to take this business at a really low margin, would you still be interested in this space, or would you let it go? Have you -- is there a cutoff that below which you would not take this business?",67,-6.0,4.0,0.16666666666666666,0.4
32307.0,"NVIDIA Corporation, Q1 2016 Earnings Call, May 07, 2015",2015-05-07,48.0,Earnings Calls,NVIDIA Corporation,3969.0,807921.0,35149808.0,Answer,Colette Kress,,Executives,10,"I think we're always going to work with the OEMs on how they want to position our products. We have probably some of the best GPUs available to them. So if we're really talking about an OEM that's looking just for a low cost, they are not -- probably not looking for us for that type of configuration. So it's not that we would turn away business, but we are going to be trying to make sure the value of what we have in terms of the GPU would be recognized by the OEMs.",95,6.0,5.0,0.8333333333333334,0.5
32307.0,"NVIDIA Corporation, Q1 2016 Earnings Call, May 07, 2015",2015-05-07,48.0,Earnings Calls,NVIDIA Corporation,3969.0,807921.0,35149809.0,Question,Sanjay Chaurasia,,Analysts,11,"Okay. As a follow-up, could you talk about GPU pricing that you saw in the quarter and any channel inventory update that you could provide because of these forex issues?",30,4.0,6.0,0.7222222222222222,0.6
32307.0,"NVIDIA Corporation, Q1 2016 Earnings Call, May 07, 2015",2015-05-07,48.0,Earnings Calls,NVIDIA Corporation,3969.0,807921.0,35149810.0,Answer,Colette Kress,,Executives,12,"Right now, we have a pretty good understanding of our channel from what we can see, as we do have a good market position in terms of our cards across the world, so we watch it carefully. I would deem them right now to be in a healthy position as we exited the quarter. And there are, of course, the FX concerns around the world, not just in Europe. But right now, again, I think the channel is in a healthy position.",82,7.0,5.0,0.8888888888888888,0.5
32307.0,"NVIDIA Corporation, Q1 2016 Earnings Call, May 07, 2015",2015-05-07,48.0,Earnings Calls,NVIDIA Corporation,3969.0,807921.0,35149811.0,Question and Answer Operator Message,Operator,,Operator,13,Our next question comes from the line of Hans Mosesmann with Raymond James.,13,5.0,7.0,0.7777777777777778,0.7
32307.0,"NVIDIA Corporation, Q1 2016 Earnings Call, May 07, 2015",2015-05-07,48.0,Earnings Calls,NVIDIA Corporation,3969.0,807921.0,35149812.0,Question,Hans Mosesmann,,Analysts,14,"Colette, can you give us some qualitative commentary on the outlook for automotive, enterprise? And I think you had mentioned gaming was going to be up, but if you can clarify that.",32,6.0,5.0,0.8333333333333334,0.5
32307.0,"NVIDIA Corporation, Q1 2016 Earnings Call, May 07, 2015",2015-05-07,48.0,Earnings Calls,NVIDIA Corporation,3969.0,807921.0,35149813.0,Answer,Colette Kress,,Executives,15,"Again, we didn't give specifics in our Q2 guidance on all of the different pieces of our markets. What we want to discuss is our markets are extremely healthy. Yes, gaming, automotive, high-performance computing, great leadership position, very healthy TAMs. How they'll grow specifically quarter-to-quarter, we'll see at the end of the quarter. But we've talked about we have a strong list of design wins for automotive. With that strong list of design wins, we can expect our revenue to grow in that area. If it grows specifically between Q1 and Q2, we'll have to see based on when the manufacturers want to pull the inventory for their lines. And so that's not necessarily fully in our control. But long term, this is a growth opportunity for us as we outlined our growth platforms. On the enterprise side, again, it's really tough to say where the currency will take us within the second quarter. We can all hope that it will improve. But right now, we're just going to have to see at the end of the quarter how it actually comes out in enterprise.",185,5.0,6.0,0.7777777777777778,0.6
32307.0,"NVIDIA Corporation, Q1 2016 Earnings Call, May 07, 2015",2015-05-07,48.0,Earnings Calls,NVIDIA Corporation,3969.0,807921.0,35149814.0,Question and Answer Operator Message,Operator,,Operator,16,Our next question comes from the line of Rajvindra Gill with Needham.,12,3.0,6.0,0.6666666666666666,0.6
32307.0,"NVIDIA Corporation, Q1 2016 Earnings Call, May 07, 2015",2015-05-07,48.0,Earnings Calls,NVIDIA Corporation,3969.0,807921.0,35149815.0,Question,Rajvindra Gill,,Analysts,17,"If you could just, Colette, maybe remind us how much of your sales is denominated in euro.",17,3.0,5.0,0.6666666666666666,0.5
32307.0,"NVIDIA Corporation, Q1 2016 Earnings Call, May 07, 2015",2015-05-07,48.0,Earnings Calls,NVIDIA Corporation,3969.0,807921.0,35149816.0,Answer,Colette Kress,,Executives,18,"To remind you, as we talk about in our SEC filings that most of our revenue is actually billed in USD. That doesn't mean we don’t have the impact from FX rates, though, on our overall business. What it just means is any part of the channel, any part of the customer buying process has to think about the prices as they sit in their regions in terms of where they are. So really, we don't have a direct translation impact in terms of our overall business, and every part of the world is going to react differently based on the FX positions.",103,5.0,6.0,0.7777777777777778,0.6
32307.0,"NVIDIA Corporation, Q1 2016 Earnings Call, May 07, 2015",2015-05-07,48.0,Earnings Calls,NVIDIA Corporation,3969.0,807921.0,35149817.0,Question,Rajvindra Gill,,Analysts,19,"Right. If we assume that there is some growth in Tegra sequentially in the June quarter and the royalty stays the same, as it always does, for time being, it would basically imply that the GPU business, including workstation, is going to be down something like 16% sequentially. And so I just wanted to try to understand, that's a pretty big dropoff if that math is correct.",67,-6.0,6.0,0.16666666666666666,0.6
32307.0,"NVIDIA Corporation, Q1 2016 Earnings Call, May 07, 2015",2015-05-07,48.0,Earnings Calls,NVIDIA Corporation,3969.0,807921.0,35149818.0,Answer,Colette Kress,,Executives,20,"Again, we're -- yes, we're probably just going to have to see at the end of the quarter. I want us to make sure we really start back with the health of many of these different markets, particularly gaming. We still expect gaming from a year-over-year perspective to definitely grow. How fast it will grow, we will have to see at the end of Q2. But keep in mind, there is generally a sequential seasonal decline as we move into our Q2 that we're going to see. So we don't have a specific number at this time in terms of our overall GPU business. We have got the weakness of the currencies right now that we have to consider in that Q2 quarter and what we see in terms of low purchasing on the overall PC market generally. So I think that is what is incorporated in our guidance rather than very specific to the GPU or the Tegra business.",160,-3.0,7.0,0.3333333333333333,0.7
32307.0,"NVIDIA Corporation, Q1 2016 Earnings Call, May 07, 2015",2015-05-07,48.0,Earnings Calls,NVIDIA Corporation,3969.0,807921.0,35149819.0,Question and Answer Operator Message,Operator,,Operator,21,[Operator Instructions] Our the next question comes from the line of Ross Seymore with Deutsche Bank.,16,3.0,6.0,0.6666666666666666,0.6
32307.0,"NVIDIA Corporation, Q1 2016 Earnings Call, May 07, 2015",2015-05-07,48.0,Earnings Calls,NVIDIA Corporation,3969.0,807921.0,35149820.0,Question,Unknown Analyst,,Analysts,22,This is Jie Yu [ph] calling in for Ross Seymore. Can you discuss any interest that you've seen for the Icera business for the technology and IP?,27,2.0,6.0,0.6111111111111112,0.6
32307.0,"NVIDIA Corporation, Q1 2016 Earnings Call, May 07, 2015",2015-05-07,48.0,Earnings Calls,NVIDIA Corporation,3969.0,807921.0,35149821.0,Answer,Jen-Hsun Huang,,Executives,23,"I'm sorry, what was the question?",7,1.0,3.0,0.5555555555555556,0.3
32307.0,"NVIDIA Corporation, Q1 2016 Earnings Call, May 07, 2015",2015-05-07,48.0,Earnings Calls,NVIDIA Corporation,3969.0,807921.0,35149822.0,Answer,Colette Kress,,Executives,24,The question was regarding the interest that we may have in the Icera business from outside.,16,4.0,7.0,0.7222222222222222,0.7
32307.0,"NVIDIA Corporation, Q1 2016 Earnings Call, May 07, 2015",2015-05-07,48.0,Earnings Calls,NVIDIA Corporation,3969.0,807921.0,35149823.0,Answer,Jen-Hsun Huang,,Executives,25,"We don't -- we have just started that process, so we don't have much to report at this time.",20,-6.0,2.0,0.16666666666666666,0.2
32307.0,"NVIDIA Corporation, Q1 2016 Earnings Call, May 07, 2015",2015-05-07,48.0,Earnings Calls,NVIDIA Corporation,3969.0,807921.0,35149824.0,Question,Unknown Analyst,,Analysts,26,"Okay, got it. And thank you for giving the update on the increased return to shareholders. Can you give us an update on the level of cash onshore? And how does that factor into if there is any offshore cash that needs to be repatriated?",45,5.0,6.0,0.7777777777777778,0.6
32307.0,"NVIDIA Corporation, Q1 2016 Earnings Call, May 07, 2015",2015-05-07,48.0,Earnings Calls,NVIDIA Corporation,3969.0,807921.0,35149825.0,Answer,Colette Kress,,Executives,27,"Again, we are extremely comfortable with our decision to raise the capital return program to $800 million and -- after much thought and consideration in terms of looking at both our onshore and our offshore cash and overall cash flow that we expect for the rest of the year. So we are comfortable with that position. And again, our total cash is about the same as where we ended at fiscal year '15, a little bit up in Q1, and so we're going to return an additional portion of that to shareholders at this time.",95,7.0,6.0,0.8888888888888888,0.6
32307.0,"NVIDIA Corporation, Q1 2016 Earnings Call, May 07, 2015",2015-05-07,48.0,Earnings Calls,NVIDIA Corporation,3969.0,807921.0,35149826.0,Question and Answer Operator Message,Operator,,Operator,28,Our next question comes from the line of Craig Ellis with B. Riley.,13,4.0,6.0,0.7222222222222222,0.6
32307.0,"NVIDIA Corporation, Q1 2016 Earnings Call, May 07, 2015",2015-05-07,48.0,Earnings Calls,NVIDIA Corporation,3969.0,807921.0,35149827.0,Question,Craig Ellis,,Analysts,29,"The first one is just a clarification. Colette, on the expense guidance for the year, it's clear what you're expecting legal to be, that $70 million to $90 million. What was it in fiscal '15? And when we look at the flat year-on-year expense x legal, is it x legal both years or just x legal in fiscal '16?",59,3.0,6.0,0.6666666666666666,0.6
